API链接,Update_Time,Author,API名称,API描述,API Popularity,API Latency,API Service Level
https://rapidapi.com/binfoconsultas/api/quadro-de-socios-cpf-cnpj/, a year ago , BINFO ,Quadro de sócios CPF/CNPJ,Consultar Quadro de Sócios e Administradores registrados na Receita Federal,9.6,"1,702 ms",100%
https://rapidapi.com/rosoemawd/api/house-plants/, 10 months ago , Ema Roso ,House Plants,"This API provides a database of house plants, along with their description and information how to best take care of them (ideal temperature, light, etc.). All proceeds go to charity (donated at the end of each month).",9.6,758 ms,93%
https://rapidapi.com/idfy-idfy-default/api/pan-card-verification1/, 10 months ago , IDfy ,PAN Card Verification,"Instant PAN Card Verification using government database check. IDfy’s PAN Card Verification API instantly verifies details of a PAN Card by confirming them from the Government database. This makes your onboarding process faster, safer and smarter. With IDfy’s PAN verification, you can be confident that the individuals or merchants you onboard hold a valid PAN card and have provided you with the right identity proof.",9.7,"1,047 ms",100%
https://rapidapi.com/ranjian0/api/cpu-data/, 10 months ago , Ian Karanja ,CPU Data,Get quick access to data on various CPUs.,9.6,55 ms,100%
https://rapidapi.com/rahilkhan224/api/pan-card-verification-at-lowest-price/, 20 hours ago , AK IT services ,Pan Card Verification at Lowest price,"Instant PAN Card Verification using government database check. (Made in India). PAN Card Verification API instantly verifies details of a PAN Card by confirming them from the Government database. This makes your onboarding process faster, safer and smarter. With our PAN verification, you can be confident that the individuals or merchants you onboard hold a valid PAN card and have provided you with the right identity proof.",9.5,"4,490 ms",100%
https://rapidapi.com/alexandremeylan92/api/car-code/, a month ago , Alexandre ,car code,This is a simple API that will return the human readable version of DTC codes (OBD-II Trouble Codes).,9.7,63 ms,100%
https://rapidapi.com/makingdatameaningful/api/restaurants-near-me-usa/, a month ago , Making Data Meaningful ,Restaurants near me USA,"USA Restaurants database. Find restaurants near you by querying this complete and comprehensive restaurant API. The API will return 10 results per page. Please use the ""page"" field for pagination.",9.6,374 ms,100%
https://rapidapi.com/rahilkhan224/api/imdb-movies-web-series-etc-search/, 2 months ago , AK IT services ,"IMDB (Movies, Web Series, etc.) Search","online database of information related to films, television series, home videos, video games, and streaming content online – including cast, production crew and personal biographies, plot summaries, trivia, ratings, and fan and critical reviews.",9.6,363 ms,100%
https://rapidapi.com/makingdatameaningful/api/motorcycle-specs-database/, a month ago , Making Data Meaningful ,Motorcycle Specs Database,"--- DEMO http://api-motorcycle.makingdatameaningful.com/ ---- The complete Motorcycle Database with specifications for all Makes & Models [year 1900 to 2023]. Full specs & images included. Real-Time updated. We provide a motorcycle database delivered through API. There are more than 35,000 moto models available along with 20+ technical information fields. One image per model is also included. Our fast API is delivered through several endpoints in order to satisfy different request types. ...",9.7,222 ms,100%
https://rapidapi.com/binfoconsultas/api/dados-cnpj/, a year ago , BINFO ,Dados CNPJ,Busca os dados de um CNPJ diretamente na base de dados da Receita Federal.,9.6,"1,231 ms",100%
https://rapidapi.com/whoisapi/api/whois-v2/, 2 years ago , Whois XML API ,WHOIS v2,"WHOIS API (v2) returns well-parsed WHOIS records with fields in XML and JSON formats for any IPv4, IPv6 address, domain name, or email.",9.7,"1,862 ms",100%
https://rapidapi.com/airaudoeduardo/api/checkleakedcc-official/, a month ago , CheckLeakedCC ,CheckLeakedCC Official,CheckLeaked.cc official api implementation to obtain results from experimental / dehashed search.,9.7,"9,853 ms",96%
https://rapidapi.com/rahilkhan224/api/all-cars-names-image-and-variants-info/, 10 months ago , AK IT services ,"All Cars Names, Image and Variants Info","Search All Cars Names, Image and Variants Info with this api ,search once and get list of all cars. use it for auto-suggestion",9.8,945 ms,99%
https://rapidapi.com/ocean-express-ocean-express-default/api/car-info/, 2 months ago , Ocean-Express ,Car Info,Car information is only available in New Zealand. Detect the vehicle number plate using the license plate recognition and detection API.,8.8,"2,845 ms",99%
https://rapidapi.com/idfy-idfy-default/api/udyam-aadhaar-verification/, 10 months ago , IDfy ,Udyam Aadhaar Verification,"Make your onboarding process safer, faster, and smarter by verifying the legitimacy of the MSME merchants operating in the manufacturing or service sectors, on your platform. With IDfy’s Udyam Aadhaar verification API, you can now confidently onboard merchants knowing that the merchant exists, is genuine and is authorized to partake in the manufacture or service sector by the Ministry of MSME.",9.3,115 ms,96%
https://rapidapi.com/idfy-idfy-default/api/vehicle-rc-verification/, 2 years ago , IDfy ,Vehicle RC Verification,"You can now confidently onboard vehicles and individuals knowing that the vehicle is genuine, registered by an RTO, and associated with a specific individual. Vehicle RC verification API helps to establish a link between the vehicle and its owner, thereby minimizing the potential for fraud.",9.2,122 ms,100%
https://rapidapi.com/alex.pcs8509/api/curp-de-renapo-clave-unica-de-registro-de-poblacion/, 3 months ago , Alex Developer ,CURP de RENAPO (Clave Única de Registro de Población),API creada para consultar y validar información de la CURP desde RENAPO.,9.0,582 ms,100%
https://rapidapi.com/idfy-idfy-default/api/icai-chartered-accountant-verification/, 2 years ago , IDfy ,ICAI Chartered Accountant Verification,This API checks the genuineness of the CA membership,8.9,106 ms,100%
https://rapidapi.com/raajreact/api/list-of-philosophers/, 9 months ago , Pizza API ,List oF Philosophers,"With the Philosophers API, you can learn about philosophers such as Socrates, Plato, and Aristotle, as well as lesser-known but equally important thinkers. You can access information on the philosophies of these thinkers, as well as the historical context in which they lived. This API is perfect for anyone looking to build applications centered around philosophy, history, or culture. Whether you're developing a website, a mobile app, or a game, the Philosophers API by Pizza API will provide ...",8.8,610 ms,100%
https://rapidapi.com/data-axle-data-axle-default/api/data-axle-business-phone-search/, 2 years ago , Data Axle ,Data Axle Business Phone Search,Find relevant businesses by phone number.,8.7,912 ms,100%
https://rapidapi.com/admhsni/api/fwd-api/, 6 months ago , 64c ,fwd-api,resource forwarding api powered by Firebase storage & Heroku,8.6,"1,765 ms",94%
https://rapidapi.com/encurate/api/airplanesdb/, a year ago , encurate ,AirplanesDB,Get the basic specifications on all types of commercial airplanes.,9.3,599 ms,100%
https://rapidapi.com/idfy-idfy-default/api/mci-nmc-doctor-verification/, 2 years ago , IDfy ,MCI NMC Doctor Verification,This API allows the client to verify the integrity and validity of a medical certificate,9.1,110 ms,100%
https://rapidapi.com/zyla-labs-zyla-labs-default/api/database-of-airports-api/, 8 months ago , Zyla Labs ,Database Of Airports API,"The Database of Airports API is a useful resource for developers looking to obtain detailed information on airports worldwide. With the ability to access data such as airport location, IATA and ICAO codes, and other relevant details using the IATA code.",9.2,"1,366 ms",100%
https://rapidapi.com/aligulajeff/api/garden-api/, 4 months ago , Jeff A ,Garden API,"The GARDEN API is a robust and all-encompassing plant and flower data API, purposefully created to provide extensive information. With its power-packed features, developers can access a wide range of plant-related data, including detailed descriptions, care instructions, growth patterns, and more. The GARDEN API is the ultimate tool for integrating comprehensive plant and flower information into applications, websites, and other projects.",9.1,"12,287 ms",100%
https://rapidapi.com/idfy-idfy-default/api/passport-verification/, 2 years ago , IDfy ,Passport Verification,Instant Passport Verification using government database check. IDfy’s Passport Verification API instantly verifies details of a Passport by confirming them from the Government database.,9.0,103 ms,100%
https://rapidapi.com/data-axle-data-axle-default/api/data-axle-consumer-phone-search/, 2 years ago , Data Axle ,Data Axle Consumer Phone Search,Find relevant people in real-time.,,,
https://rapidapi.com/encurate/api/dogbreeddb/, a year ago , encurate ,DogBreedDB,Get the basic metadata on all breeds of dogs from around the world. Check out encurate.app to manage content on your mobile apps. Contact to feature your app on encurate.app website.,9.4,750 ms,100%
https://rapidapi.com/roapis-roapis-default/api/veiculos-api/, 2 months ago , roApis ,veiculos-api,"Tabela FIPE - Busca por marca, modelo e versão. Atualizado: 08/08/2023",9.1,"1,751 ms",100%
https://rapidapi.com/societe-contacts-societe-contacts-default/api/societe-contacts/, 10 months ago , Societe Contacts ,Societe Contacts,"API which allows to have information on French companies including their contact information (emails, telephone numbers, websites, social networks)",9.1,241 ms,100%
https://rapidapi.com/stromdao-stromdao-default/api/timedb/, a year ago , STROMDAO ,timedb,"Store sensor data in managed/cloud database compatible to InfluxDB. Tested to work with Grafana, Node-RED, and other platforms. Each plan provides data retention up to 10 years. Use webhooks to trigger events in systems like n8n or other low-code environments.",9.2,247 ms,97%
https://rapidapi.com/digital-insights-digital-insights-default/api/property-records-search/, a year ago , API BROKERS ,Property Records Search,Property Records and Owner Search Public Records,8.5,656 ms,100%
https://rapidapi.com/jpbermoy/api/list-movies-v3/, 8 months ago , MUSIC EXCLUSIVE ,List Movies v3,"This Movies API contains the data of the best movies ever made in a very easy-to-use and organized format. Great choice for REST API based Frontend Developer Projects. In the case of accessing the complete list, the Cover image, Rank, Title, Thumbnail, Rating, Id, Year, Images, Description, Trailer, Genre, Director, Writer and ID of the movies are listed. This is a lightweight web service, (REST interface), which provides an easy way to access our database. An API (Application programming...",8.9,690 ms,100%
https://rapidapi.com/idfy-idfy-default/api/upi-verification/, 2 years ago , IDfy ,UPI Verification,Used to verify UPI ID's of users,9.4,738 ms,96%
https://rapidapi.com/idfy-idfy-default/api/driving-license-verification/, 2 years ago , IDfy ,Driving License Verification,"IDfy’s Driving License Verification API instantly verifies details of a driving license by confirming them from the Government database. This makes your onboarding process safer, faster, and smarter. With IDfy’s DL verification API, you can be confident that the individuals you onboard hold a valid DL and have provided you with the right identity proof. Couple it with IDfy’s Driving License OCR API to make your identity verification and onboarding process seamless and instant.",9.0,113 ms,100%
https://rapidapi.com/vaibhavchandra2007/api/data-breach-checker/, 6 months ago , Vaibhav Chandra ,Data Breach Checker,"The Data Breach Checker API allows users to check if their data has been compromised in any known data breaches. By simply entering an email address, the API searches through a vast database of known data breaches using the reputable ""Have I Been Pwned"" backend. The API is easy to integrate into existing applications, making it an essential tool for companies and individuals seeking to enhance their cybersecurity posture.",9.2,"1,337 ms",100%
https://rapidapi.com/biocrimeapp/api/vehicle-brazil-check/, 20 days ago , bio crime ,Vehicle Brazil Check,Brazilian vehicle information,9.1,"4,114 ms",100%
https://rapidapi.com/raajreact/api/roman-gods-by-pizza-api/, 9 months ago , Pizza API ,Roman Gods By Pizza API,"With the Roman Gods API, you can access information about gods such as Jupiter, the king of the gods, and his wife Juno, the goddess of marriage and childbirth. You can also learn about other prominent gods, such as Mars, the god of war, Venus, the goddess of love and beauty, and Mercury, the messenger of the gods. This API is ideal for anyone looking to build applications centered around ancient mythology, history, or culture. Whether you're developing a website, a mobile app, or a game, ...",9.2,658 ms,100%
https://rapidapi.com/encurate/api/catbreeddb/, a year ago , encurate ,CatBreedDB,Get the basic metadata on all breeds of cats from around the world.,9.2,577 ms,100%
https://rapidapi.com/raajreact/api/plants2/, 9 months ago , Pizza API ,Plants,"The Plants API made by Pizza API boasts a database of over 40,000 plants that can be easily searched by either their common name or scientific name. Each plant entry in the API includes a comprehensive list of properties, such as genus, species, category, family, growth habit, duration, and growth rate. Some of the most important properties included in the API for each plant entry are mature height, foliage texture, flower color, fruit color, toxicity, drought tolerance, shade tolerance, te...",9.2,"1,114 ms",100%
https://rapidapi.com/makingdatameaningful/api/watch-database1/, a month ago , Making Data Meaningful ,Watch Database,"Our Watch Models API is a comprehensive and accurate data source of more than 20,000 watch models. This API allows users to retrieve detailed information about each model, including brand, model name, release date, features, and more. This data can be easily integrated into a wide range of use cases, such as e-commerce, watch retailers, watch collectors, research and development and watch repair. Our API is constantly updated and maintained to ensure that the data provided is accurate and co...",9.3,210 ms,100%
https://rapidapi.com/iftiin-koox-iftiin-koox-default/api/jetionay-pro/, a year ago , Iftiin-api ,Jetionay-Pro,Api that you can use to query detailed specifications about fighter jets.,8.7,202 ms,100%
https://rapidapi.com/prybytkow/api/itecdoc/, a year ago , support iTecDoc ,iTecDoc,Catalog of auto parts for cars. We have collected data from various sources so that you can sell auto parts,8.8,"1,729 ms",100%
https://rapidapi.com/encurate/api/pageantdb/, a year ago , encurate ,PageantDB,Metadata on publicly available information on various pageant contests.,8.9,499 ms,100%
https://rapidapi.com/digital-insights-digital-insights-default/api/describe-canadian-business-search-public-records/, a year ago , API BROKERS ,Describe Canadian Business Search - Public Records,"This API allows you to search for Businesses in Canada, use a company name or phone number for search.",8.5,206 ms,100%
https://rapidapi.com/idfy-idfy-default/api/epfo-employee-verification/, 2 years ago , IDfy ,EPFO Employee Verification,This API that takes company and employee information as input and returns if the employee name is found in the PF list of the employer,9.1,105 ms,100%
https://rapidapi.com/pcprashant99/api/mocking-rock/, 8 months ago , Prashant Pandey ,Mocking Rock,An APIs collection for getting sample profiles and city Data for testings for frontend or mock testings.,8.9,"1,163 ms",100%
https://rapidapi.com/makingdatameaningful/api/kfc-locations/, a month ago , Making Data Meaningful ,KFC locations,"Our KFC Locations API is a comprehensive and accurate data source of all KFC restaurant locations in the United States. This API allows users to retrieve detailed information about each location, including address, phone number, hours of operation, and more. This data can be easily integrated into a wide range of use cases, such as delivery services, marketing, retail analysis, navigation, and research and development.",8.7,"1,097 ms",100%
https://rapidapi.com/digital-insights-digital-insights-default/api/australia-people-search-public-records/, a year ago , API BROKERS ,Australia People Search - Public Records,"This API allows you to search for individuals in Australia, use a name or phone number for search. Retrieve address, phone number and other valuable public records from Australian public records database",8.7,"1,125 ms",100%
https://rapidapi.com/kirbydimsontompong/api/webflow-api2/, 2 months ago , Flown Code ,Webflow API,"Unlock the full potential of your Webflow projects with the Webflow API on RapidAPI. Seamlessly integrate external services, automate workflows, enhance design, and expand functionality, all while enjoying robust security and customization options. Elevate your web experiences to new heights by joining our thriving developer community and start creating innovative, data-driven websites that stand out in the digital landscape today!",8.5,559 ms,100%
https://rapidapi.com/rahilkhan224/api/know-your-pan-details/, 10 months ago , AK IT services ,Know Your PAN Details,Know Your Jurisdictional Assessing Officer and PAN details,8.6,375 ms,100%
https://rapidapi.com/raajreact/api/world-history-timeline/, 9 months ago , Pizza API ,World History Timeline,"Introducing the World History Timeline API by Pizza API - an extensive resource for exploring world historical events from 3200 BCE to the year 2000. This API gives you access to a vast database of information on the most significant moments in human history, including the dates and events all organized in an easy-to-use format for developers. With the World History Timeline API, you can delve into the history of ancient civilizations, witness the key events of the Middle Ages, and underst...",9.3,327 ms,100%
https://rapidapi.com/cbd2022/api/weed-strain1/, a year ago , cbd2022 ,Weed Strain,Basic information on all weed strain. Build mobile apps for weed strains.,9.3,493 ms,100%
https://rapidapi.com/nlsql/api/natural-language-to-sql/, 2 years ago , nlsql.com ,Natural Language to SQL,"Natural Language User Interface to Database API, which allows End Users to request information from database using only Natural Language",8.8,795 ms,100%
https://rapidapi.com/whoisapi/api/bulk-whois/, 2 years ago , Whois XML API ,Bulk Whois,"Bulk WHOIS API delivers WHOIS records for large lists of domains and IPs via a single REST API query and is powered by a WHOIS Database containing 11.5 billion+ WHOIS records spanning 2,864+ TLDs for over 582M domains tracked. Upload a CSV file containing the domain list and download the result in CSV.",9.3,538 ms,100%
https://rapidapi.com/whoisapi/api/dns-lookup/, 2 years ago , Whois XML API ,DNS Lookup,"DNS Lookup API lets you gather a domain' corresponding IP address/A record, mail server/MX record, DNS servers/NS nameservers, as well as other items like SPF records/TXT records.",9.3,"1,832 ms",100%
https://rapidapi.com/idfy-idfy-default/api/india-bankruptcy-verification/, 2 years ago , IDfy ,India Bankruptcy Verification,IDfy’s IBBI Verification API will enable you to understand if an Indian corporation is under bankruptcy.,9.0,153 ms,100%
https://rapidapi.com/hello-418XozUGi/api/sneaker-database/, 2 years ago , Oliver Le Lievre ,Sneaker Database,A sneaker directory,8.8,55 ms,100%
https://rapidapi.com/xenager34/api/demo-project3916/, a year ago , xenager34 ,👋 Demo Project,This Project is created by the onboarding process,8.5,959 ms,100%
https://rapidapi.com/yatinnagpal19/api/light-switch/, 5 months ago , Yatin Nagpal ,light switch,,,,
https://rapidapi.com/soyamchinglemba/api/taekwondo_athlete_world_ranking1/, 5 months ago , Soyam Chinglemba ,Taekwondo_Athlete_World_Ranking,Taekwondo_Athlete_World_Ranking,8.7,936 ms,100%
https://rapidapi.com/koiosAPI/api/koios-cardanos-decentralized-api/, 2 months ago , Cardano ,Koios Cardano's Decentralized API,Cardano's Decentralized API - Mainnet,8.8,324 ms,100%
https://rapidapi.com/kenshi.hyweb/api/sitedomain1/, 2 years ago , 陳健志 ,siteDomain,site adm domain,9.2,8 ms,100%
https://rapidapi.com/divyaoblr89/api/registration31/, 7 months ago , Divya O ,Registration,registration details,8.7,5 ms,100%
https://rapidapi.com/rahilkhan224/api/al-qur-an-all-translations/, a month ago , AK IT services ,Al-Qur'an (All Translations),"Explore With 113 Translations In 44 Languages And 9 Recitations Free, Coming soon all languages A RESTful Quran API to retrieve an Ayah, Surah, Juz or the enitre Holy Quran.",9.3,197 ms,99%
https://rapidapi.com/benny-org-test-benny-org-test-default/api/joke-test/, a year ago , Benny Org Test ,Joke Test,This is a Joke Test,8.9,6 ms,100%
https://rapidapi.com/Ighor/api/phone-number-finder/, 2 years ago , Ighor July ,Phone Number Finder,Find full phone number by its part,9.4,384 ms,100%
https://rapidapi.com/mobilejj10795/api/onboarding-project9044/, a year ago , Mi 9A ,👋 Onboarding Project,This Project is created by the onboarding process,8.9,961 ms,100%
https://rapidapi.com/rahilkhan224/api/indian-rtos-names-search/, 10 months ago , AK IT services ,Indian RTO's Names Search,"Search all India's RTO names by name, city PREFIX, like MH (for maharashtra), GA, CA, TA, etc",9.0,"1,145 ms",100%
https://rapidapi.com/Sami-Malik/api/portfolio5/, 2 years ago , Sami Malik ,Portfolio,Sami Malik Portfolio,9.1,31 ms,100%
https://rapidapi.com/developerdevmassive/api/jamaican-banks/, 2 years ago , Basil Barnaby ,Jamaican Banks,Jamaican Banks,9.0,81 ms,100%
https://rapidapi.com/Theofanis94/api/real_estate_heroku/, a year ago , Theofanis94 ,Real_Estate_Heroku,Real Estate,,,
https://rapidapi.com/ronaldhector32/api/student22/, 2 years ago , ronald hector ,Student,students,8.9,7 ms,100%
https://rapidapi.com/whoisapi/api/email-verification/, 2 years ago , Whois XML API ,Email Verification,"Email Verification API is a simple REST API solution to ensure the existence, quality, and validity of an email address.",,,
https://rapidapi.com/MayaCarter0611/api/apple-check/, 8 months ago , MayaCarter0611 ,Apple Check,"Check your Apple deivce for SIM-Lock, Blacklist and iCloud Lock",,,
https://rapidapi.com/digital-insights-digital-insights-default/api/canadian-people-search-public-records/, a year ago , API BROKERS ,Canadian People Search - Public Records,"This API allows you to search for individuals in Canada, use a name or phone number for search.",,,
https://rapidapi.com/rahilkhan224/api/aadhaar-pan-link-status/, 8 months ago , AK IT services ,Aadhaar PAN Link Status,Aadhaar PAN Link Status,,,
https://rapidapi.com/daviciencia1/api/cypher-to-gremlin/, 2 months ago , Davi Suga ,Cypher to Gremlin,"Translate cypher queries to a variety of Gremlin flavours (Neptune, Cosmos, Tinker)",8.3,212 ms,100%
https://rapidapi.com/rahilkhan224/api/pan-card-otp-verification/, 7 months ago , AK IT services ,PAN Card OTP Verification,PAN Card OTP Verification,8.3,523 ms,100%
https://rapidapi.com/ariefsam/api/easy-sql-to-mongodb-aggregation/, 6 months ago , Arief ,Easy SQL to MongoDB Aggregation,Mongodb aggregation is hard. We create query converter from sql to mongodb aggregation pipeline. Easy to use.,,,
https://rapidapi.com/thiagocarlinim/api/partial-text-search/, 8 months ago , Thiago Carlini ,Partial Text Search,"Partial text search for databases that only accept full-text searches, like firebase",,,
https://rapidapi.com/idfy-idfy-default/api/bank-account-verification/, 2 years ago , IDfy ,Bank Account Verification,"With the Bank Account Verification solution, you can now onboard with confidence knowing that that the individual’s/ merchant’s account details you have are genuine and indeed belong to the individual/ merchant that you are onboarding, thereby reducing the potential of fraud. Couple it with our Cheque OCR API to make your bank account verification process seamless and instant.",8.3,161 ms,100%
https://rapidapi.com/mondays/api/buildwith/, 4 months ago , mondays ,Buildwith,Search domain built with,,,
https://rapidapi.com/goo1/api/gas-price-germany/, 2 years ago , goo1 ,Gas Price Germany,German Gas Prices by the MTS-K Database,,,
https://rapidapi.com/idfy-idfy-default/api/idfy-verification-suite/, 2 years ago , IDfy ,IDfy Verification Suite,The Verification Suite consists of -Verification Solution -User Authentication -Document Data Extraction,,,
https://rapidapi.com/gavinrose/api/statbasin/, 3 months ago , Gavin Rose ,StatBasin,"We provide geographical information on states, places, districts, and zip codes. We also provide hospital and health data.",8.2,5 ms,100%
https://rapidapi.com/NoahAPI11/api/winget-api/, 9 months ago , NoahAPI11 ,Winget API,Uses the Winget database to fetch informations. Updated every 3 hours.,8.1,239 ms,100%
https://rapidapi.com/namansubedi12/api/vct-global-contract-database/, 6 months ago , Naman Subedi ,VCT Global Contract Database,Get the VCT contract information for all 3 regions via this API. Updated every few hours.,,,
https://rapidapi.com/idfy-idfy-default/api/icmai-verification/, 2 years ago , IDfy ,ICMAI Verification,IDfy’s ICMA Verification API enables you to verify if a user is actually a member of ICMA. The verification API is real-time and non-intrusive in nature.,8.4,94 ms,100%
https://rapidapi.com/tvapi/api/tms5/, 2 years ago , tvapi ,TMS,TheMovieSrc,,,
