API链接,Update_Time,Author,API名称,API描述,API Popularity,API Latency,API Service Level
https://rapidapi.com/idfy-idfy-default/api/nurse-verification/, 2 years ago , IDfy ,Nurse Verification,"Nurse verification is used to verify whether an individual is a registered nurse with the Indian Nurse Council (INC). Use GET Call API to fetch results, using the request_id received in response.",8.2,91 ms,100%
https://rapidapi.com/idfy-idfy-default/api/indian-bank-statement/, 4 months ago , IDfy ,Indian Bank Statement,"The bank statement API helps banks and lenders make decisions b providing outputs about Salary frequency and estimation, current financial health of the individual, any risky behaviour associated with the transactions.",8.2,104 ms,100%
https://rapidapi.com/itisrajeshkannan/api/demo-api28/, 3 months ago , Rajesh Kannan ,demo-api,demo-api,,,
https://rapidapi.com/rahilkhan224/api/books-search/, 8 months ago , AK IT services ,Books Search,An API about books you want to search. It gives suggestions about millions of books from all around the world.,8.3,252 ms,100%
https://rapidapi.com/idfy-idfy-default/api/india-ncvt-iti-cerificate-verification/, 2 years ago , IDfy ,India NCVT ITI Cerificate Verification,"NCVT Certificate is a certificate awarded for the completion of ITI courses under the purview of the NCVT. The full form of NCVT is the National Council of Vocational Training. Exams conducted by the NCVT include Craftsman Training Scheme (CTS), Apprentice Training Scheme (ATS), and All India Trade Test (AITT).",8.3,98 ms,100%
https://rapidapi.com/idfy-idfy-default/api/udyog-aadhaar-verification/, 2 years ago , IDfy ,Udyog Aadhaar Verification,"Make your onboarding process safer, faster, and smarter by verifying the legitimacy of the MSME merchants operating in the manufacturing or service sectors, on your platform. With the Udyog Aadhaar verification API, you can now confidently onboard merchants knowing that the merchant exists, is genuine, and is authorized to partake in the manufacture or service sector by the Ministry of MSME.",8.2,"6,355 ms",100%
https://rapidapi.com/hajdu.luca/api/petlovers/, 2 years ago , Luca Hajdú ,PetLovers,details about my thesis,,,
https://rapidapi.com/ircNewBie/api/drrm/, 2 months ago , ircNewBie ,DRRM,DRRM Backend,8.0,"5,619 ms",100%
https://rapidapi.com/linjerry28/api/names-api/, a year ago , Jerry Lin ,Names API,"A API that returns first names, last names or both.",8.3,199 ms,100%
https://rapidapi.com/niceapi-org-niceapi-org-default/api/test14848/, 9 months ago , NiceAPI Org ,Test1,Test1AA,,,
https://rapidapi.com/cmor-cmor-default/api/test2794/, 2 years ago , cmor ,test,this is my first test,,,
https://rapidapi.com/ichii731/api/legend-of-takada-kenshi/, 2 years ago , IchiiP ,Legend of Takada Kenshi,An API that randomly returns the legend of Takada Kenshi,,,
https://rapidapi.com/findopenhoursorg-findopenhoursorg-default/api/stores-and-brands-api/, 5 months ago , FindOpenHoursOrg ,Stores And Brands API,Find all stores and outlets list in the US.,,,
https://rapidapi.com/berkbaba34/api/test4247/, 2 years ago , Berk Sağıroğlu ,Test,Test,,,
https://rapidapi.com/cgi-test-cgi-test-default/api/myfirstapi32/, 2 years ago , CGI-TEST ,MyFirstAPI,This is a test API,,,
https://rapidapi.com/patkhai/api/python-libraries-tst/, 2 years ago , Kam Khai ,Python Libraries tst,Testing for mock api endpointss,8.2,7 ms,100%
https://rapidapi.com/suryadwipayana1999/api/test9420/, 2 years ago , R1 0 ,test,test,,,
https://rapidapi.com/achmaddayat/api/testgetapi/, 2 years ago , Achmad Syarif Hidayatullah ,testGetApi,test api for project batman,,,
https://rapidapi.com/divyaoblr89/api/register73/, 7 months ago , Divya O ,register,registration details,8.4,7 ms,100%
https://rapidapi.com/dnorton/api/women-in-tech/, 2 years ago , Dominic Norton ,Women in Tech,A dataset of Women-led startups worldwide,8.2,6 ms,100%
https://rapidapi.com/Kurizu/api/excel-mongo1/, 4 months ago , Kurizu Taz ,Excel mongo,Import / Add data from Excel .xlsx file to mongodb,,,
https://rapidapi.com/AndresCR001/api/origin1/, 2 years ago , Andrés ,Origin,API para proyecto,,,
https://rapidapi.com/amirhosseinbahrani1385/api/chattydata/, 2 years ago , Amirhossein Bahrani ,Chattydata,This API is for chatty app,,,
https://rapidapi.com/pacelliv/api/felina-multisig-wallet-api/, 6 months ago , pacelliv ,Felina Multisig Wallet API,Handles the database of the wallet,8.3,"43,924 ms",100%
https://rapidapi.com/attilalukovics/api/peempee/, a year ago , Attila Lukovics ,Peempee,Peempee cloudflare api,8.2,534 ms,100%
https://rapidapi.com/varopn/api/crud6/, 2 years ago , Никита Варопн ,CRUD,CRUD,,,
https://rapidapi.com/laptopdb/api/laptopdb1/, a year ago , laptopdb ,LaptopDB,Laptop database API that contains both specs and images of most laptops. Updated on daily basis.,,,
https://rapidapi.com/whoisapi/api/domain-availability/, 2 years ago , Whois XML API ,Domain Availability,Domain Availability API lets you check instantly if a domain name is available to be registered.,,,
https://rapidapi.com/mquanx88/api/random-info-usa/, a year ago , Mạc Quân Official ,Random Info USA,get random address in USA,,,
https://rapidapi.com/theapimonk-theapimonk-default/api/uspto-pair-law-firm-legal-status-search/, 2 years ago , theapimonk ,USPTO PAIR Law Firm/Legal Status Search,USPTO PAIR Legal Status Search,,,
https://rapidapi.com/ixartz/api/domain-availability-domain-checker-pay-per-use/, 2 years ago , ixartz ,Domain Availability - Domain Checker [Pay per use],"[NO monthly subscription] Fast, easy, real-time and accurate API for Domain Availability. Check if the domain is available for registration.",,,
https://rapidapi.com/zohar-devs-zohar-devs-default/api/automoviles-por-marca-y-ano-2005-2023/, 4 months ago , Zohar Devs ,Automóviles por Marca y Año 2005 - 2023,"Devuelve las marcas de vehículo por año (Año, Marca, Modelo, Tipo, Segmento)",,,
https://rapidapi.com/AndyCosow/api/lithuania-companies-database/, 5 months ago , Andrius Kasovskis ,Lithuania companies database,,,,
https://rapidapi.com/filmbs/api/film-database1/, a year ago , filmbs ,Film Database,"The Internet movie database covers more than 100,000 movies and contains over a million and half filmography listings for actors, producers, directors and ...",,,
https://rapidapi.com/KarlChow92/api/camera-database/, 5 months ago , KarlChow92 ,Camera Database,"Camera bodies from several brands since 1996! We also have interchangable lenses. Old and new, all there.",,,
https://rapidapi.com/kamranalizx491/api/login-signup-api/, 10 months ago , Kamran Ali ,Login/Signup API,Node js Login and Signup API with JWT Secure Token That Will Expire in 7 days. with Forget Password Functionality also Hashed Password Functionality,,,
https://rapidapi.com/dshell/api/tradesmencosts/, 2 years ago , dshell ,tradesmencosts,An api for tradesmen costs,,,
https://rapidapi.com/petrusalmancor/api/rapidapi79/, a year ago , Pedro Benevides ,rapidapi,rapidapi,,,
https://rapidapi.com/birdmanhub/api/anichapassport/, 2 years ago , birdmanhub ,anichapassport,egsvp,,,
https://rapidapi.com/abrock77-8IGQvch4OEt/api/intelliticksapi/, 2 years ago , Amey Bhojane ,intelliticksapi,"name,description,size",,,
https://rapidapi.com/juniordeveloperonline/api/creeper-database-mangement/, a year ago , Anand Kumar ,Creeper Database Mangement,Creeper Is A Discord Bot.,,,
https://rapidapi.com/nick.damato001/api/lambert-vin-importer/, 2 years ago , Nicholas Damato ,Lambert vin importer,Website importer,,,
https://rapidapi.com/AndresCR001/api/proyecto/, 2 years ago , Andrés ,Proyecto,Desarrollo de juego,,,
https://rapidapi.com/whoisapi/api/reverse-whois/, 2 years ago , Whois XML API ,Reverse Whois,"Reverse WHOIS API lets you see all the domain names containing specified search terms (names, email, address, phone, etc.) based on WHOIS records.",,,
https://rapidapi.com/fakers/api/faker2/, a year ago , fakers ,Faker,data generator and API mocking tool,,,
https://rapidapi.com/jobhathero/api/climate-tech-unicorns/, a year ago , jobhathero ,Climate tech unicorns,A Climate tech api on climate tech unicorns,,,
https://rapidapi.com/ttanh0006-4X_-ePhROuv/api/memes-responses/, a year ago , Anh Trần Trung ,memes responses,aughhhhhh,,,
https://rapidapi.com/dathere-inc-dathere-inc-default/api/geo_coder_dev/, a year ago , datHere Inc ,Geo_Coder_Dev,Geocoder,,,
https://rapidapi.com/20myworks/api/car-info-limited-info/, a year ago , NZAPI ,Car Info Limited Info,This API retrieves information about a specific vehicle active on the NZTA register based on either the VIN or the registration plate.,,,
https://rapidapi.com/kashif619/api/key-value-store1/, a year ago , Klabs ,Key Value Store,A simple key-value store where you can put any JSON parseable data.,,,
https://rapidapi.com/s00d/api/my-geo-cloud/, 2 years ago , Pavel Kuzmin ,My GEO cloud,MY GEO CLOUD,,,
https://rapidapi.com/a9812263/api/webdis/, a year ago , a9812263 ,webdis,Cloud webdis is a simple HTTP server which forwards commands to Redis and sends the reply back using a format of your choice. It's very useful when you want to store some stateful data in to a cloud cache.,,,
https://rapidapi.com/rishabhdev/api/tsedmongoapi/, 2 years ago , rishabhdev ,TsedMongoAPI,Typescript Tsed Framework on Mongo Database,,,
https://rapidapi.com/ericzheng050701-kFbMlcLzi/api/top-10-customers/, a year ago , Eric Zheng ,Top 10 Customers,Top 10 Customers In Superstore,,,
https://rapidapi.com/achmaddayat/api/testpostapi1/, 2 years ago , Achmad Syarif Hidayatullah ,testPostApi,POST API batman RDS,,,
https://rapidapi.com/katyabirukova52/api/lb9/, a year ago , Катя Бирюкова ,lb9,Example API for lb9,,,
https://rapidapi.com/lexalikhtarovich/api/aleksea/, 2 years ago , Алесей Лихтарович ,Aleksea,development,,,
https://rapidapi.com/ahmeddevilg-Tfk3mM10hTU/api/adddata/, 2 years ago , ahmed dev ,addData,that add Data,,,
https://rapidapi.com/shwetha382001/api/data95/, a year ago , shwetha ravikumar ,Data,collection of Images,,,
https://rapidapi.com/belchiorarkad-FqvHs2EDOtP/api/taxes-and-social-security-rates/, 2 years ago , Pinto Studio ,Taxes and Social Security Rates,This API allows to get Corporate & Personal Taxes/ Social Security Rates for Company and Employees. All the Data Sources are from: trading economics,,,
https://rapidapi.com/lahcenbcf/api/profile-details-api/, 10 months ago , Hassane BENCHAREF ,profile details api,"with this api ypu are able to get a random username profiles with all the details including name , job , avatar ....",,,
https://rapidapi.com/andrehfp-Gzy21NHpF9K/api/api-imoveis-locacao/, 2 years ago , André Prado ,api-imoveis-locacao,Retorna imóveis para locação de diversas imobiliárias em Ponta Grossa - PR,,,
https://rapidapi.com/warrenbitbyte-S_0WwDVF35s/api/token-lists/, 2 years ago , Warren Bitbyte ,Token Lists,Almanack Extended - Token Lits,,,
https://rapidapi.com/fmvtofficial/api/jokesapi/, 3 months ago , FMVT ,JokesApi,Jokes Api that contains all type of jokes,,,
https://rapidapi.com/lastcodeid/api/exactbins1/, 5 months ago , BIIN database ,exactbins,Exact Bin database,,,
https://rapidapi.com/binfoconsultas/api/lista-de-empresas-por-segmento/, a year ago , BINFO ,Lista de empresas por segmento,Lista de empresas segmentadas | Leads segmentadas,2.0,"1,359 ms",10%
https://rapidapi.com/thmas5952/api/souls-api/, 5 months ago , Thomas Lincoln ,Souls API,"Unleash the power of Dark Souls in your applications! With a comprehensive collection of Dark Souls data, including weapons, armor, items, and enemies, Souls API provides developers with detailed insights, extensive statistics, scaling attributes, special effects, and immersive lore. Whether you're building a companion app, fan website, or gaming tool, Souls API is your go-to resource to create captivating experiences for Dark Souls enthusiasts. Join us and harness the power of the Dark Soul...",1.9,"30,479 ms",20%
https://rapidapi.com/whoisapi/api/subdomains-lookup/, 2 years ago , Whois XML API ,Subdomains Lookup,Subdomains Lookup API lists all the subdomains for a queried domain name.,2.2,"1,944 ms",100%
https://rapidapi.com/SzymonDukla/api/holidayapi1/, 2 years ago , Szymon Dukla ,HolidayAPI,"Festivo Holiday API is a global bank holiday & observance JSON API platform. With support for 8000+ holidays in native languages in 250+ countries, we got you covered. Get started for FREE!",,,
https://rapidapi.com/MediaFrog/api/md5-reverse-search/, 2 years ago , MediaFrog ,Md5 Reverse Search,Our tool uses a huge database in order to have the best chance of cracling the original word. Just enter the hash in the MD5 decoder in the form above to try to decrypt it!,0.0,16 ms,0%
https://rapidapi.com/OrbitSolve/api/fairestdb/, 2 years ago , Admin ,FaiRESTdb,"Online NoSQL database to store and retrieve your data. You can select a region where you would like to store your data from the version list. Storage is free, you pay only for the requests.",0.1,"34,077 ms",0%
https://rapidapi.com/lynsey/api/yooooooooexcusememiss/, 2 years ago , Lynsey Ham ,yooooooooexcusememiss,Description,,,
https://rapidapi.com/rahilkhan224/api/india-company-search/, 4 months ago , AK IT services ,India Company Search,"search all companies registered in india, by their name.",0.0,"1,032 ms",100%
https://rapidapi.com/tal99333-qUvbMsf8HFS/api/mongo-to-sql/, 2 years ago , Tal Amsalem ,mongo-to-sql,mongodb object converter API from mongodb object to sql with no problems,,,
https://rapidapi.com/data-axle-data-axle-default/api/data-axle-consumer-address-search/, 2 years ago , Data Axle ,Data Axle Consumer Address Search,Find relevant People in the Data Axle database,,,
https://rapidapi.com/nayef2757-bbZ5ND8RSLM/api/upc-ean-lookup-with-image/, a year ago , API Solutions ,UPC EAN LOOKUP With Image,UPC / EAN Barcode lookup returns product name and image,0.0,74 ms,0%
https://rapidapi.com/oli799/api/keyval-storage/, 2 years ago , oli799 ,KeyVal Storage,Simple Key-Value DB.,,,
https://rapidapi.com/periclesdambroski1/api/consulta-numero/, 2 years ago , astrahvh ,Consulta Numero,Meu Telegram @astrahvh,0.0,"127,203 ms",0%
https://rapidapi.com/nickilu009/api/architecture/, 2 years ago , nbbosco ,Architecture,An API of the most relevant architecture projects around the world.,,,
https://rapidapi.com/rahilkhan224/api/indian-railway-irctc/, 4 months ago , AK IT services ,Indian Railway IRCTC,"Train search, live train status, etc all train infos related to Indian railways",0.1,916 ms,100%
https://rapidapi.com/caesarkrit/api/electric-vehicle-population/, 4 months ago , Caesar Krit ,electric vehicle population,This dataset shows the Battery Electric Vehicles (BEVs) and Plug-in Hybrid Electric Vehicles (PHEVs) that are currently registered through Washington State Department of Licensing (DOL).,,,
https://rapidapi.com/9926495895myfather/api/address-book-api/, 9 months ago , ABHAY PARIHAR ,Address-Book-API,"This API is able to store contacts. You can update them as well. Also, if you want to add contacts you can do it.",,,
https://rapidapi.com/nayef2757-bbZ5ND8RSLM/api/movie-quote/, a year ago , API Solutions ,Movie Quote,"Find any quote in millions of movies and series. All quotes are time-based, contextualized, and linked with the imdb movie database.",0.1,416 ms,0%
https://rapidapi.com/way2risetech/api/aadhaar-verification-okyc/, 9 months ago , way2risetech ,Aadhaar verification OKYC,"Aadhaar full kyc like name ,photo, address..etc",0.1,82 ms,0%
https://rapidapi.com/rahilkhan224/api/check-tds-rate/, a year ago , AK IT services ,Check TDS rate,Check TDS rate on Cash Withdrawal u/s 194N,,,
https://rapidapi.com/juanpacode-eHfmYiTICZK/api/ui-gradients-db/, a year ago , Juanpacode Systems ,UI Gradients DB,add amazing ui gradients in your app,,,
https://rapidapi.com/julcardo870205/api/loockupsa/, 2 years ago , julcardo870205 ,LOOCKUPSA,Describe Bank Name of BIN,,,
https://rapidapi.com/idfy-idfy-default/api/domain-validation/, 2 years ago , IDfy ,Domain Validation,"Be certain that an individual claiming to work at a specific organization is not providing you a fake email ID that just “looks” like one from that organization by using the domain validation API. For example, consider an employee claiming to be from a company “xyz”. The email employee@companyxyz.com and the email employee@companyxyz.org may refer to two completely different organizations – use the domain validation API to identify the right one.",,,
https://rapidapi.com/abdulsamedkeskin/api/file-upload8/, a year ago , abdulsamedkeskin ,File Upload,Upload file,0.0,"2,433 ms",100%
https://rapidapi.com/mycoding73-29RJKzwz_49/api/mangadb-with-lots-of-top-rated-manga-manwha-manuha/, a year ago , Coding Coder ,Mangadb with lots of top-rated manga manwha manuha,it provides latest updated manga manwha and manuha with ratings and no of views,,,
https://rapidapi.com/leonkura/api/mysql3/, a year ago , leonkura ,MySQL,Execute MySQL queries via this REST API,,,
https://rapidapi.com/BasToTheMax/api/simplekv/, a year ago , BasToTheMax ,SimpleKV,A simple Key Value Database API,,,
https://rapidapi.com/periclesdambroski1/api/consulta-nome1/, 2 years ago , astrahvh ,Consulta Nome,Meu Telegram @astrahvh,0.0,"127,264 ms",0%
https://rapidapi.com/periclesdambroski1/api/consulta-cpf2/, 2 years ago , astrahvh ,Consulta Cpf,Meu Telegram @astrahvh,0.0,"127,249 ms",0%
https://rapidapi.com/nabase-nabase-default/api/consulta-cpf-cnpj-brasil/, 2 years ago , Nabase ,Consulta CPF CNPJ Brasil,"api consulta cpf cnpj diretamente na base do serasa, otimize suas aplicações",0.1,"30,242 ms",0%
https://rapidapi.com/nabase-nabase-default/api/auxilio-emergencial/, 2 years ago , Nabase ,Auxilio Emergencial,Api Auxilio Emergencial completa,,,
https://rapidapi.com/lunegreiros/api/emotion-thesaurus/, 2 years ago , Tools for Writers ,Emotion TheSaurus,Brainstorm physical signals and behaviors to express your character’s emotions in ways that fit their personality and emotional range. Essential tool for creative writing.,,,
https://rapidapi.com/abiodunoluwasegunsharafa-Pu9kywlF-YE/api/funny-joke-dataset/, 2 years ago , Abiodun O.S ,Funny Joke Dataset,This API provides a random dataset of English jokes s which you can use for testing your application,0.0,37 ms,100%
https://rapidapi.com/bakhtjamal789/api/country-state/, 2 years ago , Bakht Jamal ,Country State,API contains countries state and cities data.,,,
https://rapidapi.com/tailoralm/api/consultacnpj/, 2 years ago , Tailor Andres López Maffini ,ConsultaCNPJ,API Gratuata de consulta de dados de pessoas jurídicas (CNPJ),0.0,380 ms,100%
https://rapidapi.com/CompaniesData/api/companies-data1/, 2 years ago , CompaniesData ,Companies Data,Learn more about your prospect/client/supplier/partner in no time,,,
https://rapidapi.com/nachogonza123-maNFUM16e_H/api/auth100/, 2 years ago , Tato ,Auth100,Secure Auth API. Create users and manage them. JWT login system. Huge relationship DataBase with SQL.,0.0,"127,298 ms",0%
https://rapidapi.com/sharyt26shar/api/open-ai1/, a year ago , Edward ,Open Ai,"Access GPT-3, which performs a variety of natural language tasks, Codex, which translates natural language to code, and DALL·E, which creates and edits original images.",,,
https://rapidapi.com/autogt-klub-ltd-autogt-klub-ltd-default/api/vin-data/, 2 years ago , AutoGT Klub Ltd ,VIN data,Just enter your vehicle identification number (VIN),,,
https://rapidapi.com/cruzanayadavid/api/github-scraper/, 10 months ago , davthecoder ,Github Scraper,demo hithub scraper,,,
https://rapidapi.com/koukoulina001/api/world-cities7/, a year ago , brahim koukou ,World Cities,GET world countries and cities.,,,
https://rapidapi.com/magiabinaria/api/sheetcron-pro/, 2 years ago , magiabinaria ,Sheetcron PRO,Sheetcron en NODEJS - Convierte cualquier documento de Google Sheet en una API en formato JSON,,,
https://rapidapi.com/Golubev-S/api/golubev/, 2 years ago , Golubev-S ,Golubev,Golubev,,,
https://rapidapi.com/kojun1412/api/cosmetic-ingredients2/, 2 years ago , 으악 ,cosmetic ingredients,"cosmetic ingredients names korean , english data",0.0,339 ms,0%
https://rapidapi.com/EverettMoss/api/baby-names2/, 2 years ago , EverettMoss ,Baby Names,API that returns all baby names with the provided amount of letters,,,
https://rapidapi.com/idfy-idfy-default/api/vehicle-rc-verification-advanced/, 2 months ago , IDfy ,Vehicle RC Verification Advanced,This API is used to verify Vehicle Registration Certificate (RC) number against Vahan vehicle database. The API allows you to - Fetch vehicle details registered against an RC number Find the name of the vehicle’s owner Check class of vehicle Verify registration date of the vehicle,0.1,128 ms,100%
https://rapidapi.com/jamesalester/api/ufo-sightings/, 2 years ago , James Lester ,UFO Sightings,Get and search for UFO sightings and recent images and videos captured by experiencers,0.0,313 ms,0%
https://rapidapi.com/standingapi-standingapi-default/api/studio-ghibli/, 2 years ago , StandingAPI ,Studio Ghibli,"The Studio Ghibli API catalogs the people, places, and things found in the worlds of Ghibli. It was created to help users discover resources, consume them via HTTP requests, and interact with them in whatever way makes sense. Navigation can be found on the left sidebar, and the right sidebar shows examples of returned objects for successful calls.",0.0,482 ms,0%
https://rapidapi.com/grealmutol/api/city27/, a year ago , grealmutol ,city,cities Api,,,
https://rapidapi.com/data-axle-data-axle-default/api/data-axle-business-address-search/, 2 years ago , Data Axle ,Data Axle Business Address Search,Find relevant businesses in real-time.,0.0,"1,260 ms",100%
https://rapidapi.com/gizipp/api/indonesian-kata-baku-kbbi/, 2 years ago , gizipp ,Indonesian Kata Baku KBBI,Indonesian Kata Baku (standart-word) checker based on KBBI,,,
https://rapidapi.com/data-axle-data-axle-default/api/data-axle-consumer-search/, 2 years ago , Data Axle ,Data Axle Consumer Search,Find relevant listings in the database,0.1,"1,058 ms",100%
https://rapidapi.com/igordc16-Y4wpE4GjyvI/api/pagequotes/, 7 months ago , Igor Pantaleão ,PageQuotes,"In addition to the database of quotes from books, PageQuotes API also offers sentiment analysis functionality to determine the emotional tone conveyed in each quote. This feature uses natural language processing algorithms to analyze the words and phrases used in the quote and identify whether the sentiment expressed is positive, negative, or neutral. With this added functionality, developers can use the API to retrieve quotes and analyze their sentiment, providing insights into the emotional...",0.0,"1,252 ms",0%
https://rapidapi.com/anadev24/api/life-purpose-quotes-db/, 2 years ago , curiouscat ,Life Purpose Quotes DB,This endpoint returns 1000+ quotes about life purpose and being motivated.,,,
https://rapidapi.com/idfy-idfy-default/api/voter-card-verifications/, 2 years ago , IDfy ,Voter Card Verifications,"With the Voter Card Verification API, you can now onboard with confidence knowing that the individuals you onboard are holding a valid Voter Card issued by the Government of India, are eligible to vote, and have provided you with reliable identity and address proofs. Couple it with our Voter Card OCR API to make your identity verification process seamless and instant!",0.0,99 ms,0%
https://rapidapi.com/sameer.kumar/api/india-bank-search/, 2 years ago , Sameer Kumar ,India Bank Search,"Search IFSC, MICR, other details of a bank's branch just by a searchable API",0.0,"1,049 ms",0%
https://rapidapi.com/squidcoders-squidcoders-default/api/consulta-cpf-e-nome/, 2 years ago , squidcoders ,Consulta CPF e Nome,Consulte informações e telefones de pessoas físicas por cpf ou nome,0.0,"127,291 ms",0%
https://rapidapi.com/periclesdambroski1/api/consulta-cep1/, 2 years ago , astrahvh ,Consulta Cep,Meu Telegram @astrahvh,,,
https://rapidapi.com/standingapi-standingapi-default/api/cat-library/, 2 years ago , StandingAPI ,Cat Library,All about Cats,,,
https://rapidapi.com/mcarolacorvalan/api/summery/, 2 years ago , Carola Corvalan ,Summery,Dashboard summery,0.0,0 ms,0%
https://rapidapi.com/marketingboam/api/bankofads-v1/, 2 years ago , BOA Marketing ,Bankofads V1,API for phone number verification,,,
https://rapidapi.com/wirantopranoto5/api/busiti-net/, 2 years ago , Wira Pranoto ,busiti.net,userman,,,
https://rapidapi.com/ulvi.1999rufet/api/cretae-user/, 2 years ago , Grand Theft Auto Vidieos ,Cretae User,Yes Users,,,
https://rapidapi.com/binamjad/api/darulifa/, 2 years ago , binamjad ,darulifa,Darulifta.info Data,,,
https://rapidapi.com/rab.dev89/api/manga-series/, 2 years ago , Ron Baniqued ,Manga Series,Manga Eden Api for Manga Series,0.1,8 ms,0%
https://rapidapi.com/jmichael.imperial/api/customer1/, 2 years ago , Michael Imperial ,Customer,Test,,,
https://rapidapi.com/harrypermadis/api/nol-digit/, 2 years ago , Harry PS ,Nol Digit,belajar,,,
https://rapidapi.com/ulvi.1999rufet/api/register6/, 2 years ago , Grand Theft Auto Vidieos ,Register,Yes,,,
https://rapidapi.com/aminkoaspsn/api/48store/, 2 years ago , aminpsn koas ,48store,48store,,,
https://rapidapi.com/goblogmania4/api/click-adilla/, 2 years ago , homeindie ,Click adilla,test for API,,,
https://rapidapi.com/omnibiz/api/getbusinessdata/, 2 years ago , OmniBiz ,GetBusinessData,To get publisher Data,,,
https://rapidapi.com/GopiSonawnae/api/testdata1/, 2 years ago , GopS ,TestData,Testing GET POST PUT DELETE,,,
https://rapidapi.com/Immanuel/api/online-key-value-store/, 2 years ago , Immanuel ,Online Key Value Store,"Simple online key value store as Servcei Api fro developers to mange any variable to me maintained on cloud, (Ex: Website Hit count etc..)",,,
https://rapidapi.com/mitanshuxzero/api/miyansapi/, 2 years ago , mitanshu narawat ,Miyansapi,use as a youtube video downloader,,,
https://rapidapi.com/PeterAbdalla/api/bartenders/, 2 years ago , PeterAbdalla ,Bartenders,Today's prices,0.0,0 ms,0%
