API链接,Update_Time,Author,API名称,API描述,API Popularity,API Latency,API Service Level
https://rapidapi.com/esignly/api/esignly/, 3 months ago , esignly ,eSignly,"eSignly revolutionary electronic signatures are transforming the way industries which include, but not limited to insurance, healthcare, government , real estate and finance and IT firms sign different documents. Now, it is possible to reduce those everyday hefty tasks of managing piles of papers or documents. With the smartest tool of signing, it is easy to prepare, send, share and produce any document in seconds. Esignly offers the most reliable e-signature solution to diverse industries an...",8.8,460 ms,100%
https://rapidapi.com/gguw6adfls/api/kontrola-vozila-hrvatska/, 3 months ago , Hrvatska-soft ,Kontrola vozila Hrvatska,API za provjeru podataka o osiguranju vozila u Hrvatskoj,9.0,"3,499 ms",100%
https://rapidapi.com/24hkhoedep/api/24hkhoedep/, a year ago , 24hkhoedep ,24hkhoedep,"24hkhoedep.com là trang bán lẻ trực tuyến trực thuộc Công Ty TNHH Chăm Sóc Khoẻ Và Đẹp Việt Nam – một công ty chuyên nhập khẩu và phân phối độc quyền cho các hãng dược mỹ phẩm và trang thiết bị y tế từ Châu u. #khoedep #khoedepvietnam #mypham #myphamchauau #duocphamchauau #duocmypham #mụn thịt #rối loạn tiêu hóa #ngực chảy xệ Địa chỉ : 40/19 Bàu Cát 2, Phường 14, Quận Tân Bình, TP. HCM, Việt Nam Hotline 028 - 6296 2262 | 0931320062 Email: hbcvn@healthbeautycare.com.vn Google map https://www....",9.0,390 ms,63%
https://rapidapi.com/opt-nc-opt-nc-default/api/domaine-nc/, 10 months ago , OPT-NC for developers ,DOMAINE nc,"API REST pour interagir avec les noms de domaine, de connaitre leur date d'expiration.",9.4,980 ms,100%
https://rapidapi.com/developer-relations/api/rapidapi-credits/, 10 months ago , RapidAPI ,RapidAPI Credits,Apply promotional credits from the Rapid DevRel team to your account. Check the tutorials tab to read how.,8.0,"2,880 ms",100%
https://rapidapi.com/ugproxy/api/ugproxy/, 2 years ago , UGPROXY ,UGPROXY,UGPROXY Service | Proxy List - Residential Proxy - Rotating IP's Proxy Service,,,
https://rapidapi.com/gapjumpers/api/diversity-data-io/, 2 years ago , Kedar ,Diversity Data IO,Determine the gender and ethnicity/ race of a full name. Easily determine the diversity of a population.,8.2,310 ms,100%
https://rapidapi.com/deltagain/api/deltagain-uk-company-data-and-accounts/, 8 months ago , deltagain ,DeltaGain - UK Company Data and Accounts,"[BETA] Company Information for UK registered Companies inlcuding Company Financial Accounts, Mortages and Charges, Officers, Persons with Significant Controll, Shareholders, Group Structures and now - UK Land Owersnhip. Accounts may contain a variety of financial information including Balance Sheet and Profile and Loss information. Drop us a line with your use-case and API suggestions! DeltaGain has over 4 Million companies in the database and approximately 10 million account records for o...",,,
https://rapidapi.com/infopay/api/email-search-by-emailsherlock/, 2 years ago , infopay ,Email Search by EmailSherlock,A reverse email search conducted at EmailSherlock.com can help determine the identity of the owner of an unknown address that shows up in your inbox. You can also use this free email search service to learn more about an address you found in your address book or perhaps in connection with an online ad you're considering responding to.,,,
https://rapidapi.com/api-tier1-apitier-team/api/validate-vat/, a year ago , API Tier ,Validate VAT,"Verifies EU & GB VAT Numbers and gets company information, and address details. Extended documentation can be found here: https://www.apitier.com/api-catalogue/validate-vat-api",8.2,"2,985 ms",100%
https://rapidapi.com/companyscout/api/companyscout/, 4 months ago , companyscout ,CompanyScout,"REST APIs to retrieve company data, ultimate beneficial owner data, and more.",8.2,393 ms,100%
https://rapidapi.com/kc35-kc35-default/api/employment-job-change-tracker/, 8 months ago , KC35 ,Employment Job Change Tracker,"Easily track when a key contact, champion or product power user leaves a company. Job changes create new opportunities for sales teams. These changes can also create a churn risk in your existing customer base and sales pipeline. With this API you can track when these changes happen. Simply provide the LinkedIn Person and Company Profile URLs of the person you want to verify employment. - Save hours of manually checking for changes in employment by automating it. - Increase sales pipeli...",8.2,6 ms,100%
https://rapidapi.com/oamdynamics/api/stockx-pricing-data-and-market-analytics/, 10 days ago , oamdynamics ,Stockx pricing data and market analytics,"**STOCKX API** Our real-time data feeds deliver the insights you need to create value in the world of sneaker trading, collecting, and reselling.",8.2,"1,058 ms",100%
https://rapidapi.com/audox-ingenieria-spa-audox-ingenieria-spa-default/api/sandbox-api1/, 3 months ago , Audox Ingenieria SpA ,Sandbox API,API for Audox Sandbox,,,
https://rapidapi.com/woorati/api/comprehensive-business-insights-for-finnish-companies/, 3 months ago , woorati ,Comprehensive Business Insights for Finnish Companies,"Woorati API is an exhaustive data solution for anyone looking to obtain comprehensive business data about Finnish companies. This service empowers you to query company data using business ID, domain, or associated personnel. With this powerful tool, users can gain insights into a company's tax debt, financial health, and the technology stack they are utilizing. It also offers exclusive data about government purchases, providing a robust picture of the company's business operations. Streamline...",,,
https://rapidapi.com/appaio/api/france-company-data/, 10 months ago , appaio ,France Company Data,Access to the official french government business register via an API. Ideal for KYB,8.3,"2,278 ms",100%
https://rapidapi.com/alreadycoded/api/local-business-listing-finder/, 6 months ago , alreadycoded ,Local Business Listing Finder,This API can provide you data of local businesses based on provided search term and location.,,,
https://rapidapi.com/tstep916/api/calendar22/, 2 years ago , Thomas Step ,Calendar,Create calendars and keep track of events,,,
https://rapidapi.com/dock-labs-ag-dock-labs-ag-default/api/dock-api1/, 7 months ago , Dock Labs AG ,Dock API,"Dock's API easily integrates with your system and data sources, working in the background to make your data fraud-proof and instantly verifiable. With this API, developers can easily leverage Verifiable Credentials (VCs) and Decentralized Identifiers (DIDs) in their applications. VCs and DIDs are interoperable with other wallets and verification services using the same W3C open standards.",,,
https://rapidapi.com/apishub/api/share-screens/, 2 years ago , apishub ,Share Screens,"Share your screen on desktop computers without installing any software. View screen sharing from any device (PC, Mobile) with a browser without installing any software. You can expect low-latency screen sharing. Provide collaborate annotation tool and various resolution plans.",8.3,406 ms,100%
https://rapidapi.com/rahman.abdur4420/api/test-ecohub-marketplace/, 5 months ago , Abdur Rahman ,test ecohub marketplace,test eco-hub marketplace description,,,
https://rapidapi.com/archieamarsanaa/api/ofac-service/, 8 months ago , Amar Amgalan ,OFAC Service,Searches an entity from OFAC's Sanctions List with fuzzy logic on its name search field to look for potential matches on the Specially Designated Nationals (SDN) List and on its Non-SDN Consolidated Sanctions List.,,,
https://rapidapi.com/tec-2-scale-tec-2-scale-default/api/geo-distance-calculator/, 7 months ago , Tec-2-Scale ,GEO Distance Calculator,"Calculate the distance and travel time. Introducing our powerful Geo Distance API, allowing you to calculate the distance and duration between two locations with ease.",,,
https://rapidapi.com/aaronpratt27/api/demo833/, 5 months ago , aaronpratt27 ,Demo,,,,
https://rapidapi.com/Thawtarlamin/api/shwe-2d-live-api/, 16 days ago , Kyaw Minn Khant ,Shwe 2D Live Api,"Myanmar 2D ,Thai Stock ,Set",8.4,"1,713 ms",100%
https://rapidapi.com/appaio/api/south-african-vat-api/, a year ago , appaio ,South African VAT API,Verify a South African VAT number,,,
https://rapidapi.com/scraperium/api/fotocasa1/, 10 days ago , scraperium ,Fotocasa,"Scrape ads from Fotocasa. Get location suggestions, list of ads and property details with this API.",8.4,649 ms,100%
https://rapidapi.com/bheijkoop/api/maintenanceman-nl-asset-management-api/, a month ago , Bart Heijkoop ,Maintenanceman.nl asset management API,"Maintenanceman.nl API allows you to dynamically simulate a complex, usage and/or calendar based maintenance schedule, based on a predefined schedule and historic values and will enable you to quickly and accurately predict when your asset will require maintenance, based on how intensively it is used.",8.2,131 ms,100%
https://rapidapi.com/qrgraphix1/api/custom-qr-code1/, 2 years ago , qrgraphix ,Custom QR Code,"Design QR Code with custom colors for Background, Foreground, eyes and eyeballs. Choose QR Code Designs for QR Code body, eyes and eyeballs. Display your logo on QR Code.",8.4,"6,843 ms",90%
https://rapidapi.com/evlar-evlar-default/api/email-checker-disposable-or-invalid/, 4 months ago , Evlar LLC ,Email Checker - Disposable or Invalid,"Validate and verify email addresses, specifically identifying disposable or invalid email addresses. With this API, you can integrate email verification capabilities into your applications, platforms, or services, enabling you to ensure the accuracy and quality of email contact lists, reduce bounce rates, and improve communication effectiveness.",8.3,"2,228 ms",100%
https://rapidapi.com/immatriculationapi-Sf2chpuXeWt/api/api-de-plaque-d-immatriculation-france/, 6 months ago , immatriculationapi ,API de plaque d'immatriculation (France),"L’API de plaque d’immatriculation est un service web qui permet d’accéder aux données techniques des véhicules immatriculés en France. Grâce à cette API, il est possible de connaître les caractéristiques d’un véhicule à partir de sa plaque d’immatriculation, comme la marque, le modèle, le type de carburant, les émissions de CO2, etc. Ce service est particulièrement utile pour les professionnels de l’automobile, les assureurs, les experts et les particuliers qui souhaitent vérifier les informa...",8.3,"2,730 ms",100%
https://rapidapi.com/doitpom/api/companies-api4/, 4 months ago , xyz xyz ,Companies API,"Stay up-to-date with the latest company information as our API delivers real-time data feeds, ensuring that businesses can make timely and informed decisions.",,,
https://rapidapi.com/tec-2-scale-tec-2-scale-default/api/useful-business-1001-functions/, 7 months ago , Tec-2-Scale ,Useful Business 1001 Functions,"1001 Functions to enhance your business via API. Access a comprehensive API offering various business functions, including VAT rate lookup, geolocation, currency conversion, email validation, domain verification, BMI calculation, and more.",,,
https://rapidapi.com/bigdatacloud-pty-ltd-bigdatacloud-pty-ltd-default/api/phone-number-validation-by-ip-address/, a year ago , BigDataCloud Pty Ltd ,Phone Number Validation by IP Address,This API provides a similar validation check as the Phone Number Validation API by using the user’s IP address.,,,
https://rapidapi.com/ztt2920671/api/tiktok-video-download/, 9 months ago , King Allen ,tiktok video download,"TikTok no watermark video music download, get video user information",8.1,"2,917 ms",100%
https://rapidapi.com/reit-data-market-reit-data-market-default/api/reit-property-data1/, 8 months ago , REIT Data Market ,REIT Property Data,Property level data and analytics for publicly traded Real Estate owned/operated by Real Estate Investment Trusts (REITs),8.3,"7,031 ms",100%
https://rapidapi.com/businessangelsunited/api/prepaid-legal-api/, 4 months ago , Life Coach Ray ,Prepaid Legal API,"Introducing the Prepaid Legal API: a game-changing solution for accessing legal information. Harness the power of the Web Scraper Express Deluxe, a robust Node.js application built with Express, Axios, and Cheerio. Effortlessly scrape legal data from any webpage, extract desired content using jQuery-like selectors, and deliver it as a polished JSON response. Impress clients with flawless functionality and graceful error handling. Stay ahead of the competition by unlocking the full potential o...",,,
https://rapidapi.com/onlinestorekit/api/startup-ideas/, 7 months ago , onlinestorekit ,Startup Ideas,"A complete collection of startup ideas. Startup Ideas is the ultimate API for anyone looking to jumpstart their entrepreneurial journey. With thousands of unique and innovative startup ideas, sorted by industry, target audience, and market size, our API is the perfect tool to help you brainstorm, research, and develop your next big idea. Easy to use and constantly updated, Startup Ideas is the ideal resource for anyone looking to turn their ideas into reality.",,,
https://rapidapi.com/adityawagh114/api/pdf-to-zpl/, 5 months ago , Aditya Wagh ,PDF to ZPL,,8.1,663 ms,100%
https://rapidapi.com/dearponce-yPccHXkVcOT/api/us-public-schools-api/, 3 months ago , Rob Ponce ,US Public Schools API,an api to get you most of the public schools in the US by thier Zipcode,8.1,48 ms,100%
https://rapidapi.com/kallumparr/api/uk-property-listings/, 5 months ago , Kazi2812 ,UK Property Listings,"Access and retrieve properties for rent and sale in the UK by postcode, as well as sourced properties such as no chain or high rental yield.",8.2,"10,968 ms",100%
https://rapidapi.com/explorarcofficial/api/explorarcs-opengraph-crawling-api/, 8 months ago , Explor Arc ,ExplorArc's OpenGraph Crawling API,The Best API to Fetch all the OpenGraph and Meta tags from an given website URL,,,
https://rapidapi.com/pguardiario/api/opensea-data/, a year ago , pguardiario ,Opensea Data,"Realtime autocomplete, history, and sales / listings data for Opensea NFT collections",,,
https://rapidapi.com/hassan.cs91/api/what-people-are-searching-for/, 4 months ago , PromoterKit ,What People Are Searching For?,Discover popular questions people are asking online on Google,8.3,"13,940 ms",100%
https://rapidapi.com/herriekyarib/api/french-cnit-type-mime-api/, 5 months ago , QuantumTech ,French CNIT / Type Mime API,Lookup French CNIT / Mime Type values,8.2,"8,962 ms",100%
https://rapidapi.com/appaio/api/netherlands-company-data/, 10 months ago , appaio ,Netherlands Company Data,Access to the official Netherlands Government company register via this API. Ideal for KYB purposes,,,
https://rapidapi.com/assafbarButterfly/api/the-world-bank-api/, 4 months ago , AsiBFLYING ,The World Bank API,The World Bank Documents & Report API v0.2,,,
https://rapidapi.com/bigdatacloud-pty-ltd-bigdatacloud-pty-ltd-default/api/user-agent-parser1/, a year ago , BigDataCloud Pty Ltd ,User Agent Parser,This API provides an extremely quick and simple parser which gives you clearly readable and defined information based on the provided UA string.,,,
https://rapidapi.com/belchiorarkad-FqvHs2EDOtP/api/email-validator51/, 4 months ago , Pinto Studio ,Email Validator,"Check email addresses in real-time to verify their existence and validity. This ensures that a mailbox exists and is active, helping to maintain the integrity of your user database.",,,
https://rapidapi.com/rapihub-rapihub-default/api/eu-vat-number-check-vat-check-rest-api/, 20 days ago , RapiHub ,EU VAT Number Check | VAT Check REST API,Fast and accurate EU VAT number validation REST API. Easy to use.,,,
https://rapidapi.com/dnevedrov-ud3itwydw/api/qr-code-generator30/, 3 months ago , dnevedrov ,QR Code Generator,The app generates QR code,,,
https://rapidapi.com/kcrbsd/api/ld/, 2 years ago , kcrbsd ,LD,Lanka Designer Website,,,
https://rapidapi.com/alnka-alnka-default/api/example-2/, 2 years ago , ALNKA ,Example #2,"Lorem ipsum dolor sit amet, consectetur adipiscing elit. Aliquam bibendum nulla sit amet auctor aliquet. Cras fermentum ligula orci, hendrerit euismod neque facilisis id. Nunc tempor pellentesque nisi id iaculis.",8.1,507 ms,100%
https://rapidapi.com/188org1-t1/api/8prd2t1api1/, 2 years ago , 188org1 ,8prd2T1api1,8prd2T1,,,
https://rapidapi.com/sipp11/api/add2/, 2 years ago , sipp11 ,Add,Add any number,,,
https://rapidapi.com/cxolast/api/1117/, 2 years ago , Алексей Паняев ,111,fdfd,,,
https://rapidapi.com/Paperlit/api/paperlit/, 2 years ago , Paperlit ,Paperlit,Api for Paperlit digital publishing platform,,,
https://rapidapi.com/DataServices/api/faqs-on-exporting/, 2 years ago , DataServices ,FAQs on Exporting,The Frequently Asked Questions (FAQs) API includes more than 300 commonly asked questions about exporting. The answers provided are from government experts that specialize in unique aspects of trade.,,,
https://rapidapi.com/DataServices/api/ita-offices-centers/, 2 years ago , DataServices ,ITA Offices Centers,The ITA Offices & Centers API provides contact and address information for all of ITA’s domestic and international export assistance centers. There are almost 200 ITA centers worldwide whose locations are managed by ITA’s internal office management system.,,,
https://rapidapi.com/sameerbhatia/api/proprofs-polls-maker/, 2 years ago , sameerbhatia ,ProProfs Polls Maker,"ProProfs Poll Software, offers instructors, educators and organizations advanced options for creating effective online polls, in a matter of minutes. With ProProfs, anyone can create different kinds of polls using multiple choices, checkboxes and essay question types. Users can create text-based polls, image-based polls and even polls with a combination of text, images and videos. A set of advanced customization features allows users to create polls, using different themes, adding comment sections, shuffling answers and even adding an expiry date to the polls. Along with this, ProProfs offers powerful security features, for blocking repeat voting and creating password protected polls. Users also get detailed reports for their polls and get visual representation of statistics in the form of pie charts.",8.2,"1,179 ms",100%
https://rapidapi.com/zenpayroll/api/zenpayroll/, 2 years ago , zenpayroll ,ZenPayroll,"ZenPayroll is delightful, modern payroll. Our comprehensive payroll service enables businesses to get set up and run payroll in minutes, from any web enabled device. All government payroll taxes, reporting, and compliance are taken care of automatically and paperlessly. The ZenPayroll API transforms payroll from being a vertical silo to a horizontal platform that seamlessly connects applications for HR, time tracking, accounting and other important back office functions. The immediate benefit of enabling systems to “talk” to payroll is efficiency and improved data quality. In the long run, opening up the flow of information between back-office applications and payroll is about creating new ways to manage work and compensate employees. For instance, imagine a point-of-sale system that could dynamically offer incentives to salespeople based on changes in inventory or an HR system that could generate on-the-spot bonuses for employees to reward them for their great work.",,,
https://rapidapi.com/chartbeat/api/chartbeat/, 2 years ago , chartbeat ,Chartbeat,"Chartbeat collects various metrics about each visitor on your site. Some of this is reported basically raw (like number of readers on an article), and some data is mashed up and modified before being reported (like understanding that a visitor that c",8.2,523 ms,100%
https://rapidapi.com/speedplane/api/docket-alarm/, 2 years ago , speedplane ,Docket Alarm,"API for the United States Federal Court System (commonly referred to as PACER). Search for cases, get detailed docket information, and download filings. Save money by downloading cached copies of documents. Docket Alarm is for: (1) Financial institutions that want to run background litigation checks on companies; (2) Document management or doc review systems that want to automatically sync data with the court's; and (3) Law firms that want to automate tracking court filings in their cases.",,,
https://rapidapi.com/passslot/api/passbook/, 2 years ago , passslot ,Passbook,PassSlot is a free service for developers that aims to make Passbook integration easy – Really easy.,,,
https://rapidapi.com/pamfax/api/pamfax/, 2 years ago , pamfax ,Pamfax,"You can use the PamFax API to send faxes, show incoming faxes, create new PamFax users, and a lot more.",,,
https://rapidapi.com/567liveapp/api/567-live-app-2022/, 2 years ago , 567live ,567 Live app 2022,"567 Live có trang chủ 567live.io duy nhất chính xác. Cung cấp đủ link tải 567 live app an toàn cho bạn phiên bản mới nhất. Địa chỉ : 99 Giải Phóng, Đồng Tâm, Hai Bà Trưng, Hà Nội Google map https://www.google.com/maps?cid=7118718670140148249 Hotline 0978720550 Gmail: 567liveapp@gmail.com Website https://567live.io/ https://sites.google.com/view/567live-app/ https://567live.io/tai-ve/567live-apk https://567live.io/tai-ve/567live-ios https://567live.io/thu-muc/app-live/ https://folkd.com/u...",,,
https://rapidapi.com/AcroChannel/api/acrosuite-oauther/, a month ago , Samurai ,AcroSuite OAuther,Get OAuth/OpenID Connect authentication information. OpenID Connect認証情報取得サービスを提供います。,,,
https://rapidapi.com/bongdaao/api/bongdaao/, 2 years ago , bongdaao ,bongdaao,"Bongdaao.online |Bóng đá ảo Online là trò chơi cá độ đổi thưởng thú vị và được ưa chuộng hiện nay. Các trận đấu bóng đá ảo được lập trình sẵn, diễn ra ngẫu nhiên giữa các đội bóng #bongdaao #bongdaaoonline #bongdaaouytin #cadobongdaao #bongdaao.online Địa chỉ 65 Đại Đồng, Thanh Trì, Hai Bà Trưng, Hà Nội Email: bongdaaoonline@gmail.com Website https://bongdaao.online/ https://www.facebook.com/bongdaaoonline https://sites.google.com/view/bongdaao https://stocktwits.com/bongdaao https://bong...",,,
https://rapidapi.com/Turbos1k/api/docs25/, a year ago , Turbos1k ,Docs,Example API for Dosc,,,
https://rapidapi.com/bettingtopnet/api/bettingtop/, a year ago , bettingtop net ,Bettingtop,"Bettingtop.net chuyên Review chi tiết các nhà cái game bài, slot game, game bài đổi thưởng cá cược trực tuyến mới nhất được cập nhật liên tục mỗi ngày. #bettingtopnet #bettingtop #nhà_cái_uy_tín #nhà_cái_uy_tín_tại_Việt_Nam #nhà_cái_cá_cược_uy_tín #cổng_game_uy_tín #cổng_game_đổi_thưởng #đổi_thưởng_uy tín Hotline 0903214547 Địa chỉ : 12A Floor, Siam Tower, 989 Rama I Road, Pathumwan,, Bangkok, 10330 Gmail: bettingtopnet@gmail.com Website https://bettingtop.net/ https://bettingtop.net/nha...",,,
https://rapidapi.com/ae988net/api/ae988net/, a year ago , ae988net ,ae988net,"Ae988.net ☑️ Nhà cái đá gà cựa sắt uy tín số 1 Việt Nam, đến với ae988 bạn sẽ được xem các trận đá gà cựa sắt, cựa dao cùng các game như: bóng đá, đá gà, casino... #đăng ký ae988 #nạp tiền ae988 #rút tiền ae988 #rút tiền ae988 #tải ứng dụng ae988 #linkvaonhacaiae9882022 /m/033_l8 /m/033_l8 #Casino Hotline 0382.977.144 Địa chỉ : 549a Trần Xuân Soạn, Tân Hưng, Quận 7, Thành phố Hồ Chí Minh, Việt Nam Gmail: ae988net@gmail.com Website https://ae988.net/ https://ae988.net/dang-ky-ae988/ http...",,,
https://rapidapi.com/kucasinopro3/api/kucasino-nha-cai-ku-casino-online-so-1/, a year ago , kucasinopro3 ,KUcasino Nha cai KU Casino online so 1,"KU Casino hay Kucasino là nhà cái cá cược trực tuyến uy tín. KU casino Pro luôn nằm trong top 5 nhà cái cá cược chất lượng năm 2021. Đăng nhập, đăng ký, tải app tại trang chủ https://kucasino.pro để tham gia thế giới casino online đẳng cấp thế giới, nhận nhiều ưu đãi hấp dẫn và tiền cược trải nghiệm miễn phí lên đến 128k /m/033_l8 /m/033_l8 #Casino #KU Casino #KUCasinoPro #TảiKucasino #TinTứcKu casino #đăngkýKucasino Địa chỉ 22 Nguyễn Huệ, Bến Nghé, Quận 1, Thành phố Hồ Chí Minh Hotline 8456...",,,
https://rapidapi.com/new88top/api/new88top/, 2 years ago , new88t ,new88top,"new88top.com - new88 Nhà cái uy tín hàng đầu Châu Á, Link vào new88 chính thức cung cấp các game cá cược như: thể thao, đá gà, casino online... #nạp tiền new88 #rút tiền new88 #đăng nhập new88 #đăng ký new88 #NEW88 SDT 0971.97.63.63 Địa chỉ : 266 P. Minh Khai, Mai Động, Hai Bà Trưng, Hà Nội, Việt Nam Gmail: new88top@gmail.com Website https://new88top.com/ Xem thêm https://new88top.com/nap-tien-new88/ https://new88top.com/rut-tien-new88/ https://new88top.com/dang-ky-new88/ h...",8.3,273 ms,100%
https://rapidapi.com/matigrat/api/woo-temp/, a year ago , Mateusz Gratkowski ,Woo-temp,Temp APi,,,
https://rapidapi.com/pukhrajcode2stay-2tqosgKmr9T/api/h2s/, 2 years ago , Pukhraj Suthar ,h2s,h2s api,,,
https://rapidapi.com/hualuong23596-3wbbT4qiaP-/api/deal-catcher/, 2 years ago , Hứa Cát Lượng ,Deal Catcher,Deal Catcher React Native app,,,
