API链接,Update_Time,Author,API名称,API描述,API Popularity,API Latency,API Service Level
https://rapidapi.com/vipulrajdeep/api/vcloud-air-ondemand-calculator/, 2 years ago , vipulrajdeep ,vCloud Air Ondemand Calculator,vCloud Air OnDemand Calculator,,,
https://rapidapi.com/antoinederoche/api/datafield-1/, 2 years ago , antoinederoche ,Datafield,"COMPLETE FORMS AND SURVEY ON MOBILE (EVEN OFFLINE) AND PLUG DATA COLLECTED TO YOUR SYSTEM WITH OUR API. ------------------------------------------ Create and publish your forms and surveys on Datafield mobile application for iPhone, iPad and Android and start collecting on site data in real time. Datafield's mobile form builder is trusted by small, medium and large corporation worldwide",,,
https://rapidapi.com/sameerbhatia/api/proprofs-survey-maker-1/, 2 years ago , sameerbhatia ,ProProfs Survey Maker,"ProProfs is a powerful survey tool, using which educators, instructors, online marketers and organizations can quickly create a range of surveys such as customer feedback survey, market research survey, demographic survey, course evaluation survey and more. Along with this, ProProfs Survey Maker supports advanced features including response grading, detailed survey stats, multiple question types, cross-device compatibility, survey embed facility and many more. ProProfs also makes creating surveys a delight, with a simple drag and drop survey creation interface, easy edit and effortlessly change or reordering of survey questions, all on the same page. With ProProfs Survey Maker you can create surveys tailored to the needs of your respondents and get detailed reports which help you to accurately interpret the results of your survey.",,,
https://rapidapi.com/sameerbhatia/api/proprofs-knowledge-base-software/, 2 years ago , sameerbhatia ,ProProfs Knowledge Base Software,"ProProfs Knowledge Base Software is a powerful online tool, using which businesses can centrally access and manage organizational and employees knowledge. The knowledgebase software also helps organizations to create an online FAQ to share relevant information with their customers by uploading files, documents, videos and more. ProProfs Knowledge Base also facilitates HR professional to centrally manage employees records as well as share relevant HR policies, procedures and know-hows.",,,
https://rapidapi.com/dmdigital/api/timeneye-time-tracking/, 2 years ago , dmdigital ,Timeneye Time Tracking,"Timeneye Time Tracking is a time tracking and reporting web app meant to be extremely simple and usable even for the most recalcitrant user. Timeneye can be used from the web (http://app.timeneye.com) or from the Android mobile app. An iOS version is currently in development. Timeneye integrates with Basecamp, allowing users to track time directly from Basecamp commenting on their to-dos with the time spent on them.",,,
https://rapidapi.com/edocr/api/edocr/, 2 years ago , edocr ,edocr,Upload docs/pdfs 4 lead generation. Export leads 2 CRM/email marketing 4 lead nurturing.,,,
https://rapidapi.com/mohan21-mohan21-default/api/firstapi52/, 2 years ago , Mohan21 ,firstApi,nadarad,,,
https://rapidapi.com/zakkanaturals/api/zakka-naturals/, 2 years ago , zakkanaturals ,Zakka Naturals -,"Zakka Naturals - Thương hiệu mỹ phẩm thiên nhiên ứng dụng công nghệ tiên tiến. Các sản phẩm của Zakka: serum vitamin c, serum niacinamide, serum b5… #zakkanaturalscom #zakkanaturals #serum vitamin c #serum niacinamide #serum b5 #Mỹ_phẩm #Dưỡng_ẩm_da #Làm_dẹp_da #Sữa_rửa_mặt Địa chỉ : 12/7 Trương Định, Phường 6, Quận 3, Thành phố Hồ Chí Minh, Việt Nam Hotline 0907 050 959 | 02866709966 Gmail: zakkanaturalscom@gmail.com Google map https://www.google.com/maps?cid=1204409815373898565 Website ...",,,
https://rapidapi.com/anthonyhrwbdo85/api/sabasportscc/, 7 months ago , saba sport ,sabasportscc,https://www.sabasports.cc/ Saba Sport CC là nhà cung cấp tỉ lệ kèo nhà cái trực tuyến có đông người chơi nhất hiện nay.,,,
https://rapidapi.com/boudiz-boudiz-default/api/boudinet/, 2 years ago , boudiz ,BoudiNet,BoudiNet,,,
https://rapidapi.com/lode888com/api/lode88/, 2 years ago , lode888com ,LODE88,"lode88 - lode888.com ⭐️ Là cty lô đề trên mạng, đánh số đề tại LODE88 đảm bảo tỷ lệ ăn cao, rút & nạp tiền nhanh, an toàn. Có bí kíp soi cầu lô đề, số đề... #đăng_ký_lode88 #nạp_tiền_lode88 #tải_ứng_dụng_lode88 # lode88 #rút_tiền_lode88_2022 /m/033_l8 /m/033_l8 #Casino Gmail: lode888com@gmail.com Dia chi : 33 ngõ 147 Phố Tân Mai, Tân Mai, Hoàng Mai, Hà Nội, Việt Nam Hotline 0987743174 Webiste https://lode888.com/ https://lode888.com/dang-ky-lode88/ https://lode888.com/nap-tien-lode88...",,,
https://rapidapi.com/maunhadep/api/maunhadep/, a year ago , mau nhadep ,maunhadep,"Mẫu nhà đẹp là nhóm của Công ty TNHH Thiết kế Thi công Nhà đẹp. Với mục đích muốn tạo ra một sân chơi chung, tham khảo những mẫu nhà đẹp và chia sẻ kinh nghiệm trong lĩnh vực thiết kế, thi công nhà. Chính vì thế nếu các bạn đang có nhu cầu xây nhà có thể vào tham khảo và thảo luận cùng các thành viên có nhiều kinh nghiệm trong lĩnh vực. Với 10 năm kinh nghiệm thiết kế Nhà đẹp sẽ có những chuyên gia trong lĩnh vực này có thể hỗ trợ và tư vấn thêm cho các bạn trong quá trình xây dựng nhà. Ngoài...",,,
https://rapidapi.com/thomo678net/api/da-ga-thomo67-truc-tiep/, a year ago , thomo678net ,Da ga Thomo67 truc tiep,"Thomo67 ✓ Xem đá gà trực tiếp Thomo hôm nay mới nhất tại Thomo 678 ✓ Trực tiếp đá gà cựa sắt Thomo Campuchia hôm nay tại bồ gà 999 & 67. #đá_gà_trực_tiếp #đá_gà sv388 #đá_gà 68 # #/m/033_l8 /m/033_l8 Địa chỉ :568 Đ. Bạch Đằng, Bạch Đằng, Hai Bà Trưng, Hà Nội, Việt Nam Hotline 0888.310.444 Gmail: thomo678net@gmail.com Website https://thomo678.net/ https://thomo678.net/da-ga-truc-tiep/ https://thomo678.net/sv388-link-vao-trang-da-ga-dagasv388/ https://thomo678.net/daga68/ https://twit...",,,
https://rapidapi.com/panoply1/api/img-src-x2/, 2 years ago , panoply1full ,,{{2*2}}desc{{2*2}}desc{{2*2}}desc,,,
https://rapidapi.com/v9betvi/api/v9bet-link-vao-nhanh-nha-cai-v9bet-mobile-moi-nhat-2022/, a year ago , v9betvi ,V9BET Link vao nhanh nha cai V9BET Mobile moi nhat 2022,"V9bet là tên một nhà cái cá cược trực tuyến, xuất hiện lần đầu tiên tại thị trường Việt Nam vào khoảng tháng 10 năm 2012. Nhà cái V9bet cung cấp các dịch cá cược như thể thao, Casino Online (Sòng bạc trực tuyến), Slots game, Xổ số, Game 3D,… Với giao diện đẹp mắt, trò chơi phòng phú và đa dạng, dễ dàng nạp rút nhanh với việc hỗ trợ nhiều hình thức thanh toán các dịch vụ của công ty đã thu hút rất đông người đam mê giải trí đỏ đen tìm đến. #v9bet #V9BET88 #v9betvi # /m/033_l8 /m/033_l8 #Casin...",,,
https://rapidapi.com/guillainbisimwa/api/bomokoapi/, 2 years ago , guillainbisimwa ,Bomokoapi,Testing Bomoko app API,,,
https://rapidapi.com/tihonbasov/api/last/, a year ago , Тихон Басов ,last,last,,,
https://rapidapi.com/mu9city/api/nha-cai-mu9-link-vao-mu9-nha-cai-ca-cuoc-bong-da/, a year ago , mu9city ,Nha cai MU9 - Link vao Mu9 Nha cai ca cuoc bong da,"MU9 là nhà cái uy tín số 1 về cá cược bóng đá, game bài, nổ hũ, bắn cá, xổ số lô đề, live casino,...đứng top 1 tại thị trường Anh Quốc. Đăng ký Mu9 để nhận khuyến mãi siêu hot, Link đăng nhập Mu9 chính thức 2022! #Mu9_nhà_cái #Mu9 #Link_đăng_nhập_Mu9 #/m/033_l8 /m/033_l8 #Casino #naptienMU9 #dangkyMu9 #linkvaonhacaiMu92022 Địa chỉ: 15 Đ. Tôn Đức Thắng, Phường Phạm Ngũ Lão, Quận 1, Thành phố Hồ Chí Minh Hotline 0961707270 Gmail: mu9city@gmail.com Website https://mu9.city/ https://mu9.city...",,,
https://rapidapi.com/vwinwin/api/vwin/, 2 years ago , vwinwin ,Vwin,"Vwin là nhà cái cá cược trực tuyến hàng đầu thuộc tập đoàn BVI. Các sản phẩm đều được cấp phép hoạt động bởi Cục Quản lý Giải trí và Trò chơi Philippines. #vwinwin #nhà_cái_Vwin #nạp_tiền_Vwin #link_vào_Vwin #hướng_dẫn_chơi_Vwin /m/033_l8 /m/033_l8 #Casino #đăng ký vwin #khuyễn mãi vwin #lô_xiên_là_gì Địa chỉ 89 Xuân Phương, Hòe Thị, Từ Liêm, Hà Nội Hotline 0973 404 745 Email: vwin.win3@gmail.com Google map https://www.google.com/maps?cid=14698248580497652518 Website https://vwin.win/ htt...",,,
https://rapidapi.com/seozatec/api/zatec/, a year ago , Zatec Seo ,Zatec,"Zatec là một doanh nghiệp ra đời với mong muốn trở thành một giải pháp toàn diện cho người tiêu dùng về các sản phẩm kệ để hàng bao gồm: Kệ sắt, kệ siêu thị, Kệ sắt V lỗ, Kệ trung tải, kệ sắt, kệ để hàng, kệ đa năng, kệ đa năng mặt lưới, kệ sắt lắp ráp, kệ sắt 3 tầng,... Zatec đã và đang là nhà thầu phụ uy tín, cung cấp các giải pháp về kho hàng cho các nhà máy, nhà xưởng trong các khu công nghiệp, cũng như hệ thống siêu thị, cửa hàng tạp hóa lớn và nhỏ trên khắp địa bàn Hà Nội, Hồ Chí Minh v...",,,
https://rapidapi.com/printingdigital/api/printing-new-york-test/, 2 years ago , Printing Digital ,Printing New York Test,Test API,,,
https://rapidapi.com/JohnAbbott/api/doccia-esterna-da-giardino/, a year ago , JohnAbbott ,doccia esterna da giardino,https://www.nivito.it/,,,
https://rapidapi.com/xingfa-group-xingfa-group-default/api/cua-nhom-xingfa-chinh-hang-va-hang-nhai/, 2 years ago , Xingfa Group ,Cua nhom Xingfa chinh hang va hang nhai,Phan biet cua nhom Xingfa chinh hang va hang nhai,,,
https://rapidapi.com/altintasiletisim/api/ickale/, 2 years ago , Anıl Altıntaş ,ICKALE,ICKALE,,,
https://rapidapi.com/7ball-viet-nam-7ball-viet-nam-default/api/7ball-viet-nam/, a year ago , 7Ball Viet Nam ,7Ball Việt Nam,7Ball Việt Nam - 7Ball Casino Game - Nhà Cái 7Ball Khuyến Mãi Lớn Năm 2022,,,
https://rapidapi.com/umangp/api/test6914/, 2 years ago , umangp ,Test,This is test api,,,
https://rapidapi.com/tusharv/api/blog19/, 2 years ago , tusharv ,Blog,This is very good Blog,,,
https://rapidapi.com/jfwu2008-Xf3Ou9hFiOB/api/helloapi1/, a year ago , Jianfeng Wu ,helloApi,this is hello Api,,,
https://rapidapi.com/printingdigital/api/luxury-printing-test/, 2 years ago , Printing Digital ,Luxury Printing test,Test,,,
https://rapidapi.com/davidgrey0022/api/portrait-for-pet-custom-pet-portrait1/, a year ago , David Grey ,Portrait For Pet Custom Pet Portrait,Capture the personality of your royal pet with pet canvas art. Each of Portrait4pet.com renaissance pet portraits are made with love from our talented Capture the personality of your royal pet with pet canvas art. Each of Portrait4pet.com renaissance pet portraits are made with love from our talented Capture the personality of your royal pet with pet canvas art. Each of Portrait4pet.com renaissance pet portraits are made with love from our talented Capture the personality of your royal pet wi...,,,
https://rapidapi.com/devin12driss/api/merge-two-pst-file/, a year ago , Devin Driss ,Merge Two PST File,IF you want to merge multiple pst files .so you can use the MailsDaddy pst merge and join tool.,,,
https://rapidapi.com/showgirl/api/showgirl-live/, 2 years ago , showgirl ,Showgirl live,"Showgirl live là ứng dụng dành riêng cho điện thoại, có chức năng xem idol live kiếm tiền thoải mái, tải app show girl miễn phí. #showgirl apk #showgirl ios #app live #Showgirl Địa chỉ 5 Giải Phóng, Đồng Tâm, Hai Bà Trưng, Hà Nội Email: showgirlapp1@gmail.com Hotline 0865177667 Website https://showgirlapp.live/ Google map https://g.page/r/CUHW22-wLwnwEBA https://showgirlapp.live/tai-ve/showgirl-apk/ https://showgirlapp.live/tai-ve/showgirl-apk/ https://showgirlapp.live/thu-muc/app-li...",,,
https://rapidapi.com/dattorossoneri/api/davide1/, 2 years ago , Datto Liluashvili ,davide,my best appp,,,
https://rapidapi.com/winart/api/winart/, a year ago , winart ,WINART,"WINART là nhà cung cấp các giải pháp thi công lắp đặt hàng đầu về mành rèm tại thị trường Hà Nội nói riêng và Việt Nam nói chung. WinArt mang đến cho bạn một thế giới mành rèm với đa dạng kiểu dáng, mẫu mã và những công năng ưu việt.Dây chuyền và nguyên vật liệu sản xuất đồng bộ được chuyển giao từ Tập đoàn hàng đầu Hàn Quốc giúp gia tăng chất lượng, đảm bảo độ chính xác và nâng cao chất lượng sản phẩm. #rèm_cầu_vồng #rèm_cửa_Hàn Quốc #Rèm_cuốn #Rèm_vải #Hà_Nội #winart Địa chỉ : 206 Phố Vọng ...",,,
https://rapidapi.com/123win0com/api/123win0com/, 5 months ago , 123win0com ,123win0com,123Win 🎖️ Cổng game trực tuyến được săn đón nhất 2023,,,
https://rapidapi.com/imgloryco/api/imglory/, a year ago , imgloryco ,imglory,"IMGlory is a membership site that sharing all the MMO courses from big authors around of the world, all in one place #imglory #graphickits #imtools Address 12st Pariser Platz, Berlin, 10117, Germany Hotline 0989.022.861 Email: support@imglory.co Website https://imglory.co/ https://www.imglory.co/gb-courses/ https://www.imglory.co/graphickits/ https://www.imglory.co/im-tools/ https://www.imglory.co/spy-tools/ https://fb.me/imgloryb/ https://twitter.com/imglory2016 https://www.pinterest...",,,
https://rapidapi.com/printingdigital/api/printing-brooklyn-test/, 2 years ago , Printing Digital ,Printing Brooklyn test,Test,,,
https://rapidapi.com/may88live/api/may88-link-vao-nha-cai-nhan-quan-2022/, a year ago , MAY88 - Link Vào Nhà Cái MAY88 Nhận Thưởng Khủng ,May88 link vao nha cai nhan quan 2022,"May88.live - May88 ⭐️ Link vào may88 mới nhất, web cá cược thể thao trực tuyến, Casino, Keno, Lô đề, Slot game đa dạng với nhiều thể loại cá cược. #May88.live #May88 #dang_ky_May88 #nhacai_May88 #Link_vào_MAY88 Email: may88live1@gmail.com Hotline 0865494075 Địa chỉ : 87 Ngô Quyền,P. Quang Trung,Hà Đông,Hà Nội Website https://may88.live/ https://may88.live/dang-ky-may88/ https://may88.live/nap-tien-may88/ https://may88.live/rut-tien-may88/ https://may88.live/tai-ung-dung-may88/ https://tw...",,,
https://rapidapi.com/taikucasinoapp/api/taikucasino/, 2 years ago , taikucasinoapp ,taikucasino,"taikucasino.app trang tải app kubet chính thức. Tải Ku casino, KU casinp app, KU app, App ku casino phiên bản mới nhất 2022 cho iPhone và Android tại taikucasino.app - Website chính thức của KU Casino. #taikubet #taiappkubet #kubet /m/033_l8 /m/033_l8 #Casino Địa chỉ Ng. 37 Đại Đồng, Thanh Trì, Hoàng Mai, Hà Nội, Việt Nam Hotline 0868269875 Webiste https://taikucasino.app/ https://sites.google.com/view/taikucasinoapp/link-vao-app-kucasino https://taikucasinoapp.blogspot.com/ https://www....",,,
https://rapidapi.com/AndrewSchaaf1652092570/api/nivito3/, a year ago , AndrewSchaaf1652092570 ,Nivito,Nivito je švedsko podjetje,,,
https://rapidapi.com/ae8888net/api/venus888/, a year ago , ae8888net ,Venus888,"Venus888 - AE8888 - ae8888.net ⭐ Trang chủ đăng ký và đăng nhập của nhà cái ae388 ⭐ Link vào ae888 chính thức để chơi bóng đá, đá gà, tài xỉu, lô đề tại Venus casino. #Hướng_dẫn_ae8888 #Game_bài_venus888 #thể_thao_venus888 #Khuyến_mãi_venus888 #ae8888net #Link_vào_Venus888 #nhà_cái_Venus888 #/m/033_l8 /m/033_l8 #Casino Địa chỉ : 199 P. Minh Khai, Minh Khai, Hai Bà Trưng, Hà Nội, Việt Nam Hotline 0857090996 Gmail: ae8888net1@gmail.com Website https://ae8888.net/ https://ae8888.net/chuyen...",,,
https://rapidapi.com/donghovangkhoivn/api/donghovangkhoivn/, a year ago , donghovangkhoivn ,Donghovangkhoivn,"Donghovangkhoi.vn Là đơn vị đầu tiên và lâu năm trong lĩnh vực chế tác đồng hồ và trang sức .Tất cả sản phẩm đồng hồ như Đồng hồ rolex fake , đồng hồ hublot fake , đồng hồ patek philippe fake , đồng hồ richard mille fake , đồng hồ omega fake , đồng hồ audemars piguet fake chế tác đều được làm từ vàng thật 18k , và kim cương thiên nhiên .Đồng Hồ Vàng Khối cam kết tất cả sản phẩm đều được làm từ vàng 18k và kim cương thiên nhiên có đầy đủ kiểm định của nhưng trung tâm kiểm định lớn và uy tín n...",,,
https://rapidapi.com/sv388sv288net/api/sv388-link-nha-cai-da-ga-uy-tin/, a year ago , sv388sv288net ,SV388 Link nha cai da ga uy tin,"SV388 – Nhà Cái chuyên về đá gà online nổi tiếng hàng đầu châu Á với hàng nghìn trận đấu mỗi ngày tử nhiều loại gà Đá Gà Cựa Sắt, Đá Gà Cựa dao, đá gà thomo,... Ngoài ra SV388 còn có rất nhiều trò chơi casino trực tuyến, slot game, bóng đá, lô đề,...Tại Việt Nam, SV388 có nhiều trường gà để nuôi và huấn luyện như trường gà Thomo Cambodia. Về điểm vượt trội của SV388 mạnh về truyền hình trực tiếp và cho phép người chơi đặt cược lớn. Dù só lượng chơi đông nhưng chất lượng hình ảnh tốt, đường ...",,,
https://rapidapi.com/s777pro/api/s777pro/, a year ago , s777pro ,s777pro,"S777 - s777pro Game Bài Đổi Thưởng Uy Tín tặng ngay 30k trải nghiệm và 100% ngay lần nạp đầu tiên. Nhà Cái S777 Game Bài với nhiều thể loại game như xổ số, bắn cá,.. Dưới đây chúng tôi sẽ bật mí cho bạn các thông tin thú vị về sân chơi game bài đổi thưởng cực #s777 #s777pro #s777app #gamebais777 #conggames777 #s777fun #s777net #s777vn #Tải_app_S777 #Đăng_ký_s777 #Nạp_tiền_s777 Địa chỉ : 10 Lê Văn Sỹ, Phường 11, Quận 3, Thành phố Hồ Chí Minh, Việt Nam Hotline 0528276899 – 0563791518 Gmail: inf...",,,
https://rapidapi.com/AcroChannel/api/acrosuite-auther/, a month ago , Samurai ,AcroSuite Auther,Provide one-time or multi-time authentication service. ワンタイム又は複数回の認証・検証サービスを提供います。,,,
https://rapidapi.com/daga988com/api/da-ga-truc-tiep-xem-da-ga-cua-dao-cua-sat-thomo/, a year ago , daga988com ,Da Ga Truc Tiep Xem Da Ga Cua Dao Cua Sat Thomo,"Đá gà trực tiếp ⭐️ Xem đá gà cựa sắt thomo & cựa dao là hình thức chơi cá cược phổ biến hiện nay ⭐️ được phát trực tiếp 12h mỗi ngày trên daga988.com #Đá_Gà_Campuchia #Đá_Gà_Cựa Dao #Đá_Gà_SV388 #daga988com #daga988 #Đá Gà_Thomo Địa chỉ : 281 Ngô Xuân Quảng, Trâu Quỳ, Gia Lâm, Hà Nội, Việt Nam Hotline 02438769605 Gmail: daga988com@gmail.com Website https://daga988.com/ https://daga988.com/da-ga-campuchia/ https://daga988.com/da-ga-cua-dao/ https://daga988.com/da-ga-sv388/ https://daga98...",,,
https://rapidapi.com/tructiepdagatv/api/tructiepdagatv/, a year ago , tructiepdagatv ,tructiepdagatv,"Trực tiếp đá gà TV là website xem đá gà trực tiếp hôm nay, xem đá gà campuchia, đá gà cựa sắt thomo và chia sẻ thông tin, kinh nghiệm bổ ích về việc nuôi gà cũng như kiến thức nuôi gà hiệu quả. Các giải đá gà lớn nhỏ từ đá gà tre, gà chọi và nhiều giải khác. Hãy nhanh chóng truy cập tructiepdaga.tv để xem ngay các trận đá gà hấp dẫn nhất trong ngày. #tructiepdagatv #tructiepdaga #dagatructiep #dagathomo #dagacampuchia #đá_gà_trực_tiếp Gmail: tructiepdagatv@gmail.com Địa chỉ 101 Đặng Tiến Đô...",,,
https://rapidapi.com/five88casino/api/five88/, a year ago , five88casino ,Five88,"Five88 - https://five88.casino - Trang chủ đăng ký chính thức của nhà cái Five88. Five88 là sân chơi casino, cá cược bóng đá đẳng cấp hàng đầu Việt Nam, nơi người chơi sẽ hoàn toàn hài lòng với những trải nghiệm thú vị đang chờ đón trước mắt. #five88 #nhacaifive88 #casino #/m/033_l8 /m/033_l8 #Casino #xoso #lode #cacuoc #FIVE88 #dangnhap #linkvaofive882022 Gmail: five88.casino@gmail.com Hotline 0389.575.002 Địa chỉ 49 Đ. Lê Trọng Tấn La Khê Hà Đông Hà Nội Việt Nam https://muckrack.com/fiv...",,,
https://rapidapi.com/tos39653501/api/test21108/, a year ago , としゆき ,TEST2,テスト２,,,
https://rapidapi.com/professional-blogger-professional-blogger-default/api/contus-mirrorfly/, 2 years ago , Professional-Blogger ,CONTUS MirrorFly,CONTUS MirrorFly Integrate Highly Secured Voice Calling APIs & SDKs For Any Device and Platform.,,,
https://rapidapi.com/danienguyen/api/danienguyen/, a year ago , Danie Nguyễn ,danienguyen,"Tôi là Danie Nguyễn chuyên gia trong lĩnh vực cá độ đá gà trực tiếp và nhiều kinh nghiệm, kiến thức nuôi gà đá đẳng cấp. #danienguyen #tructiepdaga #tructiepdagatv Gmail: danienguyendaga@gmail.com Website : https://tructiepdaga.tv/ https://www.mixcloud.com/danienguyen/ https://readthedocs.org/projects/danie-nguyen/ https://danienguyen.simplesite.com/ https://profile.ameba.jp/ameba/danienguyen https://ko-fi.com/danienguyen https://fliphtml5.com/homepage/xyqkn https://www.themehorse.com/suppor...",,,
https://rapidapi.com/hoplocationcafe-hoplocationcafe-default/api/locationmap1/, a year ago , hoplocationcafe ,locationMap,thisLocationMap,,,
https://rapidapi.com/noithatsento/api/noithatsento/, a year ago , noithatsento ,noithatsento,"Nội thất SENTO là đơn vị chuyên kinh doanh sản phẩm nội thất cho công ty, doanh nghiệp các đại lý trên toàn quốc. SENTO là đơn vị trực tiếp sản xuất các sản phẩm như là:Tủ locker, tủ ngăn kéo, tủ hồ sơ văn phòng, tủ đựng tài liệu, tủ giày dép. Các sản phẩm do SENTO sản xuất luôn thích ứng nhanh với thay đổi của thị trường và nhu cầu khách hàng, chúng tôi luôn luôn cải tiến sản phẩm để đưa ra những phẩm phẩm tối ưu nhất, và giá cả cạnh tranh nhất cho khách hàng. #noithatsento #tulocke #tủ_hồ_s...",,,
https://rapidapi.com/lucky88life/api/lucky88/, a year ago , lucky88life ,Lucky88,"Lucky88 - https://lucky88.life/ - Link đăng ký chính thức của nhà cái lucky88. Lucky88 đã và đang mang đến một sân chơi đầy may mắn dành cho các cược thủ. Tại đây, người chơi sẽ được tận hưởng sân chơi cá cược bóng đá, casino trực tuyến hàng đầu Việt Nam #lucky88 #nhacailucky88 #casino #xoso #lode #cacuoc /m/033_l8 /m/033_l8 #Casino Hotline (+63)99668852 Gmail: lucky88dotlife@gmail.com Địa chỉ : 11-3 Phượng Bãi, Biên Giang, Hà Đông, Hà Nội, Việt Nam Website https://lucky88.life/the-thao/...",,,
https://rapidapi.com/ek88betpro/api/ek88-dang-nhap-dang-ky-nha-cai-truc-tuyen/, a year ago , ek88betpro ,EK88 dang nhap dang ky nha cai truc tuyen,"EK88 là nhà cái uy tín hàng đầu châu Á, nhà cái EK88 cung cấp tỷ lệ cược tốt nhất, nhiều khuyến mãi, link vào EK88 nhanh không bị chặn mới nhất 2022. #EK88 #NhacaiEK88 #CacuocEK88 /m/033_l8 /m/033_l8 #Casino #Hướng_dẫn_cá_cược_EK88 #Đăng_ký_EK88 #Khuyến_mãi_EK88 #link_vào_EK88_2022 Địa chỉ : 3/39/147 Phố Tân Mai, Tân Mai, Hoàng Mai, Hà Nội, Việt Nam Hotline +84886337598 Website https://ek88.bet/ Gmail: ek88betpro@gmail.com https://ek88.bet/huong-dan-ca-cuoc-ek88 https://ek88.bet/dang-ky-e...",,,
https://rapidapi.com/mrsdarlene/api/allsafebot/, 2 years ago , mrsdarlene ,allsafebot,my API,,,
https://rapidapi.com/jhonnyx161-ilgSV8-FSoH/api/ebay7/, 2 years ago , Jhonny Espinoza ,ebay,mit,,,
https://rapidapi.com/dothuyhocdientu/api/dothuyhocdientu/, a year ago , dothuyhocdientu ,dothuyhocdientu,"Tôi Đỗ Thủy Học Điện Tử một người đam mê cung cấp kiến thức cuộc sống và kiến thức giáo dục văn học , vật lý , điện tử đến cho mọi người hãy cùng tôi tiếp nhận kiến thức mới nhé ! #Hocdientu #dothuyhocdientu #hocdientunet Website https://hocdientu.net/dothuyhocdientu/admin/ Gmail: dothuy.alphavina@gmail.com Liên hệ 0389967362 https://www.youtube.com/channel/UCWndtZoUs1VesSGCos080CQ/about https://www.instagram.com/dothuyhocdientu/ https://twitter.com/dothuyhocdientu https://www.beatstars.c...",,,
https://rapidapi.com/comemhomelab/api/comemhomelab/, 2 years ago , comemhomelab ,comemhomelab,"Cỏ Mềm Homelab là thương hiệu mỹ phẩm thiên nhiên lành và thật được chiết xuất từ thảo mộc an toàn với con người đặc biệt là bà bầu, trẻ em và da kích ứng #myphamthiennhien #myphambabau #daugoithaoduoc #soncomem# nuochoakho #kemchongnangthiennhien #SerumDuongDaBanDem #muoitamcafe #Serumduongtoc #daugoitrigauthaoduoc #daugoinganrungtoc Địa chỉ 225 Trần Đăng Ninh, Dịch Vọng, Cầu Giấy, Hà Nội Hotline 1800646890 |0934849339 | NTL : 25/11/2015 EmaiL: cskh@comem.vn Google map https://www.google.co...",,,
