API链接,Update_Time,Author,API名称,API描述,API Popularity,API Latency,API Service Level
https://rapidapi.com/myniu1/api/waproapi/,2021-11, myniu1 ,WaproAPI,Testing API dor WAPRO,,,
https://rapidapi.com/a2k-solutions-a2k-solutions-default/api/limoucloud/,2021-11, A2K Solutions ,LimouCloud,LimouCloud APIs,0.0,233 ms,100%
https://rapidapi.com/thremapi/api/thremapi/,2021-11, thremapi ,Thremapi,Simple threat modeling for REST API based on OpenAPI/Swagger specification,0.0,"127,273 ms",0%
https://rapidapi.com/anantcode/api/test-catch-ns-req-2/,2023-08, anantcode ,Test catch NS req 2,test2,,,
https://rapidapi.com/jayeon-technology-pvt-ltd-jayeon-technology-pvt-ltd-default/api/urlo/,2022-11, Jayeon Technology Pvt Ltd ,URLO,FREE URL SHORTENER,0.0,276 ms,100%
https://rapidapi.com/jordigasso-hGjokIUGR/api/opa-test/,2022-11, Jordi Gassó ,OPA-test,Test API for OPA,,,
https://rapidapi.com/Svix/api/svix1/,2021-11, Svix ,Svix,"Webhooks as a Service. Build a secure, reliable, scalable webhooks service with Svix Webhooks API.",,,
https://rapidapi.com/shuaibam1/api/latestreactjsjobs/,2021-11, Shuaib Masoud ,LatestReactJSJobs,Get the Latest ReactJS Jobs from many leading sources.,0.0,968 ms,0%
https://rapidapi.com/ndadilladismas/api/droiidmix/,2021-11, Trebes Digital ,DroiidMix,Music radio,,,
https://rapidapi.com/pandadoc-inc-pandadoc-inc-default/api/pandadoc-docgen-and-esignatures/,2021-11, PandaDoc Inc ,PandaDoc - DocGen and eSignatures,"PandaDoc is a simple and scalable all-in-one API solution for generating documents and capturing eSignature by embedding them into your app, website, or using the backend API.You can get a trial sandbox in 5 seconds by signing up on https://developers.pandadoc.com/?utm_source=rapidapi&utm_medium=marketplace&utm_campaign=2021-listing",,,
https://rapidapi.com/JohnSt/api/scandocflow/,2021-11, JohnSt ,ScanDocFlow,"API for extraction keyfields from documents, such as: invoices, checks, receipts, taxforms etc. We use ML, OCR and NLP to get information from documents",,,
https://rapidapi.com/FunnyMaze700/api/mac/,2021-11, FunnyMaze700 ,Mac,Macss https://reservety.com,,,
https://rapidapi.com/smartegic-tools/api/protect-pdf/,2022-11, smartegic ,protect-pdf,Password Protect Pdf,,,
https://rapidapi.com/bigpicture-bigpicture-default/api/ip14/,2021-11, BigPicture ,IP,Convert IP addresses into full company profiles.,0.0,588 ms,100%
https://rapidapi.com/bkdata/api/pacer-bk-data/,2021-11, bkdata ,PACER BK Data,PACER automation for law firms. https://bkdata.com/api,,,
https://rapidapi.com/iva-gnt70-iva-gnt70-default/api/iva-docs-apis/,2022-11, Iva docs ,Iva docs APIs,Iva docs APIs,,,
https://rapidapi.com/rahilkasaragod198/api/hash-tags-generator/,2023-02, Mohammed Rahil ,hash tags generator,generate hashtags for twitter instagram any other social medias,,,
https://rapidapi.com/dukim/api/dhfjkhjkl/,2023-08, 김다운 ,DHFJKHJKL,ㅇㅇㅇ,,,
https://rapidapi.com/yee0726/api/hello-123/,2023-04, fs a asfga kjdfha kdafsdfgaskfghs kjdfhga kjfgaksjdfhg askd ,hello 123,hello 123,,,
https://rapidapi.com/snowpal-software-services-snowpal-software-services-default/api/snowpal-project-management2/,2023-03, Snowpal ,Snowpal Project Management,"Build project management solutions. For Guide and API Reference, go to https://developers.snowpal.com.",,,
https://rapidapi.com/csysfxllc/api/ff31/,2022-11, Csys Fxllc ,FF3,FF3 KEY,,,
https://rapidapi.com/nischay876-A8BtWNvfCsz/api/test16983/,2023-07, - O G G Y - ,test,test,,,
https://rapidapi.com/vaxxy/api/knowband-s-magneto-2-multi-vendor-marketplace-a-smart-solution-for-e-store-owners/,2021-11, vaxxy ,Knowband’s Magneto 2 Multi-Vendor Marketplace | A smart solution for e-store owners,"Nowadays store owners are looking for ways to extend the store reach and enhance their sales. Having a mobile app and building a Multi-vendor store is one of the prominent ways to catch customer attention and increase the customer return rate. If you are an online store owner all you need is to do is to install the Multi-seller Marketplace extension by Knowband. Within 3 simple clicks, your marketplace is ready to sell goods of multiple third-party sellers. Multiple vendors can register their store after submitting a simple registration form. Once the store owner will approve the account request, sellers can start listing the products and updating their shop profile which includes logo, banners, shop name etc.",,,
https://rapidapi.com/metinnazif77/api/sms420/,2023-09, Hasanboy Xalilov ,SMS,Send SMS,,,
