API链接,Update_Time,Author,API名称,API描述,API Popularity,API Latency,API Service Level
https://rapidapi.com/adverifai/api/adverifai-es/,2021-11, adverifai ,AdVerifai-es,AdVerifai - automatically get news quality score and insights with FakeRank,,,
https://rapidapi.com/makore/api/newnew/,2021-11, makore ,newnew,fds,,,
https://rapidapi.com/it4craigslist/api/appraiser/,2021-11, 247Apps Web Studio ,Appraiser,"Get details of an appraiser license. Validate an appraiser license given lastname, state, and license from 55 US States. Data set is updated periodically. This API assists Appraisal and Real Estate Software .exe applications, Web Apps and Mobile Apps. Built for software that serves Appraisers, Realtors, Lending, Loan, Home Insurance Software Companies. Fast, less code, less load for your application and server. Save much more development time and for your software end-users.",,,
https://rapidapi.com/vidyuths/api/qr-for-figma-links/,2023-02, V ,QR for Figma Links,"This API takes the Figma link and gives you a QR code, which you can share with anybody. No more boring long links. A QR code will do just fine! Just add your Figma URL to the URL field in the Required Parameters below and run! Optionally If you have a password set for your Figma file you can attach it to the end of the Figma link by adding secret=yourpassword.",,,
https://rapidapi.com/cas8180/api/scanily/,2023-02, cas8180 ,Scanily,"Scanily is a service that offers sophisticated shipping label recognition through our API interface. Our API's have been optimized on a wide array of shipping label variations to provide the highest accuracy possible for extracting shipping data from labels. Scaily uses a ""best attempt"" to try and recognize key data points like tracking numbers as well as order numbers and addresses. In scenarios where Scanily can not detect key data point's like a tracking number with confidence, all of the ...",,,
https://rapidapi.com/tec-2-scale-tec-2-scale-default/api/operating-functions-for-1001-low-and-no-code-tools/,2023-04, Tec-2-Scale ,Operating Functions for 1001 Low and No Code Tools,"Introducing the 1001 Operator by FX, an all-in-one API solution designed to streamline text processing, URL manipulation, HTML parsing, and more. Boost your application's efficiency with powerful algorithms such as Levenshtein, Cosine, and Jaccard for text comparisons, and perform seamless UTM tracking for your marketing campaigns. Extract and manipulate data from HTML documents and web pages with ease, all while enhancing your website's search engine ranking with our SEO-optimized API. Exper...",,,
https://rapidapi.com/srprakash016/api/secure-npm-analysis-api/,2023-06, Poorna Prakash ,Secure NPM Analysis API,"The SecureNPM Score Analysis API provides comprehensive insights on npm package information, including security assessment and scoring. Analyze npm packages with confidence and ensure the security of your project.",,,
https://rapidapi.com/hadxit/api/ratelimiter/,2022-11, David ,ratelimiter,"Limit number of runs per minute API This API is used to select users on a first-come, first-served basis when there is a sudden rush of users when making ticket reservations for concert halls or theaters, or when you have to select only a few of them when traffic per minute is high. 분당 실행 갯수 제한 API 해당 API 는 공연장,극장 티켓 예매시 사용자가 순간 몰리는 경우 그 중에서 선착순으로 사용자를 선정한다던가 혹은 분당 트래픽이 몰렸을 경우 그 중에 몇개만 선택을 해야 하는 경우 사용이 됩니다.",,,
https://rapidapi.com/gem-up-consulting-gem-up-consulting-default/api/retail-pricing-optimizer/,2021-11, GEM-UP CONSULTING ,Retail Pricing Optimizer,"This API aims at providing retailers access to a combination of artificial intelligence and data to calculate full margin, retail-adjusted, psychological, and other pricing strategies.",,,
https://rapidapi.com/Vector2Web/api/vector2web/,2023-06, Vector2Web ,Vector2web,"Increase your web development productivity with this API that will instantly convert your Figma pages into fully fledged and functioning Elementor pages. Though further tweaking is required the amount of actions you save by not having to manually download the images, copy text, set colors and fonts to image, etc... will make you love Vector2Web.",,,
https://rapidapi.com/roiquant/api/roiquant/,2023-05, roiquant ,roiquant,Welcome to roiquant's API.,,,
https://rapidapi.com/progwhiz1/api/qr-code-logo-generator/,2023-05, Mark Raymond ,QR Code Logo Generator,To embed (add) a logo to an existing image for example a QR Code,,,
https://rapidapi.com/progwhiz1/api/qr-tracker-client-api/,2023-05, Mark Raymond ,QR Tracker Client API,QR Tracker Ticket client api to create end user validation apps,,,
https://rapidapi.com/sinpriest/api/detect-proxy-vpn/,2023-01, sinpriest ,Detect Proxy VPN,"Detect Proxy IP, VPN IP, Tor Exits and Hosting Providers.",,,
https://rapidapi.com/sisinfo-sisinfo-default/api/dynamic-qr-code1/,2023-09, sisinfo ,Dynamic QR Code,"Generate Dynamic QR Code for text, website urls, email addresses, vcards, twitter profiles, facebook profiles, linkedin profiles, googleplus profiles, print or share qr codes on advertisements to generate trade leads from marketing campaigns.",,,
https://rapidapi.com/ravindratltr126/api/qrcode-generator13/,2023-05, Tech Flag ,QRCode Generator,Generate QRCode for your different use cases,,,
https://rapidapi.com/lugo-test-lugo-test-default/api/proctoringapi1/,2023-06, LuGo-Test ,ProctoringAPI,,,,
https://rapidapi.com/progwhiz1/api/qr-ticket-tracker-generator/,2023-05, Mark Raymond ,QR Ticket Tracker Generator,Create Tracker QR Code eTickets for events or parties to track usage and validate via Mobile Client Apps,,,
https://rapidapi.com/cryptenginerequestsss/api/cryptengine1/,2022-11, cryptengine admin ,CryptEngine,www.cryptengine.in,,,
https://rapidapi.com/rchilli-inc-rchilli-inc-default/api/rchilli-resume-parser1/,2023-03, RChilli Inc ,RChilli Resume Parser,"RChilli resume parser is a deep learning/AI framework that identifies complete information from resumes and enriches it through its taxonomies. It extracts candidate data from resumes in 140+ data fields like Contact Information, Personal Information, Education, Experience, and Skills, etc. through REST API.",,,
https://rapidapi.com/snowpal-software-services-snowpal-software-services-default/api/snowpal-project-management1/,2023-03, Snowpal ,Snowpal: Project Management,"(DEMO Only) Go to http://rapid.snowpal.com, and subscribe to the real API there.",,,
https://rapidapi.com/Atomoworks/api/lemlist/,2021-11, TomoBloq ,lemlist,Send cold emails that get replies.,,,
https://rapidapi.com/talha.malik/api/talha-web-service/,2021-11, Talha ,Talha web service,webservice,,,
https://rapidapi.com/stark-industries-stark-industries-default/api/orgapi1/,2021-11, Stark-Industries ,orgapi,orgapi,,,
https://rapidapi.com/hydyrgameplayer/api/hydyr/,2022-11, hydyrS ,Hydyr,For developing,,,
https://rapidapi.com/ribboners-rCfSQ3uc1Xy/api/get-user-pwn/,2021-11, Content Support ,get user pwn,no desc,,,
https://rapidapi.com/vishwakarmasomit205/api/mbox-to-pst/,2022-11, Somit Vishwakarma ,MBOX to PST,Migrate MBOX file to Outlook PST file format using MailsDaddy MBOX to PST Converter tool. Get more detail: https://www.mailsdaddy.com/mbox-to-pst-converter/,,,
https://rapidapi.com/meappcool/api/proba3/,2021-11, mario ,proba,proba is great tool,,,
https://rapidapi.com/vaxxy/api/knowbands-prestashop-multi-vendor-marketplace-addon/,2021-11, vaxxy ,Knowbands PrestaShop Multi-Vendor Marketplace Addon,"PrestaShop Multi-Seller Marketplace Addon by Knowband enable the store admin to transform their e-store into an online shopping mall. Using the Marketplace Addon, the store owner can allow multiple sellers to register and sell their goods at the Marketplace.",,,
https://rapidapi.com/devin12driss/api/pst-password-remover/,2022-11, Devin Driss ,PST Password Remover,If you have forgotten the password of your PST file then you can retrieve the password of any Outlook version PST file by using Maildaddy PST Password Remover Tool. There is no 2GB PST file size limit for a PST file. PST Password Unlocker makes it easy to recover passwords from large Outlook PST files. Just browse your large PST file and recover the password in a few clicks.,,,
https://rapidapi.com/marvin-zKFcvX3U7wy/api/xctuality-interactive/,2022-11, Marvin Ramoda ,Xctuality-Interactive,App for 360,,,
https://rapidapi.com/surveystance-surveystance-default/api/surveystance1/,2021-11, SurveyStance ,SurveyStance,Feedback Survey API,,,
https://rapidapi.com/selimdaoud/api/oci-slo/,2023-03, Selim Daoud ,OCI SLO,SLO metrics for OCI IaaS/PaaS,,,
https://rapidapi.com/anujtiwari1375/api/currency-conversion3/,2021-11, Anuj Tiwari ,Currency Conversion,This API converts currency.,,,
https://rapidapi.com/thenorthface24-KSxddjKo-I/api/posts15/,2021-11, Northface Kiteboarding ,Posts,Posts API for testing.,,,
https://rapidapi.com/support-Vdk0EpISq/api/personyze-rest/,2021-11, Personyze Support ,Personyze REST,"A single API for personalization, recommendations, testing, and messaging, alongside all your other personalization needs for website and emails. Personyze is truly your one-stop-shop for creating relevant experiences across all digital touch-points.",,,
https://rapidapi.com/stam100000000/api/aug13/,2021-11, StamUser ,aug13,fdf,,,
https://rapidapi.com/WhereIsMyMind/api/tempproject/,2021-11, WhereIsMyMind ,TempProject,Make new Temp Project,,,
https://rapidapi.com/vishwakarmasomit205/api/thunderbird-to-outlook-converter/,2022-11, Somit Vishwakarma ,Thunderbird to Outlook Converter,Best and easy way to export Thunderbird email to Outlook PST format.,,,
https://rapidapi.com/mqroo2/api/pro71/,2021-11, mqroo2 ,PRO71,The API provides an interface for applications to interact with the MQROO2 site by sending and receiving data as JSON (JavaScript Object Notation) object,,,
https://rapidapi.com/iglovikov/api/test_api102/,2022-11, Vladimir Iglovikov ,Test_api,test_api,,,
https://rapidapi.com/charlie.knoll/api/responsive-paper-html-to-pdf/,2021-11, Charlie Knoll ,Responsive Paper HTML to PDF,Full featured html report processor,,,
https://rapidapi.com/ThomasSForney/api/proxyscan1/,2022-11, ThomasSForney ,Proxyscan,Proxy List,,,
https://rapidapi.com/jeetmohapatra98/api/password-generator16/,2023-03, Aaric ,Password Generator,To generate strong password.,,,
https://rapidapi.com/marcelo-arrivabeni-vieira-marcelo-arrivabeni-vieira-default/api/sap-cpi-transport-iflows/,2021-11, Informatico Systems ,SAP CPI Transport iFlows,Transport iFlows of SAP Cloud Platform Integration (CPI) to other packages or to other tenants.,,,
https://rapidapi.com/qrgraphix1/api/b2c-qr-code/,2021-11, qrgraphix ,B2C QR Code,Generate dynamic B2C QR Code for GST Invoices. Integrate B2C QR Code in your ERP / Billing Application to print B2C QR Codes on GST Invoices.,,,
https://rapidapi.com/uplead-uplead-default/api/uplead/,2021-11, UpLead ,UpLead,B2B company and contact data.,,,
https://rapidapi.com/codejungle-pro/api/warp-perspective/,2022-11, CodeJungle ,Warp Perspective,"Fast and easy to set up Warp Perspective function. Just send the coordinates of the object on which to apply Warp Perspective. In the example [A1, A2] the first digit is a pixel from the left horizontally and the second one vertically from the top [X, Y] required string - '[[A1,A2], [B1,B2], [C1,C2], [D1,D2]]' A ----- B |⠀⠀⠀⠀⠀ | |⠀⠀⠀⠀⠀ | |⠀⠀⠀⠀⠀ | C------D All uploaded files and data are treated as strictly confidential and are never disclosed to third parties. Uploaded files are automatica...",,,
https://rapidapi.com/vcappuccio/api/paw-some-currency-trading/,2023-01, Victor Cappuccio ,Paw-some currency trading,Fetching you the best exchange rates with our canine-powered API,,,
https://rapidapi.com/manasamin-8NkqKED2c/api/pitch-testing/,2022-11, Anas Amin ,Pitch Testing,Just testing,,,
https://rapidapi.com/hedayatcore/api/html-website-to-pdf/,2023-01, Hedayat ,HTML (website) to PDF,"This API allows developers to easily convert webpages to high-quality PDFs. By sending a GET request to the API endpoint with the URL of the webpage, users can quickly and easily generate a PDF of the webpage in question. The API also allows for customization of the size of the generated PDF by passing width and height parameters in the query string. Additionally, the API sets the downloaded filename as the title of the website, providing a convenient and easily identifiable file.",,,
https://rapidapi.com/furiouscode-furiouscode-default/api/flagside-apis/,2021-11, FuriousCode ,FlagSide APIs,FlagSide,,,
https://rapidapi.com/ChrisJKirkland/api/ipwhois/,2022-11, ChrisJKirkland ,ipwhois,IP Geolocation API,,,
https://rapidapi.com/oshitsd99/api/develope/,2021-11, OSHIT SD ,develope,nothing,,,
https://rapidapi.com/amirinterai/api/test10761/,2022-11, Amir Inter ,test,test api,,,
https://rapidapi.com/smssachan-WqunUtXRA83/api/remove-pii-from-a-document/,2021-11, Shiv M Singh ,Remove PII from a document,The API removes the personally identifiable information from the document,,,
https://rapidapi.com/Bedless/api/test_user_a001/,2022-11, Bedless ,TEST_USER_A001,Test User Formatting Type 1,,,
https://rapidapi.com/ez-nettools-ez-nettools-default/api/ez-contactmanager/,2022-11, EZ-NetTools ,EZ-ContactManager,Short ability to send and retrieve data from your EZ-ContactManager Account,,,
https://rapidapi.com/digitslab-AxwapiFMx/api/billsquare/,2023-04, Digits Lab Solutions ,billSQUARE,billSQUARE APIs,,,
https://rapidapi.com/harshangandamalla/api/test_flask/,2022-11, Harshan GAK ,test_flask,testing app in flask,,,
https://rapidapi.com/dietz/api/pimcore/,2021-11, Dietmar Rietsch ,Pimcore,Pimcore API for headless product information management (PIM/MDM),,,
https://rapidapi.com/qrzebra/api/qr-code-generator-and-management/,2021-11, qrtiger ,QR code generator and management,"A complete API to make a customized QR code generator with logo, dynamic QR codes to track data, QR codes in bulk for consumer products. We offer PNG as SVG format for professional use. Many major brands use our API. For more information contact us on: it@qrtiger.com",,,
https://rapidapi.com/yotaverse1-yotaverse-default/api/ip2location5/,2023-01, Yotaverse ,IP2Location,IP to Country api with country code & their currency name & currency code,,,
https://rapidapi.com/upi-qr-code-generator-upi-qr-code-generator-default/api/upi-qr-code/,2021-11, UPI QR Code Generator ,UPI QR Code,"UPI QR Code Generator to receive payment from UPI APPs. Print UPI Qr Code on bills, so your customers can Scan UPI QR Code to make payment.",,,
https://rapidapi.com/rroussev88/api/convert-json-to-typescript/,2022-11, Rosen Rusev ,Convert JSON to Typescript,Convert JSON payload to TypeScript definitions,,,
https://rapidapi.com/tariqhusainkhan01/api/aaoo-chale-ridesharing-api/,2022-11, Tariq Husain Khan ,Aaoo-Chale-Ridesharing-API,Ridesharing api,,,
https://rapidapi.com/shubhubits313/api/instaqr/,2023-01, Shubhankit Singh ,InstaQR,This api gives you a QR code for your URL instantly and directly downloads it for you on your system by providing a downloadable response.,,,
https://rapidapi.com/horvathzsombor2005/api/practiseapi/,2021-11, Zsombor Horváth ,PractiseAPI,An API for learning,,,
https://rapidapi.com/candc-candc-default/api/candcconferencecreator4/,2021-11, CandC ,CandCConferenceCreator,API designed to simplify the creating and managing of conference applications.,,,
https://rapidapi.com/bulletproof-solutions-team/api/pro-qr-code/,2021-11, Bulletproof Solutions ,Pro QR Code,QR code generator for business.,,,
https://rapidapi.com/serg.osipchuk/api/IBMWatsonDocumentConversion/,2021-11, Serg Osipchuk ,IBMWatsonDocumentConversion,"Convert a document into HTML, text or a set of JSON answers.",,,
https://rapidapi.com/noam/api/Hubspot/,2021-11, noam ,Hubspot,connect to hubspot account through api calls,4.5,"127,264 ms",0%
https://rapidapi.com/zakutynsky/api/KeenIO/,2021-11, Igor Zakutynsky ,KeenIO,"Keen.io is for capturing, analyzing, and embedding event data in everything you build.",,,
https://rapidapi.com/zakutynsky/api/Asana/,2021-11, Igor Zakutynsky ,Asana,"Customize the Asana experience, leverage your data with the Asana.",4.7,"127,248 ms",0%
https://rapidapi.com/zakutynsky/api/Box/,2021-11, Igor Zakutynsky ,Box,"Manage, share, and upload files to the cloud.",,,
https://rapidapi.com/volodimir.kudriachenko/api/Freshdesk/,2021-11, Volodimir Kudriachenko ,Freshdesk,"Manage customer support tickets, agents and monitoring.",,,
https://rapidapi.com/stefan.skliarov/api/Evernote/,2021-11, Stefan Skliarov ,Evernote,"Create, read, update and delete notes, notebooks and tags.",4.6,"127,261 ms",0%
https://rapidapi.com/asdigitalcomrade-asdigitalcomrade-default/api/product-license-manager/,2021-11, AsDigitalComrade ,Product license manager,PLM is an php based api which allows you to generate and manage license for your product. using this api you can easily convert your ragular web based product into a paid product which require license in able to work.,,,
https://rapidapi.com/ealmiladi/api/html-to-image-pdf/,2022-11, Eamon Almiladi ,HTML to Image & PDF,Convert HTML or TailwindCSS HTML directly into images or PDFs.,,,
https://rapidapi.com/preflightapi-preflightapi-default/api/preflightapi3/,2021-11, PreflightAPI ,PreflightAPI,"PreflightAPI allows the automation of printing preflight process for web-2-print services, websites and in internal checking automation tools",,,
https://rapidapi.com/prajngen/api/simple-lead-scoring-for-your-crm/,2021-11, Prajeevan Rasaratnam ,Simple Lead Scoring for your CRM,️‍🔥 Simple Lead Scoring for your CRM,,,
https://rapidapi.com/raygorodskij/api/Mattermark/,2021-11, Denis Raygorodskij ,Mattermark,Research the Companies & Employees,4.2,"127,258 ms",0%
https://rapidapi.com/zakutynsky/api/HelpDesk/,2021-11, Igor Zakutynsky ,HelpDesk,"Ticket numbers, customer portals & robo-emails aren't a great way to build trust.",,,
https://rapidapi.com/raygorodskij/api/GoogleSlides/,2021-11, Denis Raygorodskij ,GoogleSlides,"With Google Slides, you can create, edit, collaborate, and present wherever you are.",,,
https://rapidapi.com/raygorodskij/api/Envoy/,2021-11, Denis Raygorodskij ,Envoy,"Collect guests information, capture their photos and have them sign legal documents—all on the iPad.",,,
https://rapidapi.com/zakutynsky/api/Certly/,2021-11, Igor Zakutynsky ,Certly,Certly develops a number of APIs to retrieve threat intelligence.,4.3,"127,191 ms",0%
https://rapidapi.com/mikilior1/api/Bitly/,2021-11, Miki Lior ,Bitly,URL Shortener and Link Management Platform,4.2,"127,272 ms",0%
https://rapidapi.com/mikilior1/api/Eversign/,2021-11, Miki Lior ,Eversign,"Securely approve, deliver and sign documents online",4.0,108 ms,0%
https://rapidapi.com/stefan.skliarov/api/QuickBooksAccounting/,2021-11, Stefan Skliarov ,QuickBooksAccounting,Access accounting and payment processing features.,,,
https://rapidapi.com/volodimir.kudriachenko/api/Clkim/,2021-11, Volodimir Kudriachenko ,Clkim,Create shortened URLs customized by domain.,4.3,"127,276 ms",0%
https://rapidapi.com/stefan.skliarov/api/DropboxBusiness/,2021-11, Stefan Skliarov ,DropboxBusiness,Regulate access and log usage of Dropbox Business account.,,,
https://rapidapi.com/stefan.skliarov/api/Elemeno/,2021-11, Stefan Skliarov ,Elemeno,Create and manage device-agnostic content with this CMS API.,,,
https://rapidapi.com/jribeiro19/api/nps-net-promoter-score/,2021-11, Cleverthings ,NPS-Net Promoter Score,"This API allows rapidly implement one of the most well known and accepted KPI to measure customer satisfaction and loyalty: Net Promoter Score®, or NPS®. Create your survey templates and request them from wherever your applications are. Easily get the NPS for an Organization. We also provide a word cloud mechanism and sentiment analysis to analyse your customers feedback! Try it . If you need an additional feature, feel free to consult us, because we are glad to serve if we can!!",,,
https://rapidapi.com/b2bhint-b2bhint-default/api/b2bhint/,2022-11, B2BHint ,B2BHint,"B2BHint is a business tool that provides access to official registry data on companies and the people associated with them. With B2BHint, everyone can easily search and explore information on companies, making informed decisions and growing their business.",2.2,"1,288 ms",100%
https://rapidapi.com/hrabikh/api/mybooky-demo/,2023-01, Hynek Hrabík ,myBooky - DEMO,Demo version of lightweight booking API,,,
https://rapidapi.com/stefan.skliarov/api/CAD/,2021-11, Stefan Skliarov ,CAD,"View, edit and get manufacturing prices for CAD designs.",,,
https://rapidapi.com/test_d12/api/test_d12/,2021-11, test_d12 ,test_d12,test_d12,,,
https://rapidapi.com/dk/api/pdf-co/,2021-11, Daria K ,PDF.co,"Converts, splits and merges PDF, adds virtual signatures, makes PDF searchable, generates and reads barcodes, fill in forms and more.",,,
https://rapidapi.com/creatinggenius/api/virus-checker/,2021-11, Russell Kirkwood ,Virus Checker,Scans files for Viruses and Malware On Demand,,,
https://rapidapi.com/pedrorfpaiva/api/gr1d/,2021-11, Pedro ,gr1d,gr1d,,,
https://rapidapi.com/crypto-apis/api/crypto-market-data-apis/,2021-11, Crypto APIs ,Crypto Market Data APIs,The backbone of any Crypto or Blockchain project.,,,
https://rapidapi.com/doqs-doqs-default/api/doqs-html-to-pdf/,2023-05, doqs ,doqs - HTML to PDF,Generate PDF documents with HTML input. Provided by https://doqs.dev,,,
https://rapidapi.com/seralba14/api/shadow-games/,2022-11, Sergio Alba ,Shadow Games,Shadow Games,,,
https://rapidapi.com/ldsds94/api/gptest1/,2023-04, Leonardo Silva ,GPTest,GPTest is a powerful API that automatically generates comprehensive unit tests for your code. Say goodbye to tedious and time-consuming manual testing and let GPTest handle the job for you! Convert code to unit test quickly with one HTTP request,,,
https://rapidapi.com/sauropod-api-sauropod-api-default/api/convert-image-to-black-and-white/,2021-11, SauropodAPI ,Convert image to black and white,This is an API for converting color image to black and white image.,,,
https://rapidapi.com/unified-compliance-unified-compliance-default/api/grcschema/,2021-11, Unified Compliance ,grcSchema,UCF Resource Endpoints for GRC Schema (https://docs.grcschema.org/),0.0,"509,029 ms",0%
https://rapidapi.com/dewweb.service/api/bank-documents-ocr-india/,2021-11, dewweb ,Bank Documents OCR - INDIA,"OCR - Uplalod Bank Cheque or Passbook and Fetch Bank Details like Bank Name, Account Number, IFSC CODE, MICR, Branch, Bank Address",,,
https://rapidapi.com/gfbconsulting/api/swiss-qr-bill/,2022-11, GFB Consulting ,Swiss QR Bill,"API to validate QR Bill data and generate Swiss QR bills in SVG, PDF or PNG formats.",,,
https://rapidapi.com/redirect-solutions-inc-redirect-solutions-inc-default/api/vizor-ads/,2023-11, Redirect Solutions Inc ,Vizor Ads,"Welcome to VizorAds. APIs for Converting Images, Products and Documents into NFT or Smart Contracts using QR codes. Ready for Web3.",0.0,"1,050 ms",100%
https://rapidapi.com/reachshabib/api/url-html-to-pdf/,2023-08, Ahmed Shabib ,URL HTML to PDF,URL/ HTML content will convert to PDF file of the desired size.,0.1,926 ms,0%
https://rapidapi.com/hannahle/api/yelp-com/,2021-11, Hannah Le ,Yelp.com,Real time Yelp data,0.0,92 ms,100%
https://rapidapi.com/optlog-optlog-default/api/optlog-co-optimize-anything/,2022-11, optlog ,OptLog.co - Optimize Anything,"OptLog is a software suite for a black-box global optimization engine for real-world metric optimization. The main advantage of OptLog is scalability, simplicity and continuity of serving. A function can be optimised at any time with any parameters without worrying about the optimizer state - OptLog does it for you!",,,
https://rapidapi.com/Diver44/api/new-cryptocurrencies-listings/,2021-11, Diver44 ,New Cryptocurrencies Listings,API that shows new cryptocurrencies listings on exchanges,0.0,24 ms,100%
https://rapidapi.com/md44dil/api/get-a-domains-age-and-alexa-rank/,2021-11, Mohd Aadil ,get a domains age and alexa rank,get a domains age ans alexa rank,0.0,286 ms,100%
https://rapidapi.com/techytools/api/domain-suggestions-tlds/,2021-11, techytools ,Domain Suggestions TLDs,"Return 100s of relevant domain name suggestions + related TLDs, ordered by relevance. Many of them will be available and valuable. You can choose which TLDs to use, promote, or demote. Use our other API suite to ""manage your account"" to configure your site preferences (coming soon). Also see our ""Domain Availability Bulk"" API. Read more at https://besta.domains/api",0.0,"16,244 ms",0%
https://rapidapi.com/davyvanweijen-39MHwsULX6/api/smartphone-specifications/,2022-11, Davy V ,Smartphone Specifications,Every specification of every phone that exists!Included actual prices!,0.0,929 ms,100%
https://rapidapi.com/gjklein04/api/qr-codes-custom-colors/,2023-02, Gavin Klein ,QR Codes Custom Colors,Create QR codes with cool colors to make them pop out to your users!!,,,
https://rapidapi.com/akashdathan/api/hris/,2023-02, Akash Dathan ,HRIS,"HRIS APIs for Personio, BambooHR and BobHR.",0.0,231 ms,100%
https://rapidapi.com/harishsg99/api/multilang-sentimental-analysis/,2021-11, Harish S.G ,multilang sentimental analysis,This API helps users to do sentimental analysis on the text written in 100+ languages,,,
https://rapidapi.com/standingapi-standingapi-default/api/fake-data3/,2021-11, StandingAPI ,Fake Data,Help you generate fake data in a fast and easy way. Addresses- Books- Companies- Credit Cards- Images- Persons- Places- Products- Texts- Users,0.0,69 ms,0%
https://rapidapi.com/cheetah-api-cheetah-api-default/api/cheetah-pdf/,2021-11, Cheetah Api ,Cheetah PDF,HTML/URL to PDF API: Simple PDF Conversion API you are looking for,,,
