API链接,Update_Time,Author,API名称,API描述,API Popularity,API Latency,API Service Level
https://rapidapi.com/hkumar8897/api/generate-random-password/,2022-11, Harsh Kumar ,Generate Random Password,This api is use to generate strong password based on user input. 100% Efficient and easy to use,,,
https://rapidapi.com/jackmatrix75/api/esport-tournament-engine/,2022-11, Gamenetics ,Esport Tournament Engine,A fully managed tournament Engine that comes with rich features to organize bespoke esports competitions on demand.,,,
https://rapidapi.com/quentin-ASRUWyU5m/api/informatron-logo-colors-and-infos-scraper/,2021-11, Quentin Chantelot ,informatron - logo - colors and infos scraper,"Enrich your data with just an email or a domain. Personnalize your users onboarding with their colors, logo, company description and much more.",0.0,833 ms,0%
https://rapidapi.com/pdfgenerator/api/easypdf-html-to-pdf/,2021-11, pdfgenerator ,EasyPDF - HTML to PDF,Easiest way to generate PDFs. You can use our API with plain html or urls.,,,
https://rapidapi.com/composify-composify-default/api/generate-pdf-from-url-web/,2021-11, printAPI ,Generate PDF from URL WEB,printAPI - Print website URL to PDF API Fast,,,
https://rapidapi.com/fioxxu/api/pdfconvertor/,2022-11, fioxxu ,PDFConvertor,API Converts a PDF to Base64 String.,,,
https://rapidapi.com/Jayakanth/api/crypto-arbitrage-opportunities/,2021-11, Crypto Trader ,Crypto Arbitrage Opportunities,"This api returns crypto arbitrage trading opportunities based on the currency pair provided, the exchanges provided and the minimum profit required",0.0,377 ms,100%
https://rapidapi.com/huzefakhan225/api/qr-code87/,2023-05, Huzaifa Khan ,QR CODE,Generate QR CODE,,,
https://rapidapi.com/platformedocapi/api/edocapi/,2022-11, edocapi platform ,eDocAPI,PDF Generator API | HTML to PDF documents creation and automation,,,
https://rapidapi.com/micaelbh/api/url-html-to-pdf1/,2023-06, MP Apis ,URL HTML to PDF,URL HTML content will convert to PDF file of the desired size. The return is in Base64 that can converted in pdf in all languages.,,,
https://rapidapi.com/lola-ai-lola-ai-default/api/messages-generation-tool/,2021-11, lola ai ,Messages Generation Tool,Generate emails or connection requests based on your prospect’s Linkedin profile. This tool is especially powerful for sales and marketing teams.,,,
https://rapidapi.com/HHOTTBBOXX/api/amazon-scraper15/,2021-11, HHOTTBBOXX ,AMAZON SCRAPER,"this REST API is the easiest way to get access to products, prices, offers and reviews of amazon in JSON format",,,
https://rapidapi.com/assafbarButterfly/api/natural-language-actions-api-zappier-playground/,2023-07, AsiBFLYING ,Natural Language Actions API: Zappier Playground,Natural Language Actions API: Zappier Playground for Through Testing,,,
https://rapidapi.com/wodanio-wodanio-default/api/html-to-pdf15/,2023-03, Wodanio ,HTML to PDF,HTML/URL to PDF converter with CDN. Runs on powerful Chromium. Generate a PDF now!,,,
https://rapidapi.com/Fake_Death/api/cloudflare-1-1-1-1-unlimited-warp-plus/,2023-07, Farid Chowdhury ,Cloudflare 1-1-1-1 unlimited warp plus,Cloudflare 1.1.1.1: Faster & Safer Internet unlimited warp+ data.,0.0,845 ms,100%
https://rapidapi.com/sunapis-sunapis-default/api/pdf-split-tool/,2022-11, SunApis ,PDF Split Tool,Split and combine PDF documents,,,
https://rapidapi.com/sweephy/api/csv-profiling/,2023-05, sweephy ,CSV Profiling,"Profile CSV files with pandas profiling. You can create Exploratory Data Analysis (EDA) with this endpoint. Please bear in mind that creating HTML report may take time up to 10 seconds! Maximum file size: 75 Kb Accepted File Type: .csv If you need to profile bigger sized files, you can check www.sweephy.com",,,
https://rapidapi.com/jojokcreator/api/email-cleaner/,2023-04, jojokcreator ,Email Cleaner,Clean My Mail is an api that allows you to validate a list of emails and see whether they are valid or not,,,
https://rapidapi.com/info-MEVwcMJTn/api/pptx-wizard/,2021-11, NEBIS Nero e Bianco Software ,PPTX wizard,"Simple and fast API to extract information, delete/insert/ merge slides, replace text, extract/insert images in PPTX files. More endpoints are in the works - stay tuned. Full docs here: https://bitbucket.org/nebis/ppt-wizard-docs/src/master/",,,
https://rapidapi.com/bkrm.dahal/api/parse-file/,2021-11, Bikram Dahal ,Parse File,Parse Any kind of file and get content of file and metadata.,,,
https://rapidapi.com/lasheralberto/api/book-ai-api/,2023-10, A ML ,Book AI API,Generate PDF documents with embedded images and text.,0.0,678 ms,0%
https://rapidapi.com/okkabotman/api/nft-rarity-calculator/,2023-09, Okka Botman ,NFT Rarity calculator,NFT Rarity And Score Calculator: Instantly calculate scores for each asset of yours or others collections.,,,
https://rapidapi.com/tec-2-scale-tec-2-scale-default/api/qr-code-and-bar-code-functions/,2023-04, Tec-2-Scale ,QR Code and Bar Code Functions,"Discover the power and versatility of QRCode and Bar Code with Logo, our comprehensive API for generating and decoding QR codes with ease. Our user-friendly documentation covers a wide range of functionalities, from creating custom QR codes and Bar Code with adjustable sizes, colors, and styles to decoding existing codes in various formats. Safeguarded by API Key authorization, our service ensures your data remains secure and private. QRCode also supports advanced features such as embedding i...",,,
https://rapidapi.com/signing-tech-signing-tech-default/api/document-sign-and-timestamp/,2021-11, Signing Tech ,Document Sign And Timestamp,Sign And Timestamp the documents,,,
https://rapidapi.com/go-cart-bd-go-cart-bd-default/api/qr-code60/,2023-02, Go Cart BD ,QR Code,An Api for QR Code Generator for your website link. It simultaneously download the Generated QR code image into a JPG file.,,,
https://rapidapi.com/dewweb.service/api/convert-html-to-pdf/,2021-11, dewweb ,Convert HTML to PDF,"API to Convert HTML to PDF, PNG, JPG. Adjust Page Format in A4, A3, A5, LETTER, LEGAL, TABLOID. Set Orientation to Potrait or Landscape. Adjust Image Quality",,,
https://rapidapi.com/dulmina/api/amazon-scraper-api4/,2023-01, dulmina ,Amazon Scraper API,"An Amazon Scraper API is a tool that allows you to extract data from the Amazon website using a programmatic interface. This can include information such as product details, pricing, and reviews. The API typically uses web scraping techniques to gather the information and can be accessed using a variety of programming languages, such as Python or Java. It can be used for a variety of purposes, such as price comparison websites, market research, or for building a personal database of products.",,,
https://rapidapi.com/lyubo.raykov/api/bform-running/,2021-11, Lyubomir Raykov ,bform running,"Running posture analysis API. Analyze cadence, stride, vertical bounce, and more just from a video of a person running.",,,
https://rapidapi.com/ontiveros_german_19/api/fasdaa/,2021-11, Fabian Ontiveros ,fasdaa,fsaasd,,,
https://rapidapi.com/raj860444/api/demo18/,2021-11, raj pandey ,demo,demo testing api,,,
https://rapidapi.com/sametkzl94/api/linkbot/,2021-11, Samet Kızılaslan ,LinkBot,LinkBot,,,
https://rapidapi.com/nguyendata7/api/pharmacity/,2021-11, Nguyen Dat ,Pharmacity,These are APIs for Pharmacity Company - the largest retail pharmacy chain in Vietnam,0.0,"127,299 ms",0%
https://rapidapi.com/jckob123/api/jceferin/,2021-11, jckob123 ,jceferin,test,,,
https://rapidapi.com/sarahe/api/lambdatest-screenshot/,2021-11, Sarah Elson ,LambdaTest Screenshot,LambdaTest Automated Screenshot API,,,
https://rapidapi.com/Atomoworks/api/convertkit/,2021-11, TomoBloq ,ConvertKit,ConvertKit is email marketing software for creators.,,,
https://rapidapi.com/beed/api/uuindouus/,2021-11, Benedict McNamara ,uuindouus,Win32 API in Hecsadesinnal,,,
https://rapidapi.com/oksuzofficall/api/beeg/,2021-11, Oğuzhan Öksüz ,Beeg,beeg için,0.0,603 ms,0%
https://rapidapi.com/connell87/api/shortlink/,2021-11, connell ,ShortLink,The URL Shortener To Create Shortened links With Ease:),,,
https://rapidapi.com/jzarates/api/stamping/,2021-11, Jose Zarate ,Stamping,Blockchain for active or evidence digital register,,,
https://rapidapi.com/RRRJJJ/api/api1pub/,2021-11, RickJ ,api1pub,public1pinumber1,,,
https://rapidapi.com/dph.ides2011/api/ensureflight/,2021-11, Dph Ides ,EnsureFlight,Ensure Flight booking,,,
https://rapidapi.com/ucinema19/api/ucinema/,2021-11, u cinema ,ucinema,fire for movie website purposes,,,
https://rapidapi.com/raygorodskiywork/api/sdfsdf/,2021-11, Денис Райгородский ,sdfsdf,sdfsdf,,,
https://rapidapi.com/contractfit/api/intelligent-automation-ocr-ai/,2022-11, contract.fit ,"Intelligent Automation (OCR, AI,...)","Looking for an intelligent data capture solution? With contract.fit you can easily apply state-of-the-art machine learning to all your automation needs (for invoice extraction, receipts, etc.)",0.1,395 ms,100%
https://rapidapi.com/IPIX%20LMS/api/ipix-lms/,2021-11, IPIX LMS ,IPIX LMS,"IPIX LMS provides companies and organizations with a technology-enhanced learning management solution that is compatible with every platform, allowing trainers to build and distribute courses, training programs, assessments, and other learning materials that suit their respective teaching styles and pace.",,,
https://rapidapi.com/jothipriyadharshanr/api/geospark/,2021-11, Jothi Priyadharshan Ramakrishnan ,GeoSpark,Location tracking simplified.,0.0,"1,224 ms",92%
https://rapidapi.com/abdulhadikareem/api/e2open-llc/,2021-11, abdulhadikareem ,"E2open, LLC.","E2open is a cloud-based, real-time operating platform that orchestrates the global supply chains of the world's best-known brands.",,,
https://rapidapi.com/ejobsitesoftware/api/ejobsitesoftware-com/,2021-11, ejobsitesoftware ,ejobsitesoftware.com,Get data from ejobsitesoftware.com - Job Board Software,,,
https://rapidapi.com/smithdanial007/api/mbox-migrator/,2021-11, Danial Smith ,MBOX Migrator,MBOX Migrator is an state-of-the-art application used to convert MBOX emails to 20+ file formats & email clients. You can get it from here: https://www.recoverytools.com/mbox/migrator/,,,
https://rapidapi.com/gogears/api/user-info/,2021-11, Sriram Karthick.G ,User Info,user info,,,
https://rapidapi.com/tpottei1/api/twinsecure/,2021-11, Tim P ,TwinSecure,Hardens legacy software with moving target defense protections,,,
https://rapidapi.com/frantishex/api/loyalty-apis/,2021-11, Frantishex ,Loyalty Apis,Loyalty Api,0.0,699 ms,0%
https://rapidapi.com/Harsimran/api/test2113/,2021-11, Harsimran ,test2,test2,0.0,"1,598 ms",100%
https://rapidapi.com/CLLAX/api/cllax1/,2021-11, CLLAX ,CLLAX,"Cllax - Advice, resources and tools for starting a small business. Information on getting finance, business planning, hiring, IT, marketing and much more. ( https://cllax.com/ )",,,
https://rapidapi.com/stefan.skliarov/api/LiveAgent/,2021-11, Stefan Skliarov ,LiveAgent,Stay closer to your customers and answer their questions faster with LiveAgent.,,,
https://rapidapi.com/zakutynsky/api/Prexview/,2021-11, Igor Zakutynsky ,Prexview,PrexView makes it simple to convert your data to different formats.,,,
https://rapidapi.com/zakutynsky/api/Quip/,2021-11, Igor Zakutynsky ,Quip,The Quip API provides read/write access to Quip.,,,
https://rapidapi.com/stefan.skliarov/api/Metacert/,2021-11, Stefan Skliarov ,Metacert,The MetaCert Security API allows you to look up the classification or reputation of URLs and IP addresses against our “Malware & Phishing” and “Pornography” collections.,0.1,"127,266 ms",0%
https://rapidapi.com/zakutynsky/api/OneNote/,2021-11, Igor Zakutynsky ,OneNote,OneNote is a popular note-taking tool that's available online and on many mobile and tablet platforms.,0.0,"127,307 ms",0%
https://rapidapi.com/stefan.skliarov/api/Baremetrics/,2021-11, Stefan Skliarov ,Baremetrics,Zero-setup subscription analytics and insights.,,,
https://rapidapi.com/SuperSaaS/api/supersaas-online-bookings-and-appointment-scheduling/,2021-11, SuperSaaS ,SuperSaaS - Online Bookings and Appointment Scheduling,The SuperSaaS API provides calendar services that can be used to add online booking and scheduling functionality to an existing website or CRM software.,,,
https://rapidapi.com/ironwifi/api/ironwifi/,2021-11, ironwifi ,IronWifi,"IronWifi offers a powerful Application Program Interface (API) that can be used to integrate IronWifi RADIUS authentication services with user and guest management systems. The API framework allows your platform to interact with the network access control platform provided by IronWifi. With the IronWifi API, user management systems can dynamically update the RADIUS server to instantly create or delete users in the IronWifi database, and you can set or modify access rights. When a user attempts to access the network, IronWifi uses the updated credentials as the basis for permitting activities on the network. When a user attempts to access a WiFi network, the Access Point can send a RADIUS request to IronWifi RADIUS. IronWifi authenticates the user based on the updated credentials. To receive technical assistance with your IronWifi API project, or to discuss any advanced requirements that you may have, please contact us at support@ironwifi.com, or call +1 (800) 963-6221.",,,
https://rapidapi.com/eliot/api/kloudless/,2021-11, Kloudless ,Kloudless,Cloud App Integrations Made Fast and Easy.,,,
https://rapidapi.com/mikilior1/api/Clearbit/,2021-11, Miki Lior ,Clearbit,"Retrieve company logos, employees and information.",0.0,"127,256 ms",0%
https://rapidapi.com/stefan.skliarov/api/ZendeskCore/,2021-11, Stefan Skliarov ,ZendeskCore,"Create, edit and manage customer support tickets.",,,
https://rapidapi.com/zakutynsky/api/Algorithmia/,2021-11, Igor Zakutynsky ,Algorithmia,Host language-agnostic functions and algorithms via an API.,,,
https://rapidapi.com/volodimir.kudriachenko/api/Intercom/,2021-11, Volodimir Kudriachenko ,Intercom,Access data and build integrations for this chat app.,,,
https://rapidapi.com/stefan.skliarov/api/PDFlayer/,2021-11, Stefan Skliarov ,PDFlayer,Create highly customizable PDFs from URLs & HTML.,0.1,"127,248 ms",0%
https://rapidapi.com/stefan.skliarov/api/JIRA/,2021-11, Stefan Skliarov ,JIRA,"Create and manage workflows, plan projects and track issues.",,,
https://rapidapi.com/hello-aFgIk1gDq/api/whatsapp-api-for-developers-free-plan/,2023-09, WhatsAPP API for Developer ,WhatsApp API for developers / Free plan,"Integrate WhatsApp without limits to your own services or apps! Groups & Buttons, Technical support & Guides. API works stably and does not crash during updates",0.0,588 ms,100%
https://rapidapi.com/zubayerhossain111-pc4H47zf9Nz/api/liveness-detector/,2022-11, Syntax ,Liveness Detector,The script detects liveness of a person in front of the camera real time,,,
https://rapidapi.com/SRapid/api/test9231/,2021-11, SRapid ,Test,Test Api,,,
https://rapidapi.com/panchalrajan2k19/api/myipjson/,2023-02, Rajan Panchal ,MyIPJSON,Get Your IP Address as JSON Response,,,
https://rapidapi.com/nebojsanrt619/api/ist10/,2022-11, Небојша Маричић ,ist,ist,,,
https://rapidapi.com/perammaruthireddy/api/docs3/,2021-11, MaruthiReddy Peram ,Docs,Example,,,
https://rapidapi.com/natioskar/api/sep07free/,2021-11, natioskar ,Sep07free,Sep07free,,,
https://rapidapi.com/com.realtor.api/api/real-estate-usa/,2021-11, Realtor API ,Real Estate USA,The API to search properties for sale or rent in USA,0.1,29 ms,0%
https://rapidapi.com/munyoudoum/api/test11302/,2021-11, munyoudoum ,test1,penhw,,,
https://rapidapi.com/growthfactor-growthfactor-default/api/testapi592/,2021-11, growthfactor ,testapi,Test API,,,
https://rapidapi.com/offchaindata/api/holiday-oracle/,2021-11, System Support ,Holiday Oracle,Global holiday date prediction service. Holiday and Business Day data for App and blockchain developers.,,,
https://rapidapi.com/reverie-language-technologies-reverie-language-technologies-default/api/neural-machine-translation/,2021-11, Reverie Language Technologies ,Neural Machine Translation,Localization of content in 11 Indian Languages using Neural Machine Translation based solution,,,
https://rapidapi.com/wesley.rabelo.teixeira/api/scanner-url/,2021-11, Wesley (Wesley) ,Scanner Url,Scan a URL and get your status code before ordering.,,,
https://rapidapi.com/wowlovexie-7UFjAE51vgg/api/u1888/,2021-11, 谢蒙 ,u1888,a dog,,,
https://rapidapi.com/moresensetech-Tx2rlmeP2JC/api/document-filter1/,2021-11, more sense ,Document Filter,"Document Filter API provides features to replace, redact or mask text strings and also to blur or mask images present in a document without impacting its layout or formatting. API shall be very useful for protecting PII data, for identity protection, for protecting gender sensitive information, in GDPR compliance, promoting Gender Diversity or promoting Diversity in general, protecting business intellectual property, protecting trade secrets or for generally protecting sensitive data while ...",,,
https://rapidapi.com/hktorab/api/hkt/,2021-11, Humayun Kabir ,HKT,Test API,,,
https://rapidapi.com/elmahdim/api/ftoggles/,2023-02, Mahmoud ,FToggles,Feature toggles API,,,
https://rapidapi.com/zhandongdu/api/pereless/,2021-11, zhandongdu ,Pereless,Pereless,,,
https://rapidapi.com/vph1997-_2dz1XtVHq7/api/submit1/,2021-11, VÕ SINH HIỂN ,submit,submit complie,,,
https://rapidapi.com/accwebapi/api/ksa-zatca-e-invoice-api/,2023-02, acc web ,KSA Zatca E-Invoice API,KSA Zatca E-Invoice API,,,
https://rapidapi.com/m0rgause/api/hotel-services/,2023-04, m0rgause ,Hotel Services,This API is used for storing data related to hotels and bookings made by customers.,,,
https://rapidapi.com/desaiknl6/api/getweatherzipcode/,2021-11, Desai Kunal ,getweatherzipcode,For getting weather zipcode,0.0,"254,537 ms",0%
https://rapidapi.com/oknelharun/api/harun-whtsp/,2021-11, Harun Oknel ,Harun-WHTSP,Harun-WHTSP,,,
https://rapidapi.com/amitmudgal69/api/ahelpzone/,2021-11, AMIT SHARMA ,ahelpzone,ahelpzone for bulk sms,,,
https://rapidapi.com/inkit-inkit-default/api/inkit1/,2022-11, Inkit ,Inkit,"Generate documents automatically, secure PDFs, and centralize document retention.",0.1,266 ms,100%
https://rapidapi.com/dathoang997/api/dathoang1/,2022-11, Đạt Hoàng ,dathoang,tiendat,0.0,"1,021 ms",0%
https://rapidapi.com/markorlando45/api/invoiceflow/,2023-02, Emmanuel Mark Ndaliro ,InvoiceFlow,Invoice processing API,,,
https://rapidapi.com/ahmadkhaled84/api/whatsapptestsample/,2021-11, Ahmad Khaled ,WhatsAppTestSample,WhatsApp Test Sample,,,
https://rapidapi.com/reedsheila29/api/tev/,2023-09, ᛘwɪllᛘ ,tev,tev,0.0,72 ms,100%
https://rapidapi.com/polypodo.data/api/test5953/,2021-11, Polypodo DATA ,TEST,TEST,,,
https://rapidapi.com/aliha15551/api/login210/,2021-11, سہٰۧكہٰۧيورتہٰۧي العہٰۧراق ,login2,fff,,,
https://rapidapi.com/jake-lJLVERaLFMD/api/labateio/,2021-11, Jake Labate ,labateio,Labate.io API,,,
https://rapidapi.com/iva-gnt70-iva-gnt70-default/api/iva-docs-gateway/,2022-11, Iva docs ,Iva docs Gateway,Iva docs Gateway,,,
https://rapidapi.com/inbet-games-inbet-games-default/api/slot-and-betting-games/,2021-11, Inbet Games ,Slot and Betting Games,API games for your online casino.,0.0,582 ms,100%
https://rapidapi.com/shivam9922/api/weboz/,2021-11, sam ,weboz,api for curl,,,
https://rapidapi.com/boldsign-boldsign-default/api/boldsign/,2023-06, BoldSign ,BoldSign,BoldSign offers a wide range of REST APIs that allow you to seamlessly integrate the complete sending and signing process within your applications. Learn more about [BoldSign eSignature APIs](https://boldsign.com/esignature-api/?utm_source=rapidapi&utm_medium=referral&utm_campaign=boldsign).,,,
https://rapidapi.com/apitemplate/api/apitemplate1/,2021-11, apitemplate ,APITemplate,APITemplate.io allows you to auto-generate images and PDF documents from reusable templates with a simple API.,0.0,"1,480 ms",100%
https://rapidapi.com/LuongQuocKhang/api/zoho2/,2021-11, LuongQuocKhang ,Zoho,Zoho API for handling request from Zoho,0.0,266 ms,100%
https://rapidapi.com/panabee/api/domain-name-search2/,2021-11, Panabee ,Domain Name Search,Check the status and availability of domain names,0.1,33 ms,0%
https://rapidapi.com/approvals-org-approve-meeee/api/approvallllllls/,2021-11, Approvals org ,Approvallllllls,wsad,,,
https://rapidapi.com/test-org-proddd-test-org-proddd-default/api/its-raining/,2021-11, Test org proddd ,It's Raining,outside,,,
https://rapidapi.com/psingh122/api/milkslip/,2021-11, Pankaj Singh ,milkslip,o you also allow cookies from our third-party advertising partners so we can personalize the ads you see?,,,
https://rapidapi.com/rk.cloud7solutions/api/trivial-functions/,2022-11, Rahul Kumar ,Trivial Functions,Developer friendly functions,,,
https://rapidapi.com/psingh122/api/pankaj3/,2021-11, Pankaj Singh ,Pankaj,revivefreight,,,
https://rapidapi.com/bogiemakesperfect/api/bogieapis/,2022-11, bogiemakesperfect ,BogieApis,qqwerty,0.0,119 ms,100%
https://rapidapi.com/nageshy.php/api/testotp/,2021-11, NAGESH Y ,testotp,eeee,,,
https://rapidapi.com/techleadregapis/api/regapis/,2021-11, TechLead ,regAPIs,"provides API for regulatory calculations like Fed Tax calculations, state Tax, state withholdings",,,
https://rapidapi.com/smdjrs1/api/html-to-pdf-api/,2022-11, Alex K ,HTML to PDF API,Convert HTML to PDF with one API request. Starts from $9.59/month. 50 generations/month are free. https://pdocf.com,,,
https://rapidapi.com/gsquare-web-technologies-pvt-ltd-gsquare-web-technologies-pvt-ltd-default/api/demo-project17249/,2023-02, Gsquare Web Technologies Pvt Ltd ,👋 Demo Project,"Hire Mobile App, Custom web app team & digital marketers on Hourly, Fixed Price, Monthly Retainers",,,
https://rapidapi.com/softthink.tech/api/testpostmethod1/,2021-11, Softthink ,testPostmethod,testPostmethod,,,
https://rapidapi.com/HAXSKILL/api/haxskill-fleet/,2022-11, HAXSKILL ,haxskill fleet,HAXSKILL fleet is an online intelligent delivery management software,,,
https://rapidapi.com/mks13/api/noco2/,2021-11, mks13 ,noco2,Get Co2 Emmission for everything,0.0,994 ms,100%
https://rapidapi.com/kloudless-kloudless-default/api/kloudless-unified-crm/,2021-11, Kloudless ,Kloudless Unified CRM,"One API for Any CRM Provider: Salesforce, Hubspot, Microsoft Dynamics, Zoho, NetSuite",0.0,358 ms,100%
https://rapidapi.com/growkepro/api/flask16/,2023-09, Grow Ke ,Flask,f,,,
https://rapidapi.com/patterva-patterva-default/api/trisns/,2021-11, patterva ,trisns,patterva,,,
https://rapidapi.com/jamespaden/api/docraptor-html-to-pdf/,2023-08, jamespaden ,DocRaptor HTML-to-PDF,"As the only API powered by the PrinceXML HTML-to-PDF engine, DocRaptor provides powerful support for headers, page breaks, page numbers, flexbox, watermarks, accessible PDFs, and much more.",,,
https://rapidapi.com/dathoang997/api/newapi57/,2022-11, Đạt Hoàng ,newAPI,Description,,,
https://rapidapi.com/aliazizi86/api/s-dfsdf/,2021-11, Ali Azizi ,"s,dfsdf",s.dfmsfd,,,
https://rapidapi.com/testnt-testnt-default/api/testnt/,2021-11, TestNT ,testnt,API,,,
https://rapidapi.com/vlad.marinovichv21/api/misclases/,2021-11, Vlad ,Misclases,Esta es una api de traddución,,,
https://rapidapi.com/best-tech/api/wallet3/,2021-11, Denis Kharchenko ,wallet,Сервис электронных карт Apple Wallet.,,,
https://rapidapi.com/canzaxapp/api/test4891/,2021-11, Canzax App ,Test,Test Api,,,
https://rapidapi.com/philipwaluisachi/api/tory-pos/,2021-11, philipwaluisachi ,Tory-pos,A POS inventory managment system,0.0,112 ms,100%
https://rapidapi.com/nearbystays/api/nearbystays/,2021-11, nearbystays ,nearbystays,nearby stays api,,,
https://rapidapi.com/softthink.tech/api/addprooducts/,2021-11, Softthink ,addProoducts,products can be added using this api,,,
https://rapidapi.com/jp.am.braga/api/external-system/,2021-11, Joao Braga ,external-system,External system will integrate with wss,,,
https://rapidapi.com/syed-F259pQuyn/api/netbanking/,2021-11, syed zainul abedeen ,netBanking,net banking API,,,
https://rapidapi.com/hello-iEOCpTC18/api/apitemplateio/,2021-11, apitemplateio ,APITemplateio,APITemplate.io is the newest API-based platform designed to give you two powerful APIs for your media content generation — Image and PDF,,,
https://rapidapi.com/rajneesh045/api/login389/,2022-11, rajneesh045 ,login,login api,0.0,21 ms,0%
https://rapidapi.com/omprakashpatel.jit/api/gigasports/,2021-11, omprakash patel ,Gigasports,Gigasports,,,
https://rapidapi.com/davejuelz-kW8WB0nC32/api/addax/,2021-11, NIWEWE David ,Addax,"This API provides (User Management, Entity Manipulation, Short Message Service [only for Rwanda], Chat and Notofication) features.",,,
https://rapidapi.com/maxhammadcr/api/connectreport-core/,2022-11, connectreport ,ConnectReport Core,"Automatically generate scheduled and on-demand PDFs, Excel spreadsheets, PowerPoints, and other reports on your data.",,,
https://rapidapi.com/nebojsanrt619/api/123154/,2022-11, Небојша Маричић ,123,123,,,
https://rapidapi.com/autonix-autonix-default/api/autonix/,2021-11, Autonix ,Autonix,Autonix.io provides robust visitor analytics and contactless check-in tools.,0.0,481 ms,100%
https://rapidapi.com/spencerat/api/sophos-news/,2022-11, spence-rat ,Sophos News,"Designed to show relevant news about cybersecurity vendor, Sophos.",,,
https://rapidapi.com/narahari.nayak/api/telugu1/,2021-11, Narahari G ,telugu,,,,
https://rapidapi.com/snapcall-snapcall-default/api/snapcall/,2021-11, SnapCall ,SnapCall,Transform your phone numbers in digital call buttons and reduce drastically your telco costs.,,,
https://rapidapi.com/hormoznet-hormoznet-default/api/mostafa2/,2021-11, Hormoznet ,Mostafa,For Me,,,
https://rapidapi.com/krawczykowski.maciej/api/portfolio8/,2021-11, Maciej Krawczykowski ,portfolio,portfolio in react app,,,
https://rapidapi.com/horacio.galdamez21/api/quizapp/,2021-11, Horacio Galdamez ,QuizApp,Mock API for the Quiz Application,,,
