API链接,Update_Time,Author,API名称,API描述,API Popularity,API Latency,API Service Level
https://rapidapi.com/sendgrid/api/sendgrid/,2021-11, Sendgrid ,SendGrid,"Welcome to SendGrid’s Web API v3! This API is RESTful, fully featured, and easy to integrate with.",9.9,128 ms,100%
https://rapidapi.com/leeann/api/zerobounce1/,2022-11, ZeroBounce ,ZeroBounce,Email Validation Service. Use ZeroBounce's email validation API to increase your email marketing ROI! Remove invalid email addresses from your list using our unique email verification scrubbing system to prevent email bounces.,9.7,520 ms,100%
https://rapidapi.com/BouncerAdmin/api/bouncer-email-verification/,2023-09, Bouncer ,Bouncer Email Verification,Email Verification and Email Validation by Bouncer,9.5,919 ms,100%
https://rapidapi.com/srgl/api/validect-email-verification/,2023-02, srgl ,Validect - Email Verification,Email address validation API,9.7,"1,406 ms",100%
https://rapidapi.com/fama-official-email-finder/api/email-finder10/,2023-10, Fama Official ,Email Finder,Full Name + Company Domain = Valid Email (better than any alternative!),9.7,613 ms,100%
https://rapidapi.com/seriyps/api/dropmail/,2021-11, seriyps ,DropMail,Official GraphQL API for dropmail.me temporary 10 minute email service (temp mail). https://dropmail.me/api/schema.graphql,9.7,100 ms,100%
https://rapidapi.com/principalapis/api/easy-email-validation/,2021-11, Principal APIs ,Easy Email Validation,"Use this API to quickly and effectively validate an email addresses. This API runs the following checks: valid email format, mx Record, and disposable email.",9.6,479 ms,100%
https://rapidapi.com/Smied/api/gettempmail1/,2023-10, Smied ,GetTempMail,Temporary Email,9.8,316 ms,100%
https://rapidapi.com/mrsonj/api/temp-gmail/,2022-11, Sonj ,Temp Gmail,"Basically, a disposable or [temporary gmail](https://smailpro.com) address allows you to sign up for a website, app or online service without entering your personal information, so you're not going to have to deal with constant junk mail. These forms of email addresses are created and personalized for a particular reason and you can delete or discard them until this reason is completed, which does not impact your personal mail inbox, ensuring that you can continue to receive daily emails that...",9.9,938 ms,100%
https://rapidapi.com/lkyzmanov-1rYfRuWv8CS/api/http2smtp/,2022-11, Lachezar Kuzmanov ,http2smtp,"Send emails to smtp server over http, so you can skip all restrictions on your hosting provider,datacenter,network or server.",9.6,"5,608 ms",99%
https://rapidapi.com/calvinloveland335703-0p6BxLYIH8f/api/temp-mail44/,2021-11, Loveland Calvin ,Temp Mail,Create a temp mail,9.8,"1,227 ms",99%
https://rapidapi.com/johndevz/api/gmailnator/,2022-11, John ,Gmailnator,API for Gmailnator Website,9.8,"1,988 ms",97%
https://rapidapi.com/startfu-startfu-default/api/inboxes-com/,2023-09, Startfu ,inboxes.com,inboxes.com temp email accounts for testing and automation,9.7,345 ms,100%
https://rapidapi.com/mrsonj/api/email-checker7/,2022-11, Sonj ,Email Checker,Email Checker,9.6,"1,731 ms",100%
https://rapidapi.com/MASNathan/api/email-validator8/,2023-08, André Filipe ,Email Validator,"The Email Validator API checks if an email address is valid and reliable by verifying its format, domain reachability, and whether it's from a disposable/temporary email service.",9.7,"3,379 ms",99%
https://rapidapi.com/ymgstuffs/api/temp-mail70/,2023-09, YMG Stuffs ,Temp Mail,Temporary Disposable Email Address | Disposable email is a service that allows to receive email at a temporary address that self-destructed after a certain time elapses,9.6,"1,215 ms",100%
https://rapidapi.com/officialojingirisamuel/api/free-email-sender1/,2023-07, Ojingiri Samuel ,free email sender,"a comprehensive solution for efficient and reliable email delivery. This api harnesses cutting-edge technology to streamline the process, ensuring prompt and secure message transmission. It empowers businesses and individuals to effortlessly send emails at scale, enhancing productivity and communication. Experience the convenience of this innovative email sender, enabling you to effortlessly connect with your audience in a professional and time-efficient manner. visit https://nigeriansonly.c...",9.5,749 ms,66%
https://rapidapi.com/interzoid/api/get-email-information/,2021-11, Interzoid ,Get Email Information,Validate and retrieve useful information for an email address,8.7,636 ms,100%
https://rapidapi.com/api-tier1-apitier-team/api/validate-email5/,2022-11, API Tier ,Validate Email,“Validate Email” before you send. Discover deliverability of email addresses by our most popular email verification API.,9.1,"1,810 ms",100%
https://rapidapi.com/hulkhire-hulkhire-default/api/email-validation-and-verification-end-to-end-checks/,2023-07, HulkHire ,Email Validation and Verification- End to End checks,"Validates and verifies an email address assessing deliverability and quality. There are plenty of significant reasons behind having proper validation in place: 1. Sending emails to fake/no-longer-existent addresses will hurt your deliverability. 2. Mistyping an email address will block users from confirming their account or resetting a password. 3. Valid e-mail addresses, lets you stay in touch with users. 4. Improves ROI of your email marketing campaign 5. Helps in maintaining domain reput...",8.9,"1,061 ms",100%
https://rapidapi.com/rahmar4/api/bouncer-email-checker/,2023-11, AntiGANG ,Bouncer Email Checker,This API is a fast and check email address syntax and deliverability validator,9.1,"63,173 ms",51%
https://rapidapi.com/tobidaramola77/api/mail-man/,2023-04, Tobi Daramola ,Mail man,This api sends instant mail from webapps directly to clients. It works well in both development and production (regardless of the hosting service). Check the about page for more info.,9.0,6 ms,100%
https://rapidapi.com/niteshjain8435-rg3onXmaBgQ/api/email-validation12/,2023-10, Nitesh Jain ,Email Validation,Validate emails and remove disposable email addresses before adding them to your database.,9.0,"2,909 ms",100%
https://rapidapi.com/mondaltarakes/api/emailvalidator3/,2023-01, Tarakeswar Mondal ,emailvalidator,validate email and filter disposal fake email,8.8,"1,306 ms",100%
https://rapidapi.com/unionadmin/api/validaroo-email-validator/,2023-08, Validaroo ,Validaroo Email Validator,Email validation and verification service,9.0,490 ms,100%
https://rapidapi.com/khiljidev/api/email-validator50/,2023-07, Dev Khilji ,Email Validator,Email Validator,8.8,847 ms,94%
https://rapidapi.com/tvhaudev/api/e-mail-check-invalid/,2023-08, tvh81 ,E-mail Check Invalid,The Email Check Invalid API is used to verify the validity of an email address.,8.6,255 ms,100%
https://rapidapi.com/mbavazijoshua-FBlK2-OZK5X/api/fast-email-verifier/,2023-03, Technologie Dev ,fast Email verifier,APISOLUTION services provide a comprehensive API for fast email validation and verification for any developer to use on start-ups and staff projects.,9.0,"27,054 ms",100%
https://rapidapi.com/webtutstamil/api/email-validator-api3/,2023-08, DevCast APIs ,Email Validator API,"Ensure the integrity and reliability of your email data with our advanced Email Validator API. Designed to meet the evolving needs of businesses and developers, our API offers a multi-faceted approach to email validation, incorporating SMTP verification, MX record analysis, and disposable email detection. Say goodbye to bounced emails, improve deliverability rates, and maintain a clean and authentic email list effortlessly.",8.8,"10,744 ms",100%
https://rapidapi.com/iredun/api/get-emails-from-url/,2023-09, iredun ,Get emails from url,Get all unique email address by url.,9.1,"2,323 ms",100%
https://rapidapi.com/alreadycoded/api/website-emails-social-media-pages-link-extractor/,2023-05, alreadycoded ,Website Emails & Social Media Pages Link Extractor,"This API can provide list of contact emails and Facebook, YouTube, Twitter, Linkedin, Pinterest, and Instagram page links of specified website.",9.0,"1,341 ms",100%
https://rapidapi.com/tradingtipsstock/api/email-validator39/,2023-02, Stock TIps ,Email validator,"This API will validate email with domain name, it is use to filter out invalid email and invalid domain, to perfact match delivery rate and minimum email bounce.",8.6,"1,224 ms",100%
https://rapidapi.com/dev2k3xxx/api/apimail10/,2022-11, dev 2k3 ,apimail10,apimail10,9.2,283 ms,100%
https://rapidapi.com/fatehbrar92/api/disposable-gmail/,2023-07, TheSerpent ,Disposable Gmail,~ Bugs fixed! [+] Temporary Gmail Generator API to fight with spam. [+] Generates a real Gmail. [+] Disposable Gmails are more superior than disposable domain emails. [+] Minimal chances for a website to detect a disposable gmail. Tags: Gmail Google Mail Temporary Email Disposable Email Temp Mail,9.4,30 ms,100%
https://rapidapi.com/zenno.dmv/api/temporary-mail-afeg-ru/,2023-01, Zenno dmv ,Temporary mail afeg.ru,Afeg is a service that allows you to receive email to a temporary address,8.8,912 ms,100%
https://rapidapi.com/zyla-labs-zyla-labs-default/api/email-temporary-generator/,2023-04, Zyla Labs ,Email Temporary Generator,The Email Temporary Generator API generates temporary email addresses that can be used to protect the privacy and avoid spam. This API is easy to use and can be integrated with any application. Users can create temporary email addresses and check their inboxes to view incoming emails.,9.1,"1,166 ms",100%
https://rapidapi.com/pateljimi2020/api/send-emails-api/,2023-09, Jimmy ,Send Emails API,This api sends instant mail from webapps directly to clients without your email. we will send emails from our domain.,,,
https://rapidapi.com/pk-ai-pk-ai-default/api/disposable-domain-or-invalid-email-checker/,2023-08, PK Ai ,Disposable Domain or Invalid Email Checker,"Check if the email is valid or not, disposable or not. Its results are nearly 99% accurate.",8.7,598 ms,100%
https://rapidapi.com/DaddyApi/api/gmail-alias-daddy/,2022-11, DaddyApi ,🔴 GMAIL ALIAS 🔴 Daddy,Create unlimited aliases for your Gmail address. Useful if you need to receive emails to multiple mailboxes,9.0,210 ms,100%
https://rapidapi.com/techdeluxe00/api/email-sending-medeluxe/,2023-05, Deluxe Tech (techdeluxe) ,email-sending (medeluxe),A simple but power mail sending api with ease,9.0,"2,059 ms",100%
https://rapidapi.com/zyla-labs-zyla-labs-default/api/email-disposable-generator-api/,2023-03, Zyla Labs ,Email Disposable Generator API,The Email Disposable Generator API is a tool designed for developers to create temporary email addresses for testing and development purposes. The API generates unique and disposable email addresses that ensure the privacy and security of the user.,8.9,"1,063 ms",100%
https://rapidapi.com/jibr/api/disposable-email-validation/,2023-09, APIweb.dev ,Disposable Email Validation,Disposable Email Validation and Verification check against >150K unique domains. Detect if an Email is from a Disposable Email Address Services.,9.3,253 ms,100%
https://rapidapi.com/yuvraj108c/api/youtube-channel-email-scraper/,2023-05, Hecker ,Youtube Channel Email Scraper,Scrape email addresses from youtube channels,8.8,"2,354 ms",100%
https://rapidapi.com/deveshkumarsingh75/api/email-existence-validator/,2023-05, Devesh Kumar Singh ,Email Existence Validator,"API which checks if email really exist on server or not. It check for different parameters for giving end results . Check for MX records, SMTP deliverability, Disposable check and many more.",9.2,"1,459 ms",100%
https://rapidapi.com/mailgrass-mailgrass-default/api/mailgrass/,2023-09, MailGrass ,MailGrass,"MailGrass is a revolutionary service designed specifically for developers that simplifies the process of sending emails. With MailGrass, developers can send an unlimited number of emails without writing a single line of code. This powerful tool provides a robust infrastructure that can handle high-volume sending, making it an ideal solution for everything from large-scale marketing campaigns to transactional emails. Unlike traditional SMTP servers that require complex setup and maintenance,...",8.8,278 ms,93%
https://rapidapi.com/vittorio.nardone/api/easy-fast-temp-mail/,2021-11, GoToCloud ,Easy Fast Temp Mail,Very easy and fast Temporary Disposable E-mail API .. also on your own domain!,9.1,"1,724 ms",100%
https://rapidapi.com/blaze-verify-blaze-verify-default/api/blaze-verify/,2021-11, Emailable ,Blaze Verify,"Email Verification by Emailable is astonishingly easy and low-cost. Simple, reliable, and affordable list cleaning shouldn’t be hard to find. Emailable helps marketers and developers build powerful and effective marketing campaigns.
|",9.3,71 ms,100%
https://rapidapi.com/relige/api/email-validator18/,2021-11, Konstantin Kiselev ,Email Validator,"Deep email verify. Supports: Gmail, Mail.Ru, iCloud, Hotmail, Yahoo, Outlook, Rambler, Yandex and more.",9.3,"20,979 ms",34%
https://rapidapi.com/jsavajols/api/email-verifier7/,2021-11, jsavajols ,Email verifier,Check the validity of an email address,9.4,"1,587 ms",100%
https://rapidapi.com/taipei/api/mailcheck3/,2021-11, taipei ,MailCheck,Check if emails are disposable,9.4,624 ms,100%
https://rapidapi.com/manithandi686/api/demo-project11208/,2023-01, Thandi Simbiwi ,👋 Demo Project,This Project is created by the onboarding process,8.9,967 ms,100%
https://rapidapi.com/patelyagnik0303/api/email-authentication-system/,2023-07, Yagnik-Fadadu ,Email Authentication System,"This API will help you to send your user an OTP for any purpose like login, signup, forget-password and much more. The response is in JSON form it returns authenticationCode(MD5) in response for succesfull request with you can store and validate it with users input.",9.4,"4,880 ms",93%
https://rapidapi.com/adhip/api/trustcheckr-email-risk/,2021-11, Adhip Ramesh ,TrustCheckr Email Risk,Check the risk of all the email addresses of your customer. Identify good and bad customers. Get the RISK score.,8.4,"3,199 ms",100%
https://rapidapi.com/info-qGn690NaE/api/email-verification7/,2021-11, LEC Group ,Email Verification,Validate email addresses in real time (Syntax verification and domain's MX records verifications).,,,
https://rapidapi.com/ajithjojo1230/api/email-validation-bounce-checker/,2022-11, Getecz ,Email Validation - Bounce Checker,Validate and verify emails and save your emails from bouncing - 4 Levels of checking,8.2,"15,200 ms",100%
https://rapidapi.com/santrarahul7070/api/alpha-email-verification/,2023-05, Rahul Santra ,Alpha Email Verification,Email Validation Service. check if a specific e-mail address is valid. Is it a proper domain? Is the e-mail a temporary/disposable e-mail? Our API contains 180k disposable email domains and gives the most valid email,8.2,"1,054 ms",100%
https://rapidapi.com/andreascieslik/api/tnef-attachment-extractor/,2023-07, AC Cloud Solutions ,TNEF Attachment Extractor,TNEF Attachment Extractor API helps you to extract attachments in Base64 format from a Base64-encoded TNEF file string.,,,
https://rapidapi.com/veilleio-veilleio-default/api/gender-checker/,2023-07, Veille Scraping ,Gender Checker,Gender Checker is a API that tries to infer a person's gender from their name (mostly first name) and location (country).,8.2,"5,823 ms",100%
https://rapidapi.com/andero-VDilSNebN/api/smart-email-parsing-api-extract-names-domains/,2023-05, Andero Av ,Smart Email Parsing API - Extract Names & Domains,Smart Email Parsing API allows you to intelligently extract names and domains from emails with customizable ignore options. It handles various email formats and provides processed information in a readily usable form.,,,
https://rapidapi.com/businessangelsunited/api/email-boost-pro/,2023-08, Life Coach Ray ,Email Boost Pro,"**Email Boost Pro**: Elevate your digital journey with confidence and authenticity. Experience a user-centric email validation API curated by Life Coach Ray, designed to fortify security, cultivate connections, and seamlessly integrate into your digital realm. Unleash your potential with simplicity and embark on an Odyssey of success, where every interaction is a transformative step towards brighter online experiences. Join Life Coach Ray's mission and ignite your progress today!",,,
https://rapidapi.com/nemohadaana/api/emailbounceapi/,2023-07, ta9ra9pa9 ,EmailBounceAPI,"FREE 20,000 , Email Debounce , Our bounce email API is a powerful tool that helps you manage your email deliverability by detecting, monitoring, and handling bounced emails from a range of ISPs. With our API, you can ensure your messages are delivered effectively, and that your sender reputation stays in good standing. Whether you're a small business or a large enterprise, our API is designed to simplify your email management and help you achieve better email performance. Contact us today to ...",8.1,835 ms,100%
https://rapidapi.com/brettw894/api/email-extraction/,2021-11, Brett ,Email Extraction,Will take a String and return an array of all emails contained within.,,,
https://rapidapi.com/fatehbrar92/api/email-verifier-validator/,2023-07, TheSerpent ,Email Verifier/Validator,This API uses SMTP Callback Verification technique to check if an email really exists or not.,8.2,563 ms,100%
https://rapidapi.com/protoddler-protoddler-default/api/disposable-invalid-email-verifier/,2023-06, ProToddler ,Disposable & Invalid Email Verifier,"Our email validation tool makes it simple for you to verify the authenticity of any e-mail address. With just a few clicks, you can confirm if the e-mail address is associated with a valid domain and if it is a temporary or disposable e-mail. These are common indicators of spamming or trolling, which is why we have created an API to help you easily block these unwanted e-mails. Our advanced algorithms and techniques are designed to thoroughly validate each e-mail address, ensuring that you ha...",8.4,"8,605 ms",100%
https://rapidapi.com/nguyencongt3/api/email-checker22/,2023-08, Cong Nguyen ,Email Checker,Easy to check if an email address is existing or not before actions,8.0,131 ms,100%
https://rapidapi.com/pk-ai-pk-ai-default/api/email-validation-api3/,2023-08, PK Ai ,Email Validation API,The Best API For Email Validation. Check If the email address is disposable or not.,,,
https://rapidapi.com/gamalogicapp/api/gamalogic/,2021-11, gama logic ,Gamalogic,Gamalogic provides email validation service with higher accuracy and speed. Our email validator API remove invalid email addresses from your list using most sophisticated technologies to prevent email bounces and improve quality of lead delivery metrics. ,,,
https://rapidapi.com/pavinjoseph/api/mailcheap/,2021-11, Pavin Joseph ,Mailcheap,"HTTPS API for managing dedicated email servers from Mailcheap, providing complete API support for email administration.",8.3,975 ms,100%
https://rapidapi.com/ngocattuong1997-M7D4JZ3QN0P/api/rapapi/,2021-11, Tường Ngô ,RAPAPI,RAPAPI DESS,,,
https://rapidapi.com/faikdjikic/api/emalidate1/,2022-11, Faik Djikic ,Emalidate,"Instantly verify emails entered at your site. Ensure that your customers didn’t mistype the address or forgot to enter part of the e-mail. Check MX records, disposable or free e-mails, catch-all addresses, etc. In compliance with GDPR emalidate does not store checked addresses at any point.",,,
https://rapidapi.com/dataverse-dataverse-default/api/email-checker-v2/,2022-11, Dataverse ,Email Checker v2,Validates email and checks domain DNS to be accessible,8.0,233 ms,100%
https://rapidapi.com/akshays-XTw1jQjPD/api/akshay-edu-hub/,2022-11, Akshay Shelke ,Akshay edu hub,akshay edu short description akshay edu short description akshay edu short description akshay edu short description akshay edu short description akshay edu short description akshay edu short description akshay edu short description akshay edu short description akshay edu short description akshay edu short description,,,
https://rapidapi.com/hydrone/api/send-sleuth-email-validation/,2021-11, UltraCoded ,Send Sleuth - Email Validation,Easily validate and verify email addresses with our simple API! Start for free and begin validating email addresses,,,
https://rapidapi.com/amjad.jibon/api/valid-email1/,2023-05, Amjad Hossain ,Valid Email,Check if email is valid,,,
https://rapidapi.com/akashshrivastava136-TWfp63Slgxd/api/email-validator-api2/,2023-04, Akash Shrivastava ,Email Validator API,An API to validate email addresses and check whether it really exists or not,,,
https://rapidapi.com/emailcheckerfree/api/free-email-verification/,2021-11, Free Email Verification ,Free Email Verification,Check any email address for validity or disposable domain. Keep spam users out..,,,
https://rapidapi.com/niat786/api/email-api8/,2023-05, Niat Murad ,Email API,"This Email API is helpful to validate email addresses(single or bulk, using txt and csv), detect temporary, get fake emails, check free emails, check MX records and identify free/paid email service providers.",,,
https://rapidapi.com/azizbergach/api/email-verify5/,2023-03, azizbergach ,Email Verify,"An email verifier API is a service that verifies the validity and authenticity of an email address. It checks if the email address exists, whether it is correctly formatted, and if the email server associated with the email address is active and accepting emails. The importance of an email verifier API lies in its ability to help businesses maintain the quality and accuracy of their email marketing lists. By ensuring that email addresses are valid, businesses can avoid sending emails to non-...",,,
https://rapidapi.com/sunandmoon/api/email-snitch/,2021-11, sunandmoon ,Email Snitch,Email Snitch is the fast and easy way to validate email addresses.,,,
https://rapidapi.com/emacostanzopro/api/alfa1/,2021-11, Emamuele Costanzo ,alfa,beta,,,
https://rapidapi.com/Warmy/api/warmy-email-channel-reliable/,2021-11, Warmy ,Warmy - Email Channel Reliable,Auto all-in-one tool for email deliverability to make your Email Channel Reliable,,,
https://rapidapi.com/aleftingenri/api/bot16/,2021-11, Erik ,BOT,For TG Bot,,,
https://rapidapi.com/zilinskivan/api/20fix/,2023-06, IZI ,20fix,"20fix.com | Email Marketing Platform Email delivery service that you can rely on. Responsive, highly compatible, and nicely integrated templates. Send emails more efficiently and with better results.",,,
https://rapidapi.com/outscraper-inc-outscraper-inc-default/api/emails-verifier/,2022-11, Outscraper API ,Emails Verifier,Allows verifying email addresses. Checks if emails are deliverable.,,,
https://rapidapi.com/llg/api/email-and-list-validation/,2023-01, llg ,Email and List Validation,"Verify single and multiple emails, lists & reverify them if needed after time!",,,
https://rapidapi.com/tfuture/api/disposable-email-detect/,2021-11, Tom ,Disposable Email Detect,Check if domains are disposable.,,,
https://rapidapi.com/jormshop/api/fake-email/,2023-11, JOR ,Fake Email,"Temporary Disposable E-mail, fast and easy API.",,,
https://rapidapi.com/info-4Yu4c-NI-Ht/api/verify-emails/,2021-11, Procommun Team ,Verify Emails,"Simple REST API measuring email deliverability and quality. Get rid of spam traps, hard bounces, disposable or catch-all emails without breaking your budget.",,,
https://rapidapi.com/fyhao/api/email-validation8/,2021-11, fyhao ,Email Validation,mailbox/MX verification disposable address verification RFC grammar rule check,,,
https://rapidapi.com/microbrands/api/email-address-verification/,2021-11, microbrands ,Email Address Verification,Test deliverability of an email address and see if it bounces or not. Detect invalid or non-operational mailboxes. Website: https://www.mailexists.com/,,,
https://rapidapi.com/fortulyapps-AZCVQJEOs03/api/email-validator-api1/,2023-01, David Fortuly ,Email Validator API,Validate if an email exists in real time. Prevent your emails from being rejected due to invalid emails. This API is useful to validate an email registration and also when you are sending marketing emails (to prevent bouncing emails).,,,
https://rapidapi.com/YassirSalama/api/valid-email-checker1/,2023-02, YassirSalama ,Valid Email Checker,"Check Valid Email Syntax, Good for Marketing Purposes.",,,
https://rapidapi.com/benjaminb139/api/email-checker17/,2022-11, Ben ,Email Checker,"Verify that emails are valid or not, this includes validating the email itself, but also its host (e.g. hotmail.com), aswell as checking if they're temporary/disposable.",,,
https://rapidapi.com/igorsoa/api/deep-email/,2021-11, igorsoa ,Deep Email,Email Validation Service. Use our email validation API to increase your email marketing campaigns.,,,
https://rapidapi.com/vincent-lab-vincent-lab-default/api/email-verifier8/,2021-11, Vincent Lab ,Email Verifier,"A basic email verifier that can check your email addresses for disposable email addresses, role-based email addresses, spammer domains, and you also get an email quality score (beta)",,,
https://rapidapi.com/bigdatacloud-pty-ltd-bigdatacloud-pty-ltd-default/api/email-address-verification1/,2022-11, BigDataCloud Pty Ltd ,Email Address Verification,This API carries out various in-depth email address verification checks and returns multiple check report.,,,
https://rapidapi.com/abhijeetlokhande1996/api/check-an-email-is-disposable-or-not/,2023-01, Abhijeet Lokhande ,Check an email is disposable or not,This email checks validity and disposability,,,
https://rapidapi.com/samuelgill/api/email-verify4/,2023-03, Samuel Gill ,Email Verify,Email Verify API will help you validate your email and tells if it has a valid inbox or not. It also tells if it is a disposable email.,,,
https://rapidapi.com/proweblook-proweblook-default/api/email-checker15/,2023-08, proweblook ,Email checker,check email whether it is valid or not Get your API Key from https://proweblook.com,,,
https://rapidapi.com/manikchandrabiswas72/api/email-validator30/,2022-11, Manik Chandra Biswas ,Email-Validator,Check the email if valid or not,,,
