API链接,Update_Time,Author,API名称,API描述,API Popularity,API Latency,API Service Level
https://rapidapi.com/datasmithneef/api/email-validation-activ-user-api/,2023-02, datasmith-neef ,"Email Validation Activ User , API","This API accepts a POST request containing an email address, validates the email format using regular expressions, and checks if the email can be delivered to an active recipient by performing a DNS lookup for the email domain's MX records and connecting to the recipient's SMTP server. The API then returns a JSON response indicating whether the email is valid and can be delivered.",,,
https://rapidapi.com/purvanshparmar15/api/temp-mail-blocker/,2021-11, purvansh parmar ,Temp Mail Blocker,"Backed by a database of over 38 000 throwable email domains. This will be very helpful when you have to contact your users and you want to avoid errors causing lack of communication or want to block ""spamboxes"".",,,
https://rapidapi.com/campaignkit-campaignkit-default/api/campaignkit-email-validation/,2021-11, CampaignKit ,CampaignKit Email Validation,"Verify Email addresses for existence and deliverability. Includes domain (mx) checks, disposable email address detection, quality scoring.",,,
https://rapidapi.com/pauldnorth/api/spam-email-detection1/,2022-11, Paul North ,Spam Email Detection,"A machine learning API that can detect if the contents of any message is spam. It will work for Email, SMS, Blog Posts etc",,,
https://rapidapi.com/santrarahul7070/api/disposable-email-checker2/,2023-01, Rahul Santra ,Disposable Email Checker,Email Validation Service.check if a certain e-mail address is valid. Is it a valid domain? Is the e-mail a temporary/disposable e-mail? Our API contain 100k disposable email domains and give most valid email,,,
https://rapidapi.com/StableAPI/api/mailboxvalidator-com/,2021-11, StableAPI ,MailboxValidator.com,Secure and reliable email validation service to check for invalid email addresses.,,,
https://rapidapi.com/outscraper-inc-outscraper-inc-default/api/emails-validator/,2022-11, Outscraper API ,Emails Validator,Allows validating email addresses. Checks if emails are deliverable.,,,
https://rapidapi.com/dimas/api/Postmark/,2021-11, Dmitry Shumytskyi ,Postmark,Postmark helps deliver and track transactional emails for web applications.,4.8,"127,281 ms",0%
https://rapidapi.com/zakutynsky/api/Mailjet/,2021-11, Igor Zakutynsky ,Mailjet,The complete solution to power your transactional email.,,,
https://rapidapi.com/raygorodskij/api/Trumail/,2021-11, Denis Raygorodskij ,Trumail,Prevent bounced emails and low-quality users with FREE professional grade email verification.,,,
https://rapidapi.com/stefan.skliarov/api/SlikAi/,2021-11, Stefan Skliarov ,SlikAi,Find and verify email addresses.,4.5,"127,225 ms",0%
https://rapidapi.com/zakutynsky/api/MailGun/,2021-11, Igor Zakutynsky ,MailGun,"Send, validate, receive and track emails.",4.6,"127,274 ms",0%
https://rapidapi.com/z51biz/api/verify-email2/,2021-11, Joseph benguira ,Verify Email,"Check if email really exist, this API will also inform you if the email is a catchall address",,,
https://rapidapi.com/eliottraoult/api/company-email-format-finder/,2022-11, Eliott Raoult ,Company Email Format Finder,Find Professional Email Formats easily! We help you increase your deliverability for your cold emailing campaigns.,,,
https://rapidapi.com/jabedbd/api/email-validation4/,2022-11, Creefty ,Email Validation,A Very simple to to check if the email deliverable for sending mail.,,,
https://rapidapi.com/raygorodskij/api/ContextIO/,2021-11, Denis Raygorodskij ,ContextIO,"Context.IO is a modern, scalable email API that brings IMAP into the 21st century.",4.2,"127,184 ms",0%
https://rapidapi.com/stefan.skliarov/api/OutlookMail/,2021-11, Stefan Skliarov ,OutlookMail,"OutlookMail, send emails and manage folders.",,,
https://rapidapi.com/stefan.skliarov/api/Gmail/,2021-11, Stefan Skliarov ,Gmail,Create a simple app that makes requests to the Gmail API in just 5 to 10 minutes.,4.1,"127,244 ms",0%
https://rapidapi.com/alessioscalzo2303/api/email-validation26/,2023-10, Alessio Scalzo ,Email Validation,An API to validate an email address,1.8,"5,432 ms",100%
https://rapidapi.com/cheapapicom/api/email-validator23/,2021-11, Cheap-api.com ,Email Validator,"check Email address for existing and validate with dns ping ,check mx records and send confirmation. if domain is valid then check email address for existing",,,
https://rapidapi.com/z51biz/api/lead-finder-find-email-address-of-anyone/,2021-11, Joseph benguira ,Lead Finder - Find email address of anyone,We use AI to find the professional email address of the people you want to get in touch with.,,,
https://rapidapi.com/verimail/api/verimail/,2021-11, Admin ,Verimail,"Validate email addresses, correct typos and filter out disposable addresses.",0.0,569 ms,100%
https://rapidapi.com/mailrecipe/api/mailrecipe/,2021-11, Mailrecipe ,Mailrecipe,Send mass email without flooding your users. This limits the number of email your user receives to 1 per day.,,,
https://rapidapi.com/debounceio/api/debounce-email-validation/,2021-11, DeBounce ,DeBounce Email Validation,"The DeBounce email validation and verification API returns JSON data and supports HTTP methods to validate email addresses in real time. DeBounce validates DNS, detects disposable addresses, detects misspelled domains, verifies syntaxes, detects temporary availability, detects graylist, and checks SMTP connection and availability.",,,
https://rapidapi.com/fapi/api/fapimail/,2021-11, FairestAPI ,FapiMail,Simple REST API to send emails,0.0,9 ms,0%
https://rapidapi.com/emailhippo/api/disposable-email-address-detector-basic/,2021-11, Email Hippo ,Disposable Email Address Detector (Basic),DEA detector API for list maintained @ https://github.com/wesbos/burner-email-providers,,,
https://rapidapi.com/MyEmailVerifier/api/myemailverifier1/,2021-11, MyEmailVerifier ,MyEmailVerifier,"When it comes to email verification, email validation, or email checker at competitive price, we're considered a head specialist for good reasons. With MyEmailVerifier, bounces-whether hard or soft-will become a thing of the past. The verdict is a free and effortless workflow. It's that simple!",,,
https://rapidapi.com/aviation1988/api/mass-email-sending-api/,2023-02, Useful API ,Mass Email Sending API,"This API allows you to send an email to a list of recipients by providing a file path containing the email addresses, subject, body, sender, and mail server credentials. The API checks for valid email addresses and skips any invalid email addresses before sending the email.",,,
https://rapidapi.com/samer87/api/hotya-verify/,2021-11, samer ,HOTYA Verify,Verify Hotmil and Yahoo Mail,,,
https://rapidapi.com/cognitivecamp-cognitivecamp-default/api/email-utilities/,2021-11, CognitiveCamp ,Email Utilities,API to validate email and normalize email,0.0,992 ms,100%
https://rapidapi.com/keypressingmonkey/api/tempemailchecker/,2021-11, Keypressing Monkey ,tempEmailChecker,This API gives you true/false on whether an email address comes from a known provider of spam / temporary email addresses.,,,
https://rapidapi.com/zandora/api/embounce/,2023-01, Mohammed Musthafa A ,Embounce,Embounce is an email validator API that helps to validate your email list for the best mail delivery and Return on Investment.,,,
https://rapidapi.com/paulpriti877/api/text-analyzer1/,2021-11, priti paul ,text analyzer,it analyzes every test.,,,
https://rapidapi.com/LASALVADOR/api/contact-us1/,2021-11, LASALVADOR ,Contact us,Contact us API Provider,,,
https://rapidapi.com/gautam.er.menaria/api/email-validator21/,2021-11, gautam.er.menaria ,Email Validator,This api is used to check that email id exists or not.,,,
https://rapidapi.com/gkipouros/api/text2emailaddresses/,2021-11, Giannis Kipouros ,Text2EmailAddresses,Extract email addresses from a text or HTML document,,,
https://rapidapi.com/crypto-compass-crypto-compass-default/api/mailer4/,2021-11, Crypto Compass ,Mailer,API for sending emails,,,
https://rapidapi.com/sujalmakkar/api/anonmyous-mail-sender/,2022-11, sujalmakkar ,anonmyous mail sender,send mail to anyone anonmyously. Only receiver's mail is required,0.0,275 ms,0%
https://rapidapi.com/nawarkhede/api/truemail/,2021-11, Nishant ,Truemail,An API to find out email is true,,,
https://rapidapi.com/dadeygarcia4392/api/disposable-mail/,2021-11, Dadey Garcia ,Disposable MAIL,The temp mail address to keep your original email safe. The disposable temporary email platform provides fleeting email addresses.,,,
https://rapidapi.com/WhoolefyAPI/api/email-validator12/,2021-11, WhoolefyAPI ,Email Validator,Validate email addresses,,,
https://rapidapi.com/toastyapi-toastyapi-default/api/verify-email-inbox-exists/,2023-11, PowerAPIs ,Verify Email Inbox Exists,"Send us an e-mail address and we'll check if it actually exists or not. This API endpoint is extremely useful to maintain a clean database of email leads, check emails addresses before sending out emails to ensure deliverability and avoiding getting penalised for high bounce rates.",,,
https://rapidapi.com/dootechfr/api/disposable-email-checker4/,2023-08, dootechfr ,Disposable Email Checker,"Are you tired of dealing with disposable or temporary email addresses in your applications? Our Disposable Email Checker API is the perfect solution for you! With this powerful tool, you can easily verify whether an email address is from a disposable or temporary domain.",0.0,"1,926 ms",0%
https://rapidapi.com/deocoten/api/mail-temple/,2021-11, Yotube ,Mail Temple,temporary mail,0.0,189 ms,100%
https://rapidapi.com/newhorizons-newhorizons-default/api/smtp-e-mail-sender/,2023-05, New Horizons ,SMTP e-Mail Sender,Send e-mails with an API call,0.0,250 ms,0%
https://rapidapi.com/andero-VDilSNebN/api/email-validation22/,2023-05, Andero Av ,Email Validation,"This API allows you to validate single and batch emails using various checks including Regex, MX records, Typo, Disposable and SMTP. This is useful for verifying the legitimacy and deliverability of an email address.",,,
https://rapidapi.com/belchiorarkad-FqvHs2EDOtP/api/email-finder3/,2022-11, Pinto Studio ,Email Finder,This API returns a collection of emails from any domain on the internet...,0.0,307 ms,0%
https://rapidapi.com/clearalist-clearalist/api/clearalist/,2021-11, Clearalist ,Clearalist,Clearalist's Email Verification service to improve your email marketing campaign results! Remove invalid email addresses from your list using our email validation system to prevent email bounces and improve your email sending reputation.,,,
https://rapidapi.com/jwc-tech-jwc-tech-default/api/email-validation18/,2023-11, JWC Tech ,Email Validation,"Validates email on strick requirments. check for proper format, check valid DSN, check against database of disposable email domains.",0.0,54 ms,96%
https://rapidapi.com/chandl/api/advanced-email-validator/,2021-11, chandl ,Advanced Email Validator,An advanced Email Address validation API,,,
https://rapidapi.com/kmozdev-kmozdev-default/api/bulkus-email-verification-service/,2022-11, DUP INC ,Bulkus (email verification service),"Bulkus is email verification service: check if an email address is valid, really exists and can accept mails, plus a lot more!",,,
https://rapidapi.com/kgsdevbusiness/api/email-validator9/,2021-11, Ahmad Ghofur ,Email Validator,Clean your email list now!,,,
https://rapidapi.com/azeno-azeno-default/api/sentemail/,2023-07, Azeno ,SentEmail,Our email service API utilizes the SMTP protocol for seamless and efficient email communication.,0.0,"90,236 ms",0%
https://rapidapi.com/kalprajsolutions/api/emails-checker/,2021-11, Kalpraj Solutions ,Emails Checker,Emails Checker offers a simple REST-based JSON API to check and verify email addresses right at the point of entry into your system.,,,
https://rapidapi.com/smart-api-center-smart-api-center-default/api/verify-email7/,2023-02, Smart API Center ,Verify Email,"This API provides a solution for email validation and mail server availability check. The API accepts an email address as input and returns a response indicating whether the email address is valid and the status of the email server. The response can be used to confirm the validity of an email address before sending an email or to check if an email server is functioning properly. This API helps to ensure the accuracy and deliverability of emails, making it a useful tool for businesses and orga...",0.1,986 ms,100%
https://rapidapi.com/the-api-arena-the-api-arena-default/api/email-validator16/,2021-11, The API Arena ,Email validator,Easily validate a single email or bulk emails. Check if it has a valid domain or is it a disposable email domain.,0.0,20 ms,0%
https://rapidapi.com/firebese-firebese-default/api/send-mail-serverless/,2023-05, Firebese ,Send Mail Serverless,"Welcome to Send Mail Serverless API! This API is RESTful, fully featured, and easy to integrate with any solution Send Mail Serverless API, is an easy-to-use platform that allows you to send emails from hundreds of servers across the globe. Our API is designed to be flexible, reliable, and secure, providing you with everything you need to deliver messages to your recipients quickly and efficiently. One of our key features is support for DomainKeys Identified Mail (DKIM) encryption, which al...",0.0,"1,618 ms",0%
https://rapidapi.com/polygonzugverfahren-HYfENg2nMTg/api/smtp-email/,2021-11, Yo Lo ,SMTP EMAIL,send emails with your own email providers smtp,,,
https://rapidapi.com/WhoolefyAPI/api/email-search12/,2021-11, WhoolefyAPI ,Email Search,Email Search,,,
https://rapidapi.com/rabahdjebbes6-VpFXFzqdF1R/api/pyunity-email-marketing/,2022-11, Rabah Djebbes ,PyUnity - Email Marketing,"PyUnity is a powerful email marketing API that allows you to reach your customers instantly, easily, and effectively. Our service is built on the latest-generation technologies and enabled by our experienced team of developers. The PyUnity API delivers massive scalability, reliable architecture, and adaptivity to your needs.",0.0,24 ms,0%
https://rapidapi.com/kashyap3111992/api/email-analyzer/,2021-11, Kashyap Kaki ,Email Analyzer,"Validates emails based on regex, common typos, disposable email blacklists, DNS records.",,,
https://rapidapi.com/beshoo/api/email-validation10/,2021-11, beshoo ,Email Validation,"Prevent bounced emails with world-class email verification with the Highest Accuracy Possible, The API actually connects to the mail server and checks in real-time if the email exists. We check for MTA, MX records, SMTP, hard bounces, catch-all, disposable email, role-based accounts...etc",,,
https://rapidapi.com/ebadhafeez0504-S8xGol9KS2w/api/email-scraper3/,2022-11, Ebad Hafeez ,Email Scraper,Scrape emails from any website,,,
https://rapidapi.com/alifarukm/api/fast-temp-mail/,2022-11, alifarukm ,Fast Temp Mail,Simple use temp mail api more than 50 domains. Fast response and cheap. Messages not delete in one year if you don't want.,0.0,391 ms,100%
https://rapidapi.com/emailscore-emailscore-default/api/emailscore/,2021-11, EmailScore ,EmailScore,fastest check email service,,,
https://rapidapi.com/sutharapi1-sutharapi-default/api/s-email-validator1/,2023-02, SutharAPI ,S Email Validator,Validate email addresses in real-time. Make sure a mailbox really exist. So you can avoid fake/invalid users on your database.,,,
https://rapidapi.com/orangepeel-orangepeel-default/api/email-delivery-checker/,2021-11, OrangePeel ,Email Delivery Checker,"Verifies if email address are valid and can be delivered. Check email format, host name exist, catch all emails and if the host can accept the email address.",,,
https://rapidapi.com/juanpellantada/api/simplemailsender/,2021-11, Juan Pedro Llantada Lopez ,SimpleMailSender,Its simple as that just send message and a delivery email and thats all,0.0,"127,320 ms",0%
https://rapidapi.com/rapidtestmailsender/api/simple-mail-sending/,2022-11, NodeMail ,Simple mail sending,"An API is used to send mail with subject, to address and some message text.",0.0,536 ms,0%
https://rapidapi.com/adityapundir2k/api/e-mailer-420/,2022-11, Aditya Pundir ,e-mailer-420,"e-mailer-420 gives you the remarkable ability to send emails dynamically. You need to enable ""less secure apps"" on your sender email and you'll be good to go.",,,
https://rapidapi.com/swift-software-and-services-swift-software-and-services-default/api/swift-email-validation/,2021-11, Swift Software and Services ,Swift Email Validation,Swift email validation API is a RESTful API that allows consumers and developers to verify or scrub email lists thereby enabling users to maintain a clean mailing list and reduce bounces which can significantly improve sender reputation.,,,
https://rapidapi.com/rahulchavan182/api/email-validator11/,2021-11, Rahul ,Email Validator,"Email Validator is a free, simple, and powerful WebAPI offering instant email address validation & verification via syntax checks, typo, and spelling checks, SMTP checks, free and disposable provider filtering, and much more. It's pursuing the goal of assisting developers and businesses in fighting fraudulent users and increasing success rates of email campaigns.",0.0,165 ms,0%
https://rapidapi.com/mahajanakshay488/api/mail-sender4/,2021-11, Akshay Mahajan ,Mail Sender,An API sends a mail with a your Gmail account.,0.0,535 ms,100%
https://rapidapi.com/metaapi-metaapi-default/api/metaapi-emailfinder/,2023-06, MetaAPI ,MetaAPI EmailFinder,Find out a person's email address,,,
https://rapidapi.com/area123flex-iRcVLSt3Dia/api/email-checker13/,2021-11, Capo ,Email Checker,"Check emails for correct Syntax, DNS A/MX entries and potential temporary/fake usage with DB checks of temp/fake email domain lists.",,,
https://rapidapi.com/monapi.io/api/email-verification-with-threat-detection/,2021-11, monapi.io ,Email Verification with Threat Detection,Complete Email Verification API with Threat Detection. Verify the deliverability of email addresses with our comprehensive API.,0.0,471 ms,0%
https://rapidapi.com/mike.stevens.marcomrobot/api/marcom-robot-email-validation-bot/,2021-11, MARCOM Robot ,MARCOM Robot - Email Validation Bot,"MARCOM Robot - https://www.marcomrobot.com/. Email Validation Bot performs a series of real-time checks for each email address such as MX record check, SMTP record check, RFC syntax check and many more.",0.0,"9,419 ms",92%
https://rapidapi.com/pouria1379sobatdar/api/account-verifyer/,2021-11, پوریا ثبات دار ,account verifyer,to verify Instagram account,,,
https://rapidapi.com/yuksbg/api/temporary-email/,2021-11, yuksbg ,Temporary Email,Disposable Temporary Email for QA and etc.,,,
https://rapidapi.com/datamotion/api/emailqualityplus/,2021-11, datamotion ,EmailQualityPlus,Email Validation,,,
https://rapidapi.com/matingh/api/matinapi/,2021-11, matingh ,MatinApi,its for matin,,,
https://rapidapi.com/mcolomer/api/uproc-email-verification/,2021-11, Miquel Colomer ,UProc - Email verification,Check any email,,,
https://rapidapi.com/hamada90000009/api/kora/,2021-11, Hamada Sayed ,kora,sport,,,
https://rapidapi.com/jackmahoney/api/mailslurp-email-testing/,2022-11, mailslurp ,MailSlurp Email Testing,Email sandbox testing API.,0.1,701 ms,100%
https://rapidapi.com/volodimir.kudriachenko/api/Mailboxlayer/,2021-11, Volodimir Kudriachenko ,Mailboxlayer,Validate the veracity of email addresses.,0.0,"127,228 ms",0%
https://rapidapi.com/guccimane2q34/api/tempmail22/,2021-11, dgfd ,TempMail,api),0.0,35 ms,100%
https://rapidapi.com/b6385575/api/gfugghio/,2021-11, vgsdg dsgsfgsdfg ,gfugghio,emails,,,
https://rapidapi.com/ishankaura/api/ishan1/,2021-11, ishankaura ,Ishan,Ishan,0.0,36 ms,100%
https://rapidapi.com/lordjohnex/api/dagogo/,2021-11, lordjohnex ,Dagogo,verifier,,,
https://rapidapi.com/tran-dung-tran-dung-default/api/tvd/,2021-11, tran dung ,tvd,tvd,,,
https://rapidapi.com/lvy2003-lvy2003-default/api/test6845/,2021-11, lvy2003 ,Test,Test Mail,,,
https://rapidapi.com/devicelabdhl/api/emaillist/,2021-11, derek ,emailList,get list of emails,,,
https://rapidapi.com/ishankaura/api/ishan11/,2021-11, ishankaura ,ishan1,ishan1,,,
https://rapidapi.com/zahraupwork/api/email-verifier-completely-free/,2022-11, CUF Services ,Email Verifier - Completely Free,CUF Services provide a completely free email verifier API for developers to use on startups and open source systems.,0.1,"100,264 ms",0%
https://rapidapi.com/abirbhattacharya82/api/abir82-otp-service/,2022-11, Abir Bhattacharya ,Abir82 OTP Service,Abir82 OTP service is a free API integrated with Gmail which enables you to send OTPs to your customer. Follow the guidelines to send OTPs without any problem.,0.0,563 ms,0%
https://rapidapi.com/alen88/api/email-search13/,2021-11, alen88 ,Email Search,Verify Email,,,
https://rapidapi.com/neurocode-neurocode-default/api/gettestmail/,2023-05, neurocode ,GetTestMail,Temporary emails in code,0.0,51 ms,100%
https://rapidapi.com/jackyuchang-jackyuchang-default/api/myapimail/,2021-11, JackyuChang ,MyAPImail,mail,,,
https://rapidapi.com/kloudless-kloudless-default/api/kloudless-email/,2021-11, Kloudless ,Kloudless Email,"One API for Any Email Inbox. Code once and connect your application to Gmail, Microsoft Outlook, Office 365, Exchange, IMAP, and SMTP.",,,
https://rapidapi.com/pouria1379sobatdar/api/rapidseen/,2021-11, پوریا ثبات دار ,rapidseen,haminjory,,,
https://rapidapi.com/nyenderid-nyenderid-default/api/amazon53/,2021-11, NyenderID ,Amazon53,Amazon,,,
https://rapidapi.com/vikasgupta00/api/test-kibana/,2021-11, Vikas ,test-kibana,test,,,
https://rapidapi.com/zunfuyuzora/api/testinga/,2022-11, zunfuyuzora ,TestingA,Just Testing,,,
https://rapidapi.com/EmailJS/api/emailjs/,2021-11, EmailJS ,EmailJS,Send Email API. No server code needed. Focus on things that matter!,0.1,"1,995 ms",100%
https://rapidapi.com/abstract-api-abstract-api-default/api/email-validation-and-verification1/,2021-11, Abstract API ,Email Validation and Verification,Improve your delivery rate and clean your email lists with Abstract's industry-leading email verification API,,,
https://rapidapi.com/salmanhossainxyt/api/email-validator45/,2023-03, Salman Hossain ,Email Validator,This API gets email and return Json is validate or not,,,
https://rapidapi.com/outscraper-inc-outscraper-inc-default/api/domain-emails-and-contacts/,2022-11, Outscraper API ,Domain Emails And Contacts,"Get email addresses, phones, and social links from the domains that you are interested in.",,,
https://rapidapi.com/valdiemaz/api/email-check2/,2022-11, valdiemaz ,Email check,Check email validation,,,
https://rapidapi.com/vigilant-wave-limited-vigilant-wave-limited-default/api/verify-email-now/,2023-08, Vigilant Wave Limited ,Verify Email Now,Verify Email Now reduces your bounce rate to almost zero by getting rid of ALL undeliverable emails.,,,
