API链接,Update_Time,Author,API名称,API描述,API Popularity,API Latency,API Service Level
https://rapidapi.com/dkinley/api/crypto-api/,2021-11, dkinley ,Crypto-API,"Dir. Kadata gives a single source updated directory for current top cryptocurrency news stories in the headlines around the world, provided to you via one API.",,,
https://rapidapi.com/stevemacharia/api/generate-erc20/,2021-11, Blockchain APIs ,generate-erc20,The fastest way to generate your own ERC20 tokens on Matic Network,,,
https://rapidapi.com/raygorodskij/api/Paybook/,2021-11, Denis Raygorodskij ,Paybook,Paybook is a hub that connects people with their financial world!,4.0,"127,292 ms",0%
https://rapidapi.com/raygorodskij/api/ICOWatchList/,2021-11, Denis Raygorodskij ,ICOWatchList,Discover the best ICO (initial coin offering) opportunities.,,,
https://rapidapi.com/zakutynsky/api/Quandl/,2021-11, Igor Zakutynsky ,Quandl,"Quandl has a vast collection of free and open data collected from a variety of organizations: central banks, governments, multinational organizations and more.",4.4,"127,212 ms",0%
https://rapidapi.com/volodimir.kudriachenko/api/Currencylayer/,2021-11, Volodimir Kudriachenko ,Currencylayer,Retrieve currency conversions and global exchange rates.,4.3,"127,262 ms",0%
https://rapidapi.com/stefan.skliarov/api/Vatlayer/,2021-11, Stefan Skliarov ,Vatlayer,Validate EU VAT (value added tax) numbers and get prices.,,,
https://rapidapi.com/alvaromasilva/api/currency-converter-api2/,2023-06, Álvaro Silva ,Currency Converter API,API to convert currency taking into consideration actual exchange rates,,,
https://rapidapi.com/braskam-technology-braskam-technology-default/api/stocks73/,2023-03, Braskam Technology ,Stocks,Get the the stocks informations using a REST API simple and free.,2.0,"8,267 ms",38%
https://rapidapi.com/brokingtools/api/mt5-manager-web/,2021-11, Meta Connect ,MT5 Manager Web,Integrate your MT5 Manager features in any application,0.1,519 ms,100%
https://rapidapi.com/kirs26/api/financecalc/,2021-11, kirs26 ,FinanceCalc,"Implements common financial calculations: Amortization, CAGR, CI, DF, FV, IRR, XIRR, LR, NPV, PP, PV, PI, ROI, R72, WACC, PMT, Inflation-adjusted Return",,,
https://rapidapi.com/atilcock/api/bank-converter/,2021-11, Alex Tilcock ,Bank Converter,"An API to convert between, extract and parse numerous common generic and bank specific financial message formats.",,,
https://rapidapi.com/deep_var35/api/mutual-fund-nav-info-and-historic-data/,2021-11, Deepak Varshney ,Mutual Fund Nav Info and Historic Data,This API provides latest NAV as well as Historic Data of Mutual Fund Schemes with response time in milliseconds. 1. Get NAV based on scheme Codes and dates - multiple entries supported 2. Get Unique Schemes for scheme suggestion API 3. Get latest nav based on schemes Codes - multiple scheme codes supported. 4. Latest business News,,,
https://rapidapi.com/zaininijar7610-JE6upX1gijr/api/currency-converter112/,2022-11, Zaini Nijar ,Currency Converter,A simple API that allows you to exchange a specific amount from one currency to another,,,
https://rapidapi.com/pfrodriguezj/api/loansimulator1/,2022-11, Pedro Felipe Rodriguez Jimenez ,LoanSimulator,Loan simulator,,,
https://rapidapi.com/sonu1000raw-IOO9OxyBlLr/api/stock-analytics-api/,2022-11, Sonu Kumar ,Stock Analytics API,Your one-stop place for all the stock-related analytics.,,,
https://rapidapi.com/domus-semo-sancus-domus-semo-sancus-default/api/news-media-screening/,2021-11, Domus Semo Sancus ,News Media Screening,News Media Screening enables simultaneous searching of millions of global news sources for a subject-of-interest.,,,
https://rapidapi.com/217patrick.ck/api/coiner/,2021-11, patrick bateman ,coiner,"An API showing all the latest coin news on Alltop, Coindesk, Finance.Yahoo & Bitcoin",,,
https://rapidapi.com/xTiron/api/crypto-wallet-address-validator/,2021-11, Florin Tiron ,Crypto Wallet Address Validator,Validator for crypto wallets address of Bitcoin and other top altcoins.,0.1,691 ms,0%
https://rapidapi.com/reverie-language-technologies-reverie-language-technologies-default/api/transliteration-for-banking-domain/,2021-11, Reverie Language Technologies ,Transliteration for Banking domain,"API to convert Bank name & address, banking terminologies, acronyms, customer name and address, anything related to the Banking sector.",,,
https://rapidapi.com/blockchaindevguy-aYhGoMzUG2w/api/crypto-wallet/,2021-11, Dev Guy ,Crypto Wallet,"A REST API to access private keys, build crypto wallets, and broadcast transactions to the blockchain.",0.0,188 ms,100%
https://rapidapi.com/spendid-spendid-default/api/spendid/,2023-06, SPENDiD ,SPENDiD,,,,
https://rapidapi.com/Aspheria/api/economy-dashboard-live/,2021-11, Aspheria ,Economy Dashboard Live,An API showing all the lasted Economy News around the world.,,,
https://rapidapi.com/erichhohenstein/api/categorizador-de-transacciones-bancarias/,2021-11, Erich Hohenstein ,Categorizador de Transacciones Bancarias,Este API categoriza transacciones bancarias hechas con Tarjetas de Crédito o Débito.,,,
https://rapidapi.com/Diamondzminde/api/currency-converter48/,2022-11, Diamondzminde ,Currency Converter,Simple Curency exchager,,,
https://rapidapi.com/federico90pavan/api/financial-identifiers-ticker-cik-company-name/,2021-11, fred_pabh ,"Financial identifiers - ticker, cik, company name","This API offers access to central index key (CIK), ticker and legal name of a US corporation",,,
https://rapidapi.com/farhadrazzaghii/api/blockchainapi2/,2023-02, farhad razzaghi ,BlockChainAPI,"Generate Tron Wallet, Get Balance Of Wallet on Blockchain, Make Transaction (in development), Get Transaction Detail Base of the transaction hash.",0.0,181 ms,100%
https://rapidapi.com/rsverma3333/api/rsv-option-greeks-calculator/,2023-07, Ramesh Verma ,RSV Option Greeks Calculator,"An API to calculate options prices, Greeks and implied volatility using Black Scholes Model, Binomial Pricing Model, Black76 Model and Bjerksund Stensland model.",,,
https://rapidapi.com/schiffer-foundation-schiffer-foundation-default/api/iban-parser/,2021-11, Schiffer Foundation ,IBAN PARSER,Parses and validates IBANs,0.0,124 ms,0%
https://rapidapi.com/ExoWatts/api/bitcoin-wallet-generator2/,2022-11, ExoWatts ,Bitcoin Wallet Generator,Generate a bitcoin address and private key.,,,
https://rapidapi.com/emir12/api/meme-coins-crypto/,2023-05, CoinSpot ,😎 Meme Coins Crypto 🔥🚀,"Browse Fresh Meme Coins in categories: 24H gainer, New born, Signalled, New listings, Traded, Popular, Daily Top. Filter by: BNB, ETH, AVAX, Polygon, Fantom, Cronos, DogeChain",0.0,163 ms,100%
https://rapidapi.com/adhip/api/trustcheckr-phone-risk-score-india/,2021-11, Adhip Ramesh ,TrustCheckr Phone Risk Score - India,TrustCheckr Phone Risk API helps you to understand the risk associated with the phone number. Risk score will help you onboard customers faster with lowest fraud rates,0.0,385 ms,100%
https://rapidapi.com/kidddevs/api/calcx-loan-calculator/,2023-09, Dakidarts ,CalcX - Loan Calculator,"The CalcX Loan Cost Calculator is a simple API that calculates the cost of a loan and generates an amortization schedule. The API takes in inputs like loan amount, interest rate, and repayment term, and generates estimates of the total cost of the loan over time.",0.0,492 ms,100%
https://rapidapi.com/nicksimonkratzke-xqUg8mV9CWG/api/girocode2/,2021-11, Nick Kratzke ,Girocode,Generate Girocode for bank transfers easily,0.0,312 ms,100%
https://rapidapi.com/RecNove/api/currency-converter81/,2022-11, RecNove ,Currency Converter,A Simple API That allow you to exchange a specific amount from one currency to another.,,,
https://rapidapi.com/1pkgv9/api/cci/,2021-11, 1pkgv9 ,cci,core cyclos implementation for professionals.,,,
https://rapidapi.com/crypto-compass-crypto-compass-default/api/crypto-compass/,2021-11, Crypto Compass ,Crypto Compass,"BRANDNEW API for trading bots and financial analytic systems based on news, listings on the biggest exchanges, and inter-exchange arbitrage.",0.1,"127,282 ms",0%
https://rapidapi.com/Deadpool2000/api/fincalculator/,2023-03, D2k ,FinCalculator,"A simple API for financial calculations - Fixed Deposit, Recurring Deposit, Interest Rate",,,
https://rapidapi.com/wil0814/api/currency-converters1/,2022-11, wil0814 ,currency converters,A simple API that allow you to excahnge a specific amount from one currency to anothet.,,,
https://rapidapi.com/AurelTBE/api/trending-cryptos/,2021-11, AurelTBE ,Trending Cryptos,"This API lets you get the latest data on the trending cryptocurrencies (current value, market cap, and much more) in JSON format",,,
https://rapidapi.com/jamezmca/api/index-stock-data/,2021-11, jamezmca ,Index Stock Data,Stock 365 day price history for all stocks within the S&P 500.,,,
https://rapidapi.com/namalultramediacreation/api/convert-currency-api/,2023-01, Namal Liyanage ,Convert Currency API,"Currency rate converter is an easy-to-integrate API that provides your web visitors, international customers, and app users with accurate rates that they can use to convert major currencies from all over the world.",,,
https://rapidapi.com/willtejeda/api/crystal-ball-financial-predictor/,2022-11, willtejeda ,Crystal Ball Financial Predictor,"This tool predicts a few days into the future for any given stock or crypocurrency. Disclaimer: This should be used for educational purposes only. Predictions are NOT certain, but can be helpful in understanding potential trends.",,,
https://rapidapi.com/RODAN/api/moroccan-dirham-mad-local-appelations/,2022-11, RODAN ,Moroccan Dirham MAD local appelations,"Mlyon, rial,frank,doro...",,,
https://rapidapi.com/idealspot-inc-idealspot-inc-default/api/idealspot-employment-salary-and-income/,2021-11, IdealSpot Inc ,"IdealSpot Employment, Salary, and Income","Directly access IdealSpot's location intelligence datasets to access Salary, Income, and Occupation data for a geo location's population. ![](https://www.google-analytics.com/collect?v=1&t=pageview&tid=UA-166301943-3&cid=fake&dh=rapid.com&dp=%2Fidealspot-employment-salary-and-income&dt=IdealSpot%20Employment%2C%20Salary%2C%20and%20Income =1x1)",0.0,659 ms,100%
https://rapidapi.com/kenshin579-dCJkBINoF/api/stock-api7/,2023-04, Frank Oh ,stock-api,Provide Stock API - Get Korean Gold Share - Get Stock Overview,0.0,566 ms,100%
https://rapidapi.com/marzecwojciech/api/race-chart-api/,2023-03, Wojciech Marzec ,Race Chart API,First API to create race chart,,,
https://rapidapi.com/msaquende/api/currency-converter54/,2022-11, Marcelino Saquende ,Currency Converter,A simple API that allows you to exchange a specific amount from one currency to another.,,,
https://rapidapi.com/dsdcode/api/ipo-stocks/,2021-11, Dsd ,IPO Stocks,Get all hot and trending public offering (IPO) or stock launch. This is a public offering in which shares of a company are sold to institutional investors and usually also retail (individual) investors.,,,
https://rapidapi.com/levyd01.addons/api/financial-tools-related-to-dividend-and-dividend-growth/,2021-11, David Levy ,Financial tools related to dividend and dividend growth,Calculates key dividend and dividend growth parameters for a selected security.,0.0,305 ms,100%
https://rapidapi.com/javascriptmastery/api/currency-converter36/,2022-11, javascriptmastery ,Currency Converter,A simple API that allows you to exchange a specific amount from one currency to another.,,,
https://rapidapi.com/iCodingLove/api/stocks-news/,2022-11, iCodingLove ,Stocks-News,This API provides news in the financial stock market.,,,
https://rapidapi.com/waherof29502/api/currency-converter72/,2022-11, waherof29502 ,Currency Converter,A simple API that allows you to exchange a specific amount from one currency to another,,,
https://rapidapi.com/marcopavanmp-R024fyPhqP6/api/tradingradar/,2023-08, Marco Pavan ,tradingradar,"Italy FTSE MIB real-time stocks press release, ratings, analyses and sentiment.",0.0,583 ms,100%
https://rapidapi.com/Drammaster/api/crypto-platform-releases/,2021-11, Drammaster ,Crypto-Platform-Releases,Get information on the latest announcements of new tokens arriving to exchange platforms!,,,
https://rapidapi.com/divyanshpal402-N8K_5DDPeZ/api/free-crypto-news/,2022-11, Divyansh Pal ,Free crypto news,Free crypto news from financial institutions.,,,
https://rapidapi.com/chrisjabdo/api/etherscan-erc20-top-movers/,2021-11, Chris Abdo ,Etherscan ERC20 Top Movers,"This API calls the Etherscan ERC20 Token Top Movers and displays the info in a clean and separated manner (price, volume, market cap, holders)",,,
https://rapidapi.com/coderslifesaver-_RqCKxSKhfc/api/coin-mc-analyser/,2021-11, david odoh ,Coin MC Analyser,This API shows you at least the top 100 cryptocurrencies and allows you to perform analysis on them. Enjoy!,0.0,387 ms,100%
https://rapidapi.com/ncewebapps/api/trade-signals/,2021-11, Ricardo Jose Aranha Wierzynski ,Trade Signals,This API shows a technical analysis on the most common pairs.,,,
https://rapidapi.com/Themindfactory/api/realtime-stock-quote/,2021-11, The Mind Factory ,Realtime Stock Quote,Fastest Realtime Stock Quote,0.0,102 ms,100%
https://rapidapi.com/ovinokurov/api/cryptocurrency-price-prediction-api/,2023-03, ovinokurov ,Cryptocurrency Price Prediction API,"The Cryptocurrency Price Prediction API is a machine learning and AI-powered platform designed to predict the future price of a specific cryptocurrency. The API allows users to specify the frequency and period of prediction and receive the predicted prices in the requested format. Furthermore, the platform offers a feature for users to retrieve a list of available cryptocurrencies. This API is a valuable tool for investors and traders seeking to make informed decisions based on cryptocurrency...",,,
https://rapidapi.com/darine0202/api/cion-prices-api/,2022-11, DAR. A. ,Cion Prices Api,An api showing current prices of coins,0.0,"360,073 ms",0%
https://rapidapi.com/deepakandeli/api/cams-report-generator/,2021-11, deepakandeli ,CAMS Report generator,An API to generate CAMS report,,,
https://rapidapi.com/ChuksJoshuaa/api/currency-converter131/,2022-11, ChuksJoshuaa ,Currency Converter,A simple API that allows you to exchanhge a specific amount from one currency to another.,,,
https://rapidapi.com/tp.glowacki/api/gold-to-currency/,2021-11, Damian G ,Gold To Currency,Api that converts gold price to choosen by IBAN currency for 1 gram and 1 ounce for choosen date.,,,
https://rapidapi.com/amehi4yus/api/currency-converter58/,2022-11, ame hi ,Currency Converter,A simple API that allows you to exchange a specific amount from one currency to another,,,
https://rapidapi.com/kesav75/api/stock-series-indicator-strategies/,2022-11, Kesavan Rajendran ,Stock Series Indicator Strategies,"API to get historical stock data, stocks with rsi and stochastics below and above threshold, technical indicators",,,
https://rapidapi.com/jeffersonshibuya/api/currency-converter98/,2022-11, jeffersonshibuya ,Currency Converter,A simple API that allows you to exchange a specific amout from one currency to another,,,
https://rapidapi.com/scienclick/api/intraday-stock-market-data/,2022-11, Zapwiser ,Intraday stock market data,"This API is the only intraday historical API available to the public that has very high intraday resolution since the year 2004 for 660 stocks. This should a provide a unique API for algorithmic trading developers to back-test their strategies. This API provides stock market data in 30 minutes and one hour interval. Also, SPX data is available in 1 hour, 30 minutes, 5 minutes and 1 minute resolution.",0.0,370 ms,0%
https://rapidapi.com/tcariuska/api/currency98/,2023-03, Thiago Cariuska ,Currency,real-time currency quotes,,,
https://rapidapi.com/benchmarkai/api/benchmarkai-52-week-forecaster-52-f-series/,2021-11, Benchmark.ai ,Benchmarkai 52 Week Forecaster 52 F Series,Benchmarkai 52 Week Forecaster 52F Series,,,
https://rapidapi.com/ExoWatts/api/currency-exchange-rates5/,2022-11, ExoWatts ,Currency Exchange Rates,Get live currency exchange rates and convert between currencies.,,,
https://rapidapi.com/MarketFluent/api/market-fluent-value-investing-research-uk/,2021-11, MarketFluent ,Market Fluent Value Investing Research UK,"Integrating Market Fluent's database into your own application is now easy! Its is ideal for investors looking for companies that meet specific criteria of value investing, based on the time-tested methods of Graham and Dodd. We provide high quality database, updated every 24 hours, contains over 4000 companies across Europe and North American. With more added all the time.",,,
https://rapidapi.com/bullquine/api/cotizacion-de-la-moneda/,2021-11, bullquine ,Cotizacion de la Moneda,Cotización de la moneda en tiempo real de Uruguay y Argentina.,,,
https://rapidapi.com/ntriantafillidis/api/all-about-crypto/,2021-11, Nick Triantafillidis ,All about Crypto,An api for news about crypto from around the world,,,
https://rapidapi.com/saasfusion-saasfusion-default/api/wallstreetwriter/,2023-07, SaasFusion ,WallStreetWriter,AI-Powered Financial Content Generation. Simply input a stock ticker and receive a short article incorporating recent stock price data and relevant news publications.,,,
https://rapidapi.com/xeqtter/api/currency-converter110/,2022-11, xeqtter ,Currency Converter,A simple API that allows you to exchange money from any currency to another.,0.0,832 ms,100%
https://rapidapi.com/dataiologist-dataiologist-default/api/tasi-to-json1/,2022-11, Dataiologist ,TASI To json,"Access TASI Sectors, Companies, Funds. Sukuk , Bounds in the main and numo market as json",,,
https://rapidapi.com/cemali.gencer/api/turkish-market-exchange-rates/,2021-11, Cemali Gencer ,Turkish Market Exchange Rates,an Api showing all the latest Turkish Market Exchange rates,,,
https://rapidapi.com/medmarwane/api/code-way1/,2022-11, medmarwane ,Code Way,A simple API that allows you to exchange a specific amount from a currency to another.,,,
https://rapidapi.com/f.frederico/api/financial-twitter-sentiment/,2021-11, Frederico Rocha ,Financial Twitter Sentiment,Real-time financial twitter sentiments for stocks,,,
https://rapidapi.com/ha_benantar/api/realtime-stock-market/,2021-11, ABDENNOUR BENANTAR ,Realtime Stock Market,Realtime stock& crypto market data for your Stock&Crypto market applications,,,
https://rapidapi.com/macIgy/api/world-country-finance-data/,2021-11, macIgy ,World Country Finance Data,The only API to access financial analytics of all countries in the world. Our data is regularly maintained.,,,
https://rapidapi.com/yoho4613/api/currency-converter186/,2022-11, PARK JIHO ,Currency Converter,This is a simple Currency Converter API,,,
https://rapidapi.com/ahsaeldin/api/economic-calendar2/,2022-11, MedH API ,Economic Calendar,The unofficial DailyFX economic calendar to explore key global events on the horizon that could subtly shift or substantially shake up the financial market.,,,
https://rapidapi.com/adamsalem10-PHLmxuLYHMB/api/strong-buy-stocks-live/,2021-11, adam salem ,Strong Buy Stocks Live,This API provides you with a selection of Strong Buy stocks from Trading View depending on the market,0.0,971 ms,100%
https://rapidapi.com/edward.ohemeng/api/ghana-income-tax-and-ssnit-calculator/,2021-11, Edward Osafo ,Ghana Income Tax And SSNIT Calculator,This API will calculate Ghana's income tax and SSNIT deductions.,,,
https://rapidapi.com/xdd741852963/api/currency-converter95/,2022-11, Ben Force ,Currency converter,Created from Paw,,,
https://rapidapi.com/doikuomola-EFSdGUEb4iO/api/new-currency-converter/,2022-11, David Ikuomola ,New Currency Converter,A simple API that allows you to exchange a simple amout from one currceny to another.,,,
https://rapidapi.com/MarketFluent/api/market-fluent-value-investing-research-usa/,2021-11, MarketFluent ,Market Fluent Value Investing Research USA,"Integrating Market Fluent's database into your own application is now easy! Its is ideal for investors looking for companies that meet specific criteria of value investing, based on the time-tested methods of Graham and Dodd. We provide high quality database, updated every 24 hours, contains over 4000 companies across Europe and North American. With more added all the time.",,,
https://rapidapi.com/wequity-wequity-default/api/negative-screening/,2021-11, Wequity ,Negative Screening,Check whether a company (or list of companies) is involved in a controversial sector through our data feed (API).,,,
https://rapidapi.com/oxinion/api/oxinion-finance/,2023-04, oxinion ,OXINION Finance,"Get financial data such as stock, ETFs and Cryptocurrencies, especially dividends history",,,
https://rapidapi.com/hhqqcc6872/api/api-news-project/,2022-11, Danny Huang ,api news project,get some news json data,,,
https://rapidapi.com/domus-semo-sancus-domus-semo-sancus-default/api/highrisk-check3/,2021-11, Domus Semo Sancus ,Highrisk Check,"High Risk Check enables simultaneous sanctions screening of over 1,800 global lists - including sanctions lists, persons in public life lists (PIPs), politically exposed persons lists (PEPs), and other high-risk lists, for name matches of subject-of-interests.",,,
https://rapidapi.com/pavankrishnanarne1999/api/apple_news_api/,2023-02, PavanKrishna Narne ,Apple_News_api,"Apple News API provides access to articles and content from leading news sources and magazines. The API offers a rich selection of high-quality, curated articles from top most trusted sources.",,,
https://rapidapi.com/donejeh/api/nigeria-bank-account-validation/,2023-10, donejeh ,Nigeria Bank Account validation,You can look up any bank account details in Nigeria using our free bank API in a few seconds to build applications faster.,,,
https://rapidapi.com/ryanmelikian777/api/unibit-ai/,2021-11, ryan ,UniBit AI,UniBit aggregates and analyzes financial events for thousands of companies,,,
https://rapidapi.com/Shrimpy/api/the-shrimpy-universal-crypto-exchange-interface/,2021-11, Shrimpy Team ,The Shrimpy Universal Crypto Exchange Interface,"The industry leading API for crypto trading, real-time data collection, and exchange account management.",,,
https://rapidapi.com/joissonjdm/api/softfocus-api-test/,2021-11, Joisson Mello ,softfocus-api-test,Api for developer's Softfocus,,,
https://rapidapi.com/smile-api-smile-api-default/api/smile2/,2022-11, Smile API ,Smile,"Smile provides user-authorized access to valuable employment and income data from HR, payroll, commerce, and marketplace platforms through a single API!",0.0,60 ms,100%
https://rapidapi.com/cnxt-thexdesk-cnxt-thexdesk-default/api/cnxt-thexdesk/,2021-11, CNXT THeXDesK ,CNXT THeXDesK,#HaSHTaGPRoToCoL #HaSHTaGDoMaiNs #PRiVaTeNeTWoRX #PRiVaTeCoiN$ & #PRiVaTeToKeN$,,,
https://rapidapi.com/Themindfactory/api/ai-stock-prediction/,2021-11, The Mind Factory ,AI Stock Prediction,AI Stock Prediction,,,
https://rapidapi.com/johnson19940118-6iK_ocJRkT1/api/top-9-currencies-rate/,2021-11, Xin Zhang ,Top 9 Currencies Rate,An API showing top 9 popular currencies rate,,,
https://rapidapi.com/MagtonHub/api/ginses-real-time-markets-data1/,2021-11, Magton ,Ginses Real-Time Markets' Data,"Real-time Forex, Stocks, Cryptocurrency, Indices, Bonds data websocket.",0.0,"1,991 ms",100%
https://rapidapi.com/samymassoud/api/iban-validation1/,2021-11, samymassoud ,IBAN validation,A free online IBAN API validation service,0.0,427 ms,100%
https://rapidapi.com/esg.enterprise.app/api/esg-environmental-social-governance-data/,2021-11, ESG Enterprise ,"ESG (Environmental, Social, Governance) Data","The ESG Enterprise API allows you to query and search Environmental, Social, and Governance (ESG) risk ratings and also material topics according to SDG and SASB. ESG Enterprise database maintains over 250,000 company ESG data over 142 countries. This REST API supports data searches for ESG risk scores that are formatted in JSON with HTTP GET Requests authenticate via Token.",0.1,11 ms,0%
https://rapidapi.com/vasimkk000/api/goldpricekerala/,2023-02, Muhammed Vaseem ,GoldpriceKerala,Give live gold price in kerala,,,
https://rapidapi.com/vfaltasvictory4software-tbZKlKgPlV/api/testapi619/,2021-11, Victor Faltas ,testAPI,Stock Market Data,,,
https://rapidapi.com/abyiss-abyiss-default/api/crypto-market-data-abyiss/,2022-11, Abyiss ,Crypto Market Data - Abyiss,"Crypto Data API connects you to 100+ crypto exchanges and 10,000+ cryptocurrencines with real-time and historical data. Get your API Key: Abyiss.com/signin",0.0,79 ms,100%
https://rapidapi.com/khalidalkhaldi231/api/ad-display/,2022-11, Khalid al-khaldi ,Ad display,show ads to websites,,,
https://rapidapi.com/GusiiSenpaii/api/cryptoprices/,2022-11, GusiiSenpaii ,CryptoPrices,Quick crypto prices api,,,
https://rapidapi.com/andysmithred/api/testproject70/,2022-11, Andy Smith ,TestProject,A simple test API,,,
https://rapidapi.com/datho.work/api/vietmoney-openapi/,2021-11, Dat Ho ,VietMoney OpenAPI,"VietMoney OpenAPI (1.0) is open api to allow e-wallet, banking, collection easier to integrate VietMoney services.",,,
https://rapidapi.com/kyang3200-O1c6eeiPhPm/api/currency-converter82/,2022-11, a 0322 ,Currency Converter,Created from Paw,,,
https://rapidapi.com/andkamarauskas-TtFcutRGHO4/api/crypto-address-validator/,2021-11, Andrius Kamarauskas ,Crypto address validator,Using this API you can check if crypto address is valid or not.,,,
https://rapidapi.com/harrisonbillz4/api/a1-forex/,2021-11, ppcian ,A1-forex,news,0.0,23 ms,0%
https://rapidapi.com/reefledge-reefledge-default/api/onboarding-project1252/,2022-11, ReefLedge ,👋 Onboarding Project,A powerful API designed for Quantitative Finance practitioners,,,
https://rapidapi.com/kalolevente/api/crypto-news31/,2022-11, Levente Kaló ,Crypto News,crypto news from all around the world,0.0,564 ms,0%
https://rapidapi.com/sobadrush0510/api/currency-converter-test/,2022-11, Bac Tizzy ,Currency Converter Test,這是一個可將輸入的金額進行幣別轉換的API,0.0,462 ms,100%
