API链接,Update_Time,Author,API名称,API描述,API Popularity,API Latency,API Service Level
https://rapidapi.com/palaniyapan/api/short2/,2021-11, Girri Palaniyapan ,Short,Short,,,
https://rapidapi.com/roger4ni/api/macrotrends/,2022-11, stick2stocks ,MacroTrends,Get macroeconomic data to level up your financial apps.,,,
https://rapidapi.com/mikebowers-ZGturHUDV3/api/yahoo-stock-close-price/,2021-11, Mike Bow ,Yahoo Stock Close Price,"An API that returns the stock close price from Yahoo Finance, based on the stock ticker provided by user.",0.0,218 ms,100%
https://rapidapi.com/Johannes225/api/dax1/,2022-11, Johannes225 ,DAX,"How many points did the DAX40 stock index gain or lose each month (during this period: Jan-Aug, 2022). This API will get the data that will answer that question.",,,
https://rapidapi.com/platon-DyBcqwZDJ/api/finhost/,2023-02, Platon Mykhalchuk ,FinHost,"Highload digital white-label banking platform that helps financial businesses to grow fast, scalable and reliable.",0.0,264 ms,40%
https://rapidapi.com/ekodev-ekodev-default/api/ifsc-search1/,2021-11, EkoDev ,IFSC Search,"This API gives access to all bank,state,district,city master information and it can be used as an IFSC search functionality, which will give the detail of IFSC once entered the above details",0.1,186 ms,0%
https://rapidapi.com/davidlee/api/financialmarketdata/,2021-11, davidlee ,FinancialMarketData,"FinPricing market data service provides highly accurate global financial market data from real time to historical. Those data are derived from multiple sources, including major interdealer brokers, with premium quality. The data API allows users to access the live and historical market data service systematically. More details at https://finpricing.com/curveVolList.html,",,,
https://rapidapi.com/tengku/api/running-trade/,2021-11, tengku ,Running Trade,Market streamer,,,
https://rapidapi.com/MrDNA/api/currency-converter194/,2022-11, MrDNA ,Currency Converter,Simple Currency Conversion API,,,
https://rapidapi.com/FmpCloudAPI/api/fmpcloud/,2021-11, FMP Cloud ,FmpCloud,"Access stock prices. Financial statements, real stock price values. SEC EDGAR API with all filings in real time. Free stock API to discover financial data instantly more at https://fmpcloud.io/",0.1,"1,086 ms",100%
https://rapidapi.com/bitquery-bitquery-default/api/blockchain-data/,2021-11, Bitquery ,Blockchain Data,"Gives access to more than 20 blockchains: blocks, transactions, transfers, smart contracts, tokens",0.1,218 ms,100%
https://rapidapi.com/miohtama/api/open-defi/,2021-11, miohtama ,Open DeFi,"Open DeFi API gives you access to decentralised exchange trading data, liquidity and tokens across multiple blockchains.",0.1,511 ms,97%
https://rapidapi.com/garbott-ltd-garbott-ltd-default/api/1p-challenge1/,2022-11, Garbott Web Development ,1p Challenge,APIs for the 1p Challenge,0.0,476 ms,100%
https://rapidapi.com/efg734/api/pan-card-reader/,2021-11, Steve Test ,Pan Card Reader,Reads Pan cards,,,
https://rapidapi.com/infosalary-infosalary-default/api/infosalary/,2021-11, InfoSalary ,Infosalary,The Infosalary API provides salary estimations based on job titles.,0.0,122 ms,0%
https://rapidapi.com/manq2010/api/json-placeholder155/,2022-11, mancoba Sihlongonyane ,JSON Placeholder,A simple financial API that allows you to change a specific amount from one currency to another,,,
https://rapidapi.com/samymassoud/api/bin-lookup3/,2021-11, samymassoud ,BIN Lookup,Lookup card information using card BIN. The API is free and covers most recent updates for the different BINs,0.1,91 ms,100%
https://rapidapi.com/thitruongforexinfo/api/thitruong-forex/,2021-11, Forex Thitruong ,Thitruong Forex,https://thitruongforex.info/ nơi chia sẻ kiến thức giao dịch ngoại hối (forex),,,
https://rapidapi.com/utils24/api/euro-exchange-rates-ecb/,2021-11, utils24 ,Euro exchange rates ECB,Get the exchange rates provided by European Central Bank (ECB). 41 currencies quoted against the euro. Data since 1999.,0.0,111 ms,0%
https://rapidapi.com/leonardojbarreto/api/cambiaria/,2021-11, leonardo barreto ,cambiaria,Cambiaria endpoint for testing,,,
https://rapidapi.com/ehsanbigzad/api/afghani-exchange-rate-sarai-shahzada/,2021-11, Ehsan Bigzad ,Afghani Exchange Rate - Sarai Shahzada,"This API provides the latest Afghani exchange rate from Sarai Shahzada, Kabul, Afghanistan",,,
https://rapidapi.com/sec-api-sec-api-default/api/sec-filings1/,2021-11, SEC API ,SEC Filings,Query & real-time stream API to access all +18 million SEC EDGAR filings published since 1993,0.0,"3,178 ms",100%
https://rapidapi.com/abstract-api-abstract-api-default/api/exchange-rate-and-currency-conversion/,2021-11, Abstract API ,Exchange Rate and Currency Conversion,"Get high quality, reliable data from from up-to-the-minute sources for 150+ currencies and 10,000+ currency pairs",,,
https://rapidapi.com/doksfind12-Afx11uPn0g3/api/financial-news3/,2021-11, Doks Find ,Financial News,Financial news from several newspapers,,,
https://rapidapi.com/hawooni/api/chart-img/,2023-03, hawooni ,CHART-IMG,CHART-IMG.COM API designed to take screenshots of the most popular crypto charts and tools.,0.0,36 ms,0%
https://rapidapi.com/catherine.kraus/api/embedded-business-credit/,2021-11, Catherine Kraus ,Embedded Business Credit,"Provide access to business credit within your ecosystem so you can sell more and serve your customers. Example: Software company selling to businesses can use this to attract more sign ups, management software company can offer an additional offering (fin services) to increase stickiness to their platform,.",,,
https://rapidapi.com/ozkcs/api/consulta-de-boleto/,2021-11, Fabio Teidi Ozaki Junior ,Consulta de boleto,"Consulte se um boleto já foi pago ou não, e caso não tenha sido pago, tenha as informações do boleto, tais como: Vencimento, banco emissor, nome e documento do beneficiário, valor, etc.",0.0,165 ms,100%
https://rapidapi.com/frogstickes/api/tickerval/,2021-11, tristan ,TickerVal,returns latest ticker price,,,
https://rapidapi.com/ecologyk/api/detect6/,2022-11, ecologyk ,Detect,Test obtain account,,,
https://rapidapi.com/alan-kravchuk-alan-kravchuk-default/api/bitcoin8/,2021-11, Alan Kravchuk ,Bitcoin,Bitcoin api between Investing and Binance,,,
https://rapidapi.com/thomasmin2012/api/korean-court-auction/,2022-11, Thomas Min ,korean court auction,korean court auction,,,
https://rapidapi.com/kndarpp/api/nse-market-turnover/,2023-04, Kndarp Patel ,NSE Market Turnover,Get historical values for NSE Market Turnover API,,,
https://rapidapi.com/adzoro2012/api/crypto-trading-signals/,2023-11, adzoro ziro ,Crypto Trading - Signals,Get Premium signals from pro crypto traders,,,
