API链接,Update_Time,Author,API名称,API描述,API Popularity,API Latency,API Service Level
https://rapidapi.com/vedicrishi/api/horoscope-match-making/,2021-11, Chandan Tiwari ,Horoscope Match Making,"Match-Making made easier with Vedic Rishi Astro Match APIs. These APIs provides various details and reports of horoscopes of a boy and girl matched according to Vedic Astrology. This considers the Ashtakoota points, detailed analysis along with Rajju, Vedha and Manglik Match reports.",9.5,244 ms,100%
https://rapidapi.com/vedicrishi/api/basic-horoscope-and-numerology/,2021-11, Chandan Tiwari ,Basic Horoscope and Numerology,Vedic Rishi Free APIs for Basic Astrological and Horoscope Details along with numerous Numerological details. It also provides panchang or hindu/indian calendar details.,9.8,274 ms,100%
https://rapidapi.com/HealThruWords/api/universal-inspirational-quotes/,2021-11, HealThruWords ,Universal Inspirational Quotes,"Display on your website, widget or app Inspirational Images, Motivational Pictures, Healing Quotes and more.",9.5,511 ms,100%
https://rapidapi.com/Glavier/api/online-code-compiler/,2023-07, Glavier ,Online Code Compiler,Online code compiler API in 75+ languages. Integrate the code compiler API into your applications/sites simply and quickly.,9.7,"1,543 ms",100%
https://rapidapi.com/apininjas/api/facts-by-api-ninjas/,2023-05, API Ninjas Team ,Facts by API-Ninjas,Get endless interesting facts. See more info at https://api-ninjas.com/api/facts.,9.7,340 ms,98%
https://rapidapi.com/elisbushaj2/api/youtube-mp310/,2023-10, Elis ,YouTube MP3,Download YouTube MP3.,9.5,"2,537 ms",98%
https://rapidapi.com/fdis-fdis-default/api/aka1/,2023-11, FDIS ,Aka,Aka api,9.7,712 ms,99%
https://rapidapi.com/mrsonj/api/random-username-generate/,2022-11, Sonj ,Random Username Generate,"If you need a random username for a website or application, then Ugener is the perfect choice for millions of random ideas.",9.6,405 ms,100%
https://rapidapi.com/duckduckgo/api/duckduckgo-zero-click-info/,2021-11, duckduckgo ,DuckDuckGo Zero-click Info,"DuckDuckGo Zero-click Info includes topic summaries, categories, disambiguation, official sites, !bang redirects, definitions and more. You can use this API for many things, e.g. define people, places, things, words and concepts; provides direct links to other services (via !bang syntax); list related topics; and gives official sites when available.",9.5,85 ms,100%
https://rapidapi.com/dev-8SMIA-cJK/api/quotes-diffusion/,2023-11, Nara Wira Digital ,Quotes Diffusion,"The ""Quotes Diffusion"" API provides users with a vast collection of curated popular quotes from around the world. It includes 56,394 quotes, spanning 1,963 topics, from 10,920 authors. The API also generates background images based on keywords from the quotes using text-to-image diffusion models.",9.5,200 ms,100%
https://rapidapi.com/divineapi/api/daily-horoscope3/,2023-07, divineapi ,Daily Horoscope,"The Daily Horoscope API provides the daily horoscope for all 12 zodiac signs, including fun trivia. It covers 6 categories: Personal Life, Professional Life, Health, Emotions, Travel, and Luck. You can view the horoscope for Yesterday, Today, and Tomorrow. The fun trivia includes Daily Cosmic Tips, Zodiac Couple's Compatibility, Lucky Number, Lucky Color, and a Description of the Sun Sign for the day. Sign up for a 7-day trial on the Divine API website to access the API with your unique API key.",9.7,831 ms,100%
https://rapidapi.com/a0m0rajab/api/quran-com/,2023-01, a0m0rajab ,Quran Com,The default API of Quran.com website,9.6,125 ms,100%
https://rapidapi.com/Alejandro99aru/api/horoscope-astrology/,2023-10, Alejandro99aru ,Horoscope Astrology,"The Horoscope API Server provides daily horoscope predictions for all zodiac signs. Users can access the API to retrieve daily astrological forecasts for their specific sun sign, as well as general horoscope information for the entire zodiac. The API is designed to be simple and easy to use, allowing developers to integrate horoscope content into their own applications and websites. The predictions are generated using algorithms that consider the position of the planets and other astrological...",9.9,613 ms,98%
https://rapidapi.com/webarjos/api/horoscope-api/,2022-11, ARJOS Web Development ,Horoscope API,"Horoscope API - Professional Horoscopes as a simple JSON API - Access 12 horoscopes every day, written by professional astrologers. Important: Only Portuguese (PT) language is currently available.",9.7,"1,888 ms",98%
https://rapidapi.com/cnumr-cnumr-default/api/ecoindex/,2022-11, CnumR ,Ecoindex,This API provides an easy way to analyze websites with Ecoindex. You have the ability to: - Make a page analysis - Define screen resolution - Save results to a DB - Retrieve results - Limit the number of request per day for a given host This API is built on top of ecoindex-python with FastAPI,9.5,757 ms,100%
https://rapidapi.com/Gil%20Test/api/urltest/,2021-11, Gil Test ,URLTEST,"This is a sample server Petstore server. You can find out more about Swagger at [http://swagger.io](http://swagger.io) or on [irc.freenode.net, #swagger](http://swagger.io/irc/). For this sample, you can use the api key `special-key` to test the authorization filters.",9.2,842 ms,100%
https://rapidapi.com/nicholasjohn/api/churchapp/,2021-11, nicholasjohn ,ChurchApp,Connect to ChurchApp using an API key provided by ChurchApp support.,8.8,74 ms,100%
https://rapidapi.com/ipeirotis/api/readability-metrics/,2022-11, Panos Ipeirotis ,Readability Metrics,"This API can be used to compute a set of readability metrics for a given text. We currently support the following metrics: Automated Readability Index, Coleman-Liau Index, Flesch–Kincaid Grade Level, Flesch Reading Ease, Gunning-Fog Index, SMOG score, and SMOG Index. The service is deployed at Google App Engine and available at https://ipeirotis-hrd.appspot.com/ The code and documentation are available on Github at https://github.com/ipeirotis/ReadabilityMetrics",9.4,881 ms,98%
https://rapidapi.com/jaagravseal03/api/codex7/,2023-02, Jaagrav Seal ,CodeX,"Compile your codes written in Java, C++, C, etc completely for free with this open source API!",9.2,724 ms,100%
https://rapidapi.com/apininjas/api/baby-names-by-api-ninjas/,2023-05, API Ninjas Team ,Baby Names by API-Ninjas,"Popular and unique baby name name generator for boys, girls, and gender-neutral names. See more info at https://api-ninjas.com/api/babynames",9.4,329 ms,84%
https://rapidapi.com/apininjas/api/bucket-list-by-api-ninjas/,2023-05, API Ninjas Team ,Bucket List by API-Ninjas,Get inspired with thousands of innovative bucket list ideas. See more info at https://api-ninjas.com/api/bucketlist.,8.6,456 ms,100%
https://rapidapi.com/mrsonj/api/receive-sms-online/,2022-11, Sonj ,Receive SMS Online,Protect your phone number from spam messages with SMSer. All Number country US +1,9.1,"1,169 ms",62%
https://rapidapi.com/shamsnaamir-32gE-cqV5A7/api/hafez/,2021-11, Shams ,Hafez,Get Your Hafez Fal,9.1,"2,012 ms",97%
https://rapidapi.com/mc1206matt/api/linear-program-solver/,2022-11, Matthew Coombes ,Linear Program Solver,Solves Mixed-Integer Linear Programs using the simplex method.,8.8,"2,926 ms",100%
https://rapidapi.com/soulver-soulvercloud/api/evaluate-expression/,2021-11, Soulver ,Evaluate expression,Multi-purpose natural language calculator,9.4,380 ms,100%
https://rapidapi.com/alreadycoded/api/similar-sites-finder/,2023-08, alreadycoded ,Similar Sites Finder,"This API can provide similar sites data of about 800,000 top websites.",8.5,"1,647 ms",100%
https://rapidapi.com/xtsea/api/userbot3/,2023-09, xtsea ,userbot,Ryuzaki Library,8.5,"3,084 ms",100%
https://rapidapi.com/lduran2-CvRRB1hLBCj/api/dogbreeds/,2021-11, Luis Duran ,DogBreeds,An API showing all dog breeds and your characteristics,9.3,"1,613 ms",100%
https://rapidapi.com/erel95/api/ai-endpoint/,2023-01, Erel Biran ,AI endpoint,This endpoint will give you answer to any question,8.9,7 ms,100%
https://rapidapi.com/loganamundson12/api/password-strength-tester/,2023-09, Techmode5 ,PASSWORD STRENGTH TESTER,This api will test the strength of almost any password.,8.8,"1,494 ms",100%
https://rapidapi.com/adriancardoza/api/node-express-api-tutorial/,2023-02, Adrian Cardoza ,Node Express API Tutorial,"An API that allows users to be stored, retrieved, and deleted from a database.",8.6,"27,738 ms",100%
https://rapidapi.com/giordano0alberti-e50D9-3izcS/api/words-to-numbers/,2022-11, Giordano Alberti ,Words to numbers,API to convert natural language words into numbers. Currently available in english and italian and limited to billions,9.1,618 ms,100%
https://rapidapi.com/wahrcoder-wahrcoder-default/api/most-exclusive-api/,2023-11, WahrCoder ,Most Exclusive API,Be exclusive ! Only one requester at a time gets access to exclusive content. Exclusiveness is passed on 5 min after it was assigned. The caller that is first to request the api after the previous exclusiveness expired gets exclusive access to the API.,,,
https://rapidapi.com/ItachiCrypto/api/athproject2/,2023-10, ItachiCrypto ,AthProject,AthProject,8.8,83 ms,78%
https://rapidapi.com/valengguerra-Pkt5FuIg07/api/goodreads-books/,2023-04, VG-APIs ,Goodreads Books,Get data from the most famous book collection on the web.,8.9,"3,036 ms",100%
https://rapidapi.com/pragmavant-pragmavant-default/api/pragmavantapi/,2021-11, Pragmavant ,PragmavantApi,Practical API for streamlined business and cloud applications.,9.2,"1,850 ms",82%
https://rapidapi.com/karanp41-eRiF1pYLK1P/api/world-of-quotes/,2023-02, Krishan Pal ,World of Quotes,"API returns over 50,000+ famous quotes from over 10,000+ great authors and over 350+ different categories.",9.1,"2,688 ms",100%
https://rapidapi.com/navitimejapan-navitimejapan/api/for-claris-totalnavi/,2021-11, NAVITIMEJAPAN ,For Claris totalnavi,Claris Connect連携用のサービスです。徒歩＋公共交通のルート検索を行うために利用いたします。,8.5,769 ms,100%
https://rapidapi.com/arthurdewitte/api/html-to-image2/,2021-11, Arthur De Witte ,HTML to image,"Easily convert HTML content to a PNG, JPG, JPEG, SVG, and BMP!",8.9,7 ms,100%
https://rapidapi.com/dhyantanna-0ViP6CNgGOi/api/d99-multipurpose-api-free/,2023-07, dhyan tanna ,D99 Multipurpose Api - Free,A free-to-use multipurpose api that can be easily utilised in any application,,,
https://rapidapi.com/hoangdaicntt/api/vpn-gate/,2022-11, Đại Hoàng ,VPN GATE,"VPN Gate Academic Experiment Project is an online service as an academic research at Graduate School of University of Tsukuba, Japan. The purpose of this research is to expand the knowledge of ""Global Distributed Public VPN Relay Servers"" . Why VPN Gate? You can take these advantages by using VPN Gate: You can get through the government's firewall to browse restricted web sites (e.g. YouTube). You can disguise your IP address to hide your identity while surfing the Internet. You can prot...",9.2,"2,379 ms",97%
https://rapidapi.com/navitimejapan-navitimejapan/api/for-claris-map/,2021-11, NAVITIMEJAPAN ,For Claris map,Claris Connect連携用のサービスです。地図表示を行うために利用します。,8.8,496 ms,100%
https://rapidapi.com/navitimejapan-navitimejapan/api/for-claris-car/,2021-11, NAVITIMEJAPAN ,For Claris car,Claris Connect連携用のサービスです。自動車のルート検索を行うために利用します。,9.1,642 ms,100%
https://rapidapi.com/fdis-fdis-default/api/k4sada/,2023-11, FDIS ,K4sada,K4sada API,9.2,"1,670 ms",98%
https://rapidapi.com/BFG9000/api/powerball9/,2023-10, BFG9000 ,Powerball,"The Powerball Lottery Data API is a comprehensive and up-to-date resource for accessing historical data related to the Powerball lottery in the United States. This API offers a wealth of information, spanning from the year 2010 to the present, allowing users to retrieve data on Powerball drawings, winning numbers, and more.",8.5,123 ms,100%
https://rapidapi.com/escotia/api/erictestpet/,2021-11, escatia ,erictestpet,test api for pet store,9.3,538 ms,100%
https://rapidapi.com/zarraamedali/api/dictionary29/,2021-11, Zara Daly ,Dictionary,Dictionary,8.6,42 ms,100%
https://rapidapi.com/vass4ov/api/gram/,2021-11, vasil ,gram,grammar4u,8.6,407 ms,100%
https://rapidapi.com/techtic.naitik/api/supper_app/,2021-11, Naitik Mulashiya ,supper_app,What’s for Supper? app helps users by providing them with a means to figure out what can be cooked based on entering the available ingredients in the household WFS? is presented with an animated video splash screen intro page upon open WFS? users can register through the app or through authentic Facebook login WFS? aims to be a free app trial for 30 days and offers an In-App Purchase of $.99 cents for full use of the app including additional In-App Purchases for more features GPS Integration will allow users directions to all nearby supermarkets and groceries What’s for Supper? Allows users to create custom family and allergy profiles WFS? camera feature will allow users to snap photos of food that can be added to the app for determining best dishes to make including recipes and nutritional information WIFI or Data connection is required for What’s for Supper? real time results,8.9,402 ms,100%
https://rapidapi.com/LucidCloudSolutions/api/south-african-id-no-validator/,2021-11, LucidCloudSolutions ,South African ID No Validator,This does a simple validation on a South African ID Number.,9.3,259 ms,100%
https://rapidapi.com/Jaap/api/cardsearch/,2021-11, Jaap ,Cardsearch,"Magic the Gathering card, set and Dutch price information. Each api call is required to provide a authentication key. You can request one by email, it's free by the way info@cardsearch.nl Each api call can provide an additional parameter ""format"" with values ""json"",""xml"", ""csv"" or ""table"". Json is the default format. Example GET http://api.cardsearch.nl/v1/sets?key=demo&format=xml",8.8,348 ms,100%
https://rapidapi.com/ajith/api/verify-email-address/,2023-02, Ajith Joseph ,Verify email address,Validate email addresses and confirm their existence with our API. Quickly and easily verify email IDs across any domain with this powerful tool.,9.0,52 ms,100%
https://rapidapi.com/troyhunt/api/have-i-been-pwned/,2021-11, troyhunt ,Have I been pwned,"The ""Have I been pwned?"" service allows you to search for accounts (usernames and email addresses) that have appeared in data breaches that the attackers have made public.",8.8,968 ms,100%
https://rapidapi.com/community/api/shapeways/,2021-11, community ,Shapeways,"Shapeways.com is the world's leading 3D Printing marketplace and community. We harness 3D Printing to help everyone make and share designs with the world, making product design more accessible, personal, and inspiring.",9.0,503 ms,100%
https://rapidapi.com/similarsitecheck/api/similarsites/,2021-11, similarsitecheck ,Similarsites,"Similarsitecheck is a free and open search engine to find similar and related websites. Our specially developed similarity algorithm Similarsitecheck helps to find alternative webpages. We provide an API for developers or whoever would like to use our data. It's free to get started using the API. There is a rate limit of 5,000 queries per day. If you expect to exceed that, please get in touch with us. Input a domain and receive an output of 20 similar websites with title, description, domainpower, website language and their similarity score.",8.9,599 ms,100%
https://rapidapi.com/funlake/api/frimann/,2021-11, funlake ,Frimann,This is a API for Frímann rental system. The goal is to provide complete access to all of Frímann's functions for our clients.,8.9,119 ms,100%
https://rapidapi.com/thefosk/api/heck-yes-markdown/,2021-11, thefosk ,Heck Yes Markdown,Markdownifier,,,
https://rapidapi.com/opt-nc-opt-nc-default/api/ridet-nc/,2023-06, OPT-NC for developers ,Ridet NC,API permettant d'obtenir les informations sur une entreprise ou un établissement en Nouvelle-Calédonie,9.1,866 ms,100%
https://rapidapi.com/siddsarkar/api/favicon-finder1/,2022-11, siddsarkar ,favicon-finder,Parses favicons for a given URL,8.5,588 ms,85%
https://rapidapi.com/arvind.joshi/api/sample-app-config-json/,2021-11, Arvind ,sample-app-config.json,version,,,
https://rapidapi.com/Allscamreports/api/scam-reports-from-real-victims/,2021-11, Allscamreports ,Scam Reports from real victims,All Scam Reports is an online help community that focuses on helping the victims of fraud by offering several scam reports and complete assistance in recovering funds.,8.8,"3,583 ms",100%
https://rapidapi.com/jaarvis-jaarvis-default/api/jaarvis-whatsapp-messaging/,2023-05, jaarvis ,Jaarvis-Whatsapp-Messaging,"The WhatsApp Message Sender API allows you to effortlessly send personalized messages to WhatsApp users. With this API, you can easily integrate WhatsApp messaging functionality into your applications, websites, or services, enabling you to engage with your users in a convenient and familiar way.",8.7,"85,538 ms",33%
https://rapidapi.com/tinkumajhi3001/api/dog-api/,2022-11, tinkumajhi3001 ,Dog API,Do you care about accessing free images of dogs on the internet? Do you want your dog pictures to be served at lightning fast speed with 99.999% uptime? Do you care about DaaS (Dogs as a Service)? Help us pay our hosting bills and ensure that Dog API stays free to access and use for everyone. We'll even gift you an executive business tie for your pet (or small child) to say thanks.,9.3,357 ms,100%
https://rapidapi.com/ashutoshjha2020/api/location-search/,2021-11, ashutoshjha2020 ,Location Search,Find the india state city loctaion and pincode,8.9,"1,698 ms",100%
https://rapidapi.com/onkimnilicu/api/mycar/,2023-08, L. Jones ,MyCar,Vehicle information Malaysia,9.2,"11,029 ms",100%
https://rapidapi.com/Jonak-Adipta-Kalita/api/jak_api/,2021-11, Jonak Adipta Kalita ,JAK_API,A API made by Jonak Adipta Kalita!!,9.1,28 ms,100%
https://rapidapi.com/divineapi/api/coffee-cup-reading/,2023-07, divineapi ,Coffee Cup Reading,"Experience the Coffee Cup Reading API: Accurate predictions, and thought-provoking symbols for present, near, and distant future. A magnet for Millennials and Gen Z.",9.2,435 ms,100%
https://rapidapi.com/dev-8SMIA-cJK/api/typography/,2023-11, Nara Wira Digital ,Typography,"A curated (120+) typeface combinations from Google Fonts, including details about tones, types, styles, and categories. The API also includes configurations for font sizes, letter spacing, and line heights, allowing developers and designers to create engaging and visually appealing content.",8.8,702 ms,100%
https://rapidapi.com/divineapi/api/yes-or-no-tarot/,2023-07, divineapi ,Yes or No Tarot,"Discover the power of the Yes/No Tarot API: Get instant Yes or No answers, accurate messages, and beautiful imagery for quick guidance and insights.",9.0,520 ms,100%
https://rapidapi.com/nejdetarslan26/api/petfood/,2021-11, Nejdet Arslan ,petFood,petFoods,8.9,307 ms,100%
https://rapidapi.com/manoj543/api/katzion-test/,2021-11, manoj543 ,katzion test,katzion test,8.5,6 ms,100%
https://rapidapi.com/souzadie/api/colegiosantaana/,2021-11, Diego Souza ,colegiosantaana,Colegio Santa Ana,9.3,8 ms,100%
https://rapidapi.com/divineapi/api/fortune-cookie/,2023-07, divineapi ,Fortune Cookie,"Discover Fortune Cookie: Your daily source of personalized messages and uplifting positivity, bringing a touch of inspiration to brighten your every day.",9.2,934 ms,100%
https://rapidapi.com/Vilas17111994/api/pet_test_v1/,2022-11, Vilas17111994 ,Pet_Test_V1,Test API,,,
https://rapidapi.com/divineapi/api/daily-tarot/,2023-07, divineapi ,Daily Tarot,"Experience the Daily Tarot API: Accurate Love, Money, and Career Readings with detailed Tarot Card descriptions. Beautiful imagery and personalized insights await you.",9.4,677 ms,100%
https://rapidapi.com/rudranshkhandelwal123/api/cricbuzz8/,2023-09, rudransh khandelwal ,cricbuzz,API for admin and user login and to schedule matches,9.1,"9,327 ms",97%
https://rapidapi.com/SpecialistSteak/api/people-generator-api/,2023-04, SpecialistSteak ,People Generator API,Free and public API which generates up to 50000 realistic profiles of fake people at a time.,8.7,533 ms,100%
https://rapidapi.com/promatik/api/animais-de-rua/,2021-11, António Almeida ,Animais de Rua,Retrieves info about Animais de Rua platform,8.3,445 ms,100%
https://rapidapi.com/vedicrishi/api/advanced-astrology-and-horoscope/,2021-11, Chandan Tiwari ,Advanced Astrology and Horoscope,Start creating horoscopes and reports on your websites and mobile applications within minutes using Vedic Rishi Astro APIs. These APIs provide detailed vedic or Indian astrology calculations along with various prediction reports.,,,
https://rapidapi.com/jongan69/api/memegen/,2022-11, jongan69 ,memegen,An API that generates a meme using a word,,,
https://rapidapi.com/pk-ai-pk-ai-default/api/favicon-finder-and-extractor-from-url/,2023-08, PK Ai ,Favicon Finder And Extractor From Url,Extract the favicon of any of th webiste using that api.,8.3,726 ms,100%
https://rapidapi.com/luca.carducci91/api/ukraine-war-data/,2022-11, API Maker ,Ukraine war data,Data about the Ukrainian conflict,,,
https://rapidapi.com/starhunter17017/api/crypto-price-bubble/,2023-02, Michael Bas ,Crypto Price bubble,Oil Gas producers,,,
https://rapidapi.com/BFG9000/api/mega-millions3/,2023-10, BFG9000 ,Mega Millions,"The Mega Millions Lottery Data API is a comprehensive and up-to-date resource for accessing historical data related to the Mega Millions lottery in the United States. This API offers a wealth of information, spanning from the year 2010 to the present, allowing users to retrieve data on Mega Millions drawings, winning numbers, and more.",8.2,190 ms,100%
https://rapidapi.com/aviwolicki/api/bitcoin-ordinals-api1/,2023-04, Avi w ,Bitcoin Ordinals API,Bitcoin Ordinals API - JSON API for Bitcoin Ordinals. Query easily with JSON outputs.,,,
https://rapidapi.com/xtsea/api/ryuzakilib1/,2023-09, xtsea ,RyuzakiLib,all downloader,8.2,"25,557 ms",100%
https://rapidapi.com/doitpom/api/popular-baby-names/,2023-07, xyz xyz ,Popular Baby Names,"The ""Popular Baby Names"" API empowers you to enhance your applications, engage your users, and provide them with a valuable resource for choosing the perfect name for their newborns. Stay ahead of naming trends, foster user engagement, and unlock new possibilities with our comprehensive and user-friendly API",,,
https://rapidapi.com/edrra-edrra-default/api/send-otp-via-whatsapp/,2023-09, edrra ,Send OTP via WhatsApp,An API that delivers One-Time Passwords (OTPs) through WhatsApp for authentication and verification.,,,
https://rapidapi.com/TragosDev/api/how-much-time/,2023-02, TragosDev ,How much time?,Calculate time difference between two dates in several units,,,
https://rapidapi.com/data-extractor-data-extractor-default/api/business-card-parser/,2021-11, Data Extractor ,Business Card Parser,Business Card Parser,,,
https://rapidapi.com/ChatGPTPro/api/qr-code-api242/,2023-03, ChatGPTPro ,QR Code API,This API takes url as input and generates qr code for it.,,,
https://rapidapi.com/AbdulQuayyum/api/cat-facts12/,2023-05, AbdulQuayyum ,cat-facts,An API Service returning fun facts about cats.,8.3,"139,240 ms",100%
https://rapidapi.com/prd4/api/checktransfer1/,2021-11, prd4 ,checktransfer,gg,,,
https://rapidapi.com/Makiss73/api/greek-eortologio/,2023-10, GrAppes ,Greek Eortologio,Ελληνικό Ορθόδοξο εορτολόγιο για τα έτη 2023 έως και 2028.,8.3,163 ms,100%
https://rapidapi.com/maccman/api/sourcing-io/,2021-11, maccman ,Sourcing.io,Source talented software engineers Search through our database of over 4 million developers to find the right match for your team.,,,
https://rapidapi.com/dandrocec/api/darko-androcec-example/,2021-11, dandrocec ,Darko Androcec Example,"Lists summary information about each Salesforce version currently available, including the version, label, and a link to each version's root.",8.3,129 ms,100%
https://rapidapi.com/nicereply/api/nicereply/,2021-11, nicereply ,Nicereply,"Nicereply is a web-based analytic tool used to determine customer satisfaction with your agents, products or services.",,,
https://rapidapi.com/nickrapidapi/api/google_translate/,2023-01, nickrapidapi ,google_translate,test,,,
https://rapidapi.com/valiosjudy-njFjpeFkKyO/api/moodbooster-api/,2021-11, ItzFrenz [GD] ,moodbooster-api,girls,,,
https://rapidapi.com/AimeurAmin/api/toptalonlinetest/,2021-11, AimeurAmin ,toptalOnlineTest,"a small api similar to the one I got in the toptal test, returns an array of strings only with the possibility to filter using query params",,,
https://rapidapi.com/granitebagas28/api/sunnah-fasting1/,2022-11, Granite Bagas ,Sunnah Fasting,List of sunnah fasting schedule. Start from year 2022.,8.1,111 ms,100%
https://rapidapi.com/m.fetamin/api/jokes20/,2022-11, Dmitry Sergeev ,Jokes,Jokes for site,8.1,548 ms,100%
https://rapidapi.com/interhui/api/echo5/,2021-11, Hui ,Echo,Echo Request,,,
https://rapidapi.com/devhar07-6zvjhcvVmBy/api/test6311/,2021-11, hanif robbani ,Test,API for testing Rapid API features,,,
https://rapidapi.com/dorshtaifprovider1/api/my-demo-soap-service/,2022-11, dorshtaifprovider1 ,My demo SOAP service,My demo API tries to illustrate what it's like to define and expose a SOAP API in current terms and capabilities in the RapidAPI platform. The underlying SOAP service this API wraps is the following public demo SOAP service: https://www.crcind.com/csp/samples/SOAP.Demo.cls,,,
https://rapidapi.com/tolga1497-Prvs7U5_JY7/api/translate224/,2021-11, Emre Akyol ,Translate,Translate Api,,,
https://rapidapi.com/hwr96m-mYRJ3Zjo6dF/api/searchapi10/,2021-11, Андрей А. ,SearchApi,Поиск картинок,,,
https://rapidapi.com/madsphi-1cnVTVPS_/api/model-train-prices-api/,2023-07, Mads Phikamphon ,Model Train Prices API,"Get model train locomotives, wagons etc. data",,,
