API链接,Update_Time,Author,API名称,API描述,API Popularity,API Latency,API Service Level
https://rapidapi.com/Calico90/api/certer-org/,2021-11, Calico90 ,certer.org,"The API with 40+ awesome and uncommon features related to colors, hashing, encoding, bytes, ip, numbers, random and data validation.",,,
https://rapidapi.com/wsbe/api/machine-translation/,2021-11, Farkhat Aminov ,Machine Translation,High quality machine translation service with support for more than 70 languages. Please contact us to get a custom plan for large amounts of texts.,,,
https://rapidapi.com/malwaredog/api/malware-dog/,2021-11, Malware Dog ,Malware Dog,Provides a host of tools for security researchers,0.0,522 ms,0%
https://rapidapi.com/dingfengquek/api/dingfengquek_test/,2021-11, dingfengquek ,Dingfengquek_test,"This is a test API, it is not for actual use and will be taken down soon.",,,
https://rapidapi.com/EmailChecker/api/email-verification/,2021-11, Email Checker ,Email Verification,Use our email verification API to check email addresses in real-time,,,
https://rapidapi.com/antgamdia/api/papamoscas-tfg/,2021-11, ellocoyo ,Papamoscas-TfG,End-of-Degree project: only for SLA management testing purposes.,,,
https://rapidapi.com/lenuweit/api/billing/,2021-11, lenuweit ,Billing,"Die monatliche Gebühr gestattet Ihnen den Zugang zu unserer aktualisierten Plattform und die Nutzung unseres Cloud-basierten Systems. Unsere Cloud-Publishing-Plattform wird es Ihnen ermöglichen, Ihre App so oft zu überarbeiten wie Sie möchten, sich in Echtzeit Änderungen anzeigen zu lassen und Ihre App zu aktualisieren, ohne dass Sie dafür etwas bezahlen oder Zeit für den erneuten Einreichungsprozess Ihrer App bei den Stores aufwenden müssen.",,,
https://rapidapi.com/realfavicongenerator/api/realfavicongenerator/,2021-11, realfavicongenerator ,RealFaviconGenerator,"Get favicon-related information about a particular website. The most obvious service is getting the icons of a website. In addition to the classic favicon, the API can also get the icons for iOS, Android Chrome, Windows and Safari pinned tabs. This can be handy to get the high resolution logo of a website. The API also allows you to get an icon preview. For example, what if you add a website to the home screen of an Android device using Chrome? How would it look like? The API generates such image.",0.1,"146,872 ms",16%
https://rapidapi.com/amtera/api/esa-semantic-relatedness/,2021-11, amtera ,ESA Semantic Relatedness,Calculates the semantic relatedness/similarity between pairs of text excerpts based on the likeness of their meaning or semantic content.,,,
https://rapidapi.com/enclout/api/term-analysis/,2021-11, enclout ,Term Analysis,"Given a text, this API returns the lemmatized text",0.0,14 ms,0%
https://rapidapi.com/enclout/api/dns/,2021-11, enclout ,DNS,This API takes a URL or domain as input and returns back DNS data,,,
https://rapidapi.com/enclout/api/whois-1/,2021-11, enclout ,Whois,This API takes a URL or domain as input and return back whois data.,,,
https://rapidapi.com/plutus0827-KGWylqZk-Km/api/fake-user-list-test/,2021-11, Jinnam Woo ,Fake User List Test,This is a test application.,,,
https://rapidapi.com/asposecloud/api/aspose-barcode-cloud/,2021-11, Aspose Cloud ,Aspose BarCode Cloud,"Barcode generation, recognition, and conversion REST API that supports 60+ types of linear, 2D, and postal barcodes.",,,
https://rapidapi.com/enespolat25/api/fake-users2/,2021-11, enespolat25 ,Fake Users,This API provides fake users which you can use to test yor application,,,
https://rapidapi.com/krutikgadhiya/api/certificate-generator1/,2022-11, Krutik Gadhiya ,Certificate Generator,"A place where you can generate certificate which can be shared with the url, and with the unique certificate id you can verify the certificate. it comes with one certificate template, which will increase in future, with the plan to add new certificate every week.",0.0,420 ms,100%
https://rapidapi.com/lodbujana75/api/menya/,2022-11, rodrigue butoyi ,Menya,"Menya Api met en disposition tout les information concernant divers activités ou bien mouvement du pays du Burundi. il fournit des informations a propos des institutions, des académies ainsi une bonne répartition de l'information qui permet a tout le monde de pendre connaissance du Burundi sur tout ses angles. API aussi vous donnez accès a des différents types d'exercices de musculation très bien trie pour répondre a des besoin supplémentaires .",0.0,310 ms,0%
https://rapidapi.com/developer90210brr/api/qr-generator15/,2023-02, developer90210brr ,qr generator,This API generates QR codes,,,
https://rapidapi.com/qadirabbasi1020-MXzwbKq_Ooq/api/fake-users12/,2022-11, Abdul Qadir ,Fake Users,This API is about fake users.,,,
https://rapidapi.com/techniquestudent-fopMQEtWlp3/api/otp-generation1/,2021-11, Student Technique ,Otp generation,This API is for Otp generation.,0.0,885 ms,100%
https://rapidapi.com/mabi/api/cors-proxy/,2022-11, mabi ,Cors Proxy,Cross-Origin Resource Sharing Proxy,0.0,"2,171 ms",100%
https://rapidapi.com/hinaabidi/api/apple-ios-version-details/,2021-11, hinaabidi ,apple-ios-version-details,This API provides iOS version details web scrapped from WikiPedia website,,,
https://rapidapi.com/opnfuse-zC9nCntX8/api/uniswap-v2-api/,2021-11, Mario Quevedo ,uniswap-v2-api,REST API of Uniswap V2,0.1,"1,327 ms",89%
https://rapidapi.com/Tikky-Dev/api/csv-to-json1/,2021-11, Tikky-Dev ,CSV to JSON,API to convert CSV files to JSON format and returns JSON.,0.0,272 ms,100%
https://rapidapi.com/groupdocscloud/api/groupdocs-parser-cloud/,2021-11, GroupDocs Cloud APIs ,GroupDocs Parser Cloud,"GroupDocs.Parser Cloud is a REST API that helps you parse documents to extract images, text, and other data.",,,
https://rapidapi.com/atiftirmizi-SALedgjcevn/api/area-code-date-time/,2021-11, Atif Tirmizi ,Area Code Date Time,"This API retrieves all date, time and state based on all area codes in North America",,,
https://rapidapi.com/asposecloud/api/aspose-email-cloud/,2021-11, Aspose Cloud ,Aspose Email Cloud,Email Management and Archiving REST API,0.0,762 ms,100%
https://rapidapi.com/groupdocscloud/api/groupdocs-editor-cloud/,2021-11, GroupDocs Cloud APIs ,GroupDocs Editor Cloud,GroupDocs.Editor Cloud is a document editing REST API for loading and modifying documents in the cloud.,0.0,980 ms,100%
https://rapidapi.com/bougsrim-qP4fdhCpu9P/api/fake-users8/,2021-11, RimaL878 ,Fake Users,This API provides a list of fake users.,,,
https://rapidapi.com/masakirakuten/api/testchinen/,2021-11, masakirakuten ,TESTCHINEN,This is the test API for Rakuten Support.,,,
https://rapidapi.com/groupdocscloud/api/groupdocs-metadata-cloud/,2021-11, GroupDocs Cloud APIs ,GroupDocs Metadata Cloud,GroupDocs.Metadata Cloud is a REST API to manage metadata properties of numerous file formats in the cloud.,0.0,741 ms,100%
https://rapidapi.com/Ionut-Cora/api/bookshelves/,2021-11, Ionut-Cora ,Bookshelves,"This API showing few books details, like: title, author, image url, price, review and description. For this API I used JavaScript, node, express and nodemon.",0.1,188 ms,100%
https://rapidapi.com/groupdocscloud/api/groupdocs-watermark-cloud/,2021-11, GroupDocs Cloud APIs ,GroupDocs Watermark Cloud,"REST API to add, customize and search text and image watermarks within documents of various file formats.",0.1,745 ms,100%
https://rapidapi.com/spanglemonk/api/daily-missal/,2021-11, spanglemonk ,Daily Missal,Readings for the day,,,
https://rapidapi.com/abiodunoluwasegunsharafa-Pu9kywlF-YE/api/daily-horoscopes1/,2021-11, Abiodun O.S ,Daily Horoscopes,"The Horoscopes API is a JSON API that delivers astrology and daily horoscopes. Every day, the API gives users access to 12 horoscopes prepared by expert astrologers.",0.0,218 ms,100%
https://rapidapi.com/gautam.er.menaria/api/url-shortener21/,2022-11, gautam.er.menaria ,url shortener,Create beautiful short url from long ugly url,,,
https://rapidapi.com/joyde3382/api/currency-converter80/,2022-11, joyde3382 ,Currency Converter,A simple API that allows you to exchange a specific amount from one currency to another.,,,
https://rapidapi.com/clintkavai/api/rapiddns/,2021-11, clint kavai ,rapiddns,"Secure, ultra low latency and quick way to resolve DNS queries over HTTPS or do some DNS lookup over https",,,
https://rapidapi.com/guleroman/api/mooddetectionapi/,2021-11, guleroman ,moodDetectionApi,Определение настроения.,,,
https://rapidapi.com/david.ilievsky/api/shoe-size-converter/,2021-11, David Ilievsky ,shoe size converter,converts shoe size,,,
https://rapidapi.com/sauravkpayfinix/api/blogapi7/,2023-07, Saurav Dikshit ,BlogAPI,Register User,,,
https://rapidapi.com/moxemus/api/smart-bad-words-filter/,2022-11, moxemus ,Smart bad words filter,API filter and censor bad words written in any way in your text,,,
https://rapidapi.com/Rotanev/api/correos-tracking-multilingual/,2022-11, Rotanev ,Correos Tracking - Multilingual,"Check Correos tracking code in spanish, english and french",,,
https://rapidapi.com/coladimeji/api/boiler-plate-wiki/,2021-11, chris oladimeji ,Boiler Plate Wiki,API where developers can access the latest Blockchain Dev Codes,,,
https://rapidapi.com/marco.milita11/api/fake-users11/,2022-11, Marco Milita ,Fake Users,Test Fake Users,0.0,469 ms,100%
https://rapidapi.com/tampl1/api/platformbil/,2021-11, tampl1 ,platformbil,,0.0,964 ms,100%
https://rapidapi.com/mahendraputra21/api/fake-users4/,2021-11, mahendraputra21 ,Fake Users,This API provides fake users which you can use to test your application,,,
https://rapidapi.com/313arshadkhan-yd_8YGzX27m/api/fake-users-test/,2021-11, Arshad Khan ,Fake Users Test,Created to test Rapid API capabilities using a Node.js app deployed with Heroku CLI,,,
https://rapidapi.com/sahilkgandash/api/fiverr-api/,2023-08, sahil Kumar ,fiverr api,this api include all the methods for creating an freelencig website api,0.0,"13,372 ms",100%
https://rapidapi.com/asposecloud/api/aspose-3d-cloud/,2021-11, Aspose Cloud ,Aspose.3D Cloud,"A lightweight REST API to create, manipulate, convert, and transform 3D file formats in the cloud.",,,
https://rapidapi.com/leonardosartori62/api/catascrape/,2022-11, Leonardo Sartori ,Catascrape,Get details and search artwork on Catawiki,,,
https://rapidapi.com/ionitaiustin23/api/opensea-nft-metadata/,2022-11, Iustin Ionita ,OpenSea NFT Metadata,Get NFT Metadata from OpenSea by providing the URL / Link.,,,
https://rapidapi.com/entryrise-entryrise-default/api/shortly-url-shortener/,2021-11, ENTRYRISE ,Shortly URL Shortener,"Keep your URL short and rememberable with shortly, a simple to use API that's ready to make your emails, promotional SMS more efficient and professional!",,,
https://rapidapi.com/jadomene99/api/color11/,2023-03, Javier Alejandro Domene ,Color,"Use natural language to get rgb, hex, hsl color. Get the complementary, monochromatic, triadic, tetradic, analogous scheme for any color.",,,
https://rapidapi.com/vujicandrej366/api/whats-my-ip2/,2023-01, Andrej ,What's my IP?,API for getting your IP address. Returns the IP address of the client which makes the request to the API.,,,
https://rapidapi.com/isontheline/api/mengus/,2021-11, Arnaud MENGUS ,MENGUS,Useful APIs for everyone,,,
https://rapidapi.com/groupdocscloud/api/groupdocs-translation-cloud/,2021-11, GroupDocs Cloud APIs ,GroupDocs Translation Cloud,GroupDocs.Translation Cloud is a REST API for translating English content of documents to other supported languages.,0.0,"22,708 ms",100%
https://rapidapi.com/zzfima-7dKZHSSC1Bt/api/fakeusers/,2021-11, Efim Zabarsky ,FakeUsers,Provides list of dummy users,,,
https://rapidapi.com/chenghuichao/api/dns-checker1/,2021-11, shuiguoweier ,DNS Checker,"Allow you to check the records of A, Mx, CNAME, SOA, TXT and more individually",,,
https://rapidapi.com/metavpn/api/meta-v1/,2021-11, metavpn ,meta-v1,Welcome to MetaVPN Universe,,,
https://rapidapi.com/daniellehnermail/api/chuck-norris-jokes/,2021-11, Daniel ,Chuck Norris Jokes,This API will return random Chuck Norris jokes in several languages. The amount of languages supported will grow over time. At the moment only German is supported.,,,
https://rapidapi.com/netdesignr-ltd-netdesignr-ltd-default/api/twitch-profile-stats/,2022-11, NetDesignr LTD ,Twitch profile stats,"If you're after getting the Twitch user total amount of followers, this is just the right API for you. 1. ```Get user profile details``` it allows you to grab the user ID from the user profile 2. ```Get user total followers``` it allows you to grab the total number of followers More endpoints from the Twitch profile to come",0.1,197 ms,100%
https://rapidapi.com/matykari-77sIT_ryVcG/api/sevit/,2023-11, Matyi Kari ,Sevit,An Ethereum web3 environment in the form of a REST API.,0.0,347 ms,100%
https://rapidapi.com/bobwear/api/fake-info-generator/,2021-11, Ensigma ,Fake Info Generator,"Generates fake info like address, name, etc",,,
https://rapidapi.com/rafaeljamil/api/stupid-quotes/,2021-11, rafaeljamil ,Stupid Quotes,API that returns stupid quotes (in English and Brazilian) from database,0.0,270 ms,100%
https://rapidapi.com/thieuxuanph/api/hellow3/,2022-11, thieuxuanph ,Hellow,Hellow,,,
https://rapidapi.com/phinguyen/api/geometric-calculation/,2021-11, phinguyen ,Geometric Calculation,"Contains collections of geometric algorithms such as Minkovski, Polygon operations, Polygon Collision with Circle, Delaunay Triangulation, Voronoi Diagram, Polyline Simplyfication,...",,,
https://rapidapi.com/prakhargupt00/api/quoteai/,2021-11, prakhar gupta ,QuoteAI,Inspiring short quotes on AI,0.1,316 ms,100%
https://rapidapi.com/NYT92/api/hanime-python-api/,2021-11, NYT92 ,hanime-python-api,Hanime API with more feature and free to use,0.0,38 ms,37%
https://rapidapi.com/techniquestudent-fopMQEtWlp3/api/fake-users5/,2021-11, Student Technique ,Fake users,This api will provide you some dummy user for your testing purpose.,0.0,901 ms,100%
https://rapidapi.com/engziada/api/timebasedotp/,2021-11, Muhammad Ziada ,TimebasedOTP,Generate a time based OTP,,,
https://rapidapi.com/nguyenlinhchi09-LHmK_ZrDh40/api/tech-job-search-api/,2021-11, Linh Chi Nguyen ,tech-job-search-api,searching for tech/product jobs,0.0,716 ms,0%
https://rapidapi.com/shashwath-KR/api/fake-users7/,2021-11, shashwath-KR ,Fake Users,This API provides fake users which you can use to test your application.,,,
https://rapidapi.com/ChaosBringer/api/ai-quotes2/,2021-11, ChaosBringer ,AI Quotes,Inspiring Quotes about AI,,,
https://rapidapi.com/mayur.kothawade/api/login9/,2021-11, Mayur Kothawade ,login,Sample Authentication API,,,
https://rapidapi.com/AFEX/api/afex2/,2021-11, Marcello Aondio ,AFEX,"AFEX API is designed for businesses that want to make frequent payments. By accessing our Payment Engine via our API, it allows customers to automate their end-to-end payment processes and rapidly deliver tailor-made solutions for our customers’ business directly. Payments are sent through AFEX’s intermediary banks, payment channels and are bound by applicable laws, regulations, clearing house rules or payment processing procedures. Our API is built by developers for developers making it straightforward to integrate with our systems. We’ve also designed our documentation to be easy to use. Our API calls are grouped into feature sets which you can see in the navigation here in our API documentation. What's new in this version? ------------ The latest release to support these changes was deployed to production on 28th of June, 2019. * A new *Production* API endpoint `https://webapi.afex.com/` was deployed with new load-balanced architecture for **increased stability** and **up-time** * New V2 launch of key methods including [api/V2/Quote](https://doc.api.afex.com/?version=latest#98c6fc20-a17a-4d42-b141-93c4f16c77bd), [api/V2/Trades/Create](https://doc.api.afex.com/?version=latest#91dda474-6ac2-435c-8999-e2f9302130c6), and [api/V2Payments/Create](https://doc.api.afex.com/?version=latest#9a8d48e2-012e-4f05-8f43-bb238cf705da) *Note that methods listed as ""V2"" are available through the Version 2 endpoint* * Enhanced beneficiary validation for **IBAN** and **SWIFTBIC/Routing Code** Technical Notes ------------ **Non-Prod:** V5.2019 was be deployed to the demo environment on the 6th of June, 2019. **TLS version support:** Effective June 2018, AFEX no longer supports TLS version 1.0. AFEX currently supports TLS 1.1 and 1.2 in both the demo and production environments. **Production server IP address range:** Effective August 2018, the AFEX production servers public IP range was changed to `136.179.35.192/26`. Getting Started ------------ **1. Read the documentation** We recommend that you read the API documentation in Developer Center to familiarize yourself with the API conventions and functionality along with exploring the examples. **2. Use the Demo API** The Demo API is connected to our test infrastructure. It returns real data but executes trades on your *demo account* and does not execute live transactions. A unique demo account will be provided to you as part of your engagement and will mirror the configuration needed for your *eventual* production account. Demo end points are: **AFEX API (beneficiaries, trading and payments):** Version 1.0 https://demo.api.afex.com:7890/ Version 2.0 https://WebApiDemo.afex.com/ **Partner API (account on-boarding):** Version 1.0** https://demo.api.afex.com:7885/ **3. Design & Development** Your dedicated Integrated Solutions Program Manager will assist with defining the optimum technical design based on your unique requirements.",,,
https://rapidapi.com/ikhsanul27/api/trainmyapi27/,2021-11, Ikhsanul ,trainmyAPI27,Just train,,,
https://rapidapi.com/dapp6269/api/calulator/,2021-11, Demo App ,Calulator,Calculator,,,
https://rapidapi.com/johnpepso/api/scrabble/,2021-11, John Milalr ,scrabble,word scrabble game,0.0,62 ms,0%
https://rapidapi.com/ShivaniSriram/api/myapi4/,2021-11, shivani ,myapi,api for my own use,,,
https://rapidapi.com/96abcd23/api/s-ytd/,2021-11, Abcd 1234 ,S-YTD,DOWNLOAD VIDEO EASILY ONLINE,,,
https://rapidapi.com/rishabhkalra96/api/banner-image/,2021-11, rishabh kalra ,banner-image,this api gets the conventional banner image for the websites,,,
https://rapidapi.com/atomLee1/api/fuse1/,2021-11, gsm1900.org ,fuse,This service support the use of the retrieveDeviceStatus resource including the blocked reason code and description,,,
https://rapidapi.com/anilkumarshah/api/getsource/,2021-11, anilkumarshah ,GetSource,GetSource,,,
https://rapidapi.com/khaledboussoffara/api/pp-react-js/,2021-11, khaled boussoffara ,pp-react-js,API for TEST,,,
https://rapidapi.com/megatokay/api/practicauipath/,2021-11, Jesus Bolivar ,PracticaUipath,Practica,,,
https://rapidapi.com/samrita.grg20/api/get-your-name/,2021-11, Laxmi Gurung ,Get Your Name,This is just an API for testing,,,
https://rapidapi.com/sankaranarayanan1990/api/testapi131/,2021-11, Sankaranarayanan ,TestAPI,Tet,0.1,0 ms,0%
https://rapidapi.com/AlexanderFBC/api/force-bridge/,2021-11, Alexander ,FORCE Bridge,Open API for Smart Manufacturing,,,
https://rapidapi.com/contato.viniciusolima/api/dev-teste/,2021-11, Vinicius Lima ,dev teste,teste para desenvolvedores,,,
https://rapidapi.com/andorehanyan333/api/chevereto/,2021-11, Andranik Rehanyan ,chevereto,chevereto,,,
https://rapidapi.com/kumar.ashish.sshr/api/demo-apis/,2021-11, Ashish ,Demo APIs,"**This documentation gives you real time experience on PayU Biz APIs you can interact with.** > On hitting the API with params, it gives you following: > i). Status code of API. > > ii). Response of the API in response body > > iii).Response headers > > iv). Schemas of the API > > v). CURL request > > vi). Error codes with reasons",,,
https://rapidapi.com/sharklatan/api/ignition/,2021-11, sharklatan ,Ignition,iOS Apps,,,
https://rapidapi.com/aloussoud/api/iparm/,2021-11, Ahmed Afkir ,Iparm,Iparm App,,,
https://rapidapi.com/stevehardaway/api/steve-hardaway/,2021-11, Steve Hardaway ,Steve Hardaway,Steve Hardaway,,,
https://rapidapi.com/www.sae.news/api/the-south-asian-express/,2021-11, The South Asian Express ,The South Asian Express,Wordpress v2 API,0.0,0 ms,0%
https://rapidapi.com/poojapooja.verma90/api/content1/,2021-11, Pooja Verma ,content,cms,,,
https://rapidapi.com/samuel870822/api/5970b9b3dcc757e61e53daec3e720974/,2021-11, 劉岳軒 ,5970b9b3dcc757e61e53daec3e720974,Face Detect,,,
https://rapidapi.com/Spont/api/134/,2021-11, Spont ,13,"This is the API for Spont Horeca. When you are a Spont user, you can request for an API KEY and your Company ID",0.0,"1,756 ms",100%
https://rapidapi.com/parth.bhatt20/api/mypersonal/,2021-11, parth bhatt ,MyPersonal,My API,,,
https://rapidapi.com/diegotest/api/futbolivia/,2021-11, diegotest ,Futbolivia,Sirve canchas,,,
https://rapidapi.com/gonenUN/api/apiservice-on-prod/,2021-11, Diplay ,APIService on Prod,API Service,,,
https://rapidapi.com/usermanual/api/user-manual/,2021-11, Bob Singor ,User Manual,The User Manuals API allows developers to embed user manuals onto web pages.,,,
https://rapidapi.com/zameddy/api/zec-union/,2021-11, zameddy ,zec union,zone d'épanouissement des Couples,,,
https://rapidapi.com/soham.d94/api/onehop-sms/,2021-11, soham.d94 ,Onehop SMS,The listed REST API calls give you access to the entire Onehop Platform stack. These API calls are designed to make it easy to add a rich in-app messaging feature to your application.,,,
https://rapidapi.com/felix727/api/agc/,2023-01, felix727 ,Agc,Test,,,
https://rapidapi.com/usw/api/usw-app/,2021-11, usw ,USW App,Simple Rest API for developers,,,
https://rapidapi.com/nabsterdz/api/ondexgo-market/,2021-11, nabsterdz ,ondexgo market,ON DEX GO is a blog for the Games offer and new articles and exclusive threads for Gamers,,,
https://rapidapi.com/briced750/api/bet-codigo-bonus/,2021-11, briced750 ,bet codigo bonus,This is the beta version of codigobet website,,,
https://rapidapi.com/moocher.io/api/email-reputation/,2021-11, Diego ,Email Reputation,"This API endpoint checks if an Email has been used in spam and fraudulent activities. It scores the reputation of the email: the more negative the score, the riskier the email. A positive score normally its an email with good reputation, and a zero score means neutral. Moocher.io is a set of lists like IP, domains, emails, passwords, creditcard BIN/IIN. Some of them marked as 'abusers' by several groups and initiatives of users and communities, and others used to filter out potential abusers. Moocher.io can be defined as a Look up as a Service for developers and product companies that want to know in realtime if their existing or potential users have been classified as 'abusers' by one or more of these lists.",0.0,31 ms,0%
https://rapidapi.com/moocher.io/api/domain-reputation/,2021-11, Diego ,Domain Reputation,"This API endpoint checks if a Domain name has been used as email registration, source of attacks and others malicious activities. It scores the reputation of the domain: the more negative the score, the riskier the domain. A positive score normally its a domain with good reputation, and a zero score means neutral. Moocher.io is a set of lists like IP, domains, emails, passwords, creditcard BIN/IIN. Some of them marked as 'abusers' by several groups and initiatives of users and communities, and others used to filter out potential abusers. Moocher.io can be defined as a Look up as a Service for developers and product companies that want to know in realtime if their existing or potential users have been classified as 'abusers' by one or more of these lists.",0.0,22 ms,0%
https://rapidapi.com/moocher.io/api/malicious-ip/,2021-11, Diego ,Malicious IP,"This API endpoint checks if an IP version 4 has been used in any abusing activities like spam, attacks, hacking activities and others. Moocher.io is a set of lists like IP, domains, emails, passwords, creditcard BIN/IIN. Some of them marked as 'abusers' by several groups and initiatives of users and communities, and others used to filter out potential abusers. Moocher.io can be defined as a Look up as a Service for developers and product companies that want to know in realtime if their existing or potential users have been classified as 'abusers' by one or more of these lists.",0.0,21 ms,0%
https://rapidapi.com/kashyap32/api/youtubetomp3/,2021-11, kashyap32 ,youtubeTOmp3,Convert Any video into Mp3 using youtubeinmp3. Search the song convert first video into MP3,0.1,12 ms,0%
https://rapidapi.com/windex/api/data-matching-algorithm/,2021-11, windex ,Data Matching Algorithm,"Finds the most similar objects in the dataset, based on a given set of values and weights.",,,
https://rapidapi.com/orthosie/api/font-hinting/,2021-11, orthosie ,Font Hinting,"Font hinting (also known as instructing) is the use of mathematical instructions to adjust the display of an outline font so that it lines up with a rasterized grid. At low screen resolutions, hinting is critical for producing clear, legible text. Use this API to integrate font hinting in your workflow.",,,
https://rapidapi.com/kwaazaar/api/helloveh/,2021-11, kwaazaar ,HelloVeh,Can say hello to you,0.0,48 ms,0%
https://rapidapi.com/halipso/api/opskins/,2021-11, halipso ,OPSKINS,OPSKINS custom API,,,
https://rapidapi.com/thibaultcha/api/fortunecow/,2021-11, thibaultcha ,Fortunecow,A fun API combining cowsay and fortune cookies.,,,
https://rapidapi.com/LinguLab/api/lingulab/,2021-11, LinguLab ,Lingulab,"Have fun optimizing your content with LinguLab! Understandable and to the point : Based on scientific criteria, LinguLab verifies the understandability of your content. You get wording suggestions that you can accept with one single click. Impress with structure : Get your content into perfect shape! So you attract the attention of your readers and leave a positive impression at first glance. Content for readers and machines : Optimize your texts on the fly, with up to three keywords. Save time and money for subsequent SEO campaigns.",,,
