API名称,API链接,API_Host,Endpoint名称,Endpoint描述,Endpoint种类,Endpoint必须参数,Endpoint可选参数
Comparable Companies,https://rapidapi.com/ComparableCompanies/api/comparable-companies/,comparable-companies.p.rapidapi.com,GET:/logo,The Logo API is used to show company logos in the frontend. The API link is already included in results returned by the Similar companies API.,logo,"[{'参数名': ['domain'], '参数类型': ['STRING'], '参数注意事项': ['(Required) The company domain for which you want to retrieve a logo for']}]",[{}]
New York DMV Open Data API,https://rapidapi.com/meshooidsf/api/new-york-dmv-open-data-api/,new-york-dmv-open-data-api.p.rapidapi.com,GET:search,Search the new york DMV dataset (2023),default,[{}],"[{'参数名': ['apikey', 'state', 'plate'], '参数类型': ['STRING', 'STRING', 'STRING'], '参数注意事项': ['', '', '']}]"
Crunchbase,https://rapidapi.com/shake-chillies-shake-chillies-default/api/crunchbase4/,crunchbase4.p.rapidapi.com,POST:Company details,Get company details such as,,[{}],[{}]
Realtor,https://rapidapi.com/epctex-epctex-default/api/realtor26/,realtor26.p.rapidapi.com,GET:getProperty,Returns all the detailed information of a property by its permalink,Property,"[{'参数名': ['permalink'], '参数类型': ['STRING'], '参数注意事项': ['Property Permalink']}]",[{}]
Realtor,https://rapidapi.com/epctex-epctex-default/api/realtor26/,realtor26.p.rapidapi.com,GET:searchPropertyForSell,Returns all the properties for sell that matches up by the filters,Property,[{}],"[{'参数名': ['minPrice', 'maxBed', 'minBath', 'maxBath', 'sort', 'type', 'minBed', 'maxPrice', 'page'], '参数类型': ['STRING', 'STRING', 'STRING', 'STRING', 'STRING', 'STRING', 'STRING', 'STRING', 'STRING'], '参数注意事项': ['Minimum price filter for search results', 'Maximum beds filter for search results', 'Minimum baths filter for search results', 'Maximum baths filter for search results', 'Sorting of the search results', 'Type of the properties', 'Minimum beds filter for search results', 'Maximum price filter for search results', 'Page for the pagination of the search results']}]"
Realtor,https://rapidapi.com/epctex-epctex-default/api/realtor26/,realtor26.p.rapidapi.com,GET:searchPropertyForRent,Returns all the properties for rent that matches up by the filters,Property,[{}],"[{'参数名': ['sort', 'type', 'maxPrice', 'minPrice', 'page', 'maxBath', 'moveInBy', 'maxBed', 'minBed', 'minBath'], '参数类型': ['STRING', 'STRING', 'STRING', 'STRING', 'STRING', 'STRING', 'STRING', 'STRING', 'STRING', 'STRING'], '参数注意事项': ['Sorting of the search results', 'Type of the properties', 'Maximum price filter for search results', 'Minimum price filter for search results', 'Page for the pagination of the search results', 'Maximum baths filter for search results', 'Move in date for the property. Availability filter.', 'Maximum beds filter for search results', 'Minimum beds filter for search results', 'Minimum baths filter for search results']}]"
Realtor,https://rapidapi.com/epctex-epctex-default/api/realtor26/,realtor26.p.rapidapi.com,GET:searchSoldProperties,Returns all the sold properties that matches up by the filters,Property,[{}],"[{'参数名': ['minPrice', 'type', 'page', 'minBath', 'maxPrice', 'maxBed', 'maxBath', 'minBed', 'sort'], '参数类型': ['STRING', 'STRING', 'STRING', 'STRING', 'STRING', 'STRING', 'STRING', 'STRING', 'STRING'], '参数注意事项': ['Minimum price filter for search results', 'Type of the properties', 'Page for the pagination of the search results', 'Minimum baths filter for search results', 'Maximum price filter for search results', 'Maximum beds filter for search results', 'Maximum baths filter for search results', 'Minimum beds filter for search results', 'Sorting of the search results']}]"
Realtor,https://rapidapi.com/epctex-epctex-default/api/realtor26/,realtor26.p.rapidapi.com,GET:locationLookup,Lookup for locations that are available to use. This endpoint's key attribute is necessary for search requests.,Location,"[{'参数名': ['location'], '参数类型': ['STRING'], '参数注意事项': ['Location for the search results']}]",[{}]
LinkedIn Profile Data,https://rapidapi.com/wazznco-wazznco-default/api/linkedin-profile-data2/,linkedin-profile-data2.p.rapidapi.com,GET:Profile data,Get LinkedIn profile data with username,,"[{'参数名': ['username'], '参数类型': ['STRING'], '参数注意事项': ['']}]",[{}]
Public Holidays,https://rapidapi.com/standingapi-standingapi-default/api/public-holidays3/,public-holidays3.p.rapidapi.com,GET:Public Holiday Endpoint,"The Public Holiday API allows you to gett the public, local, religious, and other holidays of a particular country.",,"[{'参数名': ['country', 'year', 'month', 'day'], '参数类型': ['STRING', 'STRING', 'STRING', 'STRING'], '参数注意事项': [""The country's two letter ISO 3166-1 alpha-2 code."", 'The year to get the holiday(s) from.', 'The month to get the holiday(s) from, in the format of 1-12 (e.g., 1 is January, 2 is February, etc).', 'he day to get the holiday(s) from, in the format of 1-31.']}]",[{}]
Apartments.com,https://rapidapi.com/epctex-epctex-default/api/apartments-com1/,apartments-com1.p.rapidapi.com,GET:searchProperty,Returns all the properties that matches up by the filters,Property,[{}],"[{'参数名': ['minRent', 'minBed', 'maxRent', 'page', 'maxBed', 'maxBath', 'minBath', 'sort'], '参数类型': ['STRING', 'STRING', 'STRING', 'STRING', 'STRING', 'STRING', 'STRING', 'STRING'], '参数注意事项': ['Minimum rent filter for search results', 'Minimum beds filter for search results', 'Maximum rent filter for search results', 'Page for the pagination of the search results', 'Maximum beds filter for search results', 'Maximum baths filter for search results', 'Minimum baths filter for search results', 'Sort the search results']}]"
Apartments.com,https://rapidapi.com/epctex-epctex-default/api/apartments-com1/,apartments-com1.p.rapidapi.com,GET:getProperty,Returns all the detailed information of a property by its ID,Property,"[{'参数名': ['propertyId'], '参数类型': ['STRING'], '参数注意事项': ['Property ID']}]",[{}]
Apartments.com,https://rapidapi.com/epctex-epctex-default/api/apartments-com1/,apartments-com1.p.rapidapi.com,GET:getPropertyImages,Returns all the images and virtual tour links of a property by its ID,Image,"[{'参数名': ['propertyId'], '参数类型': ['STRING'], '参数注意事项': ['Property ID']}]",[{}]
Apartments.com,https://rapidapi.com/epctex-epctex-default/api/apartments-com1/,apartments-com1.p.rapidapi.com,GET:getPropertyReviews,Returns all the reviews and comments of a property by its ID,Review,[{}],"[{'参数名': ['page'], '参数类型': ['STRING'], '参数注意事项': ['Page of the list']}]"
Bayut,https://rapidapi.com/apidojo/api/bayut/,bayut.p.rapidapi.com,GET:auto-complete,Get suggestions of locations by term or phrase,,[{}],"[{'参数名': ['hitsPerPage', 'page', 'lang'], '参数类型': ['NUMBER', 'NUMBER', 'STRING'], '参数注意事项': ['For paging purpose', 'For paging purpose', 'One of the following : en|ar']}]"
Bayut,https://rapidapi.com/apidojo/api/bayut/,bayut.p.rapidapi.com,GET:properties/list,List properties with options and filters,,[{}],"[{'参数名': ['purpose', 'hitsPerPage', 'page', 'lang', 'sort', 'rentFrequency', 'categoryExternalID', 'agencyExternalIDs', 'priceMin', 'priceMax', 'areaMin', 'areaMax', 'roomsMin', 'roomsMax', 'bathsMin', 'bathsMax', 'furnishingStatus', 'hasVideo', 'hasFloorPlan', 'hasPanorama'], '参数类型': ['STRING', 'NUMBER', 'NUMBER', 'STRING', 'STRING', 'STRING', 'NUMBER', 'STRING', 'NUMBER', 'NUMBER', 'NUMBER', 'NUMBER', 'NUMBER', 'NUMBER', 'NUMBER', 'NUMBER', 'STRING', 'BOOLEAN', 'BOOLEAN', 'BOOLEAN'], '参数注意事项': ['One of the following : for-rent|for-sale', 'For paging purpose', 'For paging purpose', 'One of the following : en|ar', 'One of the following : price-desc|price-asc|city-level-score|date-desc|verified-score', 'One of the following : monthly|yearly|weekly|daily', 'Apartment -> 4|Townhouses -> 16|Villas -> 3|Penthouses -> 18|Hotel Apartments -> 21|Villa Compound -> 19|Residential Plot -> 14|Residential Floor -> 12|Residential Building -> 17|Office -> 5|Shop -> 6|Warehouse -> 7|Labour camp -> 9|Commercial Villa -> 25|Bulk Units -> 20|Commercial Plot -> 15|Commercial Floor -> 13|Commercial Building -> 10|Factory -> 8|Industrial Land -> 22|Mixed Use Land -> 23|Showroom -> 24|Other Commercial -> 11', 'The externalID fields returned in …/agencies/list endpoint. Separated by comma for multiple agencies. Ex : 7737,5002', '', '', '', '', '', '', '', '', 'One of the following : unfurnished|furnished', '', '', '']}]"
Bayut,https://rapidapi.com/apidojo/api/bayut/,bayut.p.rapidapi.com,GET:properties/detail,Get detail information of a property,,"[{'参数名': ['externalID'], '参数类型': ['STRING'], '参数注意事项': ['The value of externalID returned in …./properties/list endpoint']}]",[{}]
Bayut,https://rapidapi.com/apidojo/api/bayut/,bayut.p.rapidapi.com,GET:agencies/list,List agencies or search for agencies by name,,[{}],"[{'参数名': ['query', 'hitsPerPage', 'page', 'lang'], '参数类型': ['STRING', 'NUMBER', 'NUMBER', 'STRING'], '参数注意事项': ['Any term or phrase that you are familiar with', 'For paging purpose', 'For paging purpose', 'One of the following : en|ar']}]"
Bayut,https://rapidapi.com/apidojo/api/bayut/,bayut.p.rapidapi.com,GET:agencies/get-listings,Get listing belonging to an agency,,[{}],"[{'参数名': ['hitsPerPage', 'page', 'purpose', 'lang', 'rentFrequency', 'completionStatus', 'sort', 'categorySlug'], '参数类型': ['NUMBER', 'NUMBER', 'STRING', 'STRING', 'STRING', 'STRING', 'STRING', 'STRING'], '参数注意事项': ['For paging purpose', 'For paging purpose', 'One of the following : for-rent|for-sale', 'One of the following : en|ar', 'One of the following : monthly|yearly|weekly|daily\nThe parameter only takes effect if purpose is for-rent', 'One of the following : completed|under-construction\nThis parameter only takes effect if purpose is for-sale', 'One of the following : price-desc|price-asc|city-level-score|date-desc|date-asc|verified-score', 'One of the following : commerical-properties|mixed-use-land|factories|commercial-floors|bulk-units|labour-camps|shops|showrooms|industrial-land|commercial-buildings|commercial-plots|commercial-villas|warehouses|offices|residential-floors|hotel-apartments|penthouse|villas|residential-building|residential-plots|villa-compound|townhouses|apartments']}]"
Email Validation,https://rapidapi.com/hassan.cs91/api/email-validation24/,email-validation24.p.rapidapi.com,GET:Validate Emails,Validate any email address,,[{}],"[{'参数名': ['email'], '参数类型': ['STRING'], '参数注意事项': ['']}]"
Realty in AU,https://rapidapi.com/apidojo/api/realty-in-au/,realty-in-au.p.rapidapi.com,GET:auto-complete,Get suggestions by term or phrase. The returned data will be used with …/properties/list endpoint,,"[{'参数名': ['query'], '参数类型': ['STRING'], '参数注意事项': ['Any term or phrase you are familiar with. It can be an address to get the property id directly to use with …/properties/detail endpoint.']}]",[{}]
Realty in AU,https://rapidapi.com/apidojo/api/realty-in-au/,realty-in-au.p.rapidapi.com,GET:properties/list,List properties with options and filters,,[{}],"[{'参数名': ['page', 'pageSize', 'sortType', 'propertyTypes', 'surroundingSuburbs', 'minimumBedrooms', 'maximumBedrooms', 'minimumLandSize', 'minimumBathroom', 'minimumCars', 'minimumPrice', 'maximumPrice', 'ex-under-contract', 'constructionStatus', 'keywords'], '参数类型': ['NUMBER', 'NUMBER', 'STRING', 'STRING', 'BOOLEAN', 'NUMBER', 'NUMBER', 'NUMBER', 'NUMBER', 'NUMBER', 'NUMBER', 'NUMBER', 'BOOLEAN', 'STRING', 'STRING'], '参数注意事项': ['For paging purpose', 'The number of items returned per response. For paging purpose (max is 30)', 'One of the following relevance|new-asc|new-desc|price-asc|price-desc', 'Ignore or one of the following : townhouse|unit apartment|retire|acreage|land|unitblock|house|villa|rural. Separated by comma for multiple options. Ex : townhouse,house,villa', '', '', '', 'In m2', '', '', '', '', '', 'Ignore or one of the following : established|new', 'Facilities you are looking for. Separated by comma for multiple options. Ex : pool,garage,etc…']}]"
Realty in AU,https://rapidapi.com/apidojo/api/realty-in-au/,realty-in-au.p.rapidapi.com,GET:properties/detail,Get detailed information of a property,,"[{'参数名': ['id'], '参数类型': ['NUMBER'], '参数注意事项': [""The value of 'listingId' field returned in …/properties/list endpoint or 'id' field returned in …/auto-complete endpoint with type as listing""]}]",[{}]
Realty in AU,https://rapidapi.com/apidojo/api/realty-in-au/,realty-in-au.p.rapidapi.com,GET:properties/v2/lookup,Look for off-market property by id,,"[{'参数名': ['id'], '参数类型': ['NUMBER'], '参数注意事项': [""The value of 'id' field returned in …/auto-complete endpoint with display as 'Property history'""]}]",[{}]
Realty in AU,https://rapidapi.com/apidojo/api/realty-in-au/,realty-in-au.p.rapidapi.com,GET:properties/lookup (Deprecating),Look for off-market property by id,,"[{'参数名': ['id'], '参数类型': ['NUMBER'], '参数注意事项': [""The value of 'id' field returned in …/auto-complete endpoint with display as 'Property history'""]}]",[{}]
Realty in AU,https://rapidapi.com/apidojo/api/realty-in-au/,realty-in-au.p.rapidapi.com,GET:schools/list,List schools around a GEO location,,"[{'参数名': ['lat', 'lon'], '参数类型': ['NUMBER', 'STRING'], '参数注意事项': ['The latitude of GEO location', 'The longitude of GEO location']}]",[{}]
AI Resume Parser & Extractor,https://rapidapi.com/one-api-one-api-default/api/ai-resume-parser-extractor/,ai-resume-parser-extractor.p.rapidapi.com,POST:pdf-Base64,Endpoint: /pdf-base64,default,[{}],[{}]
AI Resume Parser & Extractor,https://rapidapi.com/one-api-one-api-default/api/ai-resume-parser-extractor/,ai-resume-parser-extractor.p.rapidapi.com,POST:pdfUri,Endpoint: /pdf-uri,default,[{}],[{}]
AI Resume Parser & Extractor,https://rapidapi.com/one-api-one-api-default/api/ai-resume-parser-extractor/,ai-resume-parser-extractor.p.rapidapi.com,POST:pdfUpload,Endpoint: /pdf-upload,default,[{}],[{}]
Powerful GSTIN Tool,https://rapidapi.com/velocityhub/api/powerful-gstin-tool/,powerful-gstin-tool.p.rapidapi.com,GET:Search GST by Company Name,Retrieve GST numbers and corresponding company names that match your search term,,"[{'参数名': ['name'], '参数类型': ['STRING'], '参数注意事项': ['']}]",[{}]
Powerful GSTIN Tool,https://rapidapi.com/velocityhub/api/powerful-gstin-tool/,powerful-gstin-tool.p.rapidapi.com,GET:Retrieve GST Details,Retrieves GST details for a given entity based on their GSTIN (Goods and Services Tax Identification Number),,"[{'参数名': ['GSTIN'], '参数类型': ['STRING'], '参数注意事项': ['']}]",[{}]
Powerful GSTIN Tool,https://rapidapi.com/velocityhub/api/powerful-gstin-tool/,powerful-gstin-tool.p.rapidapi.com,GET:Retrieve GST Details - Mini,Retrieves basic GST details for a given entity based on their GSTIN (Goods and Services Tax Identification Number). This endpoint provides a subset of GST information.,,"[{'参数名': ['GSTIN'], '参数类型': ['STRING'], '参数注意事项': ['']}]",[{}]
Powerful GSTIN Tool,https://rapidapi.com/velocityhub/api/powerful-gstin-tool/,powerful-gstin-tool.p.rapidapi.com,GET:Verify GSTIN Status,This endpoint allows you to verify the status of a GSTIN (Goods and Services Tax Identification Number). It provides information on whether the specified GSTIN is currently active or not.,,"[{'参数名': ['GSTIN'], '参数类型': ['STRING'], '参数注意事项': ['']}]",[{}]
Powerful GSTIN Tool,https://rapidapi.com/velocityhub/api/powerful-gstin-tool/,powerful-gstin-tool.p.rapidapi.com,GET:Validate GSTIN Format,This endpoint allows you to verify whether a provided GSTIN (Goods and Services Tax Identification Number) is in a valid format. It checks whether the format of the GSTIN conforms to the established standards and regulations.,,"[{'参数名': ['GSTIN'], '参数类型': ['STRING'], '参数注意事项': ['']}]",[{}]
Powerful GSTIN Tool,https://rapidapi.com/velocityhub/api/powerful-gstin-tool/,powerful-gstin-tool.p.rapidapi.com,GET:Retrieve PAN Information from GSTIN,Retrieve PAN (Permanent Account Number) information associated with a given GSTIN (Goods and Services Tax Identification Number).,,"[{'参数名': ['GSTIN'], '参数类型': ['STRING'], '参数注意事项': ['']}]",[{}]
Powerful GSTIN Tool,https://rapidapi.com/velocityhub/api/powerful-gstin-tool/,powerful-gstin-tool.p.rapidapi.com,GET:Retrieve Address Information from GSTIN,"Retrieve address information associated with a given GSTIN (Goods and Services Tax Identification Number). GSTINs often have multiple associated addresses, including a principal place of business and additional addresses.",,"[{'参数名': ['GSTIN'], '参数类型': ['STRING'], '参数注意事项': ['']}]",[{}]
Realty in US,https://rapidapi.com/apidojo/api/realty-in-us/,realty-in-us.p.rapidapi.com,GET:locations/v2/auto-complete,"Get auto complete suggestions by city, ward, street name to pass in other endpoints. This endpoint also helps to get a specific property id by its address",,[{}],"[{'参数名': ['limit'], '参数类型': ['NUMBER'], '参数注意事项': ['The number of items per response, for paging purpose']}]"
Realty in US,https://rapidapi.com/apidojo/api/realty-in-us/,realty-in-us.p.rapidapi.com,GET:locations/auto-complete (Deprecated),"Get auto complete suggestions by city, ward, street name to pass in other endpoints. This endpoint also helps to get a specific property id by its address",,"[{'参数名': ['input'], '参数类型': ['STRING'], '参数注意事项': ['Name of cities, districts, places']}]",[{}]
Realty in US,https://rapidapi.com/apidojo/api/realty-in-us/,realty-in-us.p.rapidapi.com,POST:properties/v3/list,"List properties for sale, rent, sold with options and filters",properties,[{}],[{}]
Realty in US,https://rapidapi.com/apidojo/api/realty-in-us/,realty-in-us.p.rapidapi.com,GET:properties/v3/list-similar-homes,List similar homes,properties,[{}],"[{'参数名': ['limit', 'status'], '参数类型': ['NUMBER', 'STRING'], '参数注意事项': ['The number of items per response, for paging purpose', 'One of the following : for_sale|ready_to_build|for_rent|sold|off_market|other|new_community']}]"
Realty in US,https://rapidapi.com/apidojo/api/realty-in-us/,realty-in-us.p.rapidapi.com,GET:properties/v3/detail,Get property detail information (include new Home Value feature),properties,[{}],"[{'参数名': ['listing_id'], '参数类型': ['STRING'], '参数注意事项': ['The value of listing_id field returned in …/properties/…/list endpoint']}]"
Realty in US,https://rapidapi.com/apidojo/api/realty-in-us/,realty-in-us.p.rapidapi.com,GET:properties/v3/get-photos,Get photos of a property,properties,"[{'参数名': ['property_id'], '参数类型': ['STRING'], '参数注意事项': ['The value of property_id field returned in …/properties/…/list endpoint']}]",[{}]
Realty in US,https://rapidapi.com/apidojo/api/realty-in-us/,realty-in-us.p.rapidapi.com,GET:properties/v3/get-commute-time,Get commute time to travel to a location,properties,[{}],"[{'参数名': ['transportation_type', 'with_traffic'], '参数类型': ['STRING', 'BOOLEAN'], '参数注意事项': ['One of the following : bicycling|driving|transit|walking', 'Whether or not calculate the time in rush hours']}]"
Realty in US,https://rapidapi.com/apidojo/api/realty-in-us/,realty-in-us.p.rapidapi.com,GET:properties/v3/get-surroundings,Get surroundings data around a property,properties,[{}],"[{'参数名': ['enable_flood'], '参数类型': ['BOOLEAN'], '参数注意事项': ['Whether or not include flood information']}]"
Realty in US,https://rapidapi.com/apidojo/api/realty-in-us/,realty-in-us.p.rapidapi.com,GET:properties/list-sold (Deprecated),List sold properties,properties,[{}],"[{'参数名': ['postal_code', 'sort', 'prop_type', 'radius', 'age_min', 'age_max', 'sqft_min', 'sqft_max', 'lot_sqft_min', 'lot_sqft_max', 'price_min', 'price_max', 'lat_max', 'lat_min', 'lng_max', 'lng_min'], '参数类型': ['STRING', 'STRING', 'STRING', 'NUMBER', 'NUMBER', 'NUMBER', 'NUMBER', 'NUMBER', 'NUMBER', 'NUMBER', 'NUMBER', 'NUMBER', 'NUMBER', 'NUMBER', 'NUMBER', 'STRING'], '参数注意事项': ['Zip code or postal code (do not use this parameter with city and state_code)', 'One of the followings : price_low|price_high', 'One of the followings (separated by comma for multiple values): single_family, condo, mobile, multi_family, farm, land', 'Radius in miles to look for properties', 'Min age of home', 'Max age of home', 'Min size of the properties', 'Max size of the properties', 'Min Lot/Acreage size', 'Max Lot/Acreage size', 'Option filter by setting min price', 'Option filter by setting max price', 'Look for properties in bounding box, this is the max latitude of the coordinate.\nHas no affect if postal_code, or city or state_code parameter has value.', 'Look for properties in bounding box, this is the min latitude of the coordinate.\nHas no affect if postal_code, or city or state_code parameter has value.', 'Look for properties in bounding box, this is the max longitude of the coordinate.\nHas no affect if postal_code, or city or state_code parameter has value.', 'Look for properties in bounding box, this is the min longitude of the coordinate.\nHas no affect if postal_code, or city or state_code parameter has value.']}]"
Realty in US,https://rapidapi.com/apidojo/api/realty-in-us/,realty-in-us.p.rapidapi.com,GET:properties/v2/list-sold (Deprecated),List sold properties,properties,[{}],"[{'参数名': ['postal_code', 'sort', 'prop_type', 'radius', 'baths_min', 'beds_min', 'price_min', 'price_max', 'lot_sqft_min', 'lot_sqft_max', 'age_min', 'age_max', 'sqft_min', 'sqft_max', 'lat_max', 'lat_min', 'lng_max', 'lng_min'], '参数类型': ['STRING', 'STRING', 'STRING', 'NUMBER', 'NUMBER', 'NUMBER', 'NUMBER', 'NUMBER', 'NUMBER', 'NUMBER', 'NUMBER', 'NUMBER', 'NUMBER', 'NUMBER', 'NUMBER', 'NUMBER', 'NUMBER', 'NUMBER'], '参数注意事项': ['Zip code or postal code (do not use this parameter with city and state_code)', 'One of the followings : sold_date|beds_high|price_low|price_high|lot_sqft_high', 'One of the followings (separated by comma for multiple values): single_family,multi_family,condo,mobile,land,farm,other', 'Radius in miles to look for properties (1 to 20)', 'Min baths of properties', 'Min beds of properties', 'Option filter by setting min price', 'Option filter by setting max price', 'Min Lot/Acreage size', 'Max Lot/Acreage size', 'Min age of home', 'Max age of home', 'Min size of the properties', 'Max size of the properties', 'Look for properties in bounding box, this is the max latitude of the coordinate.\nHas no affect if postal_code, or city or state_code parameter has value.', 'Look for properties in bounding box, this is the min latitude of the coordinate.\nHas no affect if postal_code, or city or state_code parameter has value.', 'Look for properties in bounding box, this is the max longitude of the coordinate.\nHas no affect if postal_code, or city or state_code parameter has value.', 'Look for properties in bounding box, this is the min longitude of the coordinate.\nHas no affect if postal_code, or city or state_code parameter has value.']}]"
