API名称,API链接,API_Host,Endpoint名称,Endpoint描述,Endpoint种类,Endpoint必须参数,Endpoint可选参数
currencylayer,https://rapidapi.com/apilayer/api/currencylayer/,apilayer-currencylayer-v1.p.rapidapi.com,"GET:""timeframe"" endpoint - request exchange rates for a specified timeframe","Appending a valid ""start_date"" and ""end_date"", the API's ""timeframe"" endpoint will return exchange rates for this specified period.",,[{}],"[{'参数名': ['currencies', 'source'], '参数类型': ['STRING', 'STRING'], '参数注意事项': ['""currencies"" - request only specific currencies (e.g. EUR,CAD,GBP)', '""source"" - the currency to which all other exchange rates are relative (""Source Currency"")']}]"
WindSchedulingAPI,https://rapidapi.com/windopenapi/api/windschedulingapi/,windschedulingapi.p.rapidapi.com,POST:scheduling pro,The Scheduling API Pro Version.Tasks limitation: Unlimited,scheduling,[{}],[{}]
WindSchedulingAPI,https://rapidapi.com/windopenapi/api/windschedulingapi/,windschedulingapi.p.rapidapi.com,POST:scheduling demo,"The Scheduling API Demo Version, Tasks limitation: 100 tasks/per request",scheduling,[{}],[{}]
https://moneysaverhelp.co.uk/,https://rapidapi.com/sourbean42/api/https-moneysaverhelp-co-uk/,https-moneysaverhelp-co-uk.p.rapidapi.com,POST:create,create,,[{}],[{}]
Domain Name Generator,https://rapidapi.com/sskrishkk411/api/domain-name-generator/,domain-name-generator.p.rapidapi.com,POST:Create,Generate Unique Domain Names For Your Business In Seconds,,[{}],[{}]
UAE Real Estate,https://rapidapi.com/dotlas-dotlas-default/api/uae-real-estate/,uae-real-estate.p.rapidapi.com,GET:home__get,A home endpoint that returns the API home page JSON.,,[{}],[{}]
UAE Real Estate,https://rapidapi.com/dotlas-dotlas-default/api/uae-real-estate/,uae-real-estate.p.rapidapi.com,GET:get_districts_catalogue_districts_get,About:,API Catalogue,"[{'参数名': ['city'], '参数类型': ['STRING'], '参数注意事项': ['']}]",[{}]
UAE Real Estate,https://rapidapi.com/dotlas-dotlas-default/api/uae-real-estate/,uae-real-estate.p.rapidapi.com,GET:get_property_types_catalogue_property_types_get,About:,API Catalogue,[{}],[{}]
UAE Real Estate,https://rapidapi.com/dotlas-dotlas-default/api/uae-real-estate/,uae-real-estate.p.rapidapi.com,GET:get_cities_catalogue_cities_get,About:,API Catalogue,[{}],[{}]
UAE Real Estate,https://rapidapi.com/dotlas-dotlas-default/api/uae-real-estate/,uae-real-estate.p.rapidapi.com,GET:get_property_sub_types_catalogue_property_sub_types_get,About:,API Catalogue,"[{'参数名': ['property_type'], '参数类型': ['STRING'], '参数注意事项': ['']}]",[{}]
UAE Real Estate,https://rapidapi.com/dotlas-dotlas-default/api/uae-real-estate/,uae-real-estate.p.rapidapi.com,GET:get_property_evaluation_districts_rent_compare_get,About:,Districts,"[{'参数名': ['property_type', 'price', 'longitude', 'property_sub_type', 'latitude', 'bedrooms', 'size'], '参数类型': ['STRING', 'NUMBER', 'NUMBER', 'STRING', 'NUMBER', 'NUMBER', 'NUMBER'], '参数注意事项': ['', '', '', '', '', '', '']}]",[{}]
UAE Real Estate,https://rapidapi.com/dotlas-dotlas-default/api/uae-real-estate/,uae-real-estate.p.rapidapi.com,GET:get_rental_prices_districts_rent_history_get,About:,Districts,"[{'参数名': ['bedrooms', 'latitude', 'property_sub_type', 'longitude', 'property_type'], '参数类型': ['NUMBER', 'NUMBER', 'STRING', 'NUMBER', 'STRING'], '参数注意事项': ['', '', '', '', '']}]",[{}]
UAE Real Estate,https://rapidapi.com/dotlas-dotlas-default/api/uae-real-estate/,uae-real-estate.p.rapidapi.com,GET:get_description_districts_describe_get,About:,Districts,"[{'参数名': ['district', 'city'], '参数类型': ['STRING', 'STRING'], '参数注意事项': ['', '']}]",[{}]
UAE Real Estate,https://rapidapi.com/dotlas-dotlas-default/api/uae-real-estate/,uae-real-estate.p.rapidapi.com,GET:locate_district_districts_locate_get,About:,Districts,"[{'参数名': ['latitude', 'longitude'], '参数类型': ['NUMBER', 'NUMBER'], '参数注意事项': ['', '']}]",[{}]
Biz News API,https://rapidapi.com/srmarohit/api/biz-news-api/,biz-news-api.p.rapidapi.com,GET:Get /news,It returns the entire market related data from the multiple resources.,,[{}],"[{'参数名': ['q'], '参数类型': ['STRING'], '参数注意事项': ['']}]"
Biz News API,https://rapidapi.com/srmarohit/api/biz-news-api/,biz-news-api.p.rapidapi.com,GET:GET /news/{source},It returns the news data based on the resource which you passed as a parameter at url.,,"[{'参数名': ['source'], '参数类型': ['STRING'], '参数注意事项': ['']}]",[{}]
Random 1001 Functions,https://rapidapi.com/tec-2-scale-tec-2-scale-default/api/random-1001-functions/,random-1001-functions.p.rapidapi.com,POST:Randomnumericstring,"Experience our Random Numeric String generator, a powerful tool designed to produce unique sequences of numbers with a customizable length. Ideal for developers, testers, or anyone in need of random numeric data for various applications.",,[{}],[{}]
Random 1001 Functions,https://rapidapi.com/tec-2-scale-tec-2-scale-default/api/random-1001-functions/,random-1001-functions.p.rapidapi.com,POST:Generate Number,"Experience the convenience of our GenerateDecimal service, designed to produce random numbers within a specified range. Ideal for developers, testers, and professionals in need of unique numerical data for various applications.",,[{}],[{}]
Random 1001 Functions,https://rapidapi.com/tec-2-scale-tec-2-scale-default/api/random-1001-functions/,random-1001-functions.p.rapidapi.com,POST:GetRandomCity,"Call this endpoint to get the name of a city randomly selected. Explore the world with GetRandomCity, an API endpoint that effortlessly generates the name of a random city from around the globe. Perfect for travel enthusiasts, trivia buffs, and creative professionals seeking i...",,[{}],[{}]
Random 1001 Functions,https://rapidapi.com/tec-2-scale-tec-2-scale-default/api/random-1001-functions/,random-1001-functions.p.rapidapi.com,POST:Getrandomname,"Introducing the GetRandomName feature, a convenient tool for generating unique and diverse names on-demand. Perfect for fictional characters, user profiles, or creative projects, effortlessly generate names without the hassle.",,[{}],[{}]
My public interface,https://rapidapi.com/panoply1/api/my-public-interface/,my-public-interface.p.rapidapi.com,GET:Root endpoint,Description,,[{}],[{}]
name,https://rapidapi.com/99panoply99-99panoply99-default/api/h1-name-h1/,h1-name-h1.p.rapidapi.com,GET:qsds,qsd,,[{}],[{}]
Typengenehmigungsnummer - Switzeland,https://rapidapi.com/herriekyarib/api/typengenehmigungsnummer-switzeland/,typengenehmigungsnummer-switzeland.p.rapidapi.com,GET:search,,default,[{}],"[{'参数名': ['function', 'plate'], '参数类型': ['STRING', 'STRING'], '参数注意事项': ['', '']}]"
QR ID Tracker API,https://rapidapi.com/progwhiz1/api/qr-id-tracker-api/,qr-id-tracker-api.p.rapidapi.com,POST:QRID Tracker,"The following document provides the specifications to be able to use the following API’s
 QR ID Code Creation JSON encoding of parameters API
 Administrative Validation Mobile Apps",,[{}],[{}]
SIREN,https://rapidapi.com/fliot/api/siren/,siren.p.rapidapi.com,GET:siren2url,Get an URL link from a French SIREN reference. This API works with all French companies having a website (a 404 response is returned for companies having no website).,siren2url,"[{'参数名': ['siren'], '参数类型': ['NUMBER'], '参数注意事项': ['']}]",[{}]
SIREN,https://rapidapi.com/fliot/api/siren/,siren.p.rapidapi.com,POST:url2siren,"From a website URL of a French company, get the company's SIREN registration number.",url2siren,[{}],[{}]
SIREN,https://rapidapi.com/fliot/api/siren/,siren.p.rapidapi.com,GET:url2siren,"From a website URL of a French company, get the company's SIREN registration number.",url2siren,"[{'参数名': ['protocol', 'domain'], '参数类型': ['STRING', 'STRING'], '参数注意事项': ['', '']}]",[{}]
German Company Data,https://rapidapi.com/appaio/api/german-company-data1/,german-company-data1.p.rapidapi.com,GET:SearchbyName,"Seach for gernan companies by name, using the % symbol as a wildcard, to obtain the company ID used in other API calls",Basic operations,"[{'参数名': ['name__like'], '参数类型': ['STRING'], '参数注意事项': ['']}]",[{}]
German Company Data,https://rapidapi.com/appaio/api/german-company-data1/,german-company-data1.p.rapidapi.com,GET:CapitalByCompanyId,Get company financials by company id,Basic operations,"[{'参数名': ['companyId__exact'], '参数类型': ['STRING'], '参数注意事项': ['']}]",[{}]
German Company Data,https://rapidapi.com/appaio/api/german-company-data1/,german-company-data1.p.rapidapi.com,GET:PositionsByCompanyId,Look up company directors by company id,Basic operations,"[{'参数名': ['companyId__exact'], '参数类型': ['STRING'], '参数注意事项': ['']}]",[{}]
German Company Data,https://rapidapi.com/appaio/api/german-company-data1/,german-company-data1.p.rapidapi.com,GET:AddressByCompanyId,Get company registered addresses by company ID,Basic operations,"[{'参数名': ['companyId__exact'], '参数类型': ['STRING'], '参数注意事项': ['']}]",[{}]
German Company Data,https://rapidapi.com/appaio/api/german-company-data1/,german-company-data1.p.rapidapi.com,GET:ObjectivesByCompanyId,Receive the company objectives (i.e. purpose) in German for a given company,Basic operations,"[{'参数名': ['companyId__exact'], '参数类型': ['STRING'], '参数注意事项': ['']}]",[{}]
German Company Data,https://rapidapi.com/appaio/api/german-company-data1/,german-company-data1.p.rapidapi.com,GET:ReferenceNumbersByCompanyId,Look up the reference numbers of a company (court register etc.) from company ID.,Basic operations,"[{'参数名': ['companyId__exact'], '参数类型': ['STRING'], '参数注意事项': ['']}]",[{}]
German Company Data,https://rapidapi.com/appaio/api/german-company-data1/,german-company-data1.p.rapidapi.com,GET:SQLsearch,For advanced users only - run a custom SQL select statement against the database;,Advanced Operations,"[{'参数名': ['sql'], '参数类型': ['STRING'], '参数注意事项': ['']}]",[{}]
Denmark Company Data,https://rapidapi.com/appaio/api/denmark-company-data/,denmark-company-data.p.rapidapi.com,GET:Search by company ID,"Using Elastic search, you can use this API endpoint to search by company ID (CVR number) in Denmark",default,"[{'参数名': ['q'], '参数类型': ['STRING'], '参数注意事项': ['']}]",[{}]
Japan company data,https://rapidapi.com/appaio/api/japan-company-data/,japan-company-data.p.rapidapi.com,GET:Search By Name,"This endpoint allows you to search for a Japanese company by name, such as ""間宮""",JP Company Data,"[{'参数名': ['name', 'limit', 'page'], '参数类型': ['STRING', 'NUMBER', 'NUMBER'], '参数注意事项': ['', '', '']}]",[{}]
Japan company data,https://rapidapi.com/appaio/api/japan-company-data/,japan-company-data.p.rapidapi.com,GET:Search By Corporate ID,"This endpoint allows you to search by Corporate ID, i.e. 4030001044808",JP Company Data,"[{'参数名': ['CorporateID'], '参数类型': ['STRING'], '参数注意事项': ['']}]",[{}]
Japan company data,https://rapidapi.com/appaio/api/japan-company-data/,japan-company-data.p.rapidapi.com,GET:Get Company Patents,This API endpoint allows you to determine which patents have been filed by a Japanese company via their corporate ID,JP Company Data,"[{'参数名': ['CorporateID'], '参数类型': ['STRING'], '参数注意事项': ['']}]",[{}]
IPG - IP geolocation,https://rapidapi.com/standingapi-standingapi-default/api/ipg-ip-geolocation/,ipg-ip-geolocation.p.rapidapi.com,GET:The IP Geolocation,"The IP Geolocation allows you to look up the location, timezone, country details, and more of an IPv4 or IPv6 address.",,"[{'参数名': ['ip_address'], '参数类型': ['STRING'], '参数注意事项': ['The IP address to geolocate. Both IPv4 and IPv6 addresses are supported. Note that if you leave this parameter blank, the service will geolocate the IP address from which the request was made.']}]",[{}]
Irish Company Data,https://rapidapi.com/appaio/api/irish-company-data3/,irish-company-data3.p.rapidapi.com,GET:Search,"Here, you can search by either company name, company id, or company address in Ireland. This is sourced directly from government data, and ideal for KYB purposes.",default,[{}],"[{'参数名': ['company_name', 'company_num', 'address'], '参数类型': ['STRING', 'NUMBER', 'STRING'], '参数注意事项': ['', '', '']}]"
QR-generator,https://rapidapi.com/chitrankdixit/api/qr-generator13/,qr-generator13.p.rapidapi.com,GET:qr code generate,This endpoint generate the qr code by taking the url of the website,,"[{'参数名': ['url'], '参数类型': ['STRING'], '参数注意事项': ['']}]",[{}]
Belgium Company Data,https://rapidapi.com/appaio/api/belgium-company-data/,belgium-company-data.p.rapidapi.com,GET:SearchbyCompanyId,This API endpoint allows you to search for a Belgian company by its company ID,api.aspx,"[{'参数名': ['id'], '参数类型': ['NUMBER'], '参数注意事项': ['']}]",[{}]
AIzaSyA0F6Xwf9qEuXyqkdkuTEuGveD4d2LglDk,https://rapidapi.com/ayousseef/api/aizasya0f6xwf9qeuxyqkdkuteugved4d2lgldk/,aizasya0f6xwf9qeuxyqkdkuteugved4d2lgldk.p.rapidapi.com,GET:test,test,,[{}],[{}]
petstore-public,https://rapidapi.com/dec123/api/petstore-public/,petstore-public.p.rapidapi.com,POST:createPets,Create a pet,,[{}],[{}]
petstore-public,https://rapidapi.com/dec123/api/petstore-public/,petstore-public.p.rapidapi.com,GET:showPetById,Info for a specific pet,,"[{'参数名': ['petId'], '参数类型': ['STRING'], '参数注意事项': ['The id of the pet to retrieve']}]",[{}]
petstore-public,https://rapidapi.com/dec123/api/petstore-public/,petstore-public.p.rapidapi.com,GET:listPets,List all pets,,[{}],"[{'参数名': ['limit'], '参数类型': ['NUMBER'], '参数注意事项': ['How many items to return at one time (max 100)']}]"
Photo Reader,https://rapidapi.com/dittolabs/api/photo-reader/,dittolabs-photo-reader-v1.p.rapidapi.com,GET:/find,Process an image,,"[{'参数名': ['url', 'uid', 'client_id'], '参数类型': ['STRING', 'STRING', 'STRING'], '参数注意事项': ['A URL to an image', 'A unique identifier of your choice', 'Please contact help@dittolabs.io to get a unique API key for Ditto Photo Reader']}]",[{}]
Oanh viela,https://rapidapi.com/Oanhviela/api/oanh-viela/,oanhviela-oanh-viela-v1.p.rapidapi.com,POST:Oanh viela API,Oanh viela API,,[{}],[{}]
Tariff Rates,https://rapidapi.com/DataServices/api/tariff-rates/,dataservices-tariff-rates-v1.p.rapidapi.com,GET:/api.trade.gov/v2/tariff_rates/search,,,[{}],[{}]
vCloud Air Ondemand Calculator,https://rapidapi.com/vipulrajdeep/api/vcloud-air-ondemand-calculator/,vipulrajdeep-vcloud-ondemand-calculator-v1.p.rapidapi.com,GET:/ondemand/os,For fetching OS Data,OnDemand API,[{}],[{}]
vCloud Air Ondemand Calculator,https://rapidapi.com/vipulrajdeep/api/vcloud-air-ondemand-calculator/,vipulrajdeep-vcloud-ondemand-calculator-v1.p.rapidapi.com,GET:/ondemand/sku,For fetching SKU Pricing Data,OnDemand API,[{}],[{}]
vCloud Air Ondemand Calculator,https://rapidapi.com/vipulrajdeep/api/vcloud-air-ondemand-calculator/,vipulrajdeep-vcloud-ondemand-calculator-v1.p.rapidapi.com,GET:/ondemand/datacenter,For fetching Datacenter Data,OnDemand API,[{}],[{}]
Datafield,https://rapidapi.com/antoinederoche/api/datafield-1/,community-datafield.p.rapidapi.com,POST:*Get Token,A token is mandatory to call an API successfully. The provided user must be an account admin.,,[{}],[{}]
Datafield,https://rapidapi.com/antoinederoche/api/datafield-1/,community-datafield.p.rapidapi.com,GET:Get Detail of Survey,Get the details of a survey where you know the SurveyID,Survey,"[{'参数名': ['id'], '参数类型': ['STRING'], '参数注意事项': ['']}]",[{}]
Datafield,https://rapidapi.com/antoinederoche/api/datafield-1/,community-datafield.p.rapidapi.com,GET:Get Results of a Campaign,Get results of a campaign,Survey,"[{'参数名': ['after', 'id'], '参数类型': ['STRING', 'STRING'], '参数注意事项': ['timestamp', '']}]",[{}]
Datafield,https://rapidapi.com/antoinederoche/api/datafield-1/,community-datafield.p.rapidapi.com,GET:Get List of Surveys,Get the list of Surveys for your account,Survey,[{}],[{}]
Datafield,https://rapidapi.com/antoinederoche/api/datafield-1/,community-datafield.p.rapidapi.com,DELETE:Delete a team,Delete a team,Teams,"[{'参数名': ['id'], '参数类型': ['STRING'], '参数注意事项': ['']}]",[{}]
Datafield,https://rapidapi.com/antoinederoche/api/datafield-1/,community-datafield.p.rapidapi.com,POST:Create a team,Create a team,Teams,[{}],[{}]
Datafield,https://rapidapi.com/antoinederoche/api/datafield-1/,community-datafield.p.rapidapi.com,GET:Get team details,Get team details,Teams,"[{'参数名': ['id'], '参数类型': ['STRING'], '参数注意事项': ['']}]",[{}]
Datafield,https://rapidapi.com/antoinederoche/api/datafield-1/,community-datafield.p.rapidapi.com,GET:List items in an account,List items in an account,Teams,[{}],[{}]
Datafield,https://rapidapi.com/antoinederoche/api/datafield-1/,community-datafield.p.rapidapi.com,GET:List users,List users from an account,Users,[{}],[{}]
Datafield,https://rapidapi.com/antoinederoche/api/datafield-1/,community-datafield.p.rapidapi.com,DELETE:Delete a user,Delete a user,Users,"[{'参数名': ['id'], '参数类型': ['STRING'], '参数注意事项': ['']}]",[{}]
Datafield,https://rapidapi.com/antoinederoche/api/datafield-1/,community-datafield.p.rapidapi.com,GET:Details of a user,Get details of a user,Users,"[{'参数名': ['id'], '参数类型': ['STRING'], '参数注意事项': ['']}]",[{}]
Datafield,https://rapidapi.com/antoinederoche/api/datafield-1/,community-datafield.p.rapidapi.com,POST:Create a user,Create a user,Users,[{}],[{}]
ProProfs Survey Maker,https://rapidapi.com/sameerbhatia/api/proprofs-survey-maker-1/,sameerbhatia-proprofs-survey-maker1.p.rapidapi.com,GET:Survey Software,Create online survey,,[{}],[{}]
ProProfs Knowledge Base Software,https://rapidapi.com/sameerbhatia/api/proprofs-knowledge-base-software/,sameerbhatia-proprofs-knowledge-base-software.p.rapidapi.com,GET:Knowledge Management Software,online knowledgebase,,[{}],[{}]
Timeneye Time Tracking,https://rapidapi.com/dmdigital/api/timeneye-time-tracking/,dmdigital-timeneye-time-tracking.p.rapidapi.com,POST:removeUserFromProject,Revokes project access permissions to the specified user (targetId). Works only for limited access projects,,[{}],[{}]
Timeneye Time Tracking,https://rapidapi.com/dmdigital/api/timeneye-time-tracking/,dmdigital-timeneye-time-tracking.p.rapidapi.com,POST:startTracking,Notifies Timeneye that the user has started working on a particular project (this information is reflected on the Status page).,,[{}],[{}]
Timeneye Time Tracking,https://rapidapi.com/dmdigital/api/timeneye-time-tracking/,dmdigital-timeneye-time-tracking.p.rapidapi.com,POST:deleteEntry,Deletes an entry,,[{}],[{}]
Timeneye Time Tracking,https://rapidapi.com/dmdigital/api/timeneye-time-tracking/,dmdigital-timeneye-time-tracking.p.rapidapi.com,POST:getEntries,"Returns a list of the latest entries. You can filter it by projectId, dateFrom, dateTo or userId (the latter is only available for project managers or account owners to get another user's entries, or all users' entries using '-1'); you can use offset and limit to paginate the ...",,[{}],[{}]
Timeneye Time Tracking,https://rapidapi.com/dmdigital/api/timeneye-time-tracking/,dmdigital-timeneye-time-tracking.p.rapidapi.com,POST:getProject,"Returns a project's details. fixedAmount and hourlyRate are returned only if user has permissions to see them. If the requester is a Project Manager or an Account Owner, access data is returned too (including access type - ""public"" or ""private"" - and the list of users that can...",,[{}],[{}]
Timeneye Time Tracking,https://rapidapi.com/dmdigital/api/timeneye-time-tracking/,dmdigital-timeneye-time-tracking.p.rapidapi.com,POST:saveEntry,"Stores an entry, inserting or editing it (set entryId = -1 for inserts).",,[{}],[{}]
Timeneye Time Tracking,https://rapidapi.com/dmdigital/api/timeneye-time-tracking/,dmdigital-timeneye-time-tracking.p.rapidapi.com,POST:deauthorizeUser,"Invalidates the authToken, logging the user off from every device which was connected using the API.",,[{}],[{}]
Timeneye Time Tracking,https://rapidapi.com/dmdigital/api/timeneye-time-tracking/,dmdigital-timeneye-time-tracking.p.rapidapi.com,POST:getUsers,Returns the list of users linked to the account.,,"[{'参数名': ['authToken'], '参数类型': ['STRING'], '参数注意事项': ['Please refer to https://github.com/dmdigital/timeneye-api/blob/master/APIs/authorizeUser.md to get authToken']}]",[{}]
Timeneye Time Tracking,https://rapidapi.com/dmdigital/api/timeneye-time-tracking/,dmdigital-timeneye-time-tracking.p.rapidapi.com,POST:getEntry,Returns details for the requested entry. Only user's entries can be retrieved.,,[{}],[{}]
Timeneye Time Tracking,https://rapidapi.com/dmdigital/api/timeneye-time-tracking/,dmdigital-timeneye-time-tracking.p.rapidapi.com,POST:addUserToProject,Gives project access permissions to the specified user (targetId). Works only for limited access projects,,[{}],[{}]
Timeneye Time Tracking,https://rapidapi.com/dmdigital/api/timeneye-time-tracking/,dmdigital-timeneye-time-tracking.p.rapidapi.com,POST:authorizeUser,Exchanges email and password with an authToken.,,[{}],[{}]
Timeneye Time Tracking,https://rapidapi.com/dmdigital/api/timeneye-time-tracking/,dmdigital-timeneye-time-tracking.p.rapidapi.com,POST:getProjects,,,[{}],[{}]
edocr,https://rapidapi.com/edocr/api/edocr/,edocr-edocr.p.rapidapi.com,GET:Calling API Method,,,"[{'参数名': ['method', 'oauth_consumer_key', 'oauth_timestamp', 'oauth_token', 'oauth_signature', 'docid'], '参数类型': ['STRING', 'STRING', 'STRING', 'STRING', 'STRING', 'STRING'], '参数注意事项': ['', '', '', '', '', '']}]",[{}]
firstApi,https://rapidapi.com/mohan21-mohan21-default/api/firstapi52/,firstapi52.p.rapidapi.com,GET:dsfafafas,et er wtwe,,[{}],[{}]
firstApi,https://rapidapi.com/mohan21-mohan21-default/api/firstapi52/,firstapi52.p.rapidapi.com,GET:dfasf,asfasfasf,,[{}],[{}]
Zakka Naturals -,https://rapidapi.com/zakkanaturals/api/zakka-naturals/,zakka-naturals.p.rapidapi.com,GET:zakkana turals,"Zakka Naturals - Thương hiệu mỹ phẩm thiên nhiên ứng dụng công nghệ tiên tiến. Các sản phẩm của Zakka: serum vitamin c, serum niacinamide, serum b5…",,[{}],[{}]
sabasportscc,https://rapidapi.com/anthonyhrwbdo85/api/sabasportscc/,sabasportscc.p.rapidapi.com,GET:saba,https://www.sabasports.cc/ Saba Sport CC là nhà cung cấp tỉ lệ kèo nhà cái trực tuyến có đông người chơi nhất hiện nay. Tham gia cá cược bóng đá online tại sảnh Saba Sports Việt Nam - thể thao Saba tại sabasports.cc,,[{}],[{}]
BoudiNet,https://rapidapi.com/boudiz-boudiz-default/api/boudinet/,boudinet.p.rapidapi.com,GET:earn money,earn money earn money,,[{}],[{}]
LODE88,https://rapidapi.com/lode888com/api/lode88/,lode88.p.rapidapi.com,GET:LODE88,"lode88 - lode888.com ⭐️ Là cty lô đề trên mạng, đánh số đề tại LODE88 đảm bảo tỷ lệ ăn cao, rút & nạp tiền nhanh, an toàn. Có bí kíp soi cầu lô đề, số đề…",,[{}],[{}]
maunhadep,https://rapidapi.com/maunhadep/api/maunhadep/,maunhadep.p.rapidapi.com,GET:Mẫu nhà đẹp,"Mẫu nhà đẹp là nhóm của Công ty TNHH Thiết kế Thi công Nhà đẹp. Với mục đích muốn tạo ra một sân chơi chung, tham khảo những mẫu nhà đẹp và chia sẻ kinh nghiệm trong lĩnh vực thiết kế, thi công nhà. Chính vì thế nếu các bạn đang có nhu cầu xây nhà có thể vào tham khảo và thảo ...",,[{}],[{}]
Da ga Thomo67 truc tiep,https://rapidapi.com/thomo678net/api/da-ga-thomo67-truc-tiep/,da-ga-thomo67-truc-tiep.p.rapidapi.com,GET:Da ga Thomo67 truc tiep,Thomo67 ✓ Xem đá gà trực tiếp Thomo hôm nay mới nhất tại Thomo 678 ✓ Trực tiếp đá gà cựa sắt Thomo Campuchia hôm nay tại bồ gà 999 & 67.,,[{}],[{}]
,https://rapidapi.com/panoply1/api/img-src-x2/,img-src-x2.p.rapidapi.com,GET:ds,test,,[{}],[{}]
V9BET Link vao nhanh nha cai V9BET Mobile moi nhat 2022,https://rapidapi.com/v9betvi/api/v9bet-link-vao-nhanh-nha-cai-v9bet-mobile-moi-nhat-2022/,v9bet-link-vao-nhanh-nha-cai-v9bet-mobile-moi-nhat-2022.p.rapidapi.com,GET:V9BET Link vao nhanh nha cai V9BET Mobile moi nhat 2022,"V9bet là tên một nhà cái cá cược trực tuyến, xuất hiện lần đầu tiên tại thị trường Việt Nam vào khoảng tháng 10 năm 2012. Nhà cái V9bet cung cấp các dịch cá cược như thể thao, Casino Online (Sòng bạc trực tuyến), Slots game, Xổ số, Game 3D,… Với giao diện đẹp mắt, trò chơi phò...",,[{}],[{}]
Bomokoapi,https://rapidapi.com/guillainbisimwa/api/bomokoapi/,bomokoapi.p.rapidapi.com,POST:bomokoEndpoint_copy,Bomoko endpoint test,,[{}],[{}]
Bomokoapi,https://rapidapi.com/guillainbisimwa/api/bomokoapi/,bomokoapi.p.rapidapi.com,POST:bomokoEndpoint,Bomoko endpoint test,,[{}],[{}]
last,https://rapidapi.com/tihonbasov/api/last/,last.p.rapidapi.com,GET:Last,Last,,[{}],[{}]
Nha cai MU9 - Link vao Mu9 Nha cai ca cuoc bong da,https://rapidapi.com/mu9city/api/nha-cai-mu9-link-vao-mu9-nha-cai-ca-cuoc-bong-da/,nha-cai-mu9-link-vao-mu9-nha-cai-ca-cuoc-bong-da.p.rapidapi.com,GET:Nha cai MU9 - Link vao Mu9 Nha cai ca cuoc bong da,"MU9 là nhà cái uy tín số 1 về cá cược bóng đá, game bài, nổ hũ, bắn cá, xổ số lô đề, live casino,…đứng top 1 tại thị trường Anh Quốc. Đăng ký Mu9 để nhận khuyến mãi siêu hot, Link đăng nhập Mu9 chính thức 2022!",,[{}],[{}]
