API名称,API链接,API_Host,Endpoint名称,Endpoint描述,Endpoint种类,Endpoint必须参数,Endpoint可选参数
Consulta CPF CNPJ Brasil,https://rapidapi.com/nabase-nabase-default/api/consulta-cpf-cnpj-brasil/,consulta-cpf-cnpj-brasil.p.rapidapi.com,GET:Consulta dados societários,## consulta dados dos sócios do cnpj consultado pelo id_socio,,"[{'参数名': ['ID_SOCIO'], '参数类型': ['STRING'], '参数注意事项': ['']}]",[{}]
Auxilio Emergencial,https://rapidapi.com/nabase-nabase-default/api/auxilio-emergencial/,auxilio-emergencial.p.rapidapi.com,GET:Consulta Beneficiário,Consulta Beneficiário,,"[{'参数名': ['cpf'], '参数类型': ['STRING'], '参数注意事项': ['']}]",[{}]
Emotion TheSaurus,https://rapidapi.com/lunegreiros/api/emotion-thesaurus/,emotion-thesaurus.p.rapidapi.com,GET:Get physical signals and behaviors,Get physical signals and behaviors from a specific emotion.,,"[{'参数名': ['emotion'], '参数类型': ['STRING'], '参数注意事项': ['']}]",[{}]
Emotion TheSaurus,https://rapidapi.com/lunegreiros/api/emotion-thesaurus/,emotion-thesaurus.p.rapidapi.com,GET:List of all Emotion,Get the list all the emotions in our database.,,[{}],[{}]
ConsultaCNPJ,https://rapidapi.com/tailoralm/api/consultacnpj/,consultacnpj.p.rapidapi.com,GET:Buscar CNPJ,Busca de dados de pessoa jurídica,,"[{'参数名': ['id'], '参数类型': ['STRING'], '参数注意事项': ['']}]",[{}]
Companies Data,https://rapidapi.com/CompaniesData/api/companies-data1/,companies-data1.p.rapidapi.com,GET:Referential,Returns list of companies,,"[{'参数名': ['page_number', 'country'], '参数类型': ['STRING', 'STRING'], '参数注意事项': ['Pagination page number', ""Two letter country ISO code (e.g. 'fr' for France)""]}]",[{}]
Companies Data,https://rapidapi.com/CompaniesData/api/companies-data1/,companies-data1.p.rapidapi.com,GET:Data,Returns company details for one or more SIREN numbers,,"[{'参数名': ['siren', 'country'], '参数类型': ['STRING', 'STRING'], '参数注意事项': ['Unique ID for each company', ""Two letter country ISO code (e.g. 'fr' for France)""]}]",[{}]
Open Ai,https://rapidapi.com/sharyt26shar/api/open-ai1/,open-ai1.p.rapidapi.com,POST:Playground,Ask the Ai,,[{}],[{}]
VIN data,https://rapidapi.com/autogt-klub-ltd-autogt-klub-ltd-default/api/vin-data/,vin-data.p.rapidapi.com,GET:GET vehicle data,GET vehicle data,,"[{'参数名': ['vin'], '参数类型': ['STRING'], '参数注意事项': ['']}]",[{}]
Github Scraper,https://rapidapi.com/cruzanayadavid/api/github-scraper/,github-scraper.p.rapidapi.com,GET:get top 30 list of GitHub repos for your search,get top 30 list of GitHub repos for your search,,"[{'参数名': ['query'], '参数类型': ['STRING'], '参数注意事项': ['']}]",[{}]
Github Scraper,https://rapidapi.com/cruzanayadavid/api/github-scraper/,github-scraper.p.rapidapi.com,GET:get list of GitHub repos for ruby web scraping,get list of GitHub repos for ruby web scraping,,[{}],[{}]
World Cities,https://rapidapi.com/koukoulina001/api/world-cities7/,world-cities7.p.rapidapi.com,GET:Cities by state and country,"This endpoint returns cities of a given country and state.
NOTE:
you can use the country code or exact name.
for the state, you can use the state_id.",,"[{'参数名': ['stateId', 'code'], '参数类型': ['NUMBER', 'STRING'], '参数注意事项': ['', '']}]",[{}]
World Cities,https://rapidapi.com/koukoulina001/api/world-cities7/,world-cities7.p.rapidapi.com,GET:Country Cities,"This endpoint helps you GET the cities of a given country,
NOTE:
you can use country code or exact name.",,"[{'参数名': ['code'], '参数类型': ['STRING'], '参数注意事项': ['']}]",[{}]
World Cities,https://rapidapi.com/koukoulina001/api/world-cities7/,world-cities7.p.rapidapi.com,GET:Country States,"GET the states of a given country using this endpoint,
NOTE:
you can use the country code or name",,"[{'参数名': ['code'], '参数类型': ['STRING'], '参数注意事项': ['']}]",[{}]
World Cities,https://rapidapi.com/koukoulina001/api/world-cities7/,world-cities7.p.rapidapi.com,GET:All Countries,Using this endpoint you can GET a list of all countries in the world.,,[{}],[{}]
World Cities,https://rapidapi.com/koukoulina001/api/world-cities7/,world-cities7.p.rapidapi.com,GET:Country details,"You can get specific country details using this endpoint.
NOTE:
you can use either the country code or the country name.",,"[{'参数名': ['code'], '参数类型': ['STRING'], '参数注意事项': ['']}]",[{}]
World Cities,https://rapidapi.com/koukoulina001/api/world-cities7/,world-cities7.p.rapidapi.com,GET:Countries by region,"This Endpoint allows you to get countries filtered by geographical region.
NOTE:
regions available as parameters are :
Africa, Asia, Oceania, Polar, Europe, Americas",,"[{'参数名': ['region'], '参数类型': ['STRING'], '参数注意事项': ['']}]",[{}]
Sheetcron PRO,https://rapidapi.com/magiabinaria/api/sheetcron-pro/,sheetcron-pro.p.rapidapi.com,GET:API,"API de Sheetcron con la insuperable velocidad de un servidor en NODEJS.
ID: id del documento de Google Sheet Sheet: nombre de la tab/hoja",,[{}],"[{'参数名': ['q', 'callback'], '参数类型': ['STRING', 'STRING'], '参数注意事项': ['', '']}]"
Golubev,https://rapidapi.com/Golubev-S/api/golubev/,golubev.p.rapidapi.com,GET:test,test,,[{}],"[{'参数名': ['ds'], '参数类型': ['STRING'], '参数注意事项': ['']}]"
cosmetic ingredients,https://rapidapi.com/kojun1412/api/cosmetic-ingredients2/,cosmetic-ingredients2.p.rapidapi.com,GET:Get all cosmetic ingredients name,"This endpoint returns all Cosmetic ingredients Name
화장품 성분명칭 전체 데이터를 불러옵니다.",,[{}],[{}]
cosmetic ingredients,https://rapidapi.com/kojun1412/api/cosmetic-ingredients2/,cosmetic-ingredients2.p.rapidapi.com,GET:cosmetic-ingredients id value,"cosmetic-ingredients name id value
화장품 성분데이터의 명칭을 id 로 확인하여 불러옵니다.",,"[{'参数名': ['id'], '参数类型': ['STRING'], '参数注意事项': ['']}]",[{}]
Baby Names,https://rapidapi.com/EverettMoss/api/baby-names2/,baby-names2.p.rapidapi.com,GET:Get Specific List of Baby Names by Length,This endpoint returns all baby names with the provided number of letters (2-11),,"[{'参数名': ['length'], '参数类型': ['NUMBER'], '参数注意事项': ['']}]",[{}]
Vehicle RC Verification Advanced,https://rapidapi.com/idfy-idfy-default/api/vehicle-rc-verification-advanced/,vehicle-rc-verification-advanced.p.rapidapi.com,GET:GET task result,This GET call will give you the datapoints fetched from the database.,,"[{'参数名': ['request_id'], '参数类型': ['STRING'], '参数注意事项': ['']}]",[{}]
Vehicle RC Verification Advanced,https://rapidapi.com/idfy-idfy-default/api/vehicle-rc-verification-advanced/,vehicle-rc-verification-advanced.p.rapidapi.com,POST:RC verification advanced - async,This API is used to verify Vehicle Registration Certificate (RC) number against Vahan vehicle database. The API allows you to -,,[{}],[{}]
UFO Sightings,https://rapidapi.com/jamesalester/api/ufo-sightings/,ufo-sightings.p.rapidapi.com,GET:Event Statistics,Enter a sighting id (as found using one of the other endpoints) and a radius in km to see statistics about other sightings within the same region,,[{}],"[{'参数名': ['radius'], '参数类型': ['NUMBER'], '参数注意事项': ['The radius from the sighting in km']}]"
UFO Sightings,https://rapidapi.com/jamesalester/api/ufo-sightings/,ufo-sightings.p.rapidapi.com,GET:Event,Get more info about a specific sighting based on an id that can be found using one of the other endpoints,,"[{'参数名': ['id'], '参数类型': ['STRING'], '参数注意事项': ['']}]",[{}]
UFO Sightings,https://rapidapi.com/jamesalester/api/ufo-sightings/,ufo-sightings.p.rapidapi.com,GET:Media,Return images and videos users have submitted.,,[{}],"[{'参数名': ['page', 'size'], '参数类型': ['NUMBER', 'NUMBER'], '参数注意事项': ['', '']}]"
UFO Sightings,https://rapidapi.com/jamesalester/api/ufo-sightings/,ufo-sightings.p.rapidapi.com,GET:Search,"Enter any search term i.e location, dates, keywords, text, sighting ids.",,[{}],"[{'参数名': ['page', 'size'], '参数类型': ['NUMBER', 'NUMBER'], '参数注意事项': ['', '']}]"
UFO Sightings,https://rapidapi.com/jamesalester/api/ufo-sightings/,ufo-sightings.p.rapidapi.com,GET:Recent Sightings,Sightings sorted by date order starting with the most recent.,,[{}],"[{'参数名': ['page', 'size'], '参数类型': ['NUMBER', 'NUMBER'], '参数注意事项': ['', '']}]"
city,https://rapidapi.com/grealmutol/api/city27/,city27.p.rapidapi.com,GET:Bycity,return city information,,[{}],"[{'参数名': ['city'], '参数类型': ['STRING'], '参数注意事项': ['']}]"
Data Axle Business Address Search,https://rapidapi.com/data-axle-data-axle-default/api/data-axle-business-address-search/,data-axle-business-address-search.p.rapidapi.com,GET:Business Address Search,Find relevant businesses in the Data Axle database,,[{}],"[{'参数名': ['query'], '参数类型': ['STRING'], '参数注意事项': ['']}]"
Indonesian Kata Baku KBBI,https://rapidapi.com/gizipp/api/indonesian-kata-baku-kbbi/,indonesian-kata-baku-kbbi.p.rapidapi.com,GET:Check Baku,Check Standart Word (Baku),,"[{'参数名': ['word'], '参数类型': ['STRING'], '参数注意事项': ['']}]",[{}]
Data Axle Consumer Search,https://rapidapi.com/data-axle-data-axle-default/api/data-axle-consumer-search/,data-axle-consumer-search.p.rapidapi.com,GET:Consumer Name Search,Find relevant People in the Data Axle database,,[{}],"[{'参数名': ['query'], '参数类型': ['STRING'], '参数注意事项': ['']}]"
PageQuotes,https://rapidapi.com/igordc16-Y4wpE4GjyvI/api/pagequotes/,pagequotes.p.rapidapi.com,GET:get quote id sentiment,Endpoint to get the sentiment analysis of a quote by ID,,"[{'参数名': ['id'], '参数类型': ['NUMBER'], '参数注意事项': ['']}]",[{}]
PageQuotes,https://rapidapi.com/igordc16-Y4wpE4GjyvI/api/pagequotes/,pagequotes.p.rapidapi.com,GET:get all titles,Endpoint that retrieves all book titles,,[{}],[{}]
PageQuotes,https://rapidapi.com/igordc16-Y4wpE4GjyvI/api/pagequotes/,pagequotes.p.rapidapi.com,GET:Get quotes sentiment,This endpoint returns the sentiment analysis from the book's quotes,,[{}],[{}]
PageQuotes,https://rapidapi.com/igordc16-Y4wpE4GjyvI/api/pagequotes/,pagequotes.p.rapidapi.com,GET:Get book by title,Endpoint to get book by title,,"[{'参数名': ['title'], '参数类型': ['STRING'], '参数注意事项': ['']}]",[{}]
PageQuotes,https://rapidapi.com/igordc16-Y4wpE4GjyvI/api/pagequotes/,pagequotes.p.rapidapi.com,DELETE:Delete book,Endpoint to delete book,,"[{'参数名': ['id'], '参数类型': ['NUMBER'], '参数注意事项': ['']}]",[{}]
PageQuotes,https://rapidapi.com/igordc16-Y4wpE4GjyvI/api/pagequotes/,pagequotes.p.rapidapi.com,PUT:Update book,Endpoint to update an book by ID,,[{}],[{}]
PageQuotes,https://rapidapi.com/igordc16-Y4wpE4GjyvI/api/pagequotes/,pagequotes.p.rapidapi.com,POST:Post new book,Endpoint to post a new book/books,,[{}],[{}]
PageQuotes,https://rapidapi.com/igordc16-Y4wpE4GjyvI/api/pagequotes/,pagequotes.p.rapidapi.com,GET:Get book by genre,Endpoint to retrieve book and quote by genre,,"[{'参数名': ['genre'], '参数类型': ['STRING'], '参数注意事项': ['']}]",[{}]
PageQuotes,https://rapidapi.com/igordc16-Y4wpE4GjyvI/api/pagequotes/,pagequotes.p.rapidapi.com,GET:Get quotes by book ID,Endpoint that retrieves quotes by the book ID,,"[{'参数名': ['id'], '参数类型': ['NUMBER'], '参数注意事项': ['']}]",[{}]
PageQuotes,https://rapidapi.com/igordc16-Y4wpE4GjyvI/api/pagequotes/,pagequotes.p.rapidapi.com,GET:Quotes by author,Endpoint to retrieve quotes by author.,,"[{'参数名': ['name'], '参数类型': ['STRING'], '参数注意事项': ['']}]",[{}]
PageQuotes,https://rapidapi.com/igordc16-Y4wpE4GjyvI/api/pagequotes/,pagequotes.p.rapidapi.com,GET:Get quotes by ID,Endpoint to retrieve quotes by ID,,"[{'参数名': ['id'], '参数类型': ['STRING'], '参数注意事项': ['']}]",[{}]
PageQuotes,https://rapidapi.com/igordc16-Y4wpE4GjyvI/api/pagequotes/,pagequotes.p.rapidapi.com,GET:Get quotes by pagination and per_page limit,Endpoint to limit the amount of quotes returned per page.,,"[{'参数名': ['page', 'per_page'], '参数类型': ['NUMBER', 'NUMBER'], '参数注意事项': ['', '']}]",[{}]
PageQuotes,https://rapidapi.com/igordc16-Y4wpE4GjyvI/api/pagequotes/,pagequotes.p.rapidapi.com,GET:Get quotes by pagination,Endpoint to retrieve the quotes using pagination,,"[{'参数名': ['page'], '参数类型': ['NUMBER'], '参数注意事项': ['']}]",[{}]
PageQuotes,https://rapidapi.com/igordc16-Y4wpE4GjyvI/api/pagequotes/,pagequotes.p.rapidapi.com,GET:Get a list of all quotes,"Endpoint to retrieve a list of all quotes, quantity of pages and total number of quotes available.",,[{}],[{}]
Life Purpose Quotes DB,https://rapidapi.com/anadev24/api/life-purpose-quotes-db/,life-purpose-quotes-db.p.rapidapi.com,GET:Quotes,"This endpoint returns more than 1000 quotes about life purpose and motivation. It includes the quote, author and source url.",,[{}],[{}]
Voter Card Verifications,https://rapidapi.com/idfy-idfy-default/api/voter-card-verifications/,voter-card-verifications.p.rapidapi.com,GET:Get Call,"Get call is to be made by appending request id to the url in the query parameter, to fetch the api results.",,"[{'参数名': ['request_id'], '参数类型': ['STRING'], '参数注意事项': ['']}]",[{}]
Voter Card Verifications,https://rapidapi.com/idfy-idfy-default/api/voter-card-verifications/,voter-card-verifications.p.rapidapi.com,POST:Voter Card Verifications,"With the Voter Card Verification API, you can now onboard with confidence knowing that the individuals you onboard are holding a valid Voter Card issued by the Government of India, are eligible to vote, and have provided you with reliable identity and address proofs.",,[{}],[{}]
Consulta CPF e Nome,https://rapidapi.com/squidcoders-squidcoders-default/api/consulta-cpf-e-nome/,consulta-cpf-e-nome.p.rapidapi.com,GET:Consulta CPF por Telefone,Encontre o cpf pelo numero do telefone,,"[{'参数名': ['cpf'], '参数类型': ['STRING'], '参数注意事项': ['']}]",[{}]
Consulta CPF e Nome,https://rapidapi.com/squidcoders-squidcoders-default/api/consulta-cpf-e-nome/,consulta-cpf-e-nome.p.rapidapi.com,GET:Consulta por CPF,Informe o CPF para obter o resultado dos dados da pessoa fisica,,"[{'参数名': ['cpf'], '参数类型': ['STRING'], '参数注意事项': ['']}]",[{}]
Consulta CPF e Nome,https://rapidapi.com/squidcoders-squidcoders-default/api/consulta-cpf-e-nome/,consulta-cpf-e-nome.p.rapidapi.com,GET:Consulta Telefone,Encontre o numero de telefone buscando pelo CPF da pessoa,,"[{'参数名': ['cpf'], '参数类型': ['STRING'], '参数注意事项': ['']}]",[{}]
Consulta CPF e Nome,https://rapidapi.com/squidcoders-squidcoders-default/api/consulta-cpf-e-nome/,consulta-cpf-e-nome.p.rapidapi.com,GET:Consulta por Nome,Encontre um CPF apenas pelo nome completo da pessoa,,"[{'参数名': ['nome'], '参数类型': ['STRING'], '参数注意事项': ['']}]",[{}]
Consulta Cep,https://rapidapi.com/periclesdambroski1/api/consulta-cep1/,consulta-cep1.p.rapidapi.com,GET:consulta,consulta,,"[{'参数名': ['cep'], '参数类型': ['STRING'], '参数注意事项': ['']}]",[{}]
Cat Library,https://rapidapi.com/standingapi-standingapi-default/api/cat-library/,cat-library.p.rapidapi.com,GET:Search for Cat Breeds by name,Search for a Breed by using part of it’s name as the ‘q’ query parameter.,,"[{'参数名': ['q'], '参数类型': ['STRING'], '参数注意事项': ['Example : sib to search for Siberian , Ben for Bengal … etc']}]",[{}]
Cat Library,https://rapidapi.com/standingapi-standingapi-default/api/cat-library/,cat-library.p.rapidapi.com,GET:List the Cat Breeds,The properties for each Breed will increase over time as more research is completed.,,"[{'参数名': ['limit'], '参数类型': ['NUMBER'], '参数注意事项': ['']}]",[{}]
Summery,https://rapidapi.com/mcarolacorvalan/api/summery/,summery.p.rapidapi.com,GET:Summery_copy,dahsboard summery,,"[{'参数名': ['date', 'id', 'value'], '参数类型': ['STRING', 'NUMBER', 'NUMBER'], '参数注意事项': ['date description', 'id descrition', 'value description']}]",[{}]
Summery,https://rapidapi.com/mcarolacorvalan/api/summery/,summery.p.rapidapi.com,GET:Summery,dahsboard summery,,"[{'参数名': ['id', 'date', 'value'], '参数类型': ['NUMBER', 'STRING', 'NUMBER'], '参数注意事项': ['id descrition', 'date description', 'value description']}]",[{}]
Bankofads V1,https://rapidapi.com/marketingboam/api/bankofads-v1/,bankofads-v1.p.rapidapi.com,GET:Check Mobile Number,Check Mobile Number,,"[{'参数名': ['access_key'], '参数类型': ['STRING'], '参数注意事项': ['12345']}]",[{}]
busiti.net,https://rapidapi.com/wirantopranoto5/api/busiti-net/,busiti-net.p.rapidapi.com,GET:busiti.net,busiti.net,,[{}],[{}]
Cretae User,https://rapidapi.com/ulvi.1999rufet/api/cretae-user/,cretae-user.p.rapidapi.com,POST:Create User,Yes User,,"[{'参数名': ['Birthday', 'Password', 'Name', 'Mail'], '参数类型': ['NUMBER', 'STRING', 'STRING', 'STRING'], '参数注意事项': ['', '', '', '']}]",[{}]
darulifa,https://rapidapi.com/binamjad/api/darulifa/,darulifa.p.rapidapi.com,GET:search_fatwa,search in all public fatawa,,"[{'参数名': ['q'], '参数类型': ['STRING'], '参数注意事项': ['']}]",[{}]
Manga Series,https://rapidapi.com/rab.dev89/api/manga-series/,manga-series.p.rapidapi.com,GET:Get Category,Get List per category,,"[{'参数名': ['slug'], '参数类型': ['STRING'], '参数注意事项': ['']}]",[{}]
Manga Series,https://rapidapi.com/rab.dev89/api/manga-series/,manga-series.p.rapidapi.com,GET:Get Chapters,Get Chapters,,"[{'参数名': ['manga.id'], '参数类型': ['STRING'], '参数注意事项': ['']}]",[{}]
Customer,https://rapidapi.com/jmichael.imperial/api/customer1/,customer1.p.rapidapi.com,GET:https://Customer,https://Customer,,"[{'参数名': ['offset'], '参数类型': ['NUMBER'], '参数注意事项': ['']}]",[{}]
Nol Digit,https://rapidapi.com/harrypermadis/api/nol-digit/,nol-digit.p.rapidapi.com,GET:asd,sasd,,[{}],[{}]
Register,https://rapidapi.com/ulvi.1999rufet/api/register6/,register6.p.rapidapi.com,POST:Base,kgj,,[{}],"[{'参数名': ['Birthday', 'Name', 'Mail', 'Password'], '参数类型': ['NUMBER', 'STRING', 'STRING', 'STRING'], '参数注意事项': ['', '', '', '']}]"
Click adilla,https://rapidapi.com/goblogmania4/api/click-adilla/,click-adilla.p.rapidapi.com,GET:a,a,,[{}],[{}]
Click adilla,https://rapidapi.com/goblogmania4/api/click-adilla/,click-adilla.p.rapidapi.com,POST:b,b,,[{}],[{}]
GetBusinessData,https://rapidapi.com/omnibiz/api/getbusinessdata/,getbusinessdata.p.rapidapi.com,GET:Get Website Details,Get Website Details,,[{}],[{}]
Online Key Value Store,https://rapidapi.com/Immanuel/api/online-key-value-store/,online-key-value-store.p.rapidapi.com,GET:Update Item Value for Key,"Each App key can have multiple, Item Keys [Which is a variable for a single app]",,"[{'参数名': ['AppKey', 'AppVariable', 'VariableValue'], '参数类型': ['STRING', 'STRING', 'STRING'], '参数注意事项': [""This is the Value Retrieved By 'Get App Key' - APi or Get it from the website"", ""THis is the variable name used in the app key, incase if it doesn't exist, the Api create a new Variable with the Value Provided"", 'this value will be updated aas AppVariable Value']}]",[{}]
Online Key Value Store,https://rapidapi.com/Immanuel/api/online-key-value-store/,online-key-value-store.p.rapidapi.com,GET:Get Variable Value,This APi is used to Retrieve the variable value stored in the store,,"[{'参数名': ['AppVariable', 'AppKey'], '参数类型': ['STRING', 'STRING'], '参数注意事项': ['AppVariable Value', 'AppKey Value']}]",[{}]
Online Key Value Store,https://rapidapi.com/Immanuel/api/online-key-value-store/,online-key-value-store.p.rapidapi.com,GET:Get App Key,Api to Get Your App Key,,[{}],[{}]
Online Key Value Store,https://rapidapi.com/Immanuel/api/online-key-value-store/,online-key-value-store.p.rapidapi.com,GET:Act On Key,This is a generic actions that cab be applied on the keys,,"[{'参数名': ['AppKey', 'action', 'AppVariable'], '参数类型': ['STRING', 'STRING', 'STRING'], '参数注意事项': ['App Key', 'Right now only increment is supported, going forward based on response other features will be included.', 'App Variable']}]",[{}]
Miyansapi,https://rapidapi.com/mitanshuxzero/api/miyansapi/,miyansapi.p.rapidapi.com,POST:process_file.php,Endpointer,,[{}],[{}]
Bartenders,https://rapidapi.com/PeterAbdalla/api/bartenders/,bartenders.p.rapidapi.com,POST:ReadAll,Return all data,,[{}],[{}]
moviesearch,https://rapidapi.com/muhammadfahad325302/api/moviesearch/,moviesearch.p.rapidapi.com,GET:movie,movie using imdb ID,,"[{'参数名': ['imdbID'], '参数类型': ['STRING'], '参数注意事项': ['the default movie']}]",[{}]
MovieBase,https://rapidapi.com/rakesh.debnath0093/api/moviebase/,moviebase.p.rapidapi.com,GET:copy of endpoint: streamer,test,,[{}],[{}]
MovieBase,https://rapidapi.com/rakesh.debnath0093/api/moviebase/,moviebase.p.rapidapi.com,GET:streamer,test,,[{}],[{}]
Reverse NS,https://rapidapi.com/whoisapi/api/reverse-ns/,whoisapi-reverse-ns-v1.p.rapidapi.com,GET:/api/v1,,,[{}],"[{'参数名': ['page'], '参数类型': ['NUMBER'], '参数注意事项': ['Pagination position (default: 1).']}]"
Reverse MX,https://rapidapi.com/whoisapi/api/reverse-mx/,whoisapi-reverse-mx-v1.p.rapidapi.com,GET:/api/v1,,,[{}],"[{'参数名': ['page'], '参数类型': ['NUMBER'], '参数注意事项': ['Pagination position (default: 1)']}]"
Reverse IP,https://rapidapi.com/whoisapi/api/reverse-ip/,whoisapi-reverse-ip-v1.p.rapidapi.com,GET:/api/v1,Reverse IP API,,[{}],"[{'参数名': ['page'], '参数类型': ['NUMBER'], '参数注意事项': ['ptional. Pagination position (default: 1)']}]"
Oscar API,https://rapidapi.com/bhosalepranil16/api/oscar-api/,oscar-api.p.rapidapi.com,GET:Get Awards by Year,"This endpoint retrieves the list of awards presented in a given year. It returns a list of objects, where each object represents an award category and includes the name of the award and the nominees and winner(s) for that category.",,"[{'参数名': ['year'], '参数类型': ['NUMBER'], '参数注意事项': ['']}]",[{}]
API_VA,https://rapidapi.com/pedrogfreitas1/api/api_va/,api_va.p.rapidapi.com,GET:Leagues,…,,[{}],[{}]
Dati Comuni,https://rapidapi.com/kgoga-kgoga-default/api/dati-comuni/,dati-comuni.p.rapidapi.com,GET:MouldInformation,test,,[{}],[{}]
Profilaktika,https://rapidapi.com/codewithjeyallday/api/profilaktika/,profilaktika.p.rapidapi.com,GET:Users,gets the list of Users,,[{}],[{}]
Profilaktika,https://rapidapi.com/codewithjeyallday/api/profilaktika/,profilaktika.p.rapidapi.com,GET:Duties,Desc,,[{}],[{}]
Whois History,https://rapidapi.com/whoisapi/api/whois-history1/,whois-history1.p.rapidapi.com,GET:Whois History (v1),Check Whois record's history,,[{}],"[{'参数名': ['mode', 'outputFormat', 'sinceDate', 'createdDateFrom', 'createdDateTo', 'updatedDateFrom', 'updatedDateTo', 'expiredDateFrom', 'expiredDateTo'], '参数类型': ['STRING', 'STRING', 'STRING', 'STRING', 'STRING', 'STRING', 'STRING', 'STRING', 'STRING'], '参数注意事项': ['preview – return only the number of domains. No credits deducted. purchase – return the actual list of domains (limited to 10,000). 1 request costs 50 DRS credits. Default: preview', 'Response output format. Acceptable values: XML or JSON. Defaults to JSON.', 'If present, search through activities discovered since the given date. Sometimes there is a latency between the actual added/renewal/expired date and the date when our system detected this change. Acceptable values: date in ""YYYY-MM-DD"" format.', 'If present, search through domains created after the given date. Acceptable values: date in ""YYYY-MM-DD"" format.', 'If present, search through domains created before the given date. Acceptable values: date in ""YYYY-MM-DD"" format.', 'If present, search through domains updated after the given date. Acceptable values: date in ""YYYY-MM-DD"" format.', 'If present, search through domains updated before the given date. Acceptable values: date in ""YYYY-MM-DD"" format.', 'If present, search through domains expired after the given date. Acceptable values: date in ""YYYY-MM-DD"" format.', 'If present, search through domains expired before the given date. Acceptable values: date in ""YYYY-MM-DD"" format.']}]"
IP Netblocks,https://rapidapi.com/whoisapi/api/ip-netblocks/,ip-netblocks.p.rapidapi.com,GET:IP Netblock v2,Get exhaustive information on IP Range (v2),,[{}],"[{'参数名': ['ip', 'org', 'asn', 'outputFormat', 'mask', 'limit'], '参数类型': ['STRING', 'STRING', 'STRING', 'STRING', 'STRING', 'STRING'], '参数注意事项': ['Get ranges by IPv4/IPv6 address or by CIDR depending on input', 'Find IP Netblocks which have the specified search terms in their Netblock (netname, description, remarks), or Organisation (org.org, org.name, org.email, org.address) fields', 'Get ranges by ASN (Autonomous System Number).', 'Response output format. Acceptable values: XML or JSON. Defaults to JSON.', 'Get ranges by CIDR. Acceptable values: 0 - 128 (0 - 32 for IPv4). Default: 128', 'Max count of returned records. Acceptable values: 1 - 1000. Default: 100']}]"
Hashtag,https://rapidapi.com/deftcoders/api/hashtag2/,hashtag2.p.rapidapi.com,GET:Search Hashtag,Search hashtag,,[{}],[{}]
expired-passport-checker,https://rapidapi.com/skivsoft/api/expired-passport-checker/,expired-passport-checker.p.rapidapi.com,GET:/expired-passports/series/{series}/numbers/{number},,Checker,"[{'参数名': ['series', 'number'], '参数类型': ['STRING', 'STRING'], '参数注意事项': ['Серия паспорта.', 'Номер паспорта.']}]",[{}]
