API名称,API链接,API_Host,Endpoint名称,Endpoint描述,Endpoint种类,Endpoint必须参数,Endpoint可选参数
CLIA Lab Search,https://rapidapi.com/siedarstudios/api/clia-lab-search/,clia-lab-search.p.rapidapi.com,GET:Provider Number,"General GET request for lab demographics based on the provider number for the laboratory.
The request searches on the provider_number field.",,[{}],"[{'参数名': ['provider_number'], '参数类型': ['STRING'], '参数注意事项': ['']}]"
CLIA Lab Search,https://rapidapi.com/siedarstudios/api/clia-lab-search/,clia-lab-search.p.rapidapi.com,GET:Facility,"General GET request for lab demographics based on the name of the laboratory.
The request searches on the facility field.",,[{}],"[{'参数名': ['facility'], '参数类型': ['STRING'], '参数注意事项': ['']}]"
calcolo-danno-biologico,https://rapidapi.com/lebabamath/api/calcolo-danno-biologico/,calcolo-danno-biologico.p.rapidapi.com,POST:Calcolo Danno Biologico Macropermanente Per le Tabelle Milanesi 2021.,Calcolo Danno Biologico Macropermanente Per le Tabelle Milanesi 2021.,,[{}],[{}]
CannaAPI,https://rapidapi.com/aidengwilliams96/api/cannaapi1/,cannaapi1.p.rapidapi.com,GET:Get Strains By Highest Rating,Get Strains And Order Them By Highest Rating,,[{}],[{}]
CannaAPI,https://rapidapi.com/aidengwilliams96/api/cannaapi1/,cannaapi1.p.rapidapi.com,GET:Get Strains With Images,Get Strains Only If They Have An Image,,[{}],[{}]
CannaAPI,https://rapidapi.com/aidengwilliams96/api/cannaapi1/,cannaapi1.p.rapidapi.com,GET:Get Strain By ID,Get the strain by ID,,"[{'参数名': ['id'], '参数类型': ['STRING'], '参数注意事项': ['']}]",[{}]
CannaAPI,https://rapidapi.com/aidengwilliams96/api/cannaapi1/,cannaapi1.p.rapidapi.com,GET:Get All Strains,This endpoint gets all the strains within our database.,,[{}],[{}]
Monkeypox,https://rapidapi.com/baileymaynard418-reHD1UybSFC/api/monkeypox/,monkeypox.p.rapidapi.com,GET:cases,Returns the total world case count according to WHO.,,[{}],[{}]
Monkeypox,https://rapidapi.com/baileymaynard418-reHD1UybSFC/api/monkeypox/,monkeypox.p.rapidapi.com,GET:country,Returns the case count for all countries if a country ISO3 code is not specified.,,[{}],"[{'参数名': ['country'], '参数类型': ['STRING'], '参数注意事项': ['']}]"
Monkeypox,https://rapidapi.com/baileymaynard418-reHD1UybSFC/api/monkeypox/,monkeypox.p.rapidapi.com,GET:state,Returns cases per state in the US if a state is not specified.,,[{}],"[{'参数名': ['state'], '参数类型': ['STRING'], '参数注意事项': ['']}]"
Coroanvirus Covid-19 Tracker,https://rapidapi.com/Futurenovation/api/coroanvirus-covid-19-tracker/,coroanvirus-covid-19-tracker.p.rapidapi.com,GET:getCountries,,server,[{}],[{}]
Coroanvirus Covid-19 Tracker,https://rapidapi.com/Futurenovation/api/coroanvirus-covid-19-tracker/,coroanvirus-covid-19-tracker.p.rapidapi.com,GET:getCountryWithAllDataset,,server,[{}],"[{'参数名': ['relative'], '参数类型': ['BOOLEAN'], '参数注意事项': ['Return the data relative to the population']}]"
Coroanvirus Covid-19 Tracker,https://rapidapi.com/Futurenovation/api/coroanvirus-covid-19-tracker/,coroanvirus-covid-19-tracker.p.rapidapi.com,GET:getLastUpdate,,server,[{}],[{}]
Coroanvirus Covid-19 Tracker,https://rapidapi.com/Futurenovation/api/coroanvirus-covid-19-tracker/,coroanvirus-covid-19-tracker.p.rapidapi.com,GET:triggerupdate,,server,[{}],[{}]
Coroanvirus Covid-19 Tracker,https://rapidapi.com/Futurenovation/api/coroanvirus-covid-19-tracker/,coroanvirus-covid-19-tracker.p.rapidapi.com,GET:getWorld,,server,[{}],"[{'参数名': ['relative'], '参数类型': ['BOOLEAN'], '参数注意事项': ['Return the data relative to the population']}]"
Coroanvirus Covid-19 Tracker,https://rapidapi.com/Futurenovation/api/coroanvirus-covid-19-tracker/,coroanvirus-covid-19-tracker.p.rapidapi.com,GET:getCountry,,server,[{}],"[{'参数名': ['relative'], '参数类型': ['BOOLEAN'], '参数注意事项': ['Return the data relative to the population']}]"
Coroanvirus Covid-19 Tracker,https://rapidapi.com/Futurenovation/api/coroanvirus-covid-19-tracker/,coroanvirus-covid-19-tracker.p.rapidapi.com,GET:getNews,,server,[{}],[{}]
Coroanvirus Covid-19 Tracker,https://rapidapi.com/Futurenovation/api/coroanvirus-covid-19-tracker/,coroanvirus-covid-19-tracker.p.rapidapi.com,GET:getPositiveNews,,server,[{}],[{}]
Healthy,https://rapidapi.com/1masondavis-iRkqEmP93w/api/healthy/,healthy.p.rapidapi.com,GET:Specific clinicalstudies,"this one is specific to a large list of publications for medical conditions, and trials.",,"[{'参数名': ['researchId'], '参数类型': ['STRING'], '参数注意事项': ['']}]",[{}]
Healthy,https://rapidapi.com/1masondavis-iRkqEmP93w/api/healthy/,healthy.p.rapidapi.com,"GET:Get latest Grant requirements, and medical research news","This endpoint will return clinical data, trials, publications, grant and funding information as well as requirements and how to apply.",,[{}],[{}]
open-fda,https://rapidapi.com/icedryers-icedryers-default/api/open-fda/,open-fda.p.rapidapi.com,GET:Search_NDC_directory,Search_NDC_directory,,[{}],"[{'参数名': ['generic_name', 'limit'], '参数类型': ['STRING', 'STRING'], '参数注意事项': ['', '']}]"
English speaking medical facilities,https://rapidapi.com/Paulone1/api/english-speaking-medical-facilities/,english-speaking-medical-facilities.p.rapidapi.com,GET:Facilities,List facilities by country,,"[{'参数名': ['country'], '参数类型': ['STRING'], '参数注意事项': ['']}]",[{}]
English speaking medical facilities,https://rapidapi.com/Paulone1/api/english-speaking-medical-facilities/,english-speaking-medical-facilities.p.rapidapi.com,GET:Countries,Lists countries in the data base,,[{}],[{}]
Covid 19 World Vaccination Data,https://rapidapi.com/jamesrabels-96HXl7ebedl/api/covid-19-world-vaccination-data/,covid-19-world-vaccination-data.p.rapidapi.com,GET:home,Simply pass an iso query parameter with the alpha-3 ISO country code of your choice to receive data for that country,,"[{'参数名': ['iso'], '参数类型': ['STRING'], '参数注意事项': ['']}]",[{}]
Doctors and Medical Professionals of Jaipur India,https://rapidapi.com/AIODS/api/doctors-and-medical-professionals-of-jaipur-india/,doctors-and-medical-professionals-of-jaipur-india.p.rapidapi.com,GET:Jaipur doctors API,"Get the details of almost 11K doctors and medical professionals of Jaipur, India",,[{}],"[{'参数名': ['page_no'], '参数类型': ['NUMBER'], '参数注意事项': ['Get the details of almost 11K doctors and medical professionals of Jaipur, India']}]"
DrugAPI,https://rapidapi.com/ddowar-1g0Q3PyrJyP/api/drugapi/,drugapi.p.rapidapi.com,GET:Get Drug Info,"Gets information about drug, including the: administration, storage, dosage, description, ect. Use the ""drugLink"" property value as the required path parameter.",,"[{'参数名': ['DrugLink'], '参数类型': ['STRING'], '参数注意事项': ['']}]",[{}]
DrugAPI,https://rapidapi.com/ddowar-1g0Q3PyrJyP/api/drugapi/,drugapi.p.rapidapi.com,GET:Get Drug List By Name (Pagination),Gets the next/previous/desired listing of prescription drugs by common name.,,"[{'参数名': ['pagenum', 'name'], '参数类型': ['STRING', 'STRING'], '参数注意事项': ['', '']}]",[{}]
DrugAPI,https://rapidapi.com/ddowar-1g0Q3PyrJyP/api/drugapi/,drugapi.p.rapidapi.com,GET:Get Drug List By Letter (Pagination),Gets the next/previous/desired listing of prescription drugs by letter.,,"[{'参数名': ['pagenum', 'letter'], '参数类型': ['STRING', 'STRING'], '参数注意事项': ['', '']}]",[{}]
DrugAPI,https://rapidapi.com/ddowar-1g0Q3PyrJyP/api/drugapi/,drugapi.p.rapidapi.com,GET:Get Drug List By Name,Gets a listing of prescription drugs by a common name.,,"[{'参数名': ['name'], '参数类型': ['STRING'], '参数注意事项': ['']}]",[{}]
DrugAPI,https://rapidapi.com/ddowar-1g0Q3PyrJyP/api/drugapi/,drugapi.p.rapidapi.com,GET:Get Drug List By Letter,Gets a listing of all prescription drugs by the starting letter of their name.,,"[{'参数名': ['letter'], '参数类型': ['STRING'], '参数注意事项': ['']}]",[{}]
ZomiDictionary,https://rapidapi.com/ZomiDictionary/api/zomidictionary/,zomidictionary.p.rapidapi.com,GET:ZomiDictionary,Zomi Dictionary,ZomiDictionary,[{}],[{}]
iosep,https://rapidapi.com/dofnet/api/iosep/,iosep.p.rapidapi.com,GET:TipoInternacion,TipoInternacion,,[{}],[{}]
iosep,https://rapidapi.com/dofnet/api/iosep/,iosep.p.rapidapi.com,GET:Planes,Planes,,[{}],[{}]
GetGuidelines,https://rapidapi.com/mbvawork/api/getguidelines/,getguidelines.p.rapidapi.com,GET:all,All guidelines,,[{}],[{}]
GetGuidelines,https://rapidapi.com/mbvawork/api/getguidelines/,getguidelines.p.rapidapi.com,GET:vac,Vaccinations only,,[{}],[{}]
Alopets Promo,https://rapidapi.com/bdozajah/api/alopets-promo/,alopets-promo.p.rapidapi.com,GET:promo,promo code,,"[{'参数名': ['code'], '参数类型': ['STRING'], '参数注意事项': ['Pets Code']}]",[{}]
Life Expectancy,https://rapidapi.com/bechllc/api/life-expectancy/,life-left.p.rapidapi.com,GET:Time Left GET,Expected time left to live,time left,[{}],"[{'参数名': ['gender'], '参数类型': ['STRING'], '参数注意事项': ['Gender']}]"
Life Expectancy,https://rapidapi.com/bechllc/api/life-expectancy/,life-left.p.rapidapi.com,POST:Time Left POST,,time left,[{}],[{}]
Human,https://rapidapi.com/humanapi/api/human/,human.p.rapidapi.com,GET:Blood pressure by id,Returns a specific blood pressure recording,Blood Pressure,"[{'参数名': ['blood_pressure_id'], '参数类型': ['STRING'], '参数注意事项': ['']}]",[{}]
Human,https://rapidapi.com/humanapi/api/human/,human.p.rapidapi.com,GET:Recent blood pressure,Returns the most recent blood pressure recording,Blood Pressure,[{}],[{}]
Human,https://rapidapi.com/humanapi/api/human/,human.p.rapidapi.com,GET:Blood pressure by date,,Blood Pressure,"[{'参数名': ['date'], '参数类型': ['STRING'], '参数注意事项': ['']}]",[{}]
Human,https://rapidapi.com/humanapi/api/human/,human.p.rapidapi.com,GET:Heart rate by date,Returns heart rate recordings for a specific date,Heart Rate,"[{'参数名': ['date'], '参数类型': ['STRING'], '参数注意事项': ['']}]",[{}]
Human,https://rapidapi.com/humanapi/api/human/,human.p.rapidapi.com,GET:Heart rate by id,Returns a specific heart rate recording,Heart Rate,"[{'参数名': ['heart_rate_id'], '参数类型': ['STRING'], '参数注意事项': ['']}]",[{}]
Human,https://rapidapi.com/humanapi/api/human/,human.p.rapidapi.com,GET:Recent heart rate,Returns the most recent heart rate recording,Heart Rate,[{}],[{}]
Human,https://rapidapi.com/humanapi/api/human/,human.p.rapidapi.com,GET:Recent sleep,Returns a summary of the most recent sleep recordings,Sleep,[{}],[{}]
Human,https://rapidapi.com/humanapi/api/human/,human.p.rapidapi.com,GET:Sleep recordings by date,Returns the time series of sleep recordings for a specific date,Sleep,"[{'参数名': ['date'], '参数类型': ['STRING'], '参数注意事项': ['']}]",[{}]
Human,https://rapidapi.com/humanapi/api/human/,human.p.rapidapi.com,GET:Recent sleep series,Returns the most recent time series of sleep recordings,Sleep,[{}],[{}]
Human,https://rapidapi.com/humanapi/api/human/,human.p.rapidapi.com,GET:Sleep by id,Returns a specific sleep recording,Sleep,"[{'参数名': ['sleep_id'], '参数类型': ['STRING'], '参数注意事项': ['']}]",[{}]
Human,https://rapidapi.com/humanapi/api/human/,human.p.rapidapi.com,GET:Sleep by date,Returns a summary of recent sleep recordings for a specific date,Sleep,"[{'参数名': ['date'], '参数类型': ['STRING'], '参数注意事项': ['']}]",[{}]
Human,https://rapidapi.com/humanapi/api/human/,human.p.rapidapi.com,GET:Body fat by id,Returns a specific body fat recording,Body Fat,[{}],[{}]
Human,https://rapidapi.com/humanapi/api/human/,human.p.rapidapi.com,GET:Recent body fat,Returns the most recent body fat recording,Body Fat,[{}],[{}]
Human,https://rapidapi.com/humanapi/api/human/,human.p.rapidapi.com,GET:Body fat by date,Returns body fat recordings for a specific date,Body Fat,"[{'参数名': ['date'], '参数类型': ['STRING'], '参数注意事项': ['']}]",[{}]
Human,https://rapidapi.com/humanapi/api/human/,human.p.rapidapi.com,GET:Recent active minutes,Returns a summary of the most recent active minutes,Activity,[{}],[{}]
Human,https://rapidapi.com/humanapi/api/human/,human.p.rapidapi.com,GET:Active minutes by date,Returns a summary of the active minutes by a specific date,Activity,"[{'参数名': ['date'], '参数类型': ['STRING'], '参数注意事项': ['']}]",[{}]
Human,https://rapidapi.com/humanapi/api/human/,human.p.rapidapi.com,GET:Time series of activities by date,Returns the time series of activities for a specific date,Activity,"[{'参数名': ['date'], '参数类型': ['STRING'], '参数注意事项': ['']}]",[{}]
Human,https://rapidapi.com/humanapi/api/human/,human.p.rapidapi.com,GET:Recent time series of activities,Returns the most recent time series of activities,Activity,[{}],[{}]
Human,https://rapidapi.com/humanapi/api/human/,human.p.rapidapi.com,GET:Blood glucose by date,Returns blood glucose readings for a specific date,Blood Glucose,"[{'参数名': ['date'], '参数类型': ['STRING'], '参数注意事项': ['']}]",[{}]
Human,https://rapidapi.com/humanapi/api/human/,human.p.rapidapi.com,GET:Recent blood gluecose,Returns the most recent blood glucose reading,Blood Glucose,[{}],[{}]
Human,https://rapidapi.com/humanapi/api/human/,human.p.rapidapi.com,GET:Blood glucose by id,Returns a specific blood glucose reading,Blood Glucose,"[{'参数名': ['blood_glucose_id'], '参数类型': ['STRING'], '参数注意事项': ['']}]",[{}]
Human,https://rapidapi.com/humanapi/api/human/,human.p.rapidapi.com,GET:Genetics,Returns the genetic traits of the human,Genetics,[{}],[{}]
Human,https://rapidapi.com/humanapi/api/human/,human.p.rapidapi.com,GET:Recent height,Returns the most recent height recording,Height,[{}],[{}]
Human,https://rapidapi.com/humanapi/api/human/,human.p.rapidapi.com,GET:Height by id,Returns a specific height recording,Height,"[{'参数名': ['height_id'], '参数类型': ['STRING'], '参数注意事项': ['']}]",[{}]
Human,https://rapidapi.com/humanapi/api/human/,human.p.rapidapi.com,GET:Height by date,Returns height recordings for a specific date,Height,"[{'参数名': ['date'], '参数类型': ['STRING'], '参数注意事项': ['']}]",[{}]
Human,https://rapidapi.com/humanapi/api/human/,human.p.rapidapi.com,GET:Profile,Returns the profile of the authenticated user,Profile,[{}],[{}]
Human,https://rapidapi.com/humanapi/api/human/,human.p.rapidapi.com,GET:Summary,Returns a summary of the user's current health data,Profile,[{}],[{}]
Human,https://rapidapi.com/humanapi/api/human/,human.p.rapidapi.com,GET:Weight by date,Returns weight recordings for a specific date,Weight,"[{'参数名': ['date'], '参数类型': ['STRING'], '参数注意事项': ['']}]",[{}]
Human,https://rapidapi.com/humanapi/api/human/,human.p.rapidapi.com,GET:Weight by id,Returns a specific weight recording,Weight,"[{'参数名': ['weight_id'], '参数类型': ['STRING'], '参数注意事项': ['']}]",[{}]
Human,https://rapidapi.com/humanapi/api/human/,human.p.rapidapi.com,GET:Recent weight,,Weight,[{}],[{}]
Human,https://rapidapi.com/humanapi/api/human/,human.p.rapidapi.com,GET:Recent BMI,Returns the most recent BMI recording,BMI,[{}],[{}]
Human,https://rapidapi.com/humanapi/api/human/,human.p.rapidapi.com,GET:BMI by id,Returns a specific BMI recording,BMI,"[{'参数名': ['bmi_id'], '参数类型': ['STRING'], '参数注意事项': ['']}]",[{}]
Human,https://rapidapi.com/humanapi/api/human/,human.p.rapidapi.com,GET:BMI for a specific date,Returns BMI recordings for a specific date,BMI,"[{'参数名': ['date'], '参数类型': ['STRING'], '参数注意事项': ['']}]",[{}]
Human,https://rapidapi.com/humanapi/api/human/,human.p.rapidapi.com,GET:Location by date,Returns a list of location recordings for a specific date,Location,"[{'参数名': ['date'], '参数类型': ['STRING'], '参数注意事项': ['']}]",[{}]
Human,https://rapidapi.com/humanapi/api/human/,human.p.rapidapi.com,GET:Recent location,Returns a list of recent locations,Location,[{}],[{}]
23andMe,https://rapidapi.com/23andme/api/23andme/,23andme-23andme.p.rapidapi.com,GET:profile_picture,,User,"[{'参数名': ['profile_id'], '参数类型': ['STRING'], '参数注意事项': ['profile_id as returned from /user/']}]",[{}]
23andMe,https://rapidapi.com/23andme/api/23andme/,23andme-23andme.p.rapidapi.com,PUT:publish_put,,User,"[{'参数名': ['profile_id', 'feature_id', 'link_id'], '参数类型': ['STRING', 'STRING', 'STRING'], '参数注意事项': ['profile_id', 'feature_id', 'link_id']}]",[{}]
23andMe,https://rapidapi.com/23andme/api/23andme/,23andme-23andme.p.rapidapi.com,GET:publish_get,,User,"[{'参数名': ['profile_id', 'feature_id'], '参数类型': ['STRING', 'STRING'], '参数注意事项': ['profile_id', 'feature_id']}]",[{}]
23andMe,https://rapidapi.com/23andme/api/23andme/,23andme-23andme.p.rapidapi.com,GET:publish_get by link,,User,"[{'参数名': ['profile_id', 'feature_id', 'link_id'], '参数类型': ['STRING', 'STRING', 'STRING'], '参数注意事项': ['', '', '']}]",[{}]
23andMe,https://rapidapi.com/23andme/api/23andme/,23andme-23andme.p.rapidapi.com,GET:user,"Gets the user id, and a list of profiles (an account can have multiple genotyped people) with ids and whether or not they're genotyped. This endpoint is great for using an app anonymously because there is no personally identifying information.",User,[{}],[{}]
23andMe,https://rapidapi.com/23andme/api/23andme/,23andme-23andme.p.rapidapi.com,POST:publish_post,"Users can publish and share certain features publicly, for example on social networks, with a special link. Anyone with the link, if active, can view that person's results for the following feature_ids:",User,"[{'参数名': ['profile_id', 'feature_id'], '参数类型': ['STRING', 'STRING'], '参数注意事项': ['profile_id', '']}]",[{}]
23andMe,https://rapidapi.com/23andme/api/23andme/,23andme-23andme.p.rapidapi.com,POST:profile_picture_post,"Gets the user's profile picture for a few sizes, or uploads a picture, < 5MB, and crops it. The POST returns the same info as the GET, if successful. For the POST, set Content-Type: multipart/form-data and upload the image with parameter image.",User,"[{'参数名': ['profile_id'], '参数类型': ['STRING'], '参数注意事项': ['profile_id as returned from /user/']}]",[{}]
23andMe,https://rapidapi.com/23andme/api/23andme/,23andme-23andme.p.rapidapi.com,GET:names,"For the user and user's profile, gets first and last names. If your user wants to remain anonymous, you shouldn't request this scope. You can optionally filter by profile_id to get the names for just that profile.",User,"[{'参数名': ['profile_id'], '参数类型': ['STRING'], '参数注意事项': ['profile_id as returned from /user/']}]",[{}]
23andMe,https://rapidapi.com/23andme/api/23andme/,23andme-23andme.p.rapidapi.com,GET:traits,"Our analysis for each profile for these traits (starred reports). trait is a value in possible_traits, or null if the profile's not analyzed at those markers.",Health,"[{'参数名': ['profile_id'], '参数类型': ['STRING'], '参数注意事项': ['profile_id']}]",[{}]
23andMe,https://rapidapi.com/23andme/api/23andme/,23andme-23andme.p.rapidapi.com,GET:drug_responses,"Our analysis of how each profile responds to these drugs (starred reports). status is reduced, typical, or increased for a person, not_applicable if the drug is not applicable to them (e.g., the oral contraceptives report is for women only), or null if they're not analyzed at ...",Health,"[{'参数名': ['profile_id'], '参数类型': ['STRING'], '参数注意事项': ['profile_id']}]",[{}]
23andMe,https://rapidapi.com/23andme/api/23andme/,23andme-23andme.p.rapidapi.com,GET:risks,"Our analysis for each profile's lifetime risk of these diseases (starred reports). population_risk is the average risk for the population for which the analysis applies, and risk is the profile's risk.",Health,"[{'参数名': ['profile_id'], '参数类型': ['STRING'], '参数注意事项': ['profile_id']}]",[{}]
23andMe,https://rapidapi.com/23andme/api/23andme/,23andme-23andme.p.rapidapi.com,GET:carriers,"Our analysis of whether or not each profile is a carrier for these diseases (starred reports). The person has 0, 1, or 2 mutations, or null if they're not analyzed at any of the markers. Normally, with one mutation, the person is considered a ""carrier"" and can pass the mutatio...",Health,"[{'参数名': ['profile_id'], '参数类型': ['STRING'], '参数注意事项': ['']}]",[{}]
23andMe,https://rapidapi.com/23andme/api/23andme/,23andme-23andme.p.rapidapi.com,GET:neanderthal,Estimated genome-wide proportion of Neanderthal ancestry for the user's profile. Most users have between 0.01 and 0.04 Neanderthal ancestry -- read a full explanation of the science. proportion is -1 for un-genotyped (or as-of-yet uncomputed) profiles.,Ancestry,"[{'参数名': ['profile_id'], '参数类型': ['STRING'], '参数注意事项': ['profile_id']}]",[{}]
23andMe,https://rapidapi.com/23andme/api/23andme/,23andme-23andme.p.rapidapi.com,GET:ancestry,"Ancestral breakdown for the user's profile. Each population has an absolute proportion of the genome. A population with sub_populations has an unassigned proportion — the ancestry we couldn't classify in it. threshold is optional, default 0.75 and range (0.5, 1.0) exclusive....",Ancestry,"[{'参数名': ['threshold', 'profile_id'], '参数类型': ['STRING', 'STRING'], '参数注意事项': ['threshold ex: 0.9', '']}]",[{}]
23andMe,https://rapidapi.com/23andme/api/23andme/,23andme-23andme.p.rapidapi.com,GET:relatives,"Relatives on 23andMe, for the user's profile. shared_segments is the total number of shared IBD segments; similarity is the actual proportion (1.00 being you, or an identical twin). maternal/paternal_side are True if this match is a relative from your mom or dad's side. range ...",Ancestry,[{}],"[{'参数名': ['limit', 'offset', 'since'], '参数类型': ['STRING', 'STRING', 'STRING'], '参数注意事项': ['limit', 'offset', 'since']}]"
23andMe,https://rapidapi.com/23andme/api/23andme/,23andme-23andme.p.rapidapi.com,GET:haplogroups,"For the user's profile, gets maternal and paternal haplogroups, as well as terminal SNPs. Maternal terminal SNPs include the rsid and rCRS reference position, while the paternal ones include the rsid and ISOGG SNP. Note: if the profile belongs to a female, the paternal (y) ha...",Ancestry,"[{'参数名': ['profile_id'], '参数类型': ['STRING'], '参数注意事项': ['profile_id']}]",[{}]
23andMe,https://rapidapi.com/23andme/api/23andme/,23andme-23andme.p.rapidapi.com,GET:genotypes,"Returns the entire profile's genome as a packed string of base pairs ""AACTGA…"". This ~2MB request returns over a million SNP locations, so you must specify profile_id. If the profile has not yet unlocked certain SNPs, they'll be replaced with __. To know which SNP corresponds ...",Genetics,[{}],"[{'参数名': ['locations'], '参数类型': ['STRING'], '参数注意事项': ['ex. rs3094315%20i3000001']}]"
23andMe,https://rapidapi.com/23andme/api/23andme/,23andme-23andme.p.rapidapi.com,GET:genomes,"Returns the entire profile's genome as a packed string of base pairs ""AACTGA…"". This ~2MB request returns over a million SNP locations, so you must specify profile_id. If the profile has not yet unlocked certain SNPs, they'll be replaced with __. To know which SNP corresponds ...",Genetics,"[{'参数名': ['profile_id'], '参数类型': ['STRING'], '参数注意事项': ['profile_id']}]",[{}]
My test,https://rapidapi.com/danaheinze40/api/my-test52/,my-test52.p.rapidapi.com,POST:Urlcut,Url shortner,,[{}],[{}]
Asia Lab,https://rapidapi.com/aliyosufi/api/asia-lab1/,asia-lab1.p.rapidapi.com,GET:Asia Lab End,Asia Lab Endpoints,,[{}],"[{'参数名': ['covid-19'], '参数类型': ['STRING'], '参数注意事项': ['']}]"
HealthWise,https://rapidapi.com/Elyes/api/healthwise/,healthwise.p.rapidapi.com,GET:GetAssociatedDiseases,"Get common diseases for an organ
Parameter {bodypart}:
| 1 | brain |
| 2 | eyes |
| 3 | ears |
| 4 | nose |
| 5 | lips |
| 6 | tongue |
| 7 | jaw |
...",,"[{'参数名': ['bodypart'], '参数类型': ['STRING'], '参数注意事项': ['']}]",[{}]
HealthWise,https://rapidapi.com/Elyes/api/healthwise/,healthwise.p.rapidapi.com,GET:GetCommonSymptoms,"Get common symptoms associated to an organ.
Parameter {organ}:
| 1 | brain |
| 2 | eyes |
| 3 | ears |
| 4 | nose |
| 5 | lips |
| 6 | tongue |
| 7 | jaw ...",,"[{'参数名': ['organ'], '参数类型': ['STRING'], '参数注意事项': ['']}]",[{}]
HealthWise,https://rapidapi.com/Elyes/api/healthwise/,healthwise.p.rapidapi.com,GET:GetDiseaseSymptoms,"get common disease symptoms.
Parameter {cause} :
| 1 | Macular Degeneration |
| 2 | Cataracts |
| 3 | Glaucoma |
| 4 | Diabetic R...",,"[{'参数名': ['cause'], '参数类型': ['STRING'], '参数注意事项': ['']}]",[{}]
HealthWise,https://rapidapi.com/Elyes/api/healthwise/,healthwise.p.rapidapi.com,GET:GetMainBodyParts,"Get main body parts,",,[{}],[{}]
HealthWise,https://rapidapi.com/Elyes/api/healthwise/,healthwise.p.rapidapi.com,GET:GetBodyOrgans,"Get specefic body part's organs.
Parameter: {part} :
| 1 | head |
| 2 | upperbody |
| 3 | lowerbody |",,"[{'参数名': ['part'], '参数类型': ['STRING'], '参数注意事项': ['']}]",[{}]
Nguyễn Hữu Khương,https://rapidapi.com/devcui-devcui-default/api/nguy-n-h-u-kh-ng/,nguy-n-h-u-kh-ng.p.rapidapi.com,GET:test,test nè,,[{}],"[{'参数名': ['name'], '参数类型': ['STRING'], '参数注意事项': ['']}]"
meadrapid,https://rapidapi.com/chaozhang770/api/meadrapid/,meadrapid.p.rapidapi.com,GET:UserViewSet,API endpoint that allows users to be viewed or edited,,[{}],[{}]
