API名称,API链接,API_Host,Endpoint名称,Endpoint描述,Endpoint种类,Endpoint必须参数,Endpoint可选参数
Translation Cloud,https://rapidapi.com/berthecheick/api/translation-cloud2/,translation-cloud2.p.rapidapi.com,POST:Text Translation,"Translate a given text from one language to another.
The request body should include:",,[{}],[{}]
Translation Cloud,https://rapidapi.com/berthecheick/api/translation-cloud2/,translation-cloud2.p.rapidapi.com,GET:Supported Languages,Retrieve the list of languages supported by the Translation Cloud API. Each entry in the list contains:,,[{}],[{}]
Rimedia - Translation,https://rapidapi.com/sibaridev/api/rimedia-translation/,rimedia-translation.p.rapidapi.com,POST:Rimedia - Translate,"Rimedia Translate. instantly translates words, phrases, and paragraphs between English and more than 100 other languages. HTML / Text / JSON. Protected words. Multiple target languages in one application.",,[{}],[{}]
Rimedia - Translation,https://rapidapi.com/sibaridev/api/rimedia-translation/,rimedia-translation.p.rapidapi.com,POST:Rimedia - Translate Unlimited Characters,"Rimedia Translate. instantly translates Unlimited words, phrases, and paragraphs between English and more than 100 other languages. HTML / Text / JSON. Protected words. Multiple target languages in one application.",,[{}],[{}]
Google Cloud Translate API,https://rapidapi.com/jozef-WxBhUjW_l/api/google-cloud-translate-api/,google-cloud-translate-api.p.rapidapi.com,GET:Translate using Query,"Translate with GET method.
Use text query parameter to specify text that should be translated.
Use target_lang to specify target language.",Translate text,[{}],"[{'参数名': ['text', 'target_lang'], '参数类型': ['STRING', 'STRING'], '参数注意事项': ['', '']}]"
Google Cloud Translate API,https://rapidapi.com/jozef-WxBhUjW_l/api/google-cloud-translate-api/,google-cloud-translate-api.p.rapidapi.com,POST:Translate with JSON,"Translate with POST method.
Use text query parameter to specify text that should be translated.
Use target_lang to specify target language.",Translate text,[{}],[{}]
Vezzra,https://rapidapi.com/redible-redible-default/api/vezzra1/,vezzra1.p.rapidapi.com,GET:Translate,Jast paste text,,"[{'参数名': ['Text'], '参数类型': ['STRING'], '参数注意事项': ['']}]",[{}]
Swenapi,https://rapidapi.com/Isayaisaya/api/swenapi/,swenapi.p.rapidapi.com,GET:en-sw,Translate an English words to Swahili,,"[{'参数名': ['word'], '参数类型': ['STRING'], '参数注意事项': ['']}]",[{}]
Swenapi,https://rapidapi.com/Isayaisaya/api/swenapi/,swenapi.p.rapidapi.com,GET:sw-num,Translate any number to Swahili words,,"[{'参数名': ['num'], '参数类型': ['NUMBER'], '参数注意事项': ['']}]",[{}]
Translef - translator,https://rapidapi.com/mandus1995/api/translef-translator/,translef-translator.p.rapidapi.com,POST:Text translation,The endpoint itself will determine the source language of the text,,[{}],[{}]
Translef - translator,https://rapidapi.com/mandus1995/api/translef-translator/,translef-translator.p.rapidapi.com,GET:List of available languages,This method returns a list of language codes that will be needed in the method to translate the text,,[{}],[{}]
Amazon Translate,https://rapidapi.com/jozef-WxBhUjW_l/api/amazon-translate/,amazon-translate.p.rapidapi.com,POST:Translate with JSON,"Translate with POST method.
Use text query parameter to specify text that should be translated.
Use target_lang to specify target language.",Translate text,[{}],[{}]
Amazon Translate,https://rapidapi.com/jozef-WxBhUjW_l/api/amazon-translate/,amazon-translate.p.rapidapi.com,GET:Translate using Query,"Translate with GET method.
Use text query parameter to specify text that should be translated.
Use target_lang to specify target language.",Translate text,[{}],"[{'参数名': ['text', 'target_lang'], '参数类型': ['STRING', 'STRING'], '参数注意事项': ['', '']}]"
Lanytek Audio2Midi,https://rapidapi.com/JC1DA/api/lanytek-audio2midi/,lanytek-audio2midi.p.rapidapi.com,POST:/gen-from-youtube,[ASYNC_API] Generate transcription from youtube video.,audios,[{}],[{}]
Lanytek Audio2Midi,https://rapidapi.com/JC1DA/api/lanytek-audio2midi/,lanytek-audio2midi.p.rapidapi.com,POST:/gen-from-file,[ASYNC_API] Generate transcription from audio file.,audios,[{}],[{}]
Lanytek Audio2Midi,https://rapidapi.com/JC1DA/api/lanytek-audio2midi/,lanytek-audio2midi.p.rapidapi.com,GET:/,Get result of audio transcription,audios,"[{'参数名': ['req_id'], '参数类型': ['STRING'], '参数注意事项': ['']}]",[{}]
Lanytek Audio2Midi,https://rapidapi.com/JC1DA/api/lanytek-audio2midi/,lanytek-audio2midi.p.rapidapi.com,POST:/gen-from-file/sync,[SYNC_API] Generate transcription from audio file.,audios,[{}],[{}]
Lanytek Audio2Midi,https://rapidapi.com/JC1DA/api/lanytek-audio2midi/,lanytek-audio2midi.p.rapidapi.com,POST:/gen-from-youtube/sync,[SYNC_API] Generate transcription from youtube video.,audios,[{}],[{}]
AWS Translate,https://rapidapi.com/cpvdeveloper/api/aws-translate/,aws-translate.p.rapidapi.com,POST:Translate,Translates a string into the target language.,,[{}],[{}]
Translator 7,https://rapidapi.com/krovin70/api/translator-7/,translator-7.p.rapidapi.com,GET:text,Your text for translation,,[{}],"[{'参数名': ['text', 'language'], '参数类型': ['STRING', 'STRING'], '参数注意事项': ['', '']}]"
Vietnamese English translator,https://rapidapi.com/khangruni/api/vietnamese-english-translator/,vietnamese-english-translator.p.rapidapi.com,GET:translator,translator,,"[{'参数名': ['lang', 'text'], '参数类型': ['ENUM', 'STRING'], '参数注意事项': ['', '']}]",[{}]
Natural Translation,https://rapidapi.com/KGMK/api/natural-translation/,natural-translation.p.rapidapi.com,POST:Translate,Translate Text or HTML,,[{}],[{}]
Namba Translator,https://rapidapi.com/Isayaisaya/api/namba-translator/,namba-translator.p.rapidapi.com,GET:sw_num,Can translate a number to Swahili words.,,"[{'参数名': ['num'], '参数类型': ['NUMBER'], '参数注意事项': ['']}]",[{}]
Google Translate,https://rapidapi.com/UnlimitedAPI/api/google-translate104/,google-translate104.p.rapidapi.com,POST:Translate,Translate,,[{}],[{}]
Google Translate,https://rapidapi.com/UnlimitedAPI/api/google-translate104/,google-translate104.p.rapidapi.com,POST:Batch Translate,Fast — Batch Translate,,[{}],[{}]
QR API,https://rapidapi.com/sujalpatni007/api/qr-api6/,qr-api6.p.rapidapi.com,GET:Qr Image,This end point takes a 'GET' request with url/ string as a parameter and gives back a QR code image.,,[{}],"[{'参数名': ['url'], '参数类型': ['STRING'], '参数注意事项': ['']}]"
Transliterator,https://rapidapi.com/nontrivialtools/api/transliterator/,transliterator.p.rapidapi.com,POST:translit,(POST) Transliterates the input string and return a list of output options,,[{}],[{}]
Transliterator,https://rapidapi.com/nontrivialtools/api/transliterator/,transliterator.p.rapidapi.com,GET:translit,(GET) Transliterates the input string and return a list of output options,,[{}],"[{'参数名': ['count'], '参数类型': ['NUMBER'], '参数注意事项': ['']}]"
Efficient translate,https://rapidapi.com/sedoyjan/api/efficient-translate/,efficient-translate.p.rapidapi.com,GET:translate,Returns translation for passed query,,"[{'参数名': ['query', 'from', 'to'], '参数类型': ['STRING', 'STRING', 'STRING'], '参数注意事项': ['', '', '']}]",[{}]
Efficient translate,https://rapidapi.com/sedoyjan/api/efficient-translate/,efficient-translate.p.rapidapi.com,GET:languages,Returns the list of supported languages,,[{}],[{}]
Google translate,https://rapidapi.com/opteka-opteka-default/api/google-translate105/,google-translate105.p.rapidapi.com,POST:translate,"'af': 'afrikaans',
'sq': 'albanian',
'am': 'amharic',
'ar': 'arabic',
'hy': 'armenian',
'az': 'azerbaijani',
'eu': 'basque',
'be': 'belarusian',
'bn': 'bengali',
'bs': 'bosnian',
...",,[{}],[{}]
Google translate,https://rapidapi.com/opteka-opteka-default/api/google-translate105/,google-translate105.p.rapidapi.com,POST:detect,Automatic language detection,,[{}],[{}]
CodeMorph,https://rapidapi.com/JackLillie/api/codemorph/,codemorph.p.rapidapi.com,POST:Translate Code,"You can submit your code as input and receive the translated code in your desired target language as the output. Whether you need to convert a small code snippet, an entire function, or even a large codebase, this endpoint has got you covered.",,[{}],[{}]
Language-Translator,https://rapidapi.com/karthikhosur15/api/language-translator1/,language-translator1.p.rapidapi.com,POST:Translate,Translate the text by proving the string text along with its output language ISO code in two characters . A list of language and corresponding codes are provided in the link,,[{}],[{}]
text translation,https://rapidapi.com/jolix1235/api/text-translation6/,text-translation6.p.rapidapi.com,POST:translate,,default,[{}],[{}]
Number-to-Numeral Converter,https://rapidapi.com/CSC-89/api/number-to-numeral-converter/,number-to-numeral-converter.p.rapidapi.com,GET:Get Numeral,"Send out a number, receive its numeral equivalent",,"[{'参数名': ['number'], '参数类型': ['STRING'], '参数注意事项': ['']}]",[{}]
Automatismz translator,https://rapidapi.com/daminsoft/api/automatismz-translator/,automatismz-translator.p.rapidapi.com,POST:Translate,Automatismz translator is an api that can translate to any language chosen.,,[{}],[{}]
DeepL Translator,https://rapidapi.com/jozef-WxBhUjW_l/api/deepl-translator1/,deepl-translator1.p.rapidapi.com,GET:Translate using Query,"Translate with GET method.
Use text query parameter to specify text that should be translated.
Use target_lang to specify target language.",Translate text,"[{'参数名': ['text', 'target_lang'], '参数类型': ['STRING', 'STRING'], '参数注意事项': ['', '']}]",[{}]
DeepL Translator,https://rapidapi.com/jozef-WxBhUjW_l/api/deepl-translator1/,deepl-translator1.p.rapidapi.com,POST:Translate with JSON,"Translate with POST method.
Use text query parameter to specify text that should be translated.
Use target_lang to specify target language.",Translate text,[{}],[{}]
Word to Word Translator,https://rapidapi.com/bacloud22/api/word-to-word-translator1/,word-to-word-translator1.p.rapidapi.com,GET:Word translation,translate is the core API of our service.,api,"[{'参数名': ['word', 'source', 'target', 'score', 'limit'], '参数类型': ['STRING', 'STRING', 'STRING', 'NUMBER', 'NUMBER'], '参数注意事项': ['', '', '', '', '']}]",[{}]
Word to Word Translator,https://rapidapi.com/bacloud22/api/word-to-word-translator1/,word-to-word-translator1.p.rapidapi.com,GET:meta,meta is simply to track of the current information about our back-end.,api,[{}],[{}]
Word to Word Translator,https://rapidapi.com/bacloud22/api/word-to-word-translator1/,word-to-word-translator1.p.rapidapi.com,GET:Language detection,detect_language is a facilitator API to detect language of texts.,api,"[{'参数名': ['phrase'], '参数类型': ['STRING'], '参数注意事项': ['']}]",[{}]
Bing_Translate,https://rapidapi.com/trieuthang1991/api/bing_translate/,bing_translate.p.rapidapi.com,GET:Noname,Không có gì,,[{}],[{}]
Dil Çeviri,https://rapidapi.com/j7game/api/dil-ceviri/,dil-ceviri.p.rapidapi.com,GET:Test,deneme,,[{}],"[{'参数名': ['1'], '参数类型': ['STRING'], '参数注意事项': ['ceviri']}]"
RushTranslate,https://rapidapi.com/RushTranslate/api/rushtranslate/,rushtranslate.p.rapidapi.com,GET:List Languages,Get the list of languages we support. The language codes included in the response will be required when placing orders via the API.,,[{}],[{}]
RushTranslate,https://rapidapi.com/RushTranslate/api/rushtranslate/,rushtranslate.p.rapidapi.com,GET:Get File,Get detailed information about a specific file.,Files,"[{'参数名': ['file_id'], '参数类型': ['STRING'], '参数注意事项': ['File ID']}]",[{}]
RushTranslate,https://rapidapi.com/RushTranslate/api/rushtranslate/,rushtranslate.p.rapidapi.com,GET:Create File,Creates a new file. File uploads are limited to 100Mb in size. Each file may be attached to only one resource after creation.,Files,"[{'参数名': ['type', 'file'], '参数类型': ['STRING', 'STRING'], '参数注意事项': ['Type of file - source or reference', 'File to be uploaded']}]",[{}]
RushTranslate,https://rapidapi.com/RushTranslate/api/rushtranslate/,rushtranslate.p.rapidapi.com,GET:Download File,Retrieve a temporary download URL for the file. Files are encrypted and stored in an Amazon S3 bucket. When you want to download a file this request will generate a temporary signed URL allowing access to download the file securely. URLs expire after two minutes.,Files,"[{'参数名': ['file_id'], '参数类型': ['STRING'], '参数注意事项': ['File ID']}]",[{}]
RushTranslate,https://rapidapi.com/RushTranslate/api/rushtranslate/,rushtranslate.p.rapidapi.com,GET:Get Order,Get detailed information about a specific order.,Orders,"[{'参数名': ['order_number'], '参数类型': ['STRING'], '参数注意事项': ['Order number']}]",[{}]
RushTranslate,https://rapidapi.com/RushTranslate/api/rushtranslate/,rushtranslate.p.rapidapi.com,PUT:Approve Order,Approve an order that has a status of client_review.,Orders,"[{'参数名': ['order_number'], '参数类型': ['STRING'], '参数注意事项': ['Order number']}]",[{}]
RushTranslate,https://rapidapi.com/RushTranslate/api/rushtranslate/,rushtranslate.p.rapidapi.com,POST:Create Order,Creates a new order. Files must be created prior as their IDs will be included in the files array of this request.,Orders,[{}],"[{'参数名': ['notes', 'services.shipping', 'services.shipping_signature', 'services.shipping_service', 'address.street_2', 'services.expedited', 'address.street_1', 'callback_url', 'address.city', 'address.recipient', 'services.notarization', 'address.state', 'services.currency_conversion', 'reference', 'address.zip', 'services.certification', 'address.country'], '参数类型': ['STRING', 'BOOLEAN', 'BOOLEAN', 'STRING', 'STRING', 'BOOLEAN', 'STRING', 'STRING', 'STRING', 'STRING', 'BOOLEAN', 'STRING', 'BOOLEAN', 'STRING', 'STRING', 'BOOLEAN', 'STRING'], '参数注意事项': ['Notes for staff or translators - basic HTML allowed', 'If you would like a hard copy shipped - only available with certified translation', 'If an adult signature should be required for delivery', 'Level of shipping service - standard (USPS Priority Mail) or express (USPS Express Mail). Required if shipping.service is true', 'Second line of the address', 'If you would like expedited turnaround service', 'First line of the address. Required if shipping.service is true', 'Callback URL for webhooks', 'City the address is located in. Required if shipping.service is true', 'Name of the person - both name and company can be included. Required if shipping.service is true', 'If you would like the certification notarized - only available with certified translation', 'State or providence the address is located in. Required if shipping.service is true', 'If you would like currency conversion - only available with certified translation', 'Reference number for your use', 'Zip or postal code the address is located in. Required if shipping.service is true', 'If you would like certified translation service otherwise standard translation provided', 'ISO 3166 country code for the country the address is located in. Required if shipping.service is true']}]"
RushTranslate,https://rapidapi.com/RushTranslate/api/rushtranslate/,rushtranslate.p.rapidapi.com,PUT:Cancel Order,Cancel an existing order. Only orders that have a status of received are eligible to cancel via the API.,Orders,"[{'参数名': ['order_number'], '参数类型': ['STRING'], '参数注意事项': ['Order number']}]",[{}]
RushTranslate,https://rapidapi.com/RushTranslate/api/rushtranslate/,rushtranslate.p.rapidapi.com,GET:List Orders,Get a paginated list of your orders sorted in descending order by received_at date.,Orders,[{}],[{}]
RushTranslate,https://rapidapi.com/RushTranslate/api/rushtranslate/,rushtranslate.p.rapidapi.com,GET:Get Revision,Get detailed information about a specific revision.,Revisions,"[{'参数名': ['revision_id'], '参数类型': ['STRING'], '参数注意事项': ['Revision ID']}]",[{}]
RushTranslate,https://rapidapi.com/RushTranslate/api/rushtranslate/,rushtranslate.p.rapidapi.com,DELETE:Delete Revision,Delete an existing revision. Only revisions that have a status of requested are eligible to delete via the API.,Revisions,"[{'参数名': ['revision_id'], '参数类型': ['STRING'], '参数注意事项': ['Revision ID']}]",[{}]
RushTranslate,https://rapidapi.com/RushTranslate/api/rushtranslate/,rushtranslate.p.rapidapi.com,POST:Create Revision,Creates a new revision for an order. Files (optional) must be created prior as their IDs will be included in the files array of this request. Only a file type of reference will be accepted.,Revisions,"[{'参数名': ['body', 'files', 'order_number'], '参数类型': ['STRING', 'STRING', 'STRING'], '参数注意事项': ['Revision body - basic HTML allowed', 'List of file IDs', 'Order number in need of revision']}]",[{}]
RushTranslate,https://rapidapi.com/RushTranslate/api/rushtranslate/,rushtranslate.p.rapidapi.com,GET:List Revisions,Get a paginated list of your revisions sorted in descending order by requested_at date.,Revisions,[{}],[{}]
French Synonyms,https://rapidapi.com/ericmorvax-2YHUl-ynmUD/api/french-synonyms/,french-synonyms.p.rapidapi.com,GET:Get Synonyms,Get all synonyms from a word,,"[{'参数名': ['word'], '参数类型': ['STRING'], '参数注意事项': ['']}]",[{}]
Ai Translator,https://rapidapi.com/portamine781/api/ai-translator2/,ai-translator2.p.rapidapi.com,POST:googleTranslate,,default,[{}],[{}]
Translation,https://rapidapi.com/mudasirufatai1-xMHImU8zuKI/api/translation58/,translation58.p.rapidapi.com,GET:Translation_copy,Translate,,"[{'参数名': ['Translate'], '参数类型': ['STRING'], '参数注意事项': ['']}]",[{}]
Translation,https://rapidapi.com/mudasirufatai1-xMHImU8zuKI/api/translation58/,translation58.p.rapidapi.com,GET:Translation,Translate,,"[{'参数名': ['Translate'], '参数类型': ['STRING'], '参数注意事项': ['']}]",[{}]
Test,https://rapidapi.com/tarix22/api/test4694/,test4694.p.rapidapi.com,GET:Simple endpoint,The best endpoint,,[{}],[{}]
Ai Translation,https://rapidapi.com/sharyt26shar/api/ai-translation/,ai-translation.p.rapidapi.com,GET:Text,text,,"[{'参数名': ['text', 'to'], '参数类型': ['STRING', 'STRING'], '参数注意事项': ['', '']}]",[{}]
Nitro,https://rapidapi.com/info-fPBM4OHdS/api/nitro/,nitro.p.rapidapi.com,GET:Get a Specific Order,This endpoint retrieves a specific order.,,"[{'参数名': ['id'], '参数类型': ['STRING'], '参数注意事项': ['']}]",[{}]
Nitro,https://rapidapi.com/info-fPBM4OHdS/api/nitro/,nitro.p.rapidapi.com,POST:Translate,This endpoint sends the text for translation and creates a list of orders.,,[{}],[{}]
Nitro,https://rapidapi.com/info-fPBM4OHdS/api/nitro/,nitro.p.rapidapi.com,DELETE:Delete an Order,This endpoint deletes a specific order.,,"[{'参数名': ['id'], '参数类型': ['STRING'], '参数注意事项': ['']}]",[{}]
Nitro,https://rapidapi.com/info-fPBM4OHdS/api/nitro/,nitro.p.rapidapi.com,GET:Account,This endpoint retrieves an account.,,[{}],[{}]
Nitro,https://rapidapi.com/info-fPBM4OHdS/api/nitro/,nitro.p.rapidapi.com,GET:Get All Orders,This endpoint retrieves all account orders.,,[{}],[{}]
Nitro,https://rapidapi.com/info-fPBM4OHdS/api/nitro/,nitro.p.rapidapi.com,GET:Rates,This endpoint retrieves all rates.,,[{}],[{}]
Translate.com API,https://rapidapi.com/SantosMorar/api/translate-com-api/,translate-com-api.p.rapidapi.com,GET:User balance,Get the information about current user words/symbols/tickets balance:,,[{}],[{}]
Translate.com API,https://rapidapi.com/SantosMorar/api/translate-com-api/,translate-com-api.p.rapidapi.com,GET:Machine translation languages,Get the list of languages* which are available for Translate API Machine Translation in the format:,,"[{'参数名': ['x-api-key'], '参数类型': ['STRING'], '参数注意事项': ['']}]",[{}]
Translate.com API,https://rapidapi.com/SantosMorar/api/translate-com-api/,translate-com-api.p.rapidapi.com,GET:Human translation language pairs,Get the list of languages* which are available for Translate API Machine Translation in the format:,,"[{'参数名': ['x-api-key'], '参数类型': ['STRING'], '参数注意事项': ['']}]",[{}]
Translate.com API,https://rapidapi.com/SantosMorar/api/translate-com-api/,translate-com-api.p.rapidapi.com,POST:Get machine translation,"The endpoint serves for machine translation execution.
In the “source_language” parameter you should set the source text language code.
In the “translation_language” parameter you should set the translation text language code.
You can get available languages ...",,[{}],[{}]
Translate.com API,https://rapidapi.com/SantosMorar/api/translate-com-api/,translate-com-api.p.rapidapi.com,POST:Create human translation order,"The endpoint is designed to create a human translation order.
The result and status of the order can be tracked by the ""Get human translation order"" endpoint.
You can also pass the URL of your service to receive the translation result in the “callback_url” paramete...",,[{}],[{}]
Translate.com API,https://rapidapi.com/SantosMorar/api/translate-com-api/,translate-com-api.p.rapidapi.com,GET:Get human translation order,"The endpoint serves to receive the status and translation text of the human translation order. In the ""order_id"" parameter, you need to specify the identifier that you received when creating the order with the ""Create human translation order"" endpoint.",,"[{'参数名': ['order_id'], '参数类型': ['STRING'], '参数注意事项': ['']}]",[{}]
👋 Demo Project,https://rapidapi.com/mbg-group-mbg-group-default/api/demo-project16023/,demo-project16023.p.rapidapi.com,POST:Create Product,,Catalog,[{}],[{}]
👋 Demo Project,https://rapidapi.com/mbg-group-mbg-group-default/api/demo-project16023/,demo-project16023.p.rapidapi.com,DELETE:Delete Product,,Catalog,"[{'参数名': ['id'], '参数类型': ['NUMBER'], '参数注意事项': ['']}]",[{}]
👋 Demo Project,https://rapidapi.com/mbg-group-mbg-group-default/api/demo-project16023/,demo-project16023.p.rapidapi.com,GET:Get Categories,,Catalog,[{}],[{}]
👋 Demo Project,https://rapidapi.com/mbg-group-mbg-group-default/api/demo-project16023/,demo-project16023.p.rapidapi.com,GET:Get Products in Category,,Catalog,"[{'参数名': ['limit', 'skip', 'category'], '参数类型': ['NUMBER', 'NUMBER', 'STRING'], '参数注意事项': ['', '', '']}]",[{}]
👋 Demo Project,https://rapidapi.com/mbg-group-mbg-group-default/api/demo-project16023/,demo-project16023.p.rapidapi.com,GET:Get Product,,Catalog,"[{'参数名': ['id'], '参数类型': ['NUMBER'], '参数注意事项': ['']}]",[{}]
👋 Demo Project,https://rapidapi.com/mbg-group-mbg-group-default/api/demo-project16023/,demo-project16023.p.rapidapi.com,GET:Get Products,,Catalog,"[{'参数名': ['limit', 'skip'], '参数类型': ['NUMBER', 'NUMBER'], '参数注意事项': ['', '']}]",[{}]
👋 Demo Project,https://rapidapi.com/mbg-group-mbg-group-default/api/demo-project16023/,demo-project16023.p.rapidapi.com,DELETE:Delete from Order,,Order,"[{'参数名': ['productId', 'id'], '参数类型': ['NUMBER', 'NUMBER'], '参数注意事项': ['', '']}]",[{}]
👋 Demo Project,https://rapidapi.com/mbg-group-mbg-group-default/api/demo-project16023/,demo-project16023.p.rapidapi.com,POST:Place Order,,Order,"[{'参数名': ['id'], '参数类型': ['STRING'], '参数注意事项': ['']}]",[{}]
👋 Demo Project,https://rapidapi.com/mbg-group-mbg-group-default/api/demo-project16023/,demo-project16023.p.rapidapi.com,POST:Add to Order,,Order,[{}],[{}]
👋 Demo Project,https://rapidapi.com/mbg-group-mbg-group-default/api/demo-project16023/,demo-project16023.p.rapidapi.com,GET:Get Order,,Order,"[{'参数名': ['id'], '参数类型': ['STRING'], '参数注意事项': ['']}]",[{}]
👋 Demo Project,https://rapidapi.com/mbg-group-mbg-group-default/api/demo-project16023/,demo-project16023.p.rapidapi.com,DELETE:Cancel Order,,Order,"[{'参数名': ['id'], '参数类型': ['STRING'], '参数注意事项': ['']}]",[{}]
👋 Demo Project,https://rapidapi.com/mbg-group-mbg-group-default/api/demo-project16023/,demo-project16023.p.rapidapi.com,GET:Get User Orders,,Order,[{}],[{}]
👋 Demo Project,https://rapidapi.com/mbg-group-mbg-group-default/api/demo-project16023/,demo-project16023.p.rapidapi.com,POST:Create Order,,Order,[{}],[{}]
👋 Demo Project,https://rapidapi.com/mbg-group-mbg-group-default/api/demo-project16023/,demo-project16023.p.rapidapi.com,POST:Create User (Sign Up),,Authentication,[{}],[{}]
👋 Demo Project,https://rapidapi.com/mbg-group-mbg-group-default/api/demo-project16023/,demo-project16023.p.rapidapi.com,POST:Login,,Authentication,[{}],[{}]
👋 Demo Project,https://rapidapi.com/mbg-group-mbg-group-default/api/demo-project16023/,demo-project16023.p.rapidapi.com,GET:Me,,Authentication,[{}],[{}]
TranslateMe Translation,https://rapidapi.com/ravneetdtu/api/translateme-translation/,translateme-translation.p.rapidapi.com,POST:Language Translation,"This endpoint will take input text, input language and output language and further will
return translated text in output language. Along with the request, following details need
to be sent as body with API request.
● input_text: String -> Text needs to be ...",,[{}],[{}]
Certified Translation,https://rapidapi.com/immitranslate-developers-immitranslate-developers-default/api/certified-translation/,certified-translation.p.rapidapi.com,GET:Languages,Retrieves a list of available languages and their respective ISO codes.,,[{}],[{}]
